post_id,user_id,user_name,fullname,content
2353151835160640,100012327210361,,Pham Dung,"TÌM MÈO ĐI LẠC
Vẫn hy vọng có phép màu cho e đc gặp lại bé lần nữa ạ!
Bé mèo Anh Lông Ngắn bị đi lạc vào đêm 06.8.2024
- Đặc điểm: Mèo đực 5 tuổi, cân nặng 5-6kg, đã triệt sản, Màu Hyma như ảnh.
- Khu vực: Ngõ Quan Thổ 1, đường Tôn Đức Thắng, Đống Đa, Hà Nội.
Bé vô cùng quan trọng với e, e xin đón lại bé với bất cứ zá nào ạ. Hơn nửa tháng nay e đi tìm bé khắp nơi mà chưa thấy tin tức gì ạ.
Cô chú anh chị nào thấy bé, làm ơn liên hệ số 0943.179.043 giúp ạ!
GIA ĐÌNH XIN CẢM ƠN VÀ HẬU TẠ!"
