post_id,user_id,user_name,fullname,content
1874082303120891,,,,"Mong ad duyệt , một số kinh nghiệm cho các bạn mới ra trường xin việc làm
1. Công ty nói miệng không có hợp đồng thì nên né , kể cả thử việc cũng phải có hợp đồng thử việc . Theo luật nhà nước khi kí hợp đồng thử việc thì thuế sẽ tạm thu 10% và các bạn sẽ được hoàn lại vào năm sau nhé ( nhớ nếu nghỉ việc mà muốn lấy lại số này thì phải xin chứng từ thuế ) . Ngoài ra thì việc khi các bạn có hợp đồng thì có cơ sở nếu sau này bị quỵt lương thì vẫn có thể lên bộ Thương Binh Lao Động Xã Hội khiếu nại thì nó rất dễ . Không có hợp đồng nhưng có thư mời nhận việc , hình ảnh thì có thể xem là cơ sở để khiếu nại khi bị quỵt lương không ? Thì theo pháp luật là có nhưng mình chân thành khuyên thiệt là vẫn nên có hợp đồng là ok nhất còn không có thì kiểu hên xui lắm có khi khiếu nại có thể đòi được có khi là không đòi được và còn mất thời gian nữa . Nói tóm lại nên kiếm công ty có ký hợp đồng rõ ràng hãy làm , tất cả mọi thứ về lương bổng sẽ dựa vào giấy tờ . Nhớ đọc kĩ hợp đồng rồi hãy kí nhé <3
2. Công ty đòi phí giữ chỗ , cầm chân ..... Nói tóm lại là chưa làm mà bắt đóng tiền trước thì 100% là đa cấp hoặc lừa đảo
3. Đối với những bạn làm công theo giờ ,đặc biệt là ở các thành phố lớn thì nhà nước quy định mức lương tối thiểu là 23.800 VND/1h. Chỗ nào mà làm 16,17k 1h mà cực nhọc quá thì khuyên các bạn nên nghỉ vì lương không đáng với công sức bỏ ra
4. Làm CV chỉnh chu là một điểm cộng để tăng cơ hội trúng tuyển <3
Các bạn có thắc mắc gì cứ cmt dưới ,mình biết thì mình giải đáp còn không thì anh ,chị ,em trong nhóm sẽ giải đáp <3"
