comment_id,post_id,user_id,user_name,fullname,content
1887452931783828,1887265215135933,100080812574993,,Ann Mee,"cty trả sổ gốc cho tui rồi hẹn tui khi nào có tờ rời thì cty báo tui lên lấy. Từ đó tới giờ hơn 2 tháng, lâu lâu tui lại hỏi thăm anh hành chính một lần mà ảnh kêu bhxh chưa gửi gì cho ảnh. Cũng mệt lắm chứ bộ"
1887455601783561,1887265215135933,,lequang.tiin,Lê Quang Tín,"Tự lên bhxh làm đi bạn
Lưu ý quan trọng: cty cũ ở quận nào thì lên bhxh ở quận đó chứ k ra bhxh gần chỗ ở của mình làm gì lại tốn công ngta bảo đi về"
1887423661786755,1887265215135933,,mysa9191,Đào My Sa,"Như bình thường thì khi NLĐ nghỉ việc, cty báo giảm trên phần mềm. cty gửi sổ gốc của bạn lên cơ quan bhxh, cơ quan chốt sổ in tờ rời kèm sổ gửi trả về cty. cty đưa lại cho bạn"
1887422865120168,1887265215135933,,mysa9191,Đào My Sa,"bạn có đang cầm sổ bhxh gốc và quyết định nghỉ việc có dấu đỏ cty ko. Có thì bạn chủ động lên cơ quan bhxh quản lý để tự chốt sổ, in tờ rời đi. Ngồi chờ ng ta đến bao giờ"
1887415168454271,1887265215135933,,darcy.phuongdung,Đoàn Thị Phương Dung,"Nghỉ việc thì công ty phải chốt BHXH, tờ rời trả về công ty thì công ty phải đưa lại cho NLĐ"
