post_id,user_id,user_name,fullname,content
474106564982634,,,,"Em xin phép AD
Vị trí: Nhân viên IP
Sàn : HTFX và Doo Prime
Back com : 14$/ lot
Mô tả công việc:
Phân tích thị trường chứng khoán, các sản phẩm tài chính và xu hướng đầu tư.
Tư vấn và hỗ trợ khách hàng trong việc đầu tư chứng khoán.
Thực hiện các báo cáo phân tích và dự báo về các chỉ số tài chính.
Tham gia xây dựng và triển khai các chiến lược đầu tư hiệu quả.
Theo dõi và cập nhật thông tin thị trường, chính sách và quy định mới.
Ai ứng tuyển thì nhắn qua facebook cho mình nhé"
