comment_id,post_id,user_id,user_name,fullname,content
8414996145264784,8411837542247311,,ngokimdinh1996,Ngô Kim Đĩnh,"Da mặt bạn bị thâm sau mụn nhiều, ưu tiên sửa rửa mặt và kem mụn chứa tinh chất nghệ và mật ong Honey giúp giảm mụn viêm, kết hợp thêm kcn collegen eliza giảm thâm nám bạn nhé."
8416738771757188,8411837542247311,,ha.dieuha.585,Dieu Ha,Em lên mụn viêm hay sao??? Em đang dùng những sản phẩm nào rồi nhỉ
8414192838678448,8411837542247311,100092442021029,,Bông Skincare,"Da thâm mụn
E thêm hoạt chất trị thâm đỏ như Tranexamic azelaic Niacnamai nha e
Kèm phục hồi vs kcn kĩ nhé
Thêm nạ b5 đắp cho dịu da"
8414465841984481,8411837542247311,100083230755341,,Nguyễn Hoa Dược Sỹ,E đang dùng gi và bi lâu chưa
8425129137584818,8411837542247311,,thanglong.hatgiong,Bác Sĩ Đạt,"Vấn đề của em là da quá khô, thiếu ẩm, nhạy cảm, lỗ chân lông to, thâm mụn, da không đều màu. Để giải quyết trước tiên em cần có các bước chăm da cơ bản phù hợp với tình trạng da :
- tẩy trang( bioderma hồng)
- sữa rửa mặt( ziaja, cerave, floesk, ),
- serum phục hồi ( srx, ciracle, serum HA, b5)
- dưỡng ẩm ( bioderma, wellmax, rau má)
- kem chống nắng ( fixderma, martiderm, image)
Khi nào da khoẻ em sẽ bổ sung thêm serum niacinamide và AHa để giải quyết vấn đề sắc tố và lỗ chân lông trên da em nhé"
