post_id,user_id,user_name,fullname,content
8415670775220150,,tranggbii1782003,Nguyễn Mạnh Hoàng,"$BTC giảm nhẹ nhưng khiến cho Altcoin đỏ lửa, trước đó đa số Altcoin có 3 tuần xanh, thì nay mới đang tuần thứ 2 lại đang có xu hướng muốn test lại đáy :((
Đến cả $ETH cũng đang có hướng như vậy nên đàn con cháu ""Ôn coi"" không thể khác được.
Cuộc tập dượt vừa qua cũng giống như bao đợt chúng ta trải qua trước đó, bình thường thị trường sẽ có xu hướng nhấp nhả 1 vài lần để rũ bỏ trader thích tối ưu, cũng như đày nhà đầu tư chúng ta, coin không mua thì nó bay còn coin chúng ta cầm cứ lên xuống, biên độ nhỏ.
Về cơ bản các Altcoin chưa về đáy ngày 5/8 nên không có vấn đề đề gì quá to tát, có chăng AE nào kì vọng quá lớn vào một tháng Uptober thì hơi hụt hẫng và không đúng ý mong muốn.
Đầu tư là một quá trình dài hạn, chịu khó nhìn nến tuần hơn thay vì chỉ nhìn nến giờ, nến ngày và view dài hạn ra các bạn ạ."
