post_id,user_id,user_name,fullname,content
899591512060187,,,,"Mn giúp e vs ạ. Em 24tuổi- may mắn da em k có mụn viêm đỏ,
Bthuog em chỉ làm các bước:
tt loreal hồng - srm hadalabo xanh lá - kcn skinaqua nắp vàng
=> da em cảm thấy bị đen thâm sạm k đều màu,tàn nhang nhiều, da sần sùi và nhăn, dầu nhiều ở chữ T ( lúc nhiều lúc k 😢) da mặt cũng có dầu nhưng ít, mụn cám đầu đen ở mũi
2 tháng gần đây em có đầu tư chăm da gồm:
Tt loreal xanh nhạt - srm hadala xanh lá - toner badskin - serum Tranexamic (Bioverse) - serum nia (the ordinary) - kem dưỡng ẩm hadalabo trắng - kcn skin aqua nắp vàng
=> có cải thiện trắng lên 1tí trong thời gian đầu nhưng chỉ vậy thôi k cải thiện gì thêm và thấy tiết dầu nhiều hơn vào mỗi sáng ở vùng T ở 2 má và trán nữa,
Mong mn gợi ý thêm cho em những hoạt chất hay sp nào để cải thiện được cho da sáng bóng căn mịn, mờ tàn nhang và chu trình skin đúng cách. Em nên đổi loại nào nên mua loại nào ạ
Ps: tình trạng da em mới chụp lúc tối ạ,"
