comment_id,post_id,user_id,user_name,fullname,content
1565315444256911,1565297064258749,,ha.dinhquang,Đinh Hà,"máy hút ẩm không ăn thua luôn, tốt nhất là phòng nào đóng được cửa thì đóng vào rồi bật điều hòa hút ẩm.
Phần không gian thông thoáng như hành lang và thang thì chịu thôi"
1565438454244610,1565297064258749,,@thuy.perry,Lưu Thúy,"Chuyển sang xây nhà bằng bê tông siêu nhẹ, sàn và tường khô cong, k 1 tí nồm ẩm nào luôn"
1565430624245393,1565297064258749,,HaiYen186,Khiếu Hải Yến,"Bật điều hoà cả nhà, đóng kín cửa . Khô ron, ngoài kia ra sao : kệ ."
1565434270911695,1565297064258749,,haxuannam209,Hà Xuân Nam,"Mình cc 70m2 dùng con Lọc kk kiêm hút ẩm Sharp 55m2. Chạy 24/24 tuyệt vời luôn.

1 buổi ra 1 bình 4l nước"
1565856507536138,1565297064258749,100003054366559,,Hòa Nguyễn,Ổn áp ạ. Nhà mình cắm máy hút gần 1 ngày đc đầy bình nước ở máy. Máy chạy liên tục thì nhà lúc nào cuzng khô. Hết đặc sản miền bắc luôn hi
1565328507588938,1565297064258749,,khanh.do.3344,Khanh Do,Chân ái cuộc đời là máy hút ẩm ^^ ngày chắc mình phải đổ tầm chục lít nước. Mình xài Xiaomi
1565481504240305,1565297064258749,,nhi.le.127648,Nhi Lê,ở miền Nam nhìn ảnh mà sợ hãi ngang 🥹
1565689704219485,1565297064258749,,kunthikun,Nguyễn Hoa Quỳnh,Đhoa có cđộ hút Ẩm đó bác
1565363650918757,1565297064258749,,thanhhuong.nghp,Thanh Hương Nguyễn,Bật chế độ hút ẩm ở điều hoà là ok thôi
1565471177574671,1565297064258749,,hanmi.vu,Hanmi Vũ,Trần Tuấn Minh đọc cmt để biết thêm chi tiết 🤪
1566123184176137,1565297064258749,,dzung.nguyenthuy.9,Nguyễn Thuỳ Dung,Bật điều hoà để 18 độ là hết đó b
1565504454238010,1565297064258749,,azooosaunguyen,Sau Nguyen,"Muốn ko bị ẩm thì nên đóng hết cửa sổ, cửa chính vào nè! Chứ mở cửa to ra là nồm hết Á! Đấy chính là lý do nếu làm cửa sổ nên làm cửa kính nè!"
1565318357589953,1565297064258749,,cherry.mss.7,Nguyễn Phương Hoa,"máy hút này nha, vừa rẻ vừa bền lại sạch sẽ. 😂"
1565369980918124,1565297064258749,,ThanhThanh.211189,Thanh Thanh,Xin chia sẻ ít nắng khô ráo và se lạnh vào buổi sáng của SG cho các chị e ở miền Bắc ạ.
1565321270922995,1565297064258749,,phi.thai,Phí Hồng Thái,"nên mua loại hút dc tầm 24 lít/ngày trở lên, nếu bạn định mua nhiều cái cho mỗi phòng một cái thì có thể mua loại công suất nhỏ hơn, 18lit/ngay chẳng hạn. Nhưng nói chung nếu nhà chung cư thì chỉ cần một cái. Nhà đất nhiều tầng thì mỗi tầng một cái.
Nhà mình xài elex dc 10 năm rồi, vẫn chạy tốt."
1565368587584930,1565297064258749,,camvan.1987,Cẩm Vân Nguyễn,"Loại này bạn ạ. 20l, máy có cả ống dẫn nước ra nhà vệ sinh dùng trong trường hợp nhà ẩm quá mà hút ko kịp đổ thì dùng ống, hút rồi chảy thẳng ra nhà vệ sinh khỏi cần rút bình mang đổ. Muốn dùng bình chứa thì cũng được luôn. Dưới chân có bánh xe kéo đi kéo lại được."
1565329447588844,1565297064258749,100005968807722,,Nhung Nguyễn,máy hút ẩm vẫn là chân ái. hút phòng nào đóng cửa phòng đó lại. nhanh khô lắm
1565389787582810,1565297064258749,,nguyen.t.quynh.7798,Thuý Quỳnh,"Thế các bác cho e hỏi, nhà kiểu ở quê, thì sử lý trời nồm thế nào ạ?
Trong phòng đóng cửa thì đỡ, chứ phòng khách với bếp thì nó đúng như kiểu người mình ở thời tiết 40 độ ấy ạ."
1565349144253541,1565297064258749,,NguyetMinh1988,Lê Thị Nguyệt Minh,"Nhà em 3 tầng, 1 cái phòng khách là công suất lớn nhất. Còn mỗi phòng ngủ 1 cái công suất bé. Nhà lúc nào cũng khô roong. Hành lang cầu thang đều khô sạch. Mùa k nồm thì mỗi lần nấu ăn mà bị mùi em cho tí tinh dầu vào tờ giấy ăn rồi khẹp trên cái cửa gió máy hút ẩm nó hút. Mùi thơm dễ chịu luôn."
1565345070920615,1565297064258749,,nguyen.anhthu.144,Nguyễn Anh Thư,Sharp chân ái chị em ơi. Hút phê lòi 😜
1565319197589869,1565297064258749,,BemRomano,Nguyễn Hường,Mua máy hút ẩm Sharp cũng ổn các chị em à. Em thấy sàn có vẻ ẩm lên bật 1h là e thấy sạch bong khô ráo rồi ấy.
1565714010883721,1565297064258749,,Nguyenlan109,Nguyễn Lan,"Nhà e đang dùng mấy năm nay r, hàng nội địa trung, đúng là chân ái luôn mom ạ,"
1565319354256520,1565297064258749,,huong834,Dương Thu Hương,Máy hút ẩm nhưng mà nếu nhà rộng thì phải mỗi nơi 1 cái thì mới khô nổi. Chứ nhà mình để bê đi bê lại. Khô chỗ này xong thì chỗ khác lại ướt
1565354324253023,1565297064258749,,TrangTran.MeoMongMo,Trang Tran,"Máy hút ẩm không khí thông minh NEW WIDETECH 30L

Vừa mua. Đáng tiền. Nhà khô cong"
1565441900910932,1565297064258749,,nga.duc.710,Bùi Nga,Ngày nay mình đổ 2 bình rồi á
1565317307590058,1565297064258749,,thu.quynh.9022662,Hoàng Thu Quỳnh,"Mua sharp nhật dùng ổn, nhà mình đóng của bật nhà khô ráo như chưa hề có ẩm thấp j luôn"
1566626930792429,1565297064258749,100009981405769,,Bùi Thu Hà,nhà e dùng loại này 2 củ 5 mà ngon bổ rẻ
1565339117587877,1565297064258749,,camvan.nguyen.50767984,Nguyễn Cẩm Vân,Nhà mình cũng thế. Vừa mua máy hút ẩm lúc sáng.
1565511487570640,1565297064258749,100087389996334,,Nguyen Vy,"Có 1 lần trời quá nồm, xong tui bật chế độ hút ẩm của điều hòa trong phòng ngủ, tui hẹn 30 phút là tắt, xong tui đi ra ngoài đi ăn. Cơ mà lúc đi tui quên đóng cửa phòng ngủ, nên khi tui về thì thấy cả nhà khô ráo luôn. Haha. Từ đó hnao trời nồm quá mà máy hút ẩm đấu ko kịp là tui làm cách này. Biết là sẽ tốn điện nhưng nó KHÔ các bà ơi."
1565713520883770,1565297064258749,,Nguyenlan109,Nguyễn Lan,"Nhà e đang dùng, và e nhận luôn order hàng trả sau tết , con như hình #3,2tr"
1566263470828775,1565297064258749,,tram.anh.39108,Trâm Anh Hồ,Em thấy bố em làm như này. Lau bằng nc lau sàn. Xong lau lại bằng nước sạch. Bật quạt 1 tý là khô nền nhà. Áp dụng lau nhà nhé ạ
1565402010914921,1565297064258749,,binh.alice.7,Bình Alice,Các chị ơi dùng máy nhật bãi đi. Nhà e dùng thích lắm. Mà lại rẻ nữa. Nhà mùa này vẫn khô ron phê gì đâu.
1565321847589604,1565297064258749,,huonglan.vu.92,Hương Lan,Nhà mình 60m2 4 tầng dùng con Delonghi 30l khô ráo lắm
1567095347412254,1565297064258749,100009466374080,,Summer Summer,"M dùng xiaomi loại to nhất hút từ đêm 11h đén 5h sáng báo đầy tự ngắt.( nhà chung cư, tầng cao đó mà vẫn ẩm 🥶)"
1565465377575251,1565297064258749,,kute.panda.37,Trương Thị Minh Trang,Hút ẩm là chân ái.Bật DH vừa lạnh vừa tốn điện.
1565765834211872,1565297064258749,,LionKing2807,Lion Kinh,"mitsubishi chân voi hàng nhật bãi, cứ 4 5 tiếng đầy bình nước"
1565317577590031,1565297064258749,,minh.anh.5095,Minh Anh,"Nhà mình dùng ok, nhưng vẫn phải đóng kín cửa với những ngày nồm này"
1565368544251601,1565297064258749,100030167851487,,NgTr Nguyen,"Miền bắc khổ thật
Nóng nắng rét buốt nồm bão🙂"
1565318634256592,1565297064258749,100019107973626,,Ann Phương,"Đóng chặt cửa nhé,nhà mình ở tầng 2,phòng nào đóng kín phòng đó,cửa hành lang cũng đóng kín,không bị ướt tẹo nào,nhưng tầng 1 ôb ở đi lại cửa chính ra vào nhiều thì bị ướt nhưng mình lót thảm xốp hết cả khu vực trống và hành lang lên đỡ trơn trượt"
1565446004243855,1565297064258749,,vuduckuabc,Mạnh Đức,"Nhà mk dùng máy này nhé. Vừa hút ẩm, hết ẩm lọc không khí. Siêu tiện lợi mà giá lại phải chăng. Bạn mua ở Tổng kho Đức Hưng nha"
1566130344175421,1565297064258749,,chi.mai.5074644,Mai Chi,Bác thử đóng kín hết tất cả cửa sổ lại. K hở tí nào. Đóng kín nhà vệ sinh nữa thì nhà khô cong luôn. Nay em mới thử xong hiệu nghiệm thật sự. Cầu thang khô cong. Phải lấy cả bìa dán chặt hết các cửa sổ.
1565335404254915,1565297064258749,100027858199046,,Thu Thao,Bật chế độ dry điều hoà ạ e bật thấy khô hết sàn
1565369097584879,1565297064258749,,nguyen.yen.1408,Yen Nguyen,"M dùng dorosin, ngày đổ nc 3 lần, mỗi lần 5 lit. Cảm giác bê nc đi đổ phê lắm. Sáng ngủ dậy đổ 1 lần, trưa đổ lần nữa, chiều về đổ tiếp :))). Máy hút ẩm đúng là chân ái. Nhìn cảnh nhà ượt mùa này bị ám ảnh luôn"
1565373990917723,1565297064258749,,duc.yen.92,Hải Yến,Nhà mình Dùng loại 26l panasonic nhật. Bật nửa tiếng là nhà đã khác hẳn rồi. Chân ái
1565671450887977,1565297064258749,,nhungphan28,Nhung Phan,"Mở điều hoà hút ẩm là chân ái ạ, em vừa mở điều hoà vừa mở cửa phòng nên phần hàng lang và cầu thang cũng khô hết, nhà bác nào mà có giếng trời thì bịt vào mùa này may ra còn đỡ ạ"
1565668840888238,1565297064258749,,inseparable.0202,Hải Vân,Nhà e dùng loại 12L cho phòng ngủ. 6 tiếng mới hết 1 số điện. Ko bị lạnh như điều hòa. Phòng khách liền bếp hoặc hành lang thì dùng 60L cho sướng.
1565366034251852,1565297064258749,100004501269608,,Vân Đỗ,T định mua con vừa hút vừa lọc kk này dc ko cả nhà ?
1566035070851615,1565297064258749,,anngocdang,An Ngoc Dang,Đang dùng con Elex 12TRB ngon luôn bác. Phòng 50m khô roong
1565424697579319,1565297064258749,,kynhuong,Thu Hương,"ngày hôm nay đổ đi 16 lít nước rồi, ko có nó chắc nhà nước thành vũng"
1565488147572974,1565297064258749,,thom.tran.35977897,Thơm Trần,"Nhà em dùng con này của Sharp hút sạch khô luôn, mấy năm nay nhờ có máy này mà k còn cảm nhận trời nồm nữa"
