post_id,user_id,user_name,fullname,content
1101492510373377,,bigbossbossbg,Đỗ Đại Thông,"Biết thế con Hằng deos đi làm!
##
Hôm qua đồng nghiệp phòng mình rủ nhau đi ăn trưa nhân ngày Hà Nội mở lại hàng quán.
Bọn mình chọn một quán khá là chill để gặp nhau. Ai cũng ăn mặc lồng lộn như thể lâu lắm mới được thả cửa =)))
Mình và đồng nghiệp đang ngồi đợi mọi người đến đông đủ thì con bé Hằng dẫn người yêu đến cùng, vừa gặp mọi người nó vừa cười cười:
- Hôm nay mọi người cho em và bạn trai ăn cùng nữa nhá
Hehe cũng vui vẻ thôi, càng đông càng vui. Nhưng khổ nỗi Hằng không được lòng 1-2 người ở đây bởi con bé xinh vl, nét xinh kiểu hoa hậu ấy, đã xinh dáng lại ngon, học hành giỏi giang, gia đình gia thế, người yêu đẹp trai đúng kiểu mây tầng nào gặp mây tầng đấy nhưng bù lại Hằng lăng nhăng.
Không biết bao nhiêu lần thấy Hằng đá đưa, cặp kè với cơ số người trong cty. Cũng không phải lần đầu nó ra mắt người yêu với mọi người, Hằng bắt cá và quen nhiều người cùng lúc. Đúng kiểu đàn ông chỉ là niềm vui mà thôi =)))) dường như mình cũng chả nhớ nổi nó đã yêu bao nhiêu người nữa.
Tất nhiên - mình chả quan tâm. Mình quan niệm đồng nghiệp tốt thì chơi, không hãm loonf và tử tế với mình thì mình vẫn quý. Còn đời sống riêng tư của nó thì kệ mẹ nó, không phải chuyện của mình.
Nhưng có lẽ đ ai cũng nghĩ giống mình vì Hằng ở cty là chủ đề mang ra sân si, nói x-ấu mỗi-ngày. Và cơ hội gặp gỡ hôm nay là một dịp để người ta bộc lộ sự sân si đó vì trông có vẻ lần này Hằng chung tình, nghiêm túc với thằng Phước này phết khi công khai yêu đương trên facebook. Bọn nó tình tứ và nghe đâu dẫn cả về nhà tính chuyện cưới xin.
Nhìn Hằng bên cạnh Phước lúc này đúng kiểu hạnh phúc ngập tràn, mặt nó chỉ ửng đỏ lên rồi cười tươi vcl cả buổi.
Thế là tự dưng đang ngồi ăn thì Hằng chạy ra ngoài nghe điện thoại. Được một lúc sau bà Trang phòng mình gợi chuyện với thằng Phước - người yêu của Hằng ngay:
- Em tên gì á? Trung hay Tuấn Anh?
- Ơ chị, em giới thiệu lúc đầu buổi em tên Phước rồi ạ
- À đấy chị quên mất, cái Hằng nó ra mắt nhiều quá chị chả nhớ nổi tên
- Vâng
Mặt của Phước lúc này hơi chối rồi, nó chỉ cúi mặt xuống lau bát đũa đ,éo muốn tiếp chuyện nhưng bà Trang vẫn cứ đệm vào:
- Ơ thế Phước định quen Hằng bao lâu?
- Dạ bao lâu là sao ạ? Công việc ổn định thì cuối năm bọn em cưới
- Ối, cưới á? Thế có chắc cưới được không
:)))))))
Vãi loonf. Mình ngồi gần đấy thấy bắt đầu hãm là đá chân cho phát ý muốn nói là ""chị im mồm đi, chị đang bị vô duyên đấy"". Nhưng không nha, bà Trang vẫn cứ cưới rồi nói thêm như thể chuyện này là bình-thường:
- Thôi hôm nay con Hằng có giận chị cũng phải nói, em ăn gì mà em can đảm thế? Quen con Hằng làm sao mà giữ chân được nó? Em biết chuyện nó với thằng Trung cty chị chưa?
Lúc ấy thằng Phước ngẩng đầu lên nhìn thẳng vào mắt bà Trang. Còn con Hằng thì vô tư bước vào không biết chuyện gì xảy ra. Hằng chắc đ,éo ngờ được là nay bị đồng nghiệp chơi cho vố đau vl đâu. Phước nói:
- Dạ chuyện đấy em biết rồi, em tin người yêu em. Chị không cần phải nói gì nữa, em chọn Hằng và em tin Hằng.
Nói xong Phước dắt tay Hằng ra khỏi quán trong sự im bặt của tất cả mọi người. Bà Trang lúc này vẫn già mồm:
- Ơ tao có nói gì sai đâu
😃?? Vâng chị không sai, cái nết của chị sai. Eo ơi trần đời sao lại có loại vô duyên như thế
Tất nhiên sau đấy Hằng lên cty xé loonf Trang luôn. Hằng trước giờ đã không phải dạng vừa rồi, nó xinh đẹp nhưng cũng nổi tiếng ngoa ngoắt. Hằng sống phải phương châm cây sẽ lặng nếu gió đừng hãm loonf.
- Ơ thế mày đừng lăng nhăng để tao khỏi phải nói?
- Việc của nhà chị à?
- Tao ngứa mắt tao nói
- Thế chị đừng có trách tôi nói chuyện mẹ chị c//ặp k//è với ông Vũ Văn Cường bán vịt quay ở chợ, có 1 vợ và 4 đứa con nhé. Nhà dột từ nóc thì im cái mồm vào
Nguồn:Thảo Phương / Truyện cổ tích VN"
