comment_id,post_id,user_id,user_name,fullname,content
1848623702334248,1847881619075123,100025162457081,,Lan Trần,"Nhắn m chỉ cho này là mụn nội tiết đấy ko xử lí sớm nó viêm thành soẹ rỗ sau chữa khổ lắm, trước mh bị rồi mh biết"
1848638692332749,1847881619075123,61564659722397,,Thuỳ Dung,"Dùng thử tuýp này ạ

https://s.shopee.vn/9f2vukyUkw"
1848637845666167,1847881619075123,100083230755341,,Nguyễn Hoa Dược Sỹ,"Đừng nặn non nhé dễ rỗ đấy hiện tại mụn viêm nữa e đang dùng gi cho da
Tây trang srm sạch sâu
Thêm bôi mụn adapalen tre cho da mụn gom nhân
Tây da chết nhé ngủ sớm hạn chê thức khuya"
