comment_id,post_id,user_id,user_name,fullname,content
1822225444974074,1818842618645690,100078540048636,,Phạm Thị Liểu,"- Thứ 1: Mụn ẩn sần sùi , kích viêm thâm mụn các kiểu như này thì nền da phải luôn thật sạch sâu ( Xem lại bước làm sạch thật kĩ nhé👌)
=> Peel định kỳ nhẹ nhàng để thông thoáng lcl & ăn dưỡng hơn nhé

- Thứ 2: Duy trì với hoạt chất ( đặc trị mụn ) & Tranexamic/ Arbutin/ Kojic…sáng đều màu, mờ thâm, ucst
Kết hợp Phục hồi + Cấp ẩm đủ đô để da luôn khoẻ, khô cồi nhanh & tránh bị kích viêm như này nhé

=> Và Routine như nào cho hợp lý nữa nhé☘️ii"
1822076768322275,1818842618645690,100070026730530,,Trang Đặng,"Trị mụn b mua sp trị mụn của hãng Đỗ Thị Bình Thanh Bình Đỗ Thị Bình lấy nhân về làm sạch chấm thuốc mụn đều hàng ngày là giảm dần, khô mụn bong da là hết b ạ"
1822063384990280,1818842618645690,100016982135151,,Thùy Trang,Mụn này cũng có thể xử lý được tại nhà. Khi dùng sản phẩm . Nhưng sẽ mất thời gian hơn là điều trị. Nhưng nếu điều trị thì cũng vẫn phải chăm sóc ở nhà nữa . Nếu không có điều kiện thì đầu tư 1 bộ mỹ phẩm chăm sóc tại nhà là ổn
1822045681658717,1818842618645690,,hue.thu.lnbg,Thu Huế,"Trứng cá độ 4 là nặng rùi em, dùng chấm mụn giảm viêm tại nốt mụn, thuốc mụn bôi toàn bộ vùng mụn để gom cồi tiêu nhân, kết hợp với sp chăm sóc: tẩy trang - srm - dưỡng nữa nhé"
1822097388320213,1818842618645690,100094529220725,,Nguyễn Ngân,"B đi da liễu chữa ý, trc da mk bị mụn viêm mụn ẩn nhiều lắm, bôi dưỡng cả năm k cải thiện, từ ngày mk qua bên bác sĩ da liễu CEO Vicky Thuận điều trị giờ da mịn màng hết mụn rùi b ak"
1822257301637555,1818842618645690,61559029476406,,Trần Minh Oanh,"B qua da liễu coi thử xem sao nha. Mình rcm bạn bên TS-BS Vũ Thiên Tuân nha, đợt mình bị mụn có chữa bên này okii lắm mấy buổi là sạch mụn rồi mà bác take care nhiệt tình lắm."
1822249224971696,1818842618645690,,yenpham2609,Phạm Yến,"Da viêm đỏ kèm mụn ẩn
B chú trọng khâu làm sạch nhé
Hạn chế sờ tay lên mặt
Nặn nhân cứng dưới da
Chấm mụn cho nhanh xẹp
Thêm Tretinoin, azeliac, b5 đê dtri mụn va phục hồi
Dùng kem dưỡng thật mỏng nhẹ và thoáng thôi nhé"
1822044044992214,1818842618645690,,phanthi.thuthao.906,Nura San,"Này mụn ẩn và viêm nha b, b trị sớm ko để lại sẹo nè, ib mình hướng dẫn nha"
