post_id,user_id,user_name,fullname,content
1891202264742228,,,,"THÂN CHÀO ANH CHỊ
Em làm bên kỹ thuật cơ khí , em đang phân vân học 1 ngoại ngữ tiếng TRUNG hoặc tiếng NHẬT , không biết anh chị có cảm nhận gì về chế độ của công ty trung và nhật ( thường em thấy công ty nhật cho nghĩ 1 đến 2 thứ 7 trên tháng )
em cũng tính đi diện kỹ sư qua đài loan hoặc nhật nên em mới hỏi ạ ! theo anh chị thì lương ở việt nam tầm 15 đến 16 triệu thì có nên sang nước ngoài làm việc để có một số vốn về không ạ
Tiện thể mấy anh chị các bạn có định hướng , hướng đi nào phát triển bản thân cho em xin lời khuyên
em cảm ơn ad đã duyệt bài của em"
