comment_id,post_id,user_id,user_name,fullname,content
1878594662669655,1878171032712018,,luciafan19501,Ti Ny,"Giờ nhìu cty vậy gê, coi UV như trò đùa, coi như may mắn k làm việc với cty tào lao nha e"
1878568546005600,1878171032712018,,ha.nguyenthithanh.52206654,Nguyễn Thị Thanh Hà,Cty gì lấc xấc dữ
1878555296006925,1878171032712018,100031944344068,,Edogawa Tuấn,Thôi coi như xui gặp cty hãm lol đi bạn :)))) mình gặp hoài . Nhiều khi bạn mang hồ sơ theo pv nó cũng tìm lí do khác để không nhận bạn thôi
1878554492673672,1878171032712018,100010884872003,,Thuỳ Dương,"Nhiều cty hamlol lắm
Thôi coi như 1 kiếp nạn cần trải qua"
