comment_id,post_id,user_id,user_name,fullname,content
1808269636369655,1808003273062958,61552857908594,,Nguyễn Hoàng Ly,"Bị mụn như này thì đi điều trị đi cho dứt điểm b ạ. Trước mình cũng bị nhiều mụn lắm, điều trị bên Viện Thẩm Mỹ Royal xong thấy cải thiện hẳn, da dẻ sáng mịn nhìn mà ưng lắm nha."
1808061526390466,1808003273062958,100080718859914,,Tôn Ngộ Không,"quan trọng bước làm sạch nè
tẩy trang: https://s.shopee.vn/qc3HwuSF
srm: https://s.shopee.vn/3fkByMzZJg
toner loại bỏ dầu thừa, bã nhờn thừa khi rửa mặt: https://s.shopee.vn/6phDkFuhHG
serum giảm dầu giảm mụn, thu nhỏ lcl: https://s.shopee.vn/3q3OJRLTYg
kem dưỡng phục hồi: https://s.shopee.vn/7pZbWlojHO
chấm mụn viêm: https://s.shopee.vn/3fkAGoclvE"
1808251689704783,1808003273062958,100094529220725,,Nguyễn Ngân,"Dạ bị mụn nhiều bạn nên trị sớm để tránh nặng hơn và hình thành sẹo rỗ nhé,đợt trc mình có bạn điều trị bên CEO Vicky Thuận nay da trộm vía lắm á bạn tham khảo thử nhe"
1808253309704621,1808003273062958,61550279243141,,Thùy Trâm,Bạn qua chị Vicky Thuận chửa trị cho nhanh nè chị chuyên bên da khám trị liệu phù hợp mà khỏi đc chị nhé chị mát tay điều trị tận gốc luôn ko lo tái lại đâu nè
1808097453053540,1808003273062958,100050211463486,,San San,https://s.shopee.vn/4fcuhvhV32
