comment_id,post_id,user_id,user_name,fullname,content
2046542939111665,2046474552451837,,phuong.thao.hr.2024,Phương Thảo HR,"Mình ở BVĐK Tâm Anh Hà Nội , bên mình đang tuyển Chăm sóc khách hàng nè, Bạn quan tâm ib m nhé"
2046552622444030,2046474552451837,,gacon.mituot.93,Kim Cúc,lại đc 2 cốc trà sữa :)))
2046564222442870,2046474552451837,100086297774490,,Giang Nguyễn,"Vietin không phải viettin, cảnh sát chính tả đây"
2046559825776643,2046474552451837,,bephuc2k8,Nguyen Ngoc Phuc,"Làm theo nó hư..ớng dẫn đi, dc 3..5.0. :)) khi nào n bảo n..ạp 💵💵💵 thì thoy"
2046559035776722,2046474552451837,,bephuc2k8,Nguyen Ngoc Phuc,"Làm theo nó hướng dẫn đi, dc 3..5.0k :)) khi nào n bảo nạp 💵💵💵 thì thoy"
2046530675779558,2046474552451837,,tranviet1999,Huy Trần,Lừa chứ còn gì. Làm ngân hàng phỏng vấn trực tiếp
2046592805773345,2046474552451837,,chauailoan,Châu Ái Loan,"lừa đảo đó bạn ơi, k NH nào bắt khoá trải nghiệm sp vớ vẩn đâu"
