comment_id,post_id,user_id,user_name,fullname,content
1848630769000208,1842471612949457,100093054574592,,Hồng Thắm,Sản phẩm này hỗ trợ tình trạng da của mình. Mua nhanh có ưu đãi https://s.shopee.vn/8fAOhw9Tu7
1848636525666299,1842471612949457,,lind.lind.ngkh,Khánh Linh,https://s.shopee.vn/9A55PBWqG9 Sáp tt này làm bay đi đống mụn cám + mụn đầu đen ở mũi tuii. Mà sạch còn an toàn nữa da nào cũng dùng dc hết. Nhớ nhũ hóa kỹ nhaa
1848637025666249,1842471612949457,100083230755341,,Nguyễn Hoa Dược Sỹ,"Tây trang srm da khô
Câp ẩm dưỡng da khô
Thêm tây da chết aha"
1848639928999292,1842471612949457,61564659722397,,Thuỳ Dung,"B dùng thử mặt nạ đất sét nhé

https://s.shopee.vn/5VDMxEy0IO"
