comment_id,post_id,user_id,user_name,fullname,content
8487321624721731,8487278398059387,,duc.dan.50,Trần Minh Đức,Copy thì ghi nguồn vào nhé Pi thủ :))
8487500424703851,8487278398059387,,,Người tham gia ẩn danh 790,"Của bạn tất, mua hết đi đừng dụ ngta vào làm thanh khoản cho nhà cái"
8487314764722417,8487278398059387,,hoang.l.bich,Hoang Lam Bich,Bộ trưởng bộ lạc quan
8487312398055987,8487278398059387,,nghiatmn,Minh Nghia,Pi thủ mới sang
8487299828057244,8487278398059387,,hellovnn,Thuận Phạm,Bị coin chơi Ngáo đến mức này rồi à🤣
8487462718040955,8487278398059387,,quoc.tung.714,Quốc Tùng,Đủ vốn xoá áp dừng cuộc chơi
