post_id,user_id,user_name,fullname,content
1861613661034422,,,,"[Review công ty] KHÔNG HỢP ĐỒNG - CHẬM LƯƠNG - QUỊT LƯƠNG
Chào mọi người, tính ra em cũng không muốn phốt ai vì phận nhân viên quèn, nhưng nợ lương đến 2 THÁNG thì không muốn cũng phải giãi bày.
Chuyện là tháng 12 năm ngoái, em xin thực tập vào công ty công nghệ giáo dục lĩnh vực STEAM, vị trí là TTS. Vì là công ty start up nên khi đi làm, em đã xác định là lương mình thấp (việc này em không bàn đến). Nhưng mà kiếp nạn đời elm giờ mới đến cả nhà ạ:
1. CHẬM LƯƠNG
Cú shock đầu tiên là chậm lương. Em đi làm từ tháng 12, nhưng phải đến gần Tết em mới nhận được lương của cả tháng 12 và tháng 1 😀, lý do sếp đưa ra khá hãm: Do em không có tên trong danh sách nên anh quên! Ban đầu em tưởng mọi người ai cũng bị chậm như thế, nhưng KHÔNG, có mỗi mình em bị!
Em làm từ tháng 12 đến tháng 6, em xin nhấn mạnh là CHƯA MỘT THÁNG NÀO em NHẬN LƯƠNG ĐÚNG HẠN 🙂. Các chị đồng nghiệp an ủi em công ty là startup, nguồn tiền không ổn định nên không thể trả lương cho mọi người cùng một lúc mà phải có sự ưu tiên các phòng ban. Em cũng ok, những vấn đề là chậm bao lâu, chậm đến ngày nào và bao giờ trả thì các sếp không ai nói lời nào. Nửa năm làm việc chưa bao giờ nhận được LỜI XIN LỖI chính thức nào từ ban lãnh đạo hay các bên liên quan.
Thời gian chậm lương ban đầu từ 10 ngày, 20 ngày, xong tăng dần đến cả tháng! Lý do luôn luôn là “Dòng tiền không ổn định"", “Quỹ lương không đủ"", “Đang có sự ưu tiên"", em luôn được bảo nên thông cảm cho công ty. Thông cảm cho công ty thì ai thông cảm cho em? Em thông cảm cho công ty đến nửa năm, những kết quả thì…
2. QUỊT LƯƠNG
Tiếp nối phần chậm lương, là phần QUỊT LƯƠNG. Em làm vị trí TTS từ tháng 12 đến hết tháng 4, tháng 5 và 6 được lên parttime, nhưng không có sự review lương nào đến từ vị trí sếp. Thành thực mà nói đến hiện tại em cũng không rõ lương part time của em là bao nhiêu (vấn đề này thì do em ngoo vì không bàn bạc kỹ thật).
Trong khoảng thời gian em làm, có vài vấn đề nên ban lãnh đạo quyết định chia làm 2 đợt trả lương, hoặc 50-50 hoặc 30-70, còn ngày nào trả thì tuỳ tâm trạng =))). Hôm nay là 14/8, và em vẫn chưa nhận được hết LƯƠNG THÁNG 5. Em đã connect vs các đồng nghiệp và đều được confirm là nhận được lương tháng 6 đợt 1 rồi, nên em có nhắn tin hỏi sếp. Ngày 21/7, sếp hứa hẹn là đợi tính doanh thu sẽ trả nốt lương tháng 5 cho em nhưng đến tận 7/8 em vẫn không nhận được khoản thanh toán nào. Em nhắn lại và yêu cầu thanh toán trước lương tháng 5 thì chỉ được thả tim chứ không rep =))
Đến hiện tại thì em cũng hết hy vọng với việc lương lậu, khả năng cao là em bị quỵt rồi. Chân ướt chân ráo đi làm mà gặp phải quả công ty red flag cú shock đầu đời 🫠…
3. CÁC VẤN ĐỀ KHÁC
• Không hợp đồng: Vấn đề chung gần như toàn bộ nhân viên trong công ty, không ký kết hợp đồng, review công việc nhưng kiểu gì cũng sẽ có những công việc phát sinh khác nhưng lương vẫn thế =)).
• Không đào tạo nhân viên: Nói không đào tạo thì cũng không hẳn vì kiến thức chủ yếu em học từ đồng nghiệp và leader, và không có một lộ trình nào cho việc thăng tiến…
• Môi trường làm việc: Trộm vía đồng nghiệp của em rất tốt, quy mô nhân viên cũng không quá đông nên không có nhiều sự kèn cựa nhưng drama thì cũng không ít, chỗ nào cũng có người this người that thôi.
• Cắt giảm lương vì hiệu suất: Vâng, công ty có trò cắt lương nhân viên vì không đạt hiệu suất công việc. Giảm một vài trăm đã nhức nhối, đây cắt hẳn 1 nửa ạ 🤡
Trên đây là những kỷ niệm đáng nhớ mà quý công ty để lại cho em. Chúc sếp L** V* kinh doanh phát đạt, tiền vào như nước tiền ra nhỏ giọt, công ty mãi mãi trường tồn =))) Xin chân thành cảm ơn và không hẹn ngày hội ngộ.
P/S: Công ty gia đình, cân nhắc trước khi apply!"
