comment_id,post_id,user_id,user_name,fullname,content
2076482506165199,2075872872892829,100091810403493,,Huệ Nhuyễn,"Vệ sinh da sạch, dùng chấm mụn cocoon lành tính cho mẹ bầu và sau sinh ạ https://s.shopee.vn/20cyPLTWTr"
2076489909497792,2075872872892829,,ut.pe.71216,Vương Ngọc Bích,"Vệ sinh da mặt kĩ mom ơi, đừng bôi nghệ tươi này nọ dễ nhiễm trùng"
2076584232821693,2075872872892829,,alldo.baretho,Hạ My Alldo,Cho chị em hóng phốt bs mà né nha 😖 BÍ MẬT DAO KÉO PHỐT BS KHÔNG UY TÍN
2077382722741844,2075872872892829,,ho.mi.184300,Mimie,"đang cho con ti thì cứ tẩy trang, srm, dưỡng phục hồi dạng gel , chống nắng
, ko dùng mấy hoạt chất aha bha retinol tretinoin là đc
nào ngưng cho con ti thì thêm mấy hoạt chất đó vô để trị mụn nè"
2094474251032691,2075872872892829,,duyenspahanoi,Hệ Thống Duyên Spa Hà Nội,"Sau sinh, nếu bạn gặp tình trạng mụn viêm và đang cho con bú, bạn nên lựa chọn các sản phẩm an toàn cho cả mẹ và bé. Dưới đây là một số gợi ý:

1. Sữa rửa mặt dịu nhẹ: Chọn sữa rửa mặt không chứa hóa chất gây kích ứng, có thành phần tự nhiên như chiết xuất trà xanh hoặc lô hội.
2. Toner cân bằng: Sử dụng toner chứa thành phần như hoa hồng hoặc trà xanh để làm dịu da.
3. Kem dưỡng ẩm: Chọn kem dưỡng ẩm không chứa dầu (oil-free) để giúp kiểm soát bã nhờn.
4. Sản phẩm chứa salicylic acid hoặc niacinamide: Hai thành phần này có thể giúp giảm mụn viêm và ngăn ngừa mụn, nhưng hãy đảm bảo sản phẩm phù hợp và an toàn cho mẹ đang cho con bú.
5. Kem chấm mụn: Nếu cần, bạn có thể sử dụng các sản phẩm chứa benzoyl peroxide hoặc tea tree oil, nhưng hãy kiểm tra xem sản phẩm có an toàn cho phụ nữ đang cho con bú hay không.

Ngoài ra, việc duy trì một chế độ ăn uống lành mạnh, uống đủ nước và ngủ đủ giấc cũng rất quan trọng để hỗ trợ da. Nếu tình trạng mụn không cải thiện, bạn có thể cân nhắc tham khảo ý kiến của bác sĩ da liễu để tìm ra giải pháp phù hợp nhất."
