comment_id,post_id,user_id,user_name,fullname,content
1745267192928401,1745147799607007,,miu.thuy.3,Phương Thùy,"Mình ké cách chống dính loại nồi này với, nấu gì cũng dính cháy đáy nồi khó chịu vô cùng nên toàn bỏ xó :("
1745266999595087,1745147799607007,,chick.hong.1,Kẹo Bông,Sao lại luộc rau k cần nc hả b. Như kiểu món hấp ấy hả
1745291869592600,1745147799607007,100007136521626,,Kiều Oanh,Em luộc khoai xong gần chín đổ nước đi. Nấu thêm xíu thé là nó làm cái TẠCH đi tong cái nồi 🥲
1745260292929091,1745147799607007,,ngdiepp236,Diệp Ngọc Đặng,"Nồi gốm à c
Cho dấm lên đun rồi rửa cọ lại"
1745282652926855,1745147799607007,,mailoanbdsnamcuong0971688896,Loan Nguyễn,Mình có cái nồi nhỏ như này bà toàn nhầm là bát đựng canh 😂
1745285776259876,1745147799607007,100045047618954,,Đặng Hiền,Nồi này dùng ok b nè
1745336406254813,1745147799607007,,pt.chu.79,Pt Chu,Cảm ơn cmt của các bác k có e cũng đú đởn rinh 2 cái về
1745529482902172,1745147799607007,,baotram.nguyenvuong,Hương Thơ,Kho cái gì cũng cháy
1745608609560926,1745147799607007,,trang.quynh.144181,Trang Quynh,"Nồi của bạn chắc là loại dùng bếp từ nhỉ, của mình cũng vậy, chuyên cháy ở vòng tròn bắt từ mặc dù tôi nồi bằng cháo bằng dầu các thứ, nấu lửa bé cũng bị 😞"
1745553662899754,1745147799607007,100014308933103,,Ngọc Khánh,Nó chẳng ra gì cả. Rất chán. Nấu xíu cháo cũng cháy phía đáy nồi và rửa miết không sạch nổi.
