post_id,user_id,user_name,fullname,content
1705972380190327,100089726256821,,Hai Ba Lạng,"#buildinpublic
unlimited avatar FTW 🥳
*hiện tại*, vấn đề của các nền tảng khác là avatar bị giới hạn
tất cả khách hàng chọn chung 1 danh sách avatar
điều này có thể thay đổi trong tương lai,
nhưng giá thành sẽ là 1 vấn đề
nên mình tạo nền tảng để khách hàng kiểm soát đầu vào/đầu ra
từ kịch bảng, giọng nói, hình ảnh/video của avatar
nếu thị trường tràn ngập nội dung ai, thì cá tính/chất riêng của nhà sáng tạo sẽ tạo nên sự khác biệt
nên nhà sáng tạo cần kiểm soát
và chỉ dùng AI để đẩy nhanh sự sáng tạo"
