comment_id,post_id,user_id,user_name,fullname,content
1736451693821755,1735982473868677,,hongha.pham.104,Phạm Hồng Hà,Bác thuê bao nhiêu vậy
1736446267155631,1735982473868677,,MrJoyKent,Lưu Đăng Tiến,Có đăng ký gói ultrafast không? Có gì thử đăng ký 1 tháng xem.
1736443133822611,1735982473868677,,CVE2021.py,Tùng,"Mạng FPT có tiếng từ xưa h.

Trước mình dky gói mạng FPT, test speed cao, nhưng cứ đến 1 khung giờ là auto bị lag

Thuê VPS cũng vậy, bên nhà cung cấp sài mạng FPT. Test speed rất cao. Nhưng nhiều lúc tự nhiên ping cao, ko ổn định.

Thế là từ h chỉ dùng mỗi Viettel"
