comment_id,post_id,user_id,user_name,fullname,content
8094038710693864,8089878137776588,,nguyenha9989,Hà Emm,Nửa bình Nước sôi là hết 🤣
8094045447359857,8089878137776588,,POP.pophuong,Hương Lương,Xài thuốc ngủ nha em. Chứ em ngủ giấc đó ko thuốc nào chữa dc.
8094058470691888,8089878137776588,,vkiuck.NTMP.1010NTTQ,Nguyễn T. Minh Phấn,Kem mắt esteee á. Đỡ mà giảm nếp nhăn nữa
8093858150711920,8089878137776588,,cherry.quynh.33,Hằng Phạm,Sinh hoạt như thế k hết thâm đc đâu
8094040200693715,8089878137776588,100095248493716,,Nguyễn Dung,Chấm an
8093868080710927,8089878137776588,100067748623838,,Nguyễn Việt Phương,Sài thuốc ngủ g10 là hết thâm bạn ạ
8093959557368446,8089878137776588,,thao.buithu.9809,Bùi Thu Thảo,Cùng câu hỏi 🤣🤣
