comment_id,post_id,user_id,user_name,fullname,content
7907791129318624,7906274306136973,,tru.lothi.5,Hồ Xuân Hương,"2 sp trị mụn đỉnh caooo

Đặc biệt da đã qua dùng thuốc rượu, kể cả mụn lâu năm vẫn xử lý rất nhanh nhé😉
Xoa tầm 7 bữa đã thấy hiệu quả gôm cồi mụn , hết sưng đỏ đến 70% rồi ạ"
7909419622489108,7906274306136973,100092570064685,,Đức Tài,"Mụn viêm nền da đỏ nhạy cảm.
Tạm ngưng Trệ với nền da này.
Mụn có đầu trắng e mới chấm nha.

Tập trung cấp ẩm phục hồi hab5 + kem dưỡng ẩm mỏng nhẹ thoáng da.
Đắp mask cho dịu nha e.
Hạn chế thức khuya nha."
7909558312475239,7906274306136973,100092442021029,,Bông Skincare,"Mụn viêm tập trung vùng trán
E hạn chế thức khuya ăn đồ cay nóng nha
Chấm mụn viêm biotrade vô
Nè b5 kem dưỡng ẩm mỏng nhẹ nhé
Nạ b5 vô nè
Da kiểu kích ứng đỏ nữa"
