post_id,user_id,user_name,fullname,content
3818433115088763,,,,"Chưa hẳn đã uptrend đâu anh em.
Updata view BTC mới nhất :
Sau khi mình đã ăn full tp thì gặp ngay cây quét.
Cây quét hôm qua đã cho thấy anh em fomo khá là nhiều và có dấu hiệu sự điều chỉnh của BTC. Tính ra nhiều người hô short thì kiểu gì nó cũng phải quét mới xuống được, vùng 68.800 rất nhiều lệnh stl ở đây, sau khi mình nói ae vào hàng từ 60k thì không ai nghe, giờ đi hỏi vào hàng được không thì mình cũng khá là đắn đo.
MÌnh sẽ đợi 1 cú điều chỉnh xuống 64-63k rồi sẽ gom đợt 2 , anh em cũng có thể bắt nhịp điều chỉnh ở vùng này rồi dca sau cũng đẹp không sợ nhé.
Lưu ý : BTC sẽ có thể quét mới sập tiếp về vùng 64-63k được đấy
ETH của mình sắp gãy rồi nhé anh em."
