comment_id,post_id,user_id,user_name,fullname,content
8415016158596116,8413283032102762,,ngokimdinh1996,Ngô Kim Đĩnh,"Nhìn như mụn do tuổi dậy thì, có hiện tượng sưng, viêm cần chú ý bước làm sạch bằng sửa rửa mặt dùng thêm serum trị mụn thôi nhé. Sau da ổn thì dùng srm và kem dưỡng là đc"
8414165332014532,8413283032102762,100092442021029,,Bông Skincare,"Da mẩn đỏ có thâm mụn
E thêm hoạt chất trị thâm kháng viêm như azelaic, Niacnamai nha e
Cấp ẩm phục hồi hab5 kem dưỡng ẩm kèm theo nhé
Nạ b5 đắp cho da dịu nha e"
8413987392032326,8413283032102762,100072035858035,,Tính Phùng,Bạn dùng sp gì k
8414455935318805,8413283032102762,100083230755341,,Nguyễn Hoa Dược Sỹ,"Da thấy hơi đỏ có mụn it và thâm
Cần làm sạch da thêm bôi mụn và phục hồi đắp mặt nạ"
8414871995277199,8413283032102762,61556882228587,,Huy Skincare Khoa Học,"e ntin cho a nhé, a chỉ phác đồ cụ thể cải thiện da cho e"
8416505791780486,8413283032102762,100092015444502,,Quynh Nhu,.
8418220441609021,8413283032102762,61556814346507,,Nguyễn Thảo,B nên phục hồi đắp mask sos nhé
