post_id,user_id,user_name,fullname,content
1834014940461791,100064311744719,,Be pretty with me,"REVIEW SỮA DƯỠNG THỂ OLAY B3 NỘI ĐỊA TRUNG 😮‍💨
Hôm trước lướt weibo thấy các bạn bên Trung review em này thích quá, nên tậu thử 1 em về xài xem như nào. Nên giờ ngoi lên để đánh giá nhẹ nhàng em này cho hội chị em nè:
• Về thiết kế, sản phẩm có nhiều size cho bạn chọn, mình chọn size 250 ml xài hơi bị lâu luôn í. Mình cực ký thích mấy loại mỹ phẩm có thiết kế nắp giật luôn, vì giúp kiểm soát lượng sản phẩm mỗi lần sử dụng và cũng vệ sinh hơn.
• Về kết cấu, em này màu trắng, dạng lotion nhưng không quá lỏng nên thẩm thấu rất nhanh, không hề gây nhờn rít, bết dính nha. Lúc bôi lên thì tầm 2 phút sản phẩm đã thẩm thấu vào da rồi, không gây khó chịu.
• Sản phẩm có một mùi hương nước hoa Fressia (hoa cam) dịu nhẹ, ngọt ngào kiểu thư giãn lắm luôn.
• Em này cấp ẩm khá tốt, bôi xong da mềm hẳn và ẩm mượt. Sử dụng đều đặn mỗi ngày thì trong khoảng 1 tuần bạn đã thấy làn da đã cải thiện lên rồi, những vùng da như đầu gối, gót chân, khuỷu tay,… cũng trở nên mềm mịn và sáng màu hơn. Sử dụng em này sau khi tẩy tế bào chết thì còn phê nữa cơ, sau 1 thời gian thì mình thấy tình trạng mụn trên lưng giảm đi khá nhiều. Sau 1 tháng thì mới thấy được hiệu quả về tác dụng dưỡng trắng và làm đều màu da.
💫 Cho bạn nào muốn thử em ấy: https://s.shopee.vn/3fiPjPH5U6"
