comment_id,post_id,user_id,user_name,fullname,content
1875541376308317,1875502816312173,,long.henry.779,Henry Nguyễn,"nếu bạn là nv thì chúc mừng , bạn sẽ chịu trách nhiệm quản tts mà nhiều khi nó chả nghe đâu :)) còn lại thì cty này ko làm lâu dc thôi."
1875562319639556,1875502816312173,,dung0123456789,Nguyễn Văn Dũng,nếu vậy thì là quy mô quy trình k bền. công việc hàm lượng trách nhiệm không cao. cty tài chính cũng không được ổn được tốt. nội bộ k ổn định
1875562989639489,1875502816312173,,dont.cry.121,Nguyễn Hồng Phúc,"đỡ phải trả lương, bảo hiểm..."
1875560689639719,1875502816312173,,linh.vivu.33,Hoa Thược Dược,Đỡ phải trả lương
1875558219639966,1875502816312173,100017712188583,,Kiệt Nguyễn,Tuyển tts để cty khỏi trả lương với làm culi. Còn bạn làm nv chính thức mà nhóm bạn làm ẩu thì ng chịu phạt và trách nhiệm chỉ có bạn chịu chứ tts bọn nó đâu qtam gì
1875537596308695,1875502816312173,100012506472940,,Phong Linh,Thấy tuyển người liên tục thì chạy.
