post_id,user_id,user_name,fullname,content
3800247913573950,,Thaison990,Trần Thái Sơn,"SQUID GAME !!!!!
Coin Cũ & Coin Mới & Meme
🐣 FOMO với coin mới, nhà cái thường bơm coin cũ.
Khi thị trường trở nên sôi động, việc đầu tư vào coin cũ trước tiên sẽ tạo điều kiện cho coin mới được bơm lên.
🐣 FOMO vào altcoin, nhà cái sẽ bơm $BTC và meme.
Khi có đủ sự quan tâm đến meme, altcoin sẽ được hưởng lợi từ làn sóng này.
🐣 FOMO vào Layer 2, nhà cái bắt đầu bơm AI.
Sự bùng nổ của AI sẽ dẫn đến sự tăng trưởng mạnh mẽ của Layer 2.
📖 Bài học rút ra:
✍️ Không ai có thể dự đoán chính xác cách mà nhà cái sẽ điều hướng thị trường. Vì vậy, hãy phân bổ vốn đều cho các xu hướng.
✍️ Nếu bạn thích một xu hướng nào đó, hãy nghiên cứu và đầu tư ngay từ đầu, đừng chờ đợi sự FOMO từ đám đông.
👀 Một số suy nghĩ cá nhân:
✍️ Một dự án có “câu chuyện hay” chưa chắc đã đảm bảo thành công; điều quan trọng là giá trị của nó phải tăng ngay từ sớm.
✍️ Mục tiêu đầu tư của chúng ta là kiếm lợi nhuận, không phải chỉ để trải nghiệm công nghệ hay lắng nghe câu chuyện từ Dev.
✍️ Một câu chuyện hay đôi khi không giúp giá trị tăng lên, như trường hợp của $ARB.
✍️ Như $TIA, khi vừa niêm yết ở mức 2$, nhiều người đã chê bai (vì vốn lớn, không hot…) nhưng sau đó lại tăng vọt lên 8$, tạo ra làn sóng FOMO lớn.
=> Dự án “biết tăng giá” sẽ tự tạo nên câu chuyện hấp dẫn cho chính mình.
✍️ Khi chọn coin, hãy chú ý đến quỹ lớn đứng sau, niêm yết trên sàn lớn và giá cả hợp lý; cho dù có công nghệ kém lỗi thời, một câu chuyện có vẻ không thuyết phục vẫn có thể mang lại cơ hội tốt.
✍️ Dù dự đoán đúng về xu hướng, bạn vẫn có thể bỏ lỡ cơ hội, và tình trạng bị “ôm vốn” là điều đáng lo ngại. 🥹
✍️ Nghiên cứu và phân tích điểm vào là cần thiết, nhưng quản lý vốn và chiến lược đầu tư mới là yếu tố quyết định thành công. Hiện tại, giá đang rất hấp dẫn để cơ cấu lại tài khoản.
🙏 Không nên all-in vào một dự án duy nhất. Hãy phân bổ ra 3-5-7-10 coin tùy theo tình hình. Nếu ôm 5 coin, hãy đảm bảo chúng đến từ các xu hướng khác nhau; ví dụ, đừng đồng thời nắm giữ $OP, $ARB, $Aleo, $MANTA và $ZK.
🙏 Hãy đầu tư vào cả coin cũ và coin mới, nhưng cá nhân mình vẫn ưu tiên coin mới, vì trong dài hạn, chúng có khả năng đột phá hơn.
✍️ Không phải tất cả coin cũ đều giống như $SOL; vẫn còn nhiều coin cũ chưa có cơ hội hồi phục. Liệu bạn có đủ may mắn để lựa chọn một dự án tương tự $SOL?
✍️ Cuối cùng, cho dù là coin mới hay cũ, meme hay altcoin, cách chơi mới là điều quan trọng nhất. Và trong mùa tới, hãy sẵn sàng để đầu tư toàn bộ cho chắc chắn!
$$ không tự sinh ra & mất đi $$ chỉ chạy từ túi người này sang túi người khác."
