comment_id,post_id,user_id,user_name,fullname,content
2038683159945134,2038239506656166,100091930427449,,Như Quỳnh,Kcn thì dùng loại thuần vật lý cho da nhạy cảm bạn ạ https://s.shopee.vn/7zsyixlTXF
2038719686608148,2038239506656166,100016982135151,,Thùy Trang,Bạn dùng kcn vật lý đi. Và qtrong khâu làm sạch da nha kể cả dùng kcn gì đi nữa làm sạch k tốt thì đều bị lên mụn nha và dùng chấm mụn đi để cho nó gom mụn lại
2039995466480570,2038239506656166,,ngondenmauxanhduong,An Nhiên,"Dưỡng ẩm thì có thể tham khảo dòng lotion của Cerave ạ, mỏng nhẹ dễ thấm, khả năng dưỡng ẩm tốt
https://s.shopee.vn/qPr5q8s8P"
2040086349804815,2038239506656166,,truc.nguyenthithanh.96592,Nguyễn Thị Thanh Trúc,xài của Centella thấy ổn áp á bn
2039770709836379,2038239506656166,,Mot1652000,Nguyễn Thu Hiền,"GẤP 🔥
TUYỂN MẪU CHĂM SÓC DA, TRỊ MỤN CÓ HỖ TRỢ THUỐC TRỊ MỤN HOÀN TOÀN MIỄN PHÍ
MỤN CÀNG NẶNG CÀNG TỐT ❤️

Quyền lợi: mẫu sẽ được làm như khách đầy đủ 1 quy trình chăm sóc da và hỗ trợ thuốc trị mụn
Dc : ngõ 1 Trần quốc hoàn, Cầu Giấy, Hà Nội"
2039910739822376,2038239506656166,61559931797017,,Thanh Hiếu,Ib mk ạ
2040096523137131,2038239506656166,,jessica.xuan.7106,Xuan Jessica,"bac này làm dep c ak, truong khoa pttm #bacsithammynguyenthanhsi"
2038686189944831,2038239506656166,,maiphuong.ngo.96,Mai Phương,Dùng kcn dạng sữa ý c. Dễ tán mà k sợ bị vón cục
