comment_id,post_id,user_id,user_name,fullname,content
8399791326808095,8399713256815902,,nguyenhuutuananh241092,Tuananh Nguyen,"Đồng gì đây, cái này coin rác chỉ mình sàn có thì chấp nhận thôi, còn sàn khác có chụp đối chiếu kiện bỏ mịa nó đi 😌😌😌"
8399830910137470,8399713256815902,,langtugio86,Phạm Vũ Dương,Coin này là coin gì
8399765313477363,8399713256815902,100004992526771,,Phong Toàn,:)) bịp trắng trợn ae bỏ sàn bitget này đi
8399731730147388,8399713256815902,100081494297035,,Nguyen Nam,Sàn này có vấn đề hả b
8399913863462508,8399713256815902,,akira.aha.37604303,Coin Thủ,chơi bịp công khai 🤣
