post_id,user_id,user_name,fullname,content
423961366660902,100091312583812,,Good Girl,"Chu Linh - 2004
Good Girl Việt Nam �
--
Người thương ơi...đừng giận hờn em nhé
Để nỗi buồn giằng xé trái tim anh
Vẫn biết yêu thương vụn vỡ khó lành
Nhưng tại sao anh mơ hoài em nhỉ
Xin trả lại con đường tình mộng mị
Cho tôi về với nguyên thuỷ tình yêu
Cùng người thương sánh bước mỗi buổi chiều
Mình sẽ yêu thật nhiều trong đêm vắng
Em yêu ơi...đừng nói lời cay đắng
Cuộc tình nào không thiếu vắng đớn đau
Giận hờn mà chi chỉ làm khổ nhau
Dĩ vãng buồn phai màu theo năm tháng
Con đường tình có bao giờ phẳng lặng
Lối yêu đương thường chẳng thiếu chông gai
Cùng dìu nhau đến cuối chặng đường dài
Hết giận rồi mình lại thương nhau mãi..."
