comment_id,post_id,user_id,user_name,fullname,content
2038898976590219,2037880153358768,,quynhh.jappan.7,Hoa Nhật Quỳnhh,Da này có nhạy cảm không ạ? Nếu nhạy cảm thì chưa nên peel vội nhé ạ
2038740796606037,2037880153358768,,bao.chau.50552,Bao Chau,Cần thơ inb mình nhá
2038755386604578,2037880153358768,100003759588160,,Lê Thị Hường,ủa da này chăm sóc lại là được chứ co gì nghiêm trọng lắm mà phải đi da liễu nhỉ. vài cai mụn li ti kia chăm sóc da sạch sẽ và dưỡng lên là đc thôi c
2038774773269306,2037880153358768,,jennyhihiii,Nguyen Thao My,Peel là trị sẹo chứ mụn vẫn đang viêm thì phải phục hồi trc ạ https://s.shopee.vn/9f1CgEbVEs
2038908249922625,2037880153358768,100083048413849,,An An,"Bà nên trị mụn dứt điểm đi rồi hẳn peel nha, tui từng trị mụn bác sĩ Ánh đường Hoa Cúc Phú Nhuận đỉnh chóp, mà đông bà gọi book lịch trước 2 ngày nè"
2038763456603771,2037880153358768,,nguyenthanh.hmu,Thành Nguyễn,"Da có mụn ẩn bã nhờn đi kèm xạm da trước tiên e chú ý giữ vệ sinh mặt sạch sẽ, chọn sp dưỡng ẩm mỏng nhẹ ưu tiên dạng gel hoặc lotion cũng như kcn free oil tránh bít tắc gây mụn.
Về điều trin e có thể cân nhắc sd chu trình có aha có latic acid + Tretinoin kèm Niacinamide và azelaic acid kết hợp cho td kiềm dầu ngừa mụn cung như giúp sáng da và ngừa thâm mụn hiệu quả e nhé."
2038760566604060,2037880153358768,,nga.jenny.73,Thanh Nga,Mình da như này luôn ạ. Có ai biết sp gì k chỉ e với :((
2038796069933843,2037880153358768,,minh.phuong.39904,Minh Phượng,"B uống giải độc gan chế từ cây kế sữa hoặc atiso có thêm glutathion là da sáng & hết mụn thôi. Đừng nôn nóng vì da b có dấu hiệu lão hóa rồi, chỉ cần làm đầy đủ các bước vệ sinh da cơ bản dùng thêm serum chống lão hóa, khóa ẩm bằng kem giữ ẩm là ok, dùng nhìu thứ nó chọi nhau là da b lãnh đủ"
2045417249271725,2037880153358768,,banh.kem.helen.can.tho.718482,BÁNH KEM HELEN Cần Thơ,Thôi đừng pell
2039190789894371,2037880153358768,,huong.pham.713979,Hương Phạm,"Tha Thứ
đây nhé. Mình làm vậy đó
1. Tẩy trang. https://shope.ee/7AG3ydjU1F
2. Tẩy tế bào chết: https://shope.ee/7AG3ydjU1F
3. Rửa mặt: https://shope.ee/2fnecQuSfO
4. Peel da: https://shope.ee/30QV0p7iRQ
5. Rửa mặt rồi bôi tone:https://shope.ee/1LIH22BndH
6. Serum phục hồi:
7. Khóa ẩm: https://shope.ee/4ps5T8felc"
2038844459929004,2037880153358768,,Trangtiina,Trang Tiina,"Nên ra spa peel b ạ, nếu ở gần thì tham khảo m, chi phí hợp lý"
2038878273258956,2037880153358768,,daothuy96.doty,Đào Thùy,"Đọc cmt thấy ko ít bạn bảo trị mụn xong hẵng peel. Ủa, peel điều trị mụn đc mà, mấy bạn bị làm sao vậy 😂"
2039016429911807,2037880153358768,,nguyenthi.minhhuong.520,Hương Nguyễn,"Đi khám da liễu 1 lần cho biết da bạn đang như thế nào và là loại da nào, sau có tự skin care cũng biết mình nên mua sp ntn cho hợp da b. Đừng đi peel lung tung"
2038771029936347,2037880153358768,100048708593674,,Nguyễn Mai,Bạn nhắn tin mình tư vấn miễn phí nhé
2038770376603079,2037880153358768,100049832573854,,Nhi Pham Richarch,"Bị mụn thì không nên pee da ạ có khi tình trạng nó nặng hơn á chỉ cần xài thuốc trị mụn tẩy trang vs rửa mặt là nó cũng đỡ , nếu bạn cần xây dựng một bộ sản phẩm trị mụn thì mình có thể giúp bạn tư vấn"
2038750786605038,2037880153358768,,tothithanhxuan,Thanh Xuân,"Tham khảo thêm bên mình nhen
Cảm ơn bạn❤️"
2038811799932270,2037880153358768,,lens.tuyens,Bích Trâmm,Muốn peel thì tới Spa uy tín mà Peel. Tự ý peel taị nhà k trở tay kịp thì tốn tiền gấp nhiều lần nữa nha 😆
2038805689932881,2037880153358768,100056126299178,,Thanh Huyền,"Da này có mụn mấy đâu đi da liễu trị mụn nhỉ, peel xong phục hồi dưỡng là ok"
2039767806503336,2037880153358768,,Mot1652000,Nguyễn Thu Hiền,"GẤP 🔥
TUYỂN MẪU CHĂM SÓC DA, TRỊ MỤN CÓ HỖ TRỢ THUỐC TRỊ MỤN HOÀN TOÀN MIỄN PHÍ
MỤN CÀNG NẶNG CÀNG TỐT ❤️

Quyền lợi: mẫu sẽ được làm như khách đầy đủ 1 quy trình chăm sóc da và hỗ trợ thuốc trị mụn
Dc : ngõ 1 Trần quốc hoàn, Cầu Giấy, Hà Nội"
2038742763272507,2037880153358768,100049290102082,,Nhung Phạm,Bạn nên chữa mụn đi rồi hãy peel nha.
2038813123265471,2037880153358768,100022324597137,,Phạm Mi,Ib e nha
2038749953271788,2037880153358768,100016982135151,,Thùy Trang,Cần tv ib e dược mỹ phẩm ạ
2038740306606086,2037880153358768,,uyenxinhgai1002,Mỹ Uyên L’Kaori,Ib em nha tình yêu
2038746529938797,2037880153358768,,huynhnhaan.tran.5,Nhã Chi,"Da đang có vấn đề đừng tự peel da bạn ơi, chữ mụn cho da khoẻ rồi hãy peel"
2039140413232742,2037880153358768,100034446773120,,Mai Thu Hiền,Em có nhắn c nhó
2038905219922928,2037880153358768,,quynhh.jappan.7,Hoa Nhật Quỳnhh,"Dựa trên hình ảnh bạn cung cấp, mình có một số đánh giá về tình trạng da hiện tại như sau:

1. Tình trạng mụn: Da bạn có xuất hiện nhiều mụn nhỏ, mụn ẩn và một số vết thâm sau mụn. Đây có thể là do sự tích tụ dầu thừa, bã nhờn hoặc vi khuẩn trong lỗ chân lông.
2. Lỗ chân lông to: Có thể thấy lỗ chân lông ở vùng má và cằm hơi to, điều này thường xuất hiện khi da tiết nhiều dầu, hoặc do quá trình làm sạch da chưa đủ sâu.
3. Vết thâm: Da bạn có những vết thâm sau viêm. Có thể do không dùng kcn hoặc dùng chưa đủ.
4. Tình trạng da tổng quát: Da bạn có dấu hiệu của việc thiếu độ ẩm và thiếu sự chăm sóc toàn diện. Chỉ sử dụng sữa rửa mặt có thể không đủ để kiểm soát tình trạng da hiện tại.

Khuyến nghị:

1. Bổ sung thêm các bước chăm sóc da: Chỉ dùng sữa rửa mặt là chưa đủ. Bạn cần bổ sung thêm các sản phẩm khác như toner, serum đặc trị mụn và kem dưỡng ẩm để cân bằng và nuôi dưỡng da tốt hơn.
2. Sử dụng sản phẩm trị mụn: Tìm kiếm sản phẩm chứa BHA/AHA, adapalene để giúp làm sạch sâu, giảm mụn ẩn và mụn đầu đen.
3. Tăng cường độ ẩm: Sử dụng kem dưỡng ẩm không gây bí da, giúp cấp nước và bảo vệ hàng rào tự nhiên của da.
4. Chống nắng: Ánh nắng mặt trời có thể làm tăng tình trạng thâm nám và mụn. Hãy đảm bảo bạn sử dụng kem chống nắng hàng ngày để bảo vệ da khỏi tác hại của tia UV.

Inb mình tư vấn kỹ hơn nha"
2038806866599430,2037880153358768,,trang.cao.3192479,Thuỳ Trang,Đào Mai Diệu Thuỷo
2038743379939112,2037880153358768,,candlecia1111,Phan Thắng,ra da liễu đi bạn
2038745656605551,2037880153358768,,kimnguyet.phuong.1,Nguyệt Trần,Qt ib m nhê
2038791896600927,2037880153358768,100009660276792,,Trịnh Tuấn,Peel căng bóng PA bên mình nha 🥰🥰
