comment_id,post_id,user_id,user_name,fullname,content
8490881371032423,8490133504440543,,emdi.muadungdua,Nghiên Dĩnh,"Vốn bé mà đánh vol to thì chả toang. Mình đánh ko bao giờ ký quỹ quá 1%. Mỗi ngày vài đô là đủ tiền ăn. Ko bao giờ để lệnh qua đêm, ngủ phải ngon thì mới đảm bảo sức khoẻ được"
8490671197720107,8490133504440543,,hoang.duy.944023,Hoàng Ngọc Duy,Spot cho an toàn thì k chơi . Cứ thích giàu nhanh thì chấp nhận thôi
8490765747710652,8490133504440543,100009491112837,,Phúc Ca Ca,mua ở đáy chứ ai bảo fomo bác 😂 còn bác mua ở giữ thêm cái lệnh bán bao giờ nó lên lại thì chốt
8491009744352919,8490133504440543,,,Người tham gia ẩn danh,Tôi gồng tiếp xem nó thế nào. Nhảy vào nói đúng giọng đàn bà.
8491003951020165,8490133504440543,,,Người tham gia ẩn danh,Ông l nào vào comment cũng ra vẻ thể hiện nhỉ! Các ô thì giỏi rồi. Đăng bài lên tình cảm huynh đệ mà nhảy vào cà khịa giọng hả hê. Của các ô tất.
8490660024387891,8490133504440543,,,Người tham gia ẩn danh 209,"Chả có gì ngược lối cả, bánh đánh đủ miệng nhà cái thì nó luộc bạn thế thôi. Bạc bịp cả"
8490711954382698,8490133504440543,100022726262036,,Hao Nguyen,Đánh nhỏ mà chắc đi bạn
8490800691040491,8490133504440543,61564831305916,,Chú Pộ Đội,Bác này đánh kiểu fomo. Kiểu này tiền tấn cũng cháy
