comment_id,post_id,user_id,user_name,fullname,content
1881252629070525,1880926539103134,100051642409740,,Đinh Ngọc Hương,nên cân nhắc giai đoạn này kiếm được việc là vấn đề nan giải
1881249512404170,1880926539103134,100026982447189,,Phượng Đoàn,"Chạy ngay đi apply ngay job NVKD tại MISA, trả lương ngày thứ 3 đi làm hàng tháng, cuối tuần, ngày lễ là không được đến công ty"
1881028432426278,1880926539103134,61558020876675,,Tuan Dang,Khuyên là không nên làm nha. Điều này chứng tỏ cty bất ổn tài chính thì mới không biết khi nào trả lương. Vậy thì việc không có lương là có khả năng.
1880969219098866,1880926539103134,,thangtrouve,Thang Nguyen,"ngày trả lương còn không có cố định thì tốt nhất không nên làm. Tỷ lệ bùm lương, nợ lương cao 🙂
sẽ viện theo lý do là do công ty làm ăn kém..."
