comment_id,post_id,user_id,user_name,fullname,content
6444498105647941,6443385692425849,100092442021029,,Bông Skincare,"E chú ý bước làm sạch da
Sp dưỡng mỏng nhẹ nhé
Thêm bha vô"
6445371795560572,6443385692425849,,,Người tham gia ẩn danh,"Mn gợi ý cho e vài sp toner, serum, tẩy da chết và kem dưỡng với ạ"
6443595055738246,6443385692425849,,mauruou.le,Mau Ruou Le,"Mình nghĩ bạn nên cho 1 lớp serum HA trước kem dưỡng nữa ạ
Tác dụng của HA:Cấp ẩm,cấp nước cho da thiếu nước, thiếu ẩm
Kiềm dầu tốt cho da dầu
Rất ok bạn ạ"
6461947953902956,6443385692425849,100021942187006,,Đỗ Vui,Thêm bha vào nhé.
6458276247603460,6443385692425849,100073707910381,,Anbi Nguyen,em thêm bước tẩy da chết AHA nha
8425337500897315,6443385692425849,,Uyenonthi,Thùy Linh,Có thể dùng thêm toner nhe. Mình dùng loại này nên da cũng glass skin lém á
