post_id,user_id,user_name,fullname,content
471007221959235,,,,"NẾU BẠN MUỐN ĐẦU TƯ THÀNH CÔNG TRÊN THỊ TRƯỜNG CHỨNG KHOÁN. NẮM RÕ CHO TÔI 6 NGUYÊN TẮC:
1: KHÔNG TIN THÔNG TIN TỪ BỐ CON THẰNG NÀO, KỂ CẢ BROCKER CỦA BẠN. MỌI THÔNG TIN PHẢI TỰ BẠN TÌM KIẾM.
2: CHỈ NÊN ĐẦU TƯ VÀO CÁC CÔNG TY CÓ HOẠT ĐỘNG SẢN XUẤT KINH DOANH VÀ CÓ LÃI VÀ BẠN PHẢI HIỂU VỀ CÔNG TY ,NGÀNH ĐÓ.
3: TRONG XU HƯỚNG CỔ PHIẾU TĂNG GIÁ, KHÔNG MUA ĐUỔI KHI CỔ PHIẾU ĐÃ TĂNG QUÁ 5,6 PHIÊN ( THÀ BỎ LỠ SÓNG CHỨ KHÔNG CHẤP NHẬN FOMO)
4:TRONG XU HƯỚNG CỔ PHIẾU GIẢM GIÁ,KHÔNG BẮT ĐÁY BẰNG 100% NAV,CHÚNG TA KHÔNG THỂ BIẾT ĐƯỢC ĐÓ ĐÃ LÀ ĐÁY HAY CHƯA.
5: KHÔNG MUA DƯỚI 3 MÃ CỔ PHIẾU,HẠN CHẾ MUA NHIỀU CỔ PHIẾU CÙNG 1 NGÀNH.
6: ĐỐI VỚI NHỮNG CỔ PHIẾU RÁC,CỔ PHIẾU KHÔNG CÓ TIỀM NĂNG,CHO DÙ BẠN CÓ LỖ TRÊN 10% CŨNG NHẤT THIẾT PHẢI CẮT, CHÚNG TA CÓ THỂ LÀM LẠI VÒNG MỚI CHỨ ĐỪNG CHỜ ĐỢI.
......còn nữa!
Tham gia nhóm Zalo, Telegram để nhận tư vấn đầu tư cổ phiếu: Cộng Đồng Đầu Tư Chứng Khoán Thịnh Vượng:
Lướt Sóng Ngành: https://zalo.me/g/ommgik239
Cổ Phiếu Tích Lũy: https://zalo.me/g/zxcsxl949
Đầu Tư Theo Trụ VN30: https://zalo.me/g/yuyaih757
Telegram:https://t.me/+OrTh2kIlnpg3ODU9
TUYỂN DỤNG,ĐÀO TẠO CỘNG TÁC VIÊN HOA HỒNG CAO NHẤT THỊ TRƯỜNG.
https://zalo.me/g/ybdzse542
SĐT/Zalo Admin: 0796286822"
