comment_id,post_id,user_id,user_name,fullname,content
1711788952942003,1711711472949751,,vumanhcuongIT,Cuong Vu,"đồ ngon, chúc mừng anh và team nhé ❤️"
1711766486277583,1711711472949751,,salmonellasan,Lý Lưỡng Thiên,Xịn quá anh 😁😁
1711772732943625,1711711472949751,,forest0306,Tùng Lâm,"Ngon quá bác ơi, em hóng nhé. Có bản beta test không bác"
1711780366276195,1711711472949751,,nobespapa,Kiều Trọng Tú,Hóng hớt
1711794632941435,1711711472949751,100029014273840,,Đỗ Văn Sơn,app team mình viết bằng ngôn ngữ gì vậy a
