post_id,user_id,user_name,fullname,content
469377258788898,,@bihi.en.9400,Bùi Hữu Nội,"𝐓𝐢𝐞̂́𝐩 𝐭𝐮̣𝐜 𝐯𝐨̛́𝐢 𝐧𝐠𝐚̀𝐧𝐡 𝐭𝐡𝐞́𝐩: đ𝐨̂́𝐢 𝐯𝐨̛́𝐢 𝐭𝐡𝐞́𝐩 𝐍𝐚𝐦 𝐊𝐢𝐦 (𝐍𝐊𝐆)
𝐆𝐢𝐚́ 𝐭𝐡𝐞́𝐩 𝐧𝐨̣̂𝐢 đ𝐢̣𝐚 𝐠𝐢𝐚̉𝐦 𝐜𝐡𝐚̣̂𝐦 𝐡𝐨̛𝐧 𝐠𝐢𝐚́ 𝐧𝐠𝐮𝐲𝐞̂𝐧 𝐯𝐚̣̂𝐭 𝐥𝐢𝐞̣̂𝐮 đ𝐚̂̀𝐮 𝐯𝐚̀𝐨 𝐡𝐨̂̃ 𝐭𝐫𝐨̛̣ 𝐛𝐢𝐞̂𝐧 𝐥𝐚̃𝐢 𝐠𝐨̣̂𝐩 𝐭𝐫𝐨𝐧𝐠 𝐭𝐫𝐮𝐧𝐠 𝐡𝐚̣𝐧: Tính từ đầu 3Q2024, giá tôn mạ giảm 11% so với đà giảm 22% của giá HRC. Trong trường hợp giá HRC tiếp tục đi ngang ở vùng giá hiện tại, biên lãi gộp 4Q2024 của NKG sẽ được cải thiện đáng kể.
𝐊𝐲̀ 𝐯𝐨̣𝐧𝐠 𝐬𝐚̉𝐧 𝐥𝐮̛𝐨̛̣𝐧𝐠 𝐭𝐢𝐞̂𝐮 𝐭𝐡𝐮̣ 𝐭𝐫𝐨𝐧𝐠 𝐧𝐮̛𝐨̛́𝐜 𝐠𝐢𝐚 𝐭𝐚̆𝐧𝐠 𝐭𝐫𝐨𝐧𝐠 𝐭𝐡𝐨̛̀𝐢 𝐠𝐢𝐚𝐧 𝐭𝐨̛́𝐢: KBSV kỳ vọng sản lượng tiêu thụ nội địa sẽ được hỗ trợ nhờ (1) thuế chống bán phá giá tôn mạ được phê duyệt và áp dụng từ cuối
4Q2024, (2) thị trường Bất động sản dần hồi phục giúp kích thích nhu cầu tiêu thụ thép từ 2025 trở đi
𝐓𝐫𝐢𝐞̂̉𝐧 𝐯𝐨̣𝐧𝐠 𝐱𝐮𝐚̂́𝐭 𝐤𝐡𝐚̂̉𝐮 𝐝𝐮𝐲 𝐭𝐫𝐢̀ 𝐭𝐫𝐨𝐧𝐠 𝐝𝐚̀𝐢 𝐡𝐚̣𝐧: Chúng tôi cho rằng lợi thế cạnh tranh của NKG trên kênh xuất khẩu trong dài hạn vẫn sẽ được duy trì nhờ (1) mức thuế áp dụng cho Việt Nam thấp hơn so với với Trung Quốc, (2) chênh lệch giá HRC tại Mỹ, Châu Âu tiếp tục được duy trì tạo lợi thế cạnh tranh về giá
𝐆𝐢𝐚́ 𝐇𝐑𝐂 𝐠𝐢𝐚̉𝐦 𝐧𝐡𝐚𝐧𝐡 𝐭𝐫𝐨𝐧𝐠 𝟑𝐐𝟐𝟎𝟐𝟒 𝐭𝐚̣𝐨 𝐚́𝐩 𝐥𝐮̛̣𝐜 𝐭𝐚̆𝐧𝐠 𝐜𝐡𝐢 𝐩𝐡𝐢́ 𝐝𝐮̛̣ 𝐩𝐡𝐨̀𝐧𝐠 𝐡𝐚̀𝐧𝐠 𝐭𝐨̂̀𝐧 𝐤𝐡𝐨 𝐜𝐡𝐨 𝐍𝐊𝐆 𝐭𝐫𝐨𝐧𝐠 𝐤𝐲̀: Tính tới cuối 2Q2024, hàng tồn kho của NKG đạt 5,873 tỷ VND (đi ngang so với
1Q2024), tuy nhiên giá HRC đã giảm trung bình 21% từ đầu 3Q2024 tới nay, tạo áp lực gia tăng chi phí dự phòng giảm giá hàng tồn kho trong 3Q2024. Trong trường hợp giá HRC tiếp tục đi ngang, biên lãi gộp của NKG trong 4Q2024 sẽ được cải thiện đáng kể. Trong trung hạn, chúng tôi kỳ vọng biên lãi gộp của NKG sẽ tiếp tục được duy trì ở mức ổn định nhờ (1) giá tôn mạ, thép ống giảm
chậm hơn giá HRC (từ đầu năm tới nay, HRC, tôn mạ, thép ống giảm lần lượt 22%/12%/5%), (2) NKG chủ động duy trì hàng tồn kho ở mức ổn định, số ngày quay vòng nguyên vật liệu 2Q2024 đã giảm đáng kể so với giai đoạn 2H2022 (26 ngày so với 33 ngày). KBSV ước tính biên lãi gộp của NKG đạt 8.8%/9.6% trong
2024/2025.
𝐒𝐚̉𝐧 𝐥𝐮̛𝐨̛̣𝐧𝐠 𝐱𝐮𝐚̂́𝐭 𝐤𝐡𝐚̂̉𝐮 𝐜𝐨́ 𝐭𝐡𝐞̂̉ 𝐜𝐡𝐢̣𝐮 𝐭𝐚́𝐜 𝐒𝐚̉𝐧 𝐥𝐮̛𝐨̛̣𝐧𝐠 𝐱𝐮𝐚̂́𝐭 𝐤𝐡𝐚̂̉𝐮 𝐜𝐨́ 𝐭𝐡𝐞̂̉ 𝐜𝐡𝐢̣𝐮 𝐭𝐚́𝐜 đ𝐨̣̂𝐧𝐠 𝐬𝐮𝐲 𝐠𝐢𝐚̉𝐦 𝐭𝐫𝐨𝐧𝐠 𝐧𝐠𝐚̆́𝐧 𝐡𝐚̣𝐧 𝐧𝐡𝐮̛𝐧𝐠 𝐍𝐊𝐆 𝐯𝐚̂̃𝐧 𝐜𝐨́ 𝐥𝐨̛̣𝐢 𝐭𝐡𝐞̂́ 𝐜𝐚̣𝐧𝐡 𝐭𝐫𝐨𝐧𝐠 𝐝𝐚̀𝐢 𝐡𝐚̣𝐧: Với việc Mỹ và EU gia tăng biện pháp bảo vệ, phòng vệ thương mại với các sản phẩm thép, chúng tôi cho rằng sản lượng xuất khẩu tôn mạ của NKG trong ngắn hạn (hai thị trường trên chiếm 89% doanh thu xuất khẩu trong 8M2024,
trong đó, doanh thu từ thị trường Mỹ tăng 108% YoY). Sau giai đoạn xuất khẩu thép Trung Quốc giả rẻ bùng nổ về sản lượng tại các thị trường, các biện pháp chống bán phá giá được tăng cường áp dụng là xu hướng khó tránh khỏi. Tuy nhiên, trong dài hạn, KBSV cho rằng NKG vẫn sẽ có lợi thế trên thị trường xuất
khẩu nhờ (1) mức thuế suất áp dụng cho thép nhập khẩu từ Việt Nam thấp hơn mức thuế áp dụng cho Trung Quốc (bảng 7), (2) chênh lệch giá HRC tại Mỹ, EU tiếp tục kéo dài sẽ tạo điều kiện cho NKG cạnh tranh về giá xuất khẩu với các nhà sản xuất nội địa.
𝐍𝐡𝐮 𝐜𝐚̂̀𝐮 𝐧𝐨̣̂𝐢 đ𝐢̣𝐚 𝐠𝐢𝐚 𝐭𝐚̆𝐧𝐠 𝐭𝐚̣𝐨 đ𝐨̣̂𝐧𝐠 𝐥𝐮̛̣𝐜 𝐜𝐚̉𝐢 𝐭𝐡𝐢𝐞̣̂𝐧 𝐬𝐚̉𝐧 𝐥𝐮̛𝐨̛̣𝐧𝐠 𝐭𝐢𝐞̂𝐮 𝐭𝐡𝐮̣ 𝐭𝐫𝐨𝐧𝐠 𝐭𝐡𝐨̛̀𝐢 𝐠𝐢𝐚𝐧 𝐭𝐨̛́𝐢: Sản lượng tiêu thụ nội địa tiếp tục xu hướng hồi phục khi tiêu thụ tôn mạ, thép ống của NKG trong T8/2024 tăng 6%/27% YoY (8M2024 +23%/-7% YoY). Chúng
tôi kỳ vọng tiêu thụ trong nước sẽ tiếp tục cải thiện trong thời gian tới nhờ (1) thuế chống bán phá giá tôn mạ nhập khẩu từ Trung Quốc, Hàn Quốc được phê duyệt và áp dụng từ cuối 2024, đầu 2025 (2) nhu cầu xây dựng trong mùa cao điểm cuối năm gia tăng, (3) thị trường Bất động sản dần hồi phục, Luật Bất động sản sửa đổi được áp dụng giúp cải thiện nguồn cung, tạo động lực tăng
trưởng nhu cầu tiêu thụ thép. KBSV ước tính sản lượng tiêu thụ của NKG đạt 1.04/1.09 triệu tấn trong 2024/2025, tăng 22%/5%
𝐍𝐚𝐦 𝐊𝐢𝐦 𝐏𝐡𝐮́ 𝐌𝐲̃ 𝐥𝐞̂𝐧 𝐤𝐞̂́ 𝐡𝐨𝐚̣𝐜𝐡 𝐯𝐚̣̂𝐧 𝐡𝐚̀𝐧𝐡 𝐭𝐮̛̀ 𝟏𝐐𝟐𝟎𝟐𝟔: Nhà máy Nam Kim Phú Mỹ có công suất 800,000 tấn/năm, khi vận hành 100% công suất sẽ giúp tăng sản lượng thiết kế của NKG lên 2 triệu tấn/năm (+67% công suất hiện tại). Theo kế hoạch của NKG, nhà máy sẽ vận hành từ 1Q2026.
𝐓𝐨̂̀𝐧 𝐤𝐡𝐨 𝐇𝐑𝐂 𝐭𝐚̣𝐢 𝐓𝐫𝐮𝐧𝐠 𝐐𝐮𝐨̂́𝐜 𝐠𝐢𝐚̉𝐦 𝟑% 𝐌𝐨𝐌 𝐭𝐫𝐨𝐧𝐠 𝐓𝟗/𝟐𝟎𝟐𝟒 𝐧𝐡𝐮̛𝐧𝐠 𝐯𝐚̂̃𝐧 𝐨̛̉ 𝐦𝐮̛́𝐜 𝐜𝐚𝐨, 𝐝𝐮̛̣ 𝐛𝐚́𝐨 𝐬𝐞̃ 𝐭𝐢𝐞̂́𝐩 𝐭𝐮̣𝐜 𝐠𝐚̂𝐲 𝐚́𝐩 𝐥𝐮̛̣𝐜 𝐥𝐞̂𝐧 𝐠𝐢𝐚́ 𝐭𝐡𝐞́𝐩 𝐭𝐫𝐨𝐧𝐠 𝐛𝐨̂́𝐢 𝐜𝐚̉𝐧𝐡 𝐝𝐮̛ 𝐜𝐮𝐧𝐠 𝐯𝐚̀ 𝐧𝐡𝐮 𝐜𝐚̂̀𝐮 𝐭𝐢𝐞̂𝐮 𝐭𝐡𝐮̣ 𝐭𝐡𝐚̂́𝐩 𝐭𝐚̣𝐢
𝐭𝐡𝐢̣ 𝐭𝐫𝐮̛𝐨̛̀𝐧𝐠 𝐧𝐨̣̂𝐢 đ𝐢̣𝐚: Triển vọng xuất khẩu thép của Trung Quốc suy giảm trong thời gian tới khi các thị trường lớn như Mỹ và EU gia tăng các biện pháp phòng vệ thương mại. Điều này khiến giá thép tại Trung Quốc giảm trung bình 11% từ đầu 3Q2024 tới nay
nhằm kích thích nhu cầu tiêu thụ nội địa trong bối cảnh tồn kho thép cao (số liệu T9/2024 đạt 11.6 triệu tấn, giảm 10% so với cuối T8/2024 chủ yếu do tồn kho thép thanh giảm mạnh, trong khi đó, tồn kho HRC giảm 3%). Với tồn kho ở mức cao trong khi biên EBITDA tiếp tục suy giảm, chúng tôi cho rằng các nhà sản xuất sẽ ưu tiên giảm tồn kho, tối ưu công suất trong thời gian tới. KBSV cho rằng điều này có thể khiến giá thép tiếp tục gặp áp lực giảm thêm trong ngắn hạn và sẽ ổn định trở lại sau đó khi cung-cầu thị trường thép nội địa Trung Quốc cân bằng lại."
