comment_id,post_id,user_id,user_name,fullname,content
8493290620753144,8491902137558659,,nguyenbichngoc.nguyen.507,Nguyen Bich Ngoc,"Mua bàn chải điện ở đây đc hơn 1 năm xong hỏng xong vứt, ghét"
8493308027418070,8491902137558659,,lien.cam.5015983,Cẩm Liên,B hỏi mà shop này thấy chắc tự ái luôn ớ :)))
8493064740775732,8491902137558659,,jiangw.me,Hương Giang,Bạn mua sp nào thì đọc mấy cái 1 ⭐️ đi xem ntnao
8493191580763048,8491902137558659,100075205627426,,Nguyễn Thị Thu Hằng,"chính hãng nha bạn, tui mua chỗ này nhiều rùi"
8493189004096639,8491902137558659,,balong.lim9,Nguyễn Bá Long,nguyên chữ shopee mall chần dần đó còn hỏi nữa
