comment_id,post_id,user_id,user_name,fullname,content
2356291871513303,2356268824848941,,anhtiu.071299,Lê Hoàng Anh Tú,Đáng lý ng nằm với con mèo phải là tui
2356294898179667,2356268824848941,,tu326738,Nguyen Tu,Xinh quá
2356314301511060,2356268824848941,,trannam.luu.549,Lưu Trấn Nam,"Con mèo xong chưa, đổi chỗ cho tao"
2356293898179767,2356268824848941,,Huynhtien1411999,Tiến Meme,Mài lé ra đến lượt ah rồi
2356303888178768,2356268824848941,,long.haphi.1,Hà Phi Long,Khi tôi chụp ảnh với gái :))
