comment_id,post_id,user_id,user_name,fullname,content
7935053589925711,7933714180059652,100092442021029,,Bông Skincare,"Kích ứng r nha e
E có phục hồi ko teh
Chú ý bước làm sạch da
Thêm lọ chấm mụn viêm
Hạn chế thức nha e"
7935491099881960,7933714180059652,100067479200164,,Thiên Trang,"Mụn thâm như này dùng sp k ăn thua đâu em, đi da liễu chữa có yên tâm như chị này vừa hết dứt điểm mà da còn sáng nữa"
7936430833121320,7933714180059652,,thanglong.hatgiong,Bác Sĩ Đạt,"em dùng chấm mụn cho khô nhân rồi đi lấy sạch nhân mụn em nhé. Em dùng sữa rửa mặt cho vùng da này, chấm mụn bằng Klenzit C, vertucid hoặc biotrade, Azaduo,....thêm bôi mụn adapalene để giảm mụn ẩn. Nếu cùng cằm mặt có mụn viêm thì cần thêm thuốc uống phối hợp để kiểm soát tình trạng viêm."
7935515436546193,7933714180059652,100083230755341,,Nguyễn Hoa Dược Sỹ,Ảnh ban đầu và ảnh thư 2 hiện tại hay gì e
