comment_id,post_id,user_id,user_name,fullname,content
1650702178856462,1650680822191931,,truongiangstock,Chung Khoan Truong Giang,Nhà Vin công nhận số 1 =)))
1650683845524962,1650680822191931,,hoan.glad,Hoan Glad,Đâu phải siêu giàu là ỉa lên luật pháp được đâu
1650694858857194,1650680822191931,,phamquanghien79,Pham Quang Hiền,"Bài viết ko cho dữ kiện chính xác là đường nào, ở đâu để biết đây là đường 1 hay 2 chiều, có cầm vượt hay cấm xe máy ko!?. Nói chung...là ko có ý kiến!.

Chỉ khi lên cao tốc lúc kẹt xe mới thấy...đúng là tài xế có this có that. Phải nói cho đúng là ý thức của người tài xế chứ chiếc xe là đồ vật mà!. Biết đâu...chủ xe thuê tài xế lái thì sao!?."
1650692758857404,1650680822191931,,truongiangstock,Chung Khoan Truong Giang,Đừng bỏ lỡ cổ mạnh trong trang của em 👍
1650691505524196,1650680822191931,100028991230849,,Thành Bá Thiên,vin thì sợ ai
1650683178858362,1650680822191931,,truongiangstock,Chung Khoan Truong Giang,Các bác cập nhật cổ phiếu Mạnh trong trang mình
