comment_id,post_id,user_id,user_name,fullname,content
8451577451629482,8451298624990698,100012540214619,,Tâm Đức,Cũng thua tha thôi
8451914948262399,8451298624990698,,hucky.bim,Trịnh Văn Hùng,Nó sẽ x2 giá này
8451963831590844,8451298624990698,,CongQuanHVN,Phan Công Quân,Mấy anh short nhận mail chưa 🤣
8451583191628908,8451298624990698,100071029029622,,Tiến Sĩ Côn Trùng,Chốt 25% đi
8451554828298411,8451298624990698,,xoahet.duthien.50,Bảo Toànn,008 0085 thôi
8451553531631874,8451298624990698,,xoahet.duthien.50,Bảo Toànn,Để tp 008 bác nhé. Tin tui
8452000254920535,8451298624990698,,ne.duy.7731,Hoc Duy,Nếu chưa chốt thì chắc là cháy r nhỉ
8451713834949177,8451298624990698,61552298680439,,Nguyễn Thanh,"Theo kinh nghiệm của mình thì nó quay đầu rồi đấy, chốt nến ngày ờ mức giá khoảng 0.01"
