post_id,user_id,user_name,fullname,content
3797159120549496,,Stephen.HG.01,Hồng Giang,"Dự Đoán Giá BTC: Chu Kỳ Tăng Giá Rõ Rệt
Về mặt kỹ thuật, Bitcoin đã vượt qua kênh giảm dần, một mô hình đã hạn chế giá không vượt quá 65.000 USD kể từ tháng Bảy.
Với mức hỗ trợ tại 62.825 USD, BTC đã thành công vượt qua khu vực này. Theo biểu đồ hàng ngày, giá Bitcoin có thể gặp kháng cự tại 68.253 USD, một điểm quan trọng. Nếu vượt qua, giá có thể tiến tới 73.095 USD.
Nếu điều đó xảy ra, BTC có thể đạt mức cao kỷ lục mới trước khi quý 4 kết thúc, với các mục tiêu từ 76.075 USD.
Ngược lại, nếu không vượt qua được 68.253 USD và thanh khoản thị trường tiền điện tử không tăng, giá Bitcoin có thể giảm xuống 58.188 USD."
