post_id,user_id,user_name,fullname,content
3823444267920981,,,,"PHÂN TÍCH KỸ THUẬT SOL
👉Solana (SOL) đang tiến gần đến mức kháng cự $164, một ngưỡng quan trọng mà phe gấu sẽ nỗ lực bảo vệ.
👉Nếu phe gấu thất bại, cặp SOL/USDT sẽ hoàn thành mô hình tam giác tăng giá khi đóng cửa trên $164, mở ra khả năng giá tăng lên $189 và sau đó là $210.
👉Nếu giá quay đầu từ $164 nhưng tìm được hỗ trợ tại đường EMA 20 ngày ($150), điều đó cho thấy phe bò vẫn mua vào khi giá giảm. Phe bò sẽ cố gắng thêm lần nữa để đẩy giá vượt qua $164. Ngược lại, mô hình tăng sẽ bị vô hiệu nếu giá phá vỡ và đóng cửa dưới đường xu hướng tăng.
🧐Trên biểu đồ 4 giờ, cả hai đường trung bình động đều dốc lên và RSI gần vùng quá mua, cho thấy lợi thế đang thuộc về phe bò.
👉Tuy nhiên, kháng cự mạnh tại $164 có thể gây áp lực. Nếu giá không giảm xuống dưới SMA 50, khả năng bứt phá $164 sẽ tăng lên.
👉Nếu giá giảm mạnh và phá vỡ xuống dưới các đường trung bình động, điều này báo hiệu phe bò đã từ bỏ. Khi đó, cặp tiền này có thể giảm về $148 và sau đó là $144 CHúc mọi người giao dịch thành công🍀
Biểu đồ SOL/USDT khung 4 giờ"
