comment_id,post_id,user_id,user_name,fullname,content
1871936726668782,1871900726672382,,hoangtuan.tran.5817300,Hoang Tuan Tran,"bạn có cổ phần thì lên tiếng, không thì cứ làm tốt việc của bạn thôi"
1871938646668590,1871900726672382,100010528276083,,Trần Huyền,Bạn là quản lý hay tnao mà đòi xử lý ngta vậy? :))
1871938373335284,1871900726672382,61556829866012,,Quỳnh Chee,Ơ hay việc ai nấy làm chứ b ơi
1871938063335315,1871900726672382,,thitran383,Thi Trần,EQ thằng đó tốt hơn bạn chứ sao :))
1871936896668765,1871900726672382,100009358769135,,Trâm,"bạn cứ làm hết việc bạn xong đi về thôi, việc nó thì kệ nó nó làm xong nó chơi"
1871936520002136,1871900726672382,,van.nguyen.3994,Van Nguyen,MKN đi chời
1871933400002448,1871900726672382,,kevinquang9x,Đoàn Quang,Ko ảnh hưởng đến lương của mình thì ko cần động nó! Kệ đi! Trách nhiệm đến đâu công việc đến đấy!
1871933393335782,1871900726672382,,tranquanghuy0211,Huy TQ,"việc ai nấy làm, sml thì cuối tháng mình vẫn nhận đủ lương là được. kệ nó. sếp tự thấy. 🤔"
1871929183336203,1871900726672382,,NimBaekHan,Pinku Pinku,Không cần xử lý gì đâu nếu bạn cũng là nhân viên như bạn đó. Làm tốt phần việc của mình là được. Còn bạn là quản lý của bạn đó thì mới đi xử lý.
