comment_id,post_id,user_id,user_name,fullname,content
1799166353946650,1799147597281859,,em.mi.3382,Mỹ Anh,B đi lấy nhân mụn và dùng tẩy trang lành tính hơn cho da mụn. Sdung thêm vitamin C kết hợp với kem chống nắng á.
1800488167147802,1799147597281859,100029956640682,,Ngọc Thanh Tâm Lê,"Ngày 15.8 lúc 0h, 9h, 15h, 18h voucher giảm 30K, 60K, 70K
Voucher giảm giá https://shope.ee/4KwJGiTaan"
1800484537148165,1799147597281859,,lananhsona26,Lan Anh,"Bạn dùng lọ này để gom nhân mụn rồi nặn, sau đó bôi để liền vết nặn nhé, các spa vẫn dùng sau khi nặn mụn xong
Giá chỉ học sinh, sinh viên
Còn lại vẫn dùng tẩy trang, sữa rửa mặt để làm sạch da hằng ngày, quan trọng nhất vẫn là bước làm sạch"
1800477563815529,1799147597281859,100094410372740,,Anh Chi,Nếu em muốn trị mụn này thì theo liệu trình cho tận gốc em nhé.qua bên Vicky Thuận để bác thăm khám nặng nhẹ và đưa ra phác đồ dtri thích hợp
