comment_id,post_id,user_id,user_name,fullname,content
8420632354701163,8419724604791938,,ha.dieuha.585,Dieu Ha,"Mụn ẩn dùng adapalen bạn nhé, mụn viêm thì nên tuỳ thuộc vào tình trạng hiện tại mức độ ntn sẽ có sp phù hợp"
8422939211137144,8419724604791938,100092442021029,,Bông Skincare,"Da mụn ẩn liti
Da tiết dầu nhiều là tình trạng thừa dầu thiếu nước
E cấp ẩm tốt da hạn chế tiết dầu nha e
Mụn nhẹ e làm sạch tốt
Chọn sp dưỡng thoáng
Adapalen vs bha trị mụn
Thêm tẩy da chết định kì kèm đi lấy nhân mụn là ok nha e"
