comment_id,post_id,user_id,user_name,fullname,content
1491275911616197,1431311674279288,,quynh.bua.9,Quỳnh An,Hứa Hiếuu
1432049307538858,1431311674279288,,khanhdo5807,Khanh Do,đi k Chúc An Thanhh Hảoo Hoàng Thị Quỳnh Trang t bao !!
1432062367537552,1431311674279288,,Vantrang0311,Phạm Vân Trang,Phạm Bảo Diệp Anh Hình như gần bạn🫣
1432045857539203,1431311674279288,,thuythuynguyen.com.vn,Thủy Thủy Nguyễn,Đỗ Cường đi ăn bánh cay
1431995744210881,1431311674279288,,Je.alinh19,Anh Linhh,Ngoc Diep chờ bứm cho đi foodtour hà đông
1431398900937232,1431311674279288,,khanhvan.phan.144,Phan Khánh Vân,Hạ Mie Cường Đang Bận Ngủ Cẩm Tú điiiiiiii
1431401194270336,1431311674279288,,D4uCutM0iii,Vũ Hoàng Hà,Lan Anh Bui hình như bạn ở Hà Đông đúng khum 👉👈
1433870804023375,1431311674279288,100067304203252,,Vân Nhi,Lỗ Văn Thông nào người anh em=)) đi ăn trước khi đi lính
1432030144207441,1431311674279288,,myhanh9999999,Mỹ Hạnh,Tuấn Nguyễn 2 ae tốn 60 chục đi tàu chỉ để sang Hà Đông ăn bánh cay😂😂😂
1432043610872761,1431311674279288,,banggiangtc.77,Băng Jang,Trần Thị Thảoo
1432086217535167,1431311674279288,,quynhanh.ninh.39,Anh Anh,Nguyễn Trung Kiên này thì k có gì ăn
1431511357592653,1431311674279288,,rtntp,Phương Phương,Duy Đức chưa thấy dẫn e gái đi bao giờ😌
1432185124191943,1431311674279288,,hiiamzitt,Thu Hương,Tú Anh Mai hẹn 1 mai
1431391954271260,1431311674279288,100007273455511,,Bắp Cải,Phan Việt Thắng ảo thật đấy
1506422090101579,1431311674279288,,niii.1921,Trần Ly Ly,Thẩm Kim Huệ
1431916054218850,1431311674279288,100010849178841,,Minh Dũng Lê,Hà AnTrịnh Hoàng Thảo cuối tuần này triển đê
1431379434272512,1431311674279288,,haornguyen92,Haor Nguyễn,My Diễm em tui owiii
1431397660937356,1431311674279288,,minhanh25072002,Minh Anh,Nguyễn Đức Chính hey bro
1431411057602683,1431311674279288,100016644797158,,Nguyễn Huyền Thương,Lê Diệu Linh đỡ hỏi ăn gì
1432107337533055,1431311674279288,100008996386122,,Thảo Bi,"Quynh Anhh bạn ơi bạn ưi, quán nào cx muốn đi ạ"
1431410807602708,1431311674279288,100010923728452,,Nguyễn Mai,Bảo Ngọc Nguyễn điiiiiii
1432050334205422,1431311674279288,,arthur.van.15,Văn Đức Thịnh,Nguyễn Trường Phong số 2 😊
1440251883385267,1431311674279288,,nltrang06,Ng Trang,Phương Quỳnh nhìn ngon ngon ý chị
1431420054268450,1431311674279288,100087314228704,,Phương Thảo,Cẩm HườngThủy ThủyMai ChiBùi Khánh Linh đi lượn hà đông các chị
1431383137605475,1431311674279288,100006227109326,,Ntt Vân,Tâm Như ăn vặt này
1432095484200907,1431311674279288,,tran.huongs.71,Hường Trần,Nguyễn Thế Dũng finally😌
1431393614271094,1431311674279288,100030662138334,,Phúc Đào,Nguyễn Thành Chung hẹn Chung sau Tết 🤣🤣🤣
1432039137539875,1431311674279288,100065978450390,,Nguyễn Thị Thuận,Trương Thảo Nguyên ước đc đi
1432241954186260,1431311674279288,100083663162758,,Nguyễn Thu Huyền,Ngọc Lihn foodtua hà đông này b =))))
1433266674083788,1431311674279288,100045770801098,,Dương Hoàng,Trần Huy mẹ ơi
1431400120937110,1431311674279288,100073009767232,,Trà My,Trần Khánh Vân ủa phai lam sao
1433167070760415,1431311674279288,,quynhlien.95,Liên,Hiền Auth dẫn mình đi ăn sập Hà Đông đi bạn ơi 🤣
1484969015580220,1431311674279288,100035172793626,,Phạm Mai Anh,Đỗ Như Quỳnh
1484965855580536,1431311674279288,100035172793626,,Phạm Mai Anh,Đỗ Như Quỳnh
1432500990827023,1431311674279288,100011608695498,,Mai Anh Nguyễn,Thùy Linh Bích Ngọc chờ đại gia Ngọc ạ
1431423404268115,1431311674279288,,hue.huoc,Đức Huệ,Lan lưu vào để về thì đi
1432570014153454,1431311674279288,,v.sntt,Thu Hằng,An Hoàng Hà Đông có nhiều món quá nè
1431844890892633,1431311674279288,,buihoang.maiphuong.7,Bùi Hoàng Mai Phương,Đinh Quyết Thắng khổ nhì
1432060634204392,1431311674279288,,duahau2712,Mun,Ngọc Trâm tag lun ạ
1431456100931512,1431311674279288,,namnd0210,Đức Nam,Nguyễn Sỹ Quang Anh dẫn bạn đi nào
1431430167600772,1431311674279288,,Floraaa.2003,Phương Lan,15 chỗ Ly à Nguyễn Cẩm Ly
1431396287604160,1431311674279288,,huonglyeee,Hương Lye,Nguyễn Bích Vân khám phá
1431377790939343,1431311674279288,,user.1102,Nguyễn Quốc Hoàng Anh,Nguyễn Thái Hà đi ăn thôi alo?
1431874080889714,1431311674279288,,hien051900,Ngô Thỵ Hiền,Vũ Thương đ thấy gt chỗ nào
1431387397605049,1431311674279288,,tnthoi.minh,Tống Nguyễn Thới Minh,Bảo Lê Anh ko gthieu d 🙂
1432504197493369,1431311674279288,,hanh.homhinh.7169,Mỹ Hạnh,Loan Anh đi hết chưa
1431410580936064,1431311674279288,,dtvananh.0407,Vananh Súnn,Chu Ngọc Hiếu bánh cay là bánh j
1433613680715754,1431311674279288,,ngoc.giangminh,Hương Quỳnh,"Lý Thất Dạ trừ số 14,19,20"
1431394990937623,1431311674279288,,linhlinh03.thuy16,Linh Linh,Sớm chú chuẩn bị đủ xiền chưa🤣
1432049327538856,1431311674279288,,yunyun.358,Thanh Vân,Trần Tiến Thịnh lưu lại tết ce mình triển 🤣
1431387964271659,1431311674279288,,k.lunnek,Khánh Linh,Nguyen Gia Linh gần lắm con ơi
1431395250937597,1431311674279288,100040027837064,,Vũ Phượng,Chị Yến Yến food tour hết quận chưa chị ?🤣
1431528117590977,1431311674279288,,thuytrang1013,Thuỳ Trang,Hải Đăng em chỉ tag thế thôi anh chai ạ
1524577871619334,1431311674279288,100030422988550,,Trang Lê,Lan Nhi êk đi k
1453182435425545,1431311674279288,,lynn.cao.2026,Ly CT,"Đặng Thị Thanh Huyền
quẹo lựa quẹo lựa nè"
1432067644203691,1431311674279288,100008006596290,,Phương Lê,Thu Hà óiii
1432046407539148,1431311674279288,,vanh000,Vân Anh,Thái Dương đưa em đi
1432023247541464,1431311674279288,,cakhonglo62,Huyen Trang,NgT Hằng hốc
1459258348151287,1431311674279288,100078917045903,,Ngọc Bích Tinh Dầu,Bong Xinh Lien Phan nhiều món lạ lắm coong phù coong dăm là món đ gì
1431593870917735,1431311674279288,,nguyen.thuyduong.188,Bác Sỹ Dương.Yhct,Ăn vặt Hà Đông
1431897590887363,1431311674279288,,thuphuong.1812,Thu Phương,Sư Bùi e mới đc ăn mỗi ngô xào Cầu đen với bánh mỳ xào bòa thôi😶
1431382194272236,1431311674279288,100023831978086,,Tâm Lê,Nguyễn Duy Anh Nguyễn Mai Linh Thu Hương Nguyễn Thiên Ân Thiên An gẹt gooo
1431862890890833,1431311674279288,,quynh.lenhu.3192,Lê Như Quỳnh,Mai Nhân 😗
1431397937603995,1431311674279288,,bngocpamn,Phạm Bảo Ngọc,Trang Lê Hà Đông kìe
1433249157418873,1431311674279288,100027737445556,,Nguyen Nhung,"omo
Mọt khi nào dẫn mình đi ăn 😗"
1451862978890824,1431311674279288,100077508367866,,Lưu Thị Vananh,"Có bác nào biết ở Hà Đông chỗ nào có đồ ăn vặt như chân gà, nem chua nướng, bánh tráng trộn... các thứ không ạ"
1431821917561597,1431311674279288,,raiso.v.trang,Phúc Cần,Nhung Ho
1431406310936491,1431311674279288,,hung.roman.511,Hưng Roman,Kiên Nghiêm Thành Đạt
1432116524198803,1431311674279288,100007648005326,,Vũ Huyền,Khánh Huyền
1432012060875916,1431311674279288,100071318836206,,Giaa Huyy,Phương Uyên
1432362667507522,1431311674279288,,nbadai07,Nguyễn Bá Đài,Nguyễn Trà My
1431797157564073,1431311674279288,100075541141476,,Dinh Hoang Anh,Đàm Nam Khánh
1433370764073379,1431311674279288,100010129847508,,Thảo Híp NB,Đức Anh
1431923940884728,1431311674279288,,vuongthuyvan8386,Vuong Thuy Van,Phuong Linh 😋
1432049027538886,1431311674279288,100070743266175,,Nguyễn Thảo My,Hoàng Minh Tâm
1432048930872229,1431311674279288,100070743266175,,Nguyễn Thảo My,Hiền Suki 😂
1431401700936952,1431311674279288,100034896621358,,Ngọc Mai,Lê Thị Minh Phương
1431444207599368,1431311674279288,,huytu.phan.944,Huy Tú,Trần Duy Nam
1553770878700033,1431311674279288,,hang.halu.1,Hằng Halu,Trương Thị Thu Hiền khi nào triển đi bạn :))
1431399530937169,1431311674279288,,k.shmyhanh1010,Cao Mỹ Hạnh,Bàn Minh Ngọc alooo anh iu
1431403554270100,1431311674279288,,wylannnn,Hoàng August,Ngoc Ngoc nhờ
1432051990871923,1431311674279288,100048981573541,,Ngọc Hà,Thúy Thanh like hộ t cái cmt
1438640100213112,1431311674279288,100004991384937,,Elle Nguyen,Quân Bùi ơi
1431423297601459,1431311674279288,,hue.huoc,Đức Huệ,Nguyễn Đức Tuyển điiiiii
1491586231585165,1431311674279288,,duykhanh.phan.522,Duy Khánh Phan,NhicbNhi Cb
1432093624201093,1431311674279288,100056496887614,,Phạm Trang,Phạm Tâm bánh cay cx ngon 😗😗
1432076854202770,1431311674279288,,binshady5,Đanh Đá,Trần Hà Khánh ô hay kìa tự nhiên hiện tên luôn 😂
1431386627605126,1431311674279288,,Lizmiriki.hwang,Liz Huynh,Trung Nguyễn hà đông nì
1431382084272247,1431311674279288,100008135252989,,Vũ Hảo,Vũ Huế gần nè😋😋😋
1433301210747001,1431311674279288,100013928370809,,Phương Linh,Nữ Nhân sao mình đi rồi nó mới có nhiều quán đồ ăn ngon thế bạn
1451874162223039,1431311674279288,,thuythuynguyen.com.vn,Thủy Thủy Nguyễn,Đỗ Cường alo bạn mình ơi
1431915587552230,1431311674279288,,minh.hangg,Vũ Minhh Hằngg,Đức Nghĩaa hà đông nè
1431416597602129,1431311674279288,,maihuongvnn,Huong Mai,Tú Anh nè.
1431851770891945,1431311674279288,,yoko.thu,Minh Thu,Nguyễn Hương Quỳnh Mai Phương tiết trống géc gô
1433186044091851,1431311674279288,,Tao.Cz311,Một Mét Rưỡi,Hương Tũn haiz
1431919317551857,1431311674279288,,lann.anhh.1,Hải Đường,Mê thế Châu Thanh Linh
1431605544249901,1431311674279288,,kemminhnhat,Nguyễn Mộc Minh Nhật,Chờ cháu hái Hà Nguyên dẫn đi. 😆
1431380504272405,1431311674279288,,dieulinh.truong.3152,Dieu Anh,Nguyễn Thị Thuý Nobi Nobita Nguyễn Thị Thanh Nhàn nào ra chỗ e làm chuyến food tour đi
1432715247472264,1431311674279288,,linhdangiuhihi,Trần Phương Linh,Minh Trần ơ hấp dẫn vậy sao
1431873854223070,1431311674279288,100011693431460,,Nguyễn Nguyệt Minh,Trần Khánh Trinh đi
1431417184268737,1431311674279288,,bi.manh.3954546,Vũ Đình Mạnh,Chi Tây Hải Anh Tống tối t2 hể
1432817294128726,1431311674279288,,TranLanh.ThanhSonMoKhoaFB,Trần Lanh,Nguyễn Ngọc Ánh á lô
1431841767559612,1431311674279288,,hoqq.hoqq.28,Hồqq Hồqq,17. 20-30k nha
1431662440910878,1431311674279288,,titangpromete,Titang Promete,Ngọc Linh đã chuẩn chưa em
1431573914253064,1431311674279288,,hungpham612,Hùng Phạm,Trần Phương Thảo oke
1431388080938314,1431311674279288,,maucute04,Trang Trang,Linh Lan ngắm thôi nhé giảm cân
1431912437552545,1431311674279288,,thucquyen.luu.3,Lưu Thục Quyên,Nguyễn Thị Kim Oanh tranh thủ đi b oi:))
1431411530935969,1431311674279288,,em.nhungg.94,Nhungg Conn,Huyen Anh kìa
1431387310938391,1431311674279288,,tuyetmai.tran.1481,Tuyết Mai,NgocThien Tran alo alo
1572222850188169,1431311674279288,,thanh.ann.374,Ann Đào,Ăn gì Lê Xuân Đức
