comment_id,post_id,user_id,user_name,fullname,content
1191643444691616,1189096718279622,100029826166567,,Khoa Lê,Sao xàm lông dữ vậy
1189566841565943,1189096718279622,,trien.hong.3,Phạm Quốc Hồng,Nếu k ngủ sớm và giữ sk trong cv thì cẩn thận sau 40t bạn lại được người ta thuê đj robot đấy
1189098281612799,1189096718279622,,quocphi.ngo.35,Ngô Quốc Phi,Rất nhân văn
1189483091574318,1189096718279622,,tuang1994,Nguyễn Đặng Thanh Tuấn,Có ích thật í chứ. Ít ra họ có cái làm đỡ buồn
1189106814945279,1189096718279622,,chi.tong.716,Chi Đậu,liệt chân tay thì điều khiển thế nào nhỉ
