comment_id,post_id,user_id,user_name,fullname,content
1749465715841882,1749399782515142,,ngoc.lan.3766,Son Lipice,"bếp từ mà bác lấy búi sắt cọ ý ạ, mạo hiểm thế :D"
1749490952506025,1749399782515142,,thanh.tuyen.14289,Thanh Tuyền,Mua cana ủ chị ạ
1749497892505331,1749399782515142,61555293337162,,Linhh Tr,"ủ chai fast clean qua đêm thử đi b, bên bếp m mua bảo ko nên dùng dao hay vật sắt nhọn chà mặt bếp đâu b ạ, vs khi đặt nồi phải lau đế cho sạch, nấu ko để trào nước ra mặt bếp nữa ấy"
1749499749171812,1749399782515142,61566048720432,,Phan Minh Quí,Nhà mình mua chai này của 1 chị trong nhóm tẩy sạch lắm https://s.shopee.vn/A9ymYqNSst
1749532452501875,1749399782515142,,minhhanh.nguyen.9828,Minh Hạnh,Cọ bằng búi sắt thì hỏng hết mặt kính b ak
1749515242503596,1749399782515142,,lethithu.hien.581,Cindy Le,Lau bằng chai TS smart loại dùng cho bồn tắm toilet ấy sạch ngay. Mặt bếp từ mà dùng bùi nhùi sắt thì xước mặt kính
