comment_id,post_id,user_id,user_name,fullname,content
8033804893368388,8032977743451103,,tran.p.uyen.5,Tran Phi Uyen,thanh lăn chống nắng Sum mới đó b
8033836943365183,8032977743451103,,LoHa190402,Ngo Loan,"Sum nè c ,e hay mua bênPhương Sói ấy."
8033715106710700,8032977743451103,100050876737099,,Đoàn Thị Mến,Mom tham khảo kcn ViBa. Chống nắng tốt ko cay mắt nhé ạ
8036154529800091,8032977743451103,100013909808503,,Linh Thái Đặng,Của nhật á hãng j mà lọ màu xanh dương quên tên r hình như siseydei j j á
8034724153276462,8032977743451103,100013671843323,,Lan Cao,Viên uống chống nắng nội sinh ạ
8033698060045738,8032977743451103,100055862983153,,Lê Quế Trân,Đừng dùng thanh lăng b
8034127223336155,8032977743451103,,thanhha.phan.315865,Phan Thanh Hạ,Vote anessa hồng 🥰
