post_id,user_id,user_name,fullname,content
437712178622073,,babykiller45,Trương Hữu Phong,"Công ty Cổ phần Vàng bạc Đá quý Phú Nhuận (PNJ): Một thương hiệu vàng uy tín tại Việt Nam
Công ty Cổ phần Vàng bạc Đá quý Phú Nhuận (PNJ) là một trong những doanh nghiệp hàng đầu Việt Nam trong lĩnh vực vàng bạc đá quý. Với nhiều năm kinh nghiệm, PNJ đã khẳng định được vị thế của mình và trở thành thương hiệu được người tiêu dùng tin tưởng.
Lịch sử hình thành và phát triển
Được thành lập từ năm 1988, PNJ đã trải qua quá trình phát triển dài hơi và không ngừng lớn mạnh. Từ một cửa hàng vàng nhỏ lẻ, PNJ đã vươn lên trở thành một tập đoàn lớn mạnh với hệ thống cửa hàng trải dài khắp cả nước.
Sản phẩm và dịch vụ
PNJ cung cấp đa dạng các sản phẩm và dịch vụ, bao gồm:
Vàng: Vàng miếng, vàng trang sức,      vàng đầu tư... với nhiều mẫu mã đa dạng, đáp ứng nhu cầu của mọi khách      hàng.
Đá quý: Kim cương, đá màu, ngọc      trai... được tuyển chọn kỹ lưỡng, đảm bảo chất lượng cao.
Trang sức: Các bộ sưu tập trang      sức được thiết kế tinh xảo, phù hợp với nhiều phong cách và dịp khác nhau.
Dịch vụ: Mua bán vàng, cầm đồ,      bảo hiểm vàng...
Về kỹ thuật đồ thị của PNJ
Về Phân tích ITP thì cổ phiếu đã nằm trong xu hướng tăng về trung và dài hạn, cổ phiếu hiện đang được hưởng lợi từ nhóm ngành bán lẻ, giá gần về đến giao găm.
Anh chị có thể mở mua PNJ với giá 100+- target trước mắt 120
#itp #itpclub #itpkienthucdautu #huuphongitp"
