post_id,user_id,user_name,fullname,content
463944435998847,61558236472485,,Chứng Khoán TwoDuck,"𝐍𝐆𝐀̂𝐍 𝐇𝐀̀𝐍𝐆 𝐓𝐈𝐄̂𝐍 𝐏𝐇𝐎𝐍𝐆 - 𝐕𝐚̂̃𝐧 𝐪𝐮𝐚́ 𝐦𝐚̣𝐧𝐡 𝐦𝐞̃ 𝐝𝐨̀𝐧𝐠 𝐁𝐀𝐍𝐊
Thị trường có ru ngủ NĐT thì tiên phong mất không làm phật lòng cổ đông nắm giữ. Mua ở nền giá dưới thì còn gì mà tự tin.
Tuy nhiên 2DI đánh giá, TPB vẫn sẽ có nhịp chỉnh để mn còn có điểm mua mới - mua thêm chứ tăng suốt này người cầm tiền ko mấy vui vẻ đc.
Quý NĐT có nhu cầu TVĐT thì liên hệ với 2DI để có hàng ngon nhé!
(Link Cộng đồng có ở trong Bio)"
