comment_id,post_id,user_id,user_name,fullname,content
8410032645783963,8409464922507402,,nickhoanghip,Bùi Văn Hoàng,a ơi giá usdt tụt a cho e xin 2 lit :v
8410330152420879,8409464922507402,,dinhvuong89,Vuong Dinh,"đánh giá tiêu cực, report nó luôn :))"
8409941162459778,8409464922507402,100023867494553,,Đặng Quốc Huy,Bên em có đầu tư Vàng chỉ số khách hàng có thể Copytrade tải khoản master của bên em hoặc tự trader theo tín hiệu lợi nhuận 15-20% 1 tháng.Ib em để xem pass view khách hàng bên em ạ.
8409915992462295,8409464922507402,,louisnguyen2309,Louis Nguyễn,Báo khoá đi rồi gọi bnb hổ trợ
8410230959097465,8409464922507402,100027211161059,,Trần V. Sơn,Bảo nó k đọc được tin nhắn thì lấy kính đeo vào bh đọc được thì thôi 😄
8410200529100508,8409464922507402,,ThuanThatTha555,Hiền Thuận,=))) ib t chỉ mặt thêm 1 vài nhân tài nữa
8410495065737721,8409464922507402,100035148114108,,Nguyen Khoi,t gặp 2 lần loại như này cứ để hết giờ bấm khiếu nại là tự nhả usdt
8410085269112034,8409464922507402,,baotrung93,Bảo Trung,Bùi Tuấn Anh Quân Nguyễn
8410068145780413,8409464922507402,,baotrung93,Bảo Trung,Bùi Tuấn Anh
