comment_id,post_id,user_id,user_name,fullname,content
1844485499414735,1844014672795151,,loving.iu.7,Liz Nguyen,https://s.shopee.vn/LV8HMLB7Q
1844370922759526,1844014672795151,100027941619805,,Hoàng Thị Thu Huyền,https://s.shopee.vn/3ApJQMRUXF
1844524806077471,1844014672795151,100028919809919,,Nguyễn Hân,"Mặt kích ứng bị lên mụn thì qua da liễu điều trị cho hiệu quả b ạ. Bạn qua chỗ Thạc sĩ - Bác sĩ Vũ Thiên Tuân xem sao. Trc mình có làm liệu trình điều trị kết hợp với meso extra chỗ bs giờ da chắc khỏe, mịn màng hơn nhiều. Bs chuyên khoa thẩm mỹ cũng yên tâm ấy"
1844533359409949,1844014672795151,,phwgthank,Phương Thanh,"Bà có sử dụng sp đẩy mụn nào k z, hoặc lúc dùng dầu tẩy trang bà k nhũ hoá kỹ với nước ấm, rồi dùng thử chấm mụn em này đi bà, ổn lắm á, mà nhớ chống nắng kỹ nha
https://s.shopee.vn/8zn6hVGyL4"
1844565116073440,1844014672795151,,thienthan.tihon.712,Hoàng Bảo An,"chắc là bị kích ứng rồi bạn, ngưng dùng dầu tẩy trang đi"
1844958106034141,1844014672795151,100093958395251,,My Trà,chời ơi dạo này top top rộ lên xài tẩy trang kiu là kh nhũ hóa kỹ thì dễ bị mụn đó. mà tui thấy nhiều ng bị bùng mụn do xài dầu tt lắm lun
