comment_id,post_id,user_id,user_name,fullname,content
7963432997087770,7959367737494296,100092442021029,,Bông Skincare,"Da dầu kem dưỡng ẩm bí nha
sp to dạng tẩy da chết thui
E có ảnh da ko
E chú ý bước làm sạch da
Peel da chuyên mụn r đi lấy nhân mụn cho hết
Hết mụn.muốn sáng da thì thêm hoạt chất làm sáng da như Tranexamic arbutin vtm c nha e
Cấp ẩm phục hồi kèm theo nha e"
7963920743705662,7959367737494296,,thanglong.hatgiong,Bác Sĩ Đạt,"Em sử dụng trong peel da Tricloacetic Acid (TCA): Đây là một loại axit hữu cơ, chức năng là tái tạo cấu trúc da mới giúp trẻ hóa làn da, cải thiện tình trạng nếp nhăn và sắc tố da trên khuôn mặt."
7964133147017755,7959367737494296,,,Người tham gia ẩn danh,Dạ đây là ảnh da e ạ
7963207557110314,7959367737494296,100050751802398,,Nhung Do,"Da dầu ko xài kem dưỡng này nha chị bí da
Hiện tại chị xài những sp nào rồi"
7963263800438023,7959367737494296,61562067251008,,Nguyễn Ny,"Chị tham khảo bộ peel bên em nha, an toàn lành tính ạ"
7963387243759012,7959367737494296,100054566553434,,Nguyễn Kiều,...
