post_id,user_id,user_name,fullname,content
2391468071329016,100093269143063,,Lê Minh Đức,"Tìm mèo lạc
Khoảng 4h ngày 6/10 bạn mèo nhà em có nhảy ra ngoài và đi mất
Khu vực ngõ 225 đường 422B Vân Canh Hoài Đức Hà Nội
Cạnh trường Cao Đẳng Công Thương
Em đã có đi quanh khu và tìm nhưng không có
Bình thường em gọi là bạn ý có nghe thấy và chạy lại nhưng lần này thì bạn ý mất tích
Lúc bạn ý nhảy ra khỏi nhà là em có đeo vòng cổ màu xanh lá cây có chuông
Bạn ý đang bị đau mắt nên em rất lo bạn ý bị chó khu khác rượt rồi chạy vào nhà dân
Anh chị nào có thấy bé thì liên hệ với em nhé ạ
Có hậu tạ ạ"
