comment_id,post_id,user_id,user_name,fullname,content
1755977844834844,1755818621517433,,linhhathi253,Hà Linh,"Công việc thì cũng như sale khác thôi, lương thì theo năng lực của bạn, bạn đạt mức hợp đồng nào thì hưởng theo lương của mức đấy, được cái ngoài lương theo KPI đấy thì có nhiều phần khác nữa (thưởng, lương KH còn ở lại với mình,…), mà thời gian đầu mới vào làm thì có hỗ trợ lương đào tạo nữa, môi trường thì cũng okela, mọi người vui vẻ, nhiệt tình.
Mà sao mới pass pv mà đã vào để xem rv, sao k xem trước lúc pv đi nhỉ? Nếu xác định làm cv gì thì cứ cố gắng nha bạn, không cố gắng thì sao có kết quả"
1756019124830716,1755818621517433,,naul.thanh,Cao Thành Luân,"Fpt telecom có 2 mảng B2C và B2B, B2B thơm hơn nhé"
1755926681506627,1755818621517433,,chuthivandung1234,Chu Thị Vân Dung,Là vị trí đi bán hợp đồng mạng vs camera của Fpt ấy. Lương thưởng tính theo hợp đồng
1756116638154298,1755818621517433,,gay.sa.545,Trang Huyền,"- telesale dựa trên data của cty, nhưng data của FPT telecom rất cùi, và phải tự chi trả chi phí đt

- đi các nhà gõ cửa mời lắp mạng, đi treo bạt + biển qcao có gắn sđt của bạn lên các ngõ ngách + cột điện ---> vất vả, và cũng mất công + chi phí làm qcao + xăng xe, đôi khi bị phường hoặc dân ngta chửi, cạnh tranh vs các team khác nữa

- chạy ads, cực tốn kém nhưng nếu có team làm cùng thì cũng oke, nhàn và ko lo thiếu số"
1756116701487625,1755818621517433,,anhkhoa.30699,Anh Khoa,Nhìn avatar mình đủ uy tín chưa bạn. Bạn chấm ở đây 1 chấm nếu còn quan tâm về FPT và mình sẽ phản hồi chi tiết về công việc cho.
1755929944839634,1755818621517433,,son.lanhlung,Nguyễn Tiến Sơn,😅 nghỉ việc tới nơi
1755943864838242,1755818621517433,,tran.kinhu,Ux Biu,"Tìm kiếm khách hàng, tư vấn giới thiệu cho khách hàng các sản phẩm dịch vụ Mạng của FPT: mạng Internet, truyền hình, camera
Thu nhập thì dựa trên số hợp đồng, doanh số bạn đem về nè"
1755925681506727,1755818621517433,,duonggno.2000,Hùngg Dươngg,Chấm ké. :)) mình thấy tuyển đại trà lắm
1758637547902207,1755818621517433,,minhtrang369,Minh Trangg,Lăng Lan m à 🌝
1755943968171565,1755818621517433,,tanlm2,Lê Minh Tân,"Hỏi nhóm này thì chỉ có ở nhà cho khoẻ thôi em, ko làm được việc gì đâu"
1756390168126945,1755818621517433,100035145455710,,Phong Linh,Nghỉ sớm đi em!
1755941418171820,1755818621517433,,mongmanh.devo.54,Bạch Sầu,Nghỉ cho nó khoẻ nhé bro
1755985781500717,1755818621517433,,hungit2,Nguyễn Hưng,Hãy nhìn shark hoàng nam tiến từ nvkd đi lên là hiểu haha
1756463101452985,1755818621517433,,,Thành viên ẩn danh,Cảm ơn mn đã góp ý ạ. Em đi pvan thấy nói nữ thường hay k đạt kpi mà k đạt kpi quá nhiều sẽ bị cty loại nên chỉ muốn lên đây hỏi anh chị về tính chất công việc ntn thui ạ
1758138837952078,1755818621517433,,thuhien.nguyen.18659,Thu Hien Nguyen,Do Duc vào đọc :)))
1756421631457132,1755818621517433,,kieuthanhphongs2,Kiều Thanh Phong,Văn Thị Hạnh cho bạn xin review đi em
1755982411501054,1755818621517433,,minh.thuy.355138,Minh Thùy,Truong Nhu Quynh rv em ơi
1755929768172985,1755818621517433,100012686437636,,Đạt Lê,Cbi tinh thần đi thu cước :v
1755940068171955,1755818621517433,,liliciu12,Trần Phương Linh,Thảo Cháy =>> rv đi b
1755934618172500,1755818621517433,,khongcoji1,Thắng Đức Nguyễn,100 % pass 🤭
1755932891506006,1755818621517433,,huonghyun162,Nguyễn Thúy Hường,Đoàn Thị Vân Anh kìa
1755997738166188,1755818621517433,100086730536970,,Loan Lê,hổm mình đi pv có trao đổi chỉ CSKH là chủ yếu mà ta. k gán kpi có lương cứng
1755955624837066,1755818621517433,100079229473044,,Hoa Hồng,Nay dịch vụ bên wifi nó bão hoà ng dùng r bạn ơi. Chạy KPI sấp mặt nghen.
1756542884778340,1755818621517433,,NguyenTam133,Nguyễn Văn Tam,"Chạy số cong mông. Tháng đầu k phải chạy số lương hỗ trợ 2tr2. Tháng tiep theo 5 net, 2 pay. Đi theo bạt quảng cáo cả đêm mới được 4 net 1 pay, vẫn bị thiếu số. Công ty hỗi trợ chi phí in bạt quảng cáo. Công việc đi treo quảng cáo, không có số thì ký hộ hợp đồng, mỗi hợp đồng 50k hoặc đổi 5 lần đi ký bằng 1 hđ( đấy là những ngừoi có số tốt thì họ mới đổi còn k thì chỉ nhận tiền), nếu có tiền thì có thể chạy google add, facebook add những mình phải tự bỏ tiền ra. Mỗi tháng tuỳ chạy nhiều hay ít. Đây là những gì mình đã trải nghiệm khi làm. Còn nếu muốn biết có làm được hay k? Bạn hãy lên google đánh thử từ khoá lắp mạng fpt sẽ trả ra 2tr kết quả vậy bạn làm thế nào để cạnh tranh với ngần đấy người đang sale fpt. Chỉ có bạn mới trả lời đc câu hỏi này. Chúc bạn thành công"
1755940404838588,1755818621517433,100010772476519,,Trần Khởi Sự,Nghe pass phỏng vấn nó sang chảnh thế. Nghỉ đi em
1755936311505664,1755818621517433,,TL1009,Nguyễn Tới,Mình mới xuống shop thử việc 3 buổi và đã nghỉ luôn 😬. Nói chung phải quyết tâm lắm mới trụ nổi
1756091991490096,1755818621517433,,yumi.jung.756,Diệu Tâm,"Con gái làm FPT thì hơi cực nhưng mà cố gắng trụ đc qua 2 tháng đầu thì okela lắm b ui :)))) lương thưởng chế độ tốt, chấp nhận 2 tháng đầu lương thấp thoi. Bồ mình 2 tháng đầu học việc còn ko có lương =)))"
1755944194838209,1755818621517433,100007398330943,,Nguyễn Hồng Nhung,Mình dô được 2 hôm cái té lẹ 🤣🤣
1756454104787218,1755818621517433,,tran.don.54,Trần Thị Dơn,"Làm 1 ngày nghỉ, là nữ khó trụ lắm."
1755941868171775,1755818621517433,,phuong.le.7545,Phuong Le,Ny Thủy Phạm
1771869176579044,1755818621517433,,an.ni.7169709,Kim Loan,Thân Huy Hoàng
1775055956260366,1755818621517433,100073368734455,,Linh Linh,.
1756113891487906,1755818621517433,,iker.shen,Tăng Chấn Xuyên,"Từng làm triển khai lắp đặt bên này hồi 2015 :)) thay sale như thay áo, lương cứng thấp tè, chả đủ đổ xăng, đi kiếm hợp đồng, đi dán băng rôn, phát tờ rơi, làm chương trình các kiểu nếu ko có số, chưa kể nhiều khi tối còn phải xách bao đi tháo banner của đối thủ cạnh tranh như viettel, vnpt =]] nhìn chả khác mịa gì trộm chó cả :))
Cạnh tranh người ngoài, cạnh tranh với cả đồng nghiệp cùng cty nhưng khác địa bàn, banner bạn dán sẵn thì nó chỉ cần dán đè sdt của nó lên sdt của bạn thôi :))"
1861627964269831,1755818621517433,,biel.tp,Thanh Tran,"Sale FPT Telecom bị cho nghỉ nhiều lắm vì không đạt doanh số. Không ênn vào nhat bạn, mình làm FPT Telecom 5 năm rồi. Môi trường cũng tệ, bỏ đi."
