comment_id,post_id,user_id,user_name,fullname,content
1687087065424885,1686876602112598,100011189083617,,Hoàng Linh Chi,. hóng
1687145398752385,1686876602112598,,khi.con.927,Huy Lâm,"Giựt nhẹ tay + cẩn thận là ra
Mấy cái pad tai nghe làm gì có cái nào có ốc đâu mà tìm
Nhưng gắn lại như nào thì hơi mệt đấy :)))))) mà thường họ thay chứ ko ai tháo ra chỉ để vệ sinh cả"
1687169935416598,1686876602112598,,ngocntn13c,Nguyễn Thế Ngọc,"Thường thì cái phần ốp sẽ có phần lẫy nhựa để gắn vào tai nghe, bác có thẻ ngân hàng hay miếng nhựa dẹt thử đường viền xem."
1687192188747706,1686876602112598,,huy.lam.18007218,Huy Lâm,"Dễ mà, đặt 2 ngón tay cái bên trong cái pad tai ở vị trí đối nhau, sau đó tác dụng lực vừa phải hướng ra ngoài, pad tai sẽ bị kéo căng ra, thêm chút lực, cái pad sẽ rời khỏi vành cao su, rời ra ngoài. Đừng lo, pad ko rách đâu, rách thì lên shopee mua pad mới, bán đầy, có thể lúc đầu sẽ hơi khó, cứ tăng lực lên dần thì pad sẽ rơi ra."
