comment_id,post_id,user_id,user_name,fullname,content
3813939292204812,3813656842233057,,khucngockientruong,Khúc Ngọc Kiên Trường,Coi như hold to die thôi. Trên coinmarket đâu thấy wases
3813966888868719,3813656842233057,,Anhbe.197,Bùi Công Sáng,Bán trên dex thôi
3814442245487850,3813656842233057,,vuhuytam,Tâm Huy,"Trên ví swap luôn được mà.
Các ae cứ bài ca phi tập trung mà cứ phụ thuộc sàn thế này thì chết =))"
3813969875535087,3813656842233057,,truong2901az,Nguyễn Lam Trường,Lên dexcress mà swap sang coin khác b
3814451695486905,3813656842233057,,doitruong.Kim1,Trần Duy Hưng,"Rút về ví cũng phải chọn phi tập trung thực sự, chứ binance sập mà rút về bsc thì khác gì để ở sàn đâu"
