comment_id,post_id,user_id,user_name,fullname,content
8457528904367670,8457510114369549,,huyen.camthuy.9,Hồng Cảnh Viskin,Btc nó mà điều chỉnh thì alcoin ăn cức luôn.
8457696541017573,8457510114369549,,trong.tran.33821,Trọng Trần,"Chuẩn bị bay lên 73k4 .. sw 71k6 , tiếp là 78k"
8457545174366043,8457510114369549,100011326957052,,Nguyễn Duy Tân,Btc tăng alt bất động. Btc giảm alt sản luôn
8457619061025321,8457510114369549,100013185099609,,Triệu Đức,Ko hiếu altcoin bị gì mà ì ạch thế nhỉ
8457681751019052,8457510114369549,100008372790896,,Han Phi,Alt bay nhiều lắm rùi còn
