comment_id,post_id,user_id,user_name,fullname,content
1745532076235246,1744919682963152,,bubby.huynh,Linh Phương,"Cái đồ để bàn chải b mua đâu v, xài ổn ko bà"
1745534229568364,1744919682963152,,nguyenthinga3105,Nga Hana,Máy sấy này goi la gi vay c
1745552822899838,1744919682963152,,dothilinh.bn,Đỗ Linh,Cái hiện 21 kia là gì thế mng
1745563526232101,1744919682963152,,phamvuthanhhang,Thanh Hang,Mạch keo nhà b thợ đi nhìn đẹp xuất sắc
1745642459557541,1744919682963152,,thuylinh.do.712,Tuệ Linh,Khuyên thật lòng là c nên mua cái giá để bàn chải đánh răng riêng. Chứ gài vào đó hay bị mốc đầu bàn chải lắm c nha
