comment_id,post_id,user_id,user_name,fullname,content
1724230241716648,1724228221716850,100094187656980,,Huỳnh Khả Di,nhiều mom 8n mơi lên đó mom
1724231805049825,1724228221716850,100094137979673,,Trịnh Văn Vàng,mom cứ bình tĩnh rồi thử lại xem
1724230635049942,1724228221716850,100094225395264,,Kim Dung Võ,cứ bình tĩng rồi test lại mom ạ
1724233008383038,1724228221716850,100066271796473,,Anna Lê,mom thửu beta chưa
1724231021716570,1724228221716850,100095041196705,,Phạm Khánh Tâm,mình lần đầu 9n scp mới thử que đó mom
