comment_id,post_id,user_id,user_name,fullname,content
1691547161632849,1691541774966721,,tnytam,Trương Nguyễn Yên Tâm,"Công thức cũ mèm mà 🙄
Làm content free => tăng followers => tung sản phẩm liên quan đến content mình hay đăng, thường là khóa học/sách/app/website"
1691581064962792,1691541774966721,,henryonsoftware,Bùi Viết Hướng,Giờ là lúc mấy ông maker chuyển qua làm youtuber đó anh 🤣
1692044414916457,1691541774966721,,hinaka.dev,Trần Nguyễn Minh Trung,"ủa google giờ còn duyệt app wallpaper à ta, tưởng đợt 31/8 vừa rồi apply policy mới là purge hết rồi"
1691614921626073,1691541774966721,,vhbui02,Bùi Hùng,"K hợp e, art is free :3"
1691578918296340,1691541774966721,,hxutixnnn,Nguyễn Hữu Tiền,Sắp tới MKBHD sẽ tung coin blockchain mới để cạnh tranh với $OPENAI 🐧
1691585971628968,1691541774966721,,GrillardinT,Tuấn Hoàng,"E thấy nó hợp lý. Có tập khán giả khổng lồ thì có thể tìm được cơ hội giải quyết vấn đề ngay trong đó luôn.
Product Market Fit siêu tốc.

Mà thực tế thì maker nào cũng phải trở thành hoặc biến đội mình trở thành cái loa phát thanh tìm người nghe rồi."
1692364774884421,1691541774966721,,dunkbinggg,Bing Bing,nhưng mà cái app lỏ quá 💀 tưởng tầm cỡ ông này phải làm gì đó thú vị hơn cơ
