comment_id,post_id,user_id,user_name,fullname,content
7904528819644855,7895631230534614,,thanglong.hatgiong,Bác Sĩ Đạt,"Mụn này em dùng chấm mụn cho khô nhân rồi đi lấy sạch nhân mụn em nhé. Em dùng sữa rửa mặt cho vùng da này, chấm mụn bằng Klenzit C, vertucid hoặc biotrade, Azaduo,....thêm bôi mụn adapalene để giảm mụn ẩn. Nếu cùng cằm mặt có mụn viêm thì cần thêm thuốc uống phối hợp để kiểm soát tình trạng viêm."
7901377646626639,7895631230534614,,lethi.ngocquynh.56,Lê Thị Ngọc Quỳnh,Làm sạch da và thử thêm serum này vào routine nhé
7904905189607218,7895631230534614,,hanh.hong.9655,Hạnh Aduha,"Da e tập trung làm sạch, mụn đỏ nhạy cảm e hạn chế sản phẩm dạng thuốc mạnh tránh tình trạng bị kích ứng, bùng mụn.
Bôi thoa sản phẩm trị mụn nhẹ nhàng sẽ hợp với da của em hơn."
7904840182947052,7895631230534614,100092570064685,,Đức Tài,"Mụn li ti mụn viêm.
E chú ý các bước làm sạch.
Thêm chấm mụn viêm biotrade.
Cấp ẩm phục hồi hab5 + kem dưỡng ẩm mỏng nhẹ thoáng da.
Hạn chế thức khuya, ăn uống sinh hoạt hợp lý nhé em nha."
7899667240131013,7895631230534614,100092442021029,,Bông Skincare,"Da mụn viêm mụn ẩn liti
E chú ý bước làm sạch da nha e
Thêm lọ chấm mụn viêm nhé
Srum kem dưỡng ẩm mỏng nhẹ nè
Phục hồi da ổn vs làm sạch kĩ là cải thiện nha e"
7901090089988728,7895631230534614,100083230755341,,Nguyễn Hoa Dược Sỹ,"Nền da mụn ẩn rải rác hiện rại da b đang dùng gì cho da nhé
Chup tât cả sp e đang có
Làm sạch da là ưu tiên hàng đầu
Sau đó câp ẩm và bôi mụn"
