comment_id,post_id,user_id,user_name,fullname,content
1659104134682933,1659075044685842,,karol.antunes.984,Hoàng Ngọc San,"Chào mọi người mình là 1 trader. Mình có tham gia rất nhiều nhóm và cũng cháy rất nhiều tiền vì các nhóm vớ vẩn cuối cũng đã vào được 1 nhóm rất ok.
Họ cho mình kiến thức miễn phí có thêm cả tín hiệu chuẩn
Chia sẻ rất nhiệt tình k lùa gà như các nhóm khác nếu bạn đang gặp vấn đề về lệnh thì họ giúp được họ giúp nhiệt tình.
kb zalo 0975.665.297 Mình thêm bạn vào nhóm để học hỏi giao lưu"
1659080221351991,1659075044685842,,minhkha.duong.1,Lê Trung Toàn,"bác ấy nói đúng, ít thấy bầu Đức có hình ảnh ăn chơi (1. Do bác ấy giấu, 2. bác ấy đang cần 1 anh em dìu dắt 😁😅)"
1659080204685326,1659075044685842,,kythinh.nguyen,Kỳ Thịnh Nguyễn,Làm để trả nợ.
1659186731341340,1659075044685842,,NguyenDoanNgocDuc,Benjamin Nguyễn,Bác nợ hoài với lỗ hoài bác ơi - bác làm ăn có lời cho con đỡ khổ với bác ơi.
1659243591335654,1659075044685842,,duyvinh.ngo.984,Duy Vinh Ngo,Lòng tham đơn giản vậy thôi
1659473554645991,1659075044685842,,lycapheden,Hoàng Vũ,Con hag xập xình hoài 😗
