comment_id,post_id,user_id,user_name,fullname,content
1873211246541330,1872880076574447,,phamnhuquynh8399,Quỳnh Quỳnhh,"vớt vát thì đợi sau 1 năm làm việc tới kì annual evaluation mình deal tăng lương bạn ơi, sau thử việc cty cũng ko chịu cho deal đâu (thường là vậy) :((((("
1873200873209034,1872880076574447,,phannguyenthuyan,Phan Nguyễn Thúy An,Nếu lỡ deal thấp rồi bạn cứ mạnh dạn trình bày lại để 2 bên xem xét nếu bạn có ưu thế hơn và còn lựa chọn khác. Còn vã quá thì thôi chứ sao.
1872998659895922,1872880076574447,,Hahauanh777,Trần Joseph,Deal chỗ khác
1872947766567678,1872880076574447,100004837422076,,Anh Trâm,Anh Nguyen m hỏi đúng không :)))
1872925053236616,1872880076574447,,tham.pham.5473,Gấu Nhỏ,Deal lại =))
1872923996570055,1872880076574447,,nhuanhsaoroi88,Bùi Gia Hưng,Deal cao chắc gì giờ đã được nhận bạn ơi 😊
1872916263237495,1872880076574447,,pham.huy.332,Huy,chắc gì đã trúng mà đã lo hão
