post_id,user_id,user_name,fullname,content
469996275393663,,,,"Bản tin buổi sáng ngày 16/10/2024: RŨ BỎ CẦN THIẾT!!!
Nhìn chung thì thị trường bị nhiễu động cung cầu vì đây là tuần ĐHPS + các yếu tố về tin tức ảnh hưởng cục bộ ở 1 vài cổ phiếu góp phần làm ảnh hưởng tới tâm lí nđt
Em đánh giá các nhịp dí xuống ở nhiều cp midcaps, đặc biệt là nhóm bđs đóng vai trò như 1 pha rũ bỏ nốt lượng nđt đeo bám  cuối cùng, nếu nđt bán nhanh thì cp sẽ dễ  tạo các vùng đáy ngắn hạn, khi ấy thì tổ chức sẽ  dễ  kéo thị trường lên hơn
Sự phân hóa của thị trường vẫn diễn ra dày đặc, room mình đi tỉ trọng cực lớn  vào dòng BANK ngay từ chân  sóng và liên tục gom hàng các cổ phiếu top đầu nhóm này khi giá còn rẻ vì vậy cực kì an toàn trong 1 giai đoạn vừa qua
Các pha rung lắc như này của thị trường sẽ mở ra rất nhiều điểm mua của các  cổ phiếu tiềm năng, em sẽ lên chiến lược và chắt lọc cổ phiếu từ bây giờ, em sẽ chưa bật mí ngay, cả nhà chờ thông báo từ room cộng đồng
Diễn biến của TT e sẽ cập nhật cho cả nhà sau
Chúc mọi người có 1 ngày giao dịch thành công"
