post_id,user_id,user_name,fullname,content
8505120569608503,,,,"VÍ CỦA TESLA GÂY LO NGẠI VỀ FUD
Vào ngày 15 tháng 10, công ty phân tích on-chain Arkham Intelligence đã báo cáo rằng một số ví được cho là của Tesla đã bắt đầu di chuyển Bitcoin từ một ví không hoạt động từ năm 2022 sang một ví chưa được xác định.
Theo Arkham, các ví này, được cho là do Tesla kiểm soát, vẫn giữ số dư 11.509 BTC, trị giá khoảng $774 triệu tại thời điểm báo cáo.Những tiết lộ tài chính mới nhất từ Tesla đã củng cố các báo cáo ban đầu của Arkham Intelligence, xác nhận rằng công ty vẫn chưa bán bất kỳ tài sản kỹ thuật số nào mà họ nắm giữ.
Cổ phiếu Tesla giảm mạnh sau sự kiện ra mắt Cybercab
Elon Musk đã giới thiệu dòng taxi tự lái của Tesla tại một sự kiện vào ngày 10 tháng 10 ở Hollywood, California. Ông tin rằng xe tự lái sẽ là tương lai, giúp ngăn chặn các vụ tai nạn do lỗi con người gây ra và từ đó cứu được nhiều sinh mạng.
Tuy nhiên, sự lạc quan của Musk không được các nhà đầu tư chia sẻ, và ngay sau khi sản phẩm Robotaxi được công bố, cổ phiếu Tesla đã giảm 8%."
