comment_id,post_id,user_id,user_name,fullname,content
1744468966341557,1744450549676732,100076305056769,,Nguyễn Ngọc,"Nhà đẹp quá! Gọn gàng, sạch đẹp mà thẩm mỹ!"
1744473273007793,1744450549676732,,nguyen.yen.1408,Yen Nguyen,Đẹp quá b ơi
1744471063008014,1744450549676732,,tiencheese.98,Tiên Ốc Tiêu,Xin tips bọc drap nệm thẳng tưng như này ạ 🥹
1744475646340889,1744450549676732,,mac.huyenthuong,Mạc Huyền Thương,B có Gv ko vậy? Nhà có con nhỏ mà tinh tươm gọn gàng quá
1744467556341698,1744450549676732,100008402861313,,Hà ThuThu,nhìn mê quá. con nhỏ mà có thể gọn dấu hết đồ thế kia. thik lắm
1744471353007985,1744450549676732,,missbuuu,Tuyết Diễm,Chị ơi chị chia sẻ sang nhóm lối sống tối giản đi chị. Em là admin bên đó câu kéo chị sang luôn. :)
1744573806331073,1744450549676732,100044296510996,,Nguyễn Thị Hiền,Thảm sofa chị mua bao tiền đấy ạ?
1744476143007506,1744450549676732,,panoli.pham,Ngọc Linh Phạm,"Nhà bạn hợp gu mình quá, đơn giản nhẹ nhàng, thoáng đãng, màu sáng chủ đạo. Simple is the best luôn"
