post_id,user_id,user_name,fullname,content
2021873611578598,,,,"Chuyện không của riêng ai!
Đầu tuần mình có cuộc pv, 20' đầu tiên là trao đổi với HR ng Việt sau đó là trao đổi chuyên môn với AM và GM ng Nhật.
Bạn HR ng Việt bằng tuổi mình, liên tục hỏi tại sao thời gian mình gắn bó với cty cũ khá ngắn (?). Trong khi tgian làm việc của mình ngắn nhất cũng là 1năm (cty đầu tiên sau khi ra trg, lý do là cty dừng hoạt động ở mảng đó), còn lại lần lượt là 2,5năm và 1,5 năm (mình sn97) và mình ko nghĩ đó là khoảng thời gian ngắn. Nhưng bạn đó liên tục đưa ra những nhận xét phiến diện kiểu như mình ko nghiêm túc với cv, ko có tinh thần gắn bó với cty và luôn trong tâm thế sẽ rời đi tìm mtrg tốt hơn (?). Bạn ấy cũng đào sâu về vấn đề của mình với sếp cũ, đồng nghiệp cũ (mặc dù mình đã trả lời rất đúng trọng tâm rồi nhưng bạn ý vẫn nhắc đi nhắc lại như kiểu là muốn mình nói xấu sếp cũ và đồng nghiệp cũ mới vừa lòng ý 🙃). Nói chung dù bực nhưng mình cũng trả lời hết các câu hỏi bằng thái độ chuyên nghiệp nhất. Và cuộc pv với AM, GM thì diễn ra tốt đẹp.
Sẽ chẳng có gì cho đến khi sau đó mình biết thông tin của bạn HR này, bằng tuổi mình nhưng bạn ấy mới chỉ làm việc đúng chuyên môn hiện tại khoảng 3 năm bao gồm cả thời gian intern, và đã làm qua 3cty. Tức là tần suất nhảy việc của bạn ấy còn cao hơn mình mà.
Mình chỉ muốn nói, mình hiểu nhiệm vụ của Hr là tìm kiếm những ưv có tố chất phù hợp theo yc của cty, nhưng dù sao các bạn cũng chỉ là nhân viên, cũng là đồng nghiệp như bao ng khác thôi, đừng tự cho mình cái quyền đánh giá và nhận xét phiến diện chứ. Trong khi GM tỏ thái độ rất tôn trọng và bình đẳng, thì HR cứ làm như là mẹ ngta vậy....."
