comment_id,post_id,user_id,user_name,fullname,content
8075254362572299,8072105499553852,100092442021029,,Bông Skincare,"Mụn viêm noii tiết nha e
E thêm lọ chấm mụn viêm
Kem dưỡng ẩm mỏng nhẹ là đc e
E đang dùng sp j ko
Da có vẻ đỏ nhạy cảm"
8075437265887342,8072105499553852,,thanglong.hatgiong,Bác Sĩ Đạt,"Da của em là Sợi bã nhờn, Lcl to, mụn ẩn.
Mụn đẩy cần dùng chấm mụn. Sau đấy thì
Peel định kỳ kết hợp Re +Niacinemide da sẽ sáng dần lên & cải thiện lcl, sợi bã nhờn rõ luôn nhé .
Re : mờ thâm, chống lão hoá , căng mịn
BHA : điều tiết dầu, giảm bít tắc lcl, làm sạch sâu tbc của da
Niacinemide : cải thiện lcl, mịn da
Chú ý phục hồi & chống nắng đủ đô nhé."
