comment_id,post_id,user_id,user_name,fullname,content
8428864563877942,8426276277470104,100092442021029,,Bông Skincare,"Da có mụn ẩn mụn viêm
E hay thức khuya ko
E thêm lọ chấm mụn viêm nha e
Bha tẩy tế bào chết
Adapalen trị mụn kèm phục hồi b5 kem dưỡng ẩm mỏng nhẹ nhé
Mụn gom e đi lấy nhân mụn định kì là OK
Hạn chế thức khuya ăn đồ cay nóng nha"
8426696897428042,8426276277470104,100083230755341,,Nguyễn Hoa Dược Sỹ,"Hiện tai e đang dùng gì cho da
Vơi da này có ít mụn ẩn viêm cần chế độ sinh hoạt hơp lý
Thêm azelaic nia câp ẩm da nhé"
8426647174099681,8426276277470104,100030248422132,,Ngoc Bich,.
8426634564100942,8426276277470104,,ha.xuka.712,Hà Hà,.
8426648637432868,8426276277470104,100083860984088,,Đại Khái Là Ly,.
8426647657432966,8426276277470104,,trinhnguyen282,Nguyễn Thị Trinh,.
8426603827437349,8426276277470104,,yun.royal.7,Nguyễn Phương Trinh,.
