comment_id,post_id,user_id,user_name,fullname,content
1815122719017680,1813012979228654,100093072006959,,Quỳnh Như,Bạn qua gr Hội nhóm @[235215185944997:69:Hội nhóm TRỊ VIÊM NANG LÔNG - DÀY SỪNG NANG LÔNG - MỤN LƯNG ✅] tham khảo cách trị phù hợp và hiệu quả quả này.. nhiều mẹo hay lắm
1814950335701585,1813012979228654,100090259706277,,Mỹ Hiền,"Nhóm @[455346627145477:69:HỘI CHUYÊN TRỊ VIÊM NANG LÔNG - MỤN LƯNG ✅]này thật sự hiệu quả, viem nang lông của mình không chỉ mờ hẳn mà da còn trở nên mịn màng, căng bóng, trông trẻ trung hơn rất nhiều"
1815157985680820,1813012979228654,61552050503523,,Diễm Ái,"Em hay qua bs ở Viện Thẩm Mỹ Royal chăm sóc thích lắm, tư vấn kĩ, giá hợp lý, bác sĩ giỏi nữa, chị tham khảo qua nhé. Có nhiều phương pháp điều trị, có cả phác đồ điều trị riêng biệt, thiết bị hiện đại. Làm chỗ uy tín cho yên tâm."
1814521555744463,1813012979228654,100092974362070,,Dương Nhã Kỳ,"Trước em cũng bị mụn , điều trị xong dưỡng da cải thiện, chăm sóc kĩ và uống thuốc cân bằng nội tiết nên giờ hết mụn da cũng trắng lên rồi. Tham khảo qua CEO Vicky Thuận để được tư vấn liệu trình phù hợp da nhé. Làm chỗ uy tín cho yên tâm."
1814900682373217,1813012979228654,61552857908594,,Nguyễn Hoàng Ly,"Bị mụn nhiều như này dùng serum hay bôi thoa thông thường ko ăn thua đâu bạn ạ, như mình trước bị mụn có qua bên Viện Thẩm Mỹ Royal các chuyên gia bên này dtri nay da dẻ vẫn khỏe đẹp, mịn màng lắm này"
1815043052358980,1813012979228654,,thichuong.pham.1656,Le Hoang Anh,"Bạn xem bên bsi CEO Vicky Thuận xem, vì trước mình chữa mụn viêm, thâm hiệu quả đó."
1814484069081545,1813012979228654,,dao.van.7374,Hoàng Vân,"Bạn tham khảo chấm mụn nhé : dapsone, Biotrade,.."
