post_id,user_id,user_name,fullname,content
3801559020109506,,diemquynh.nguyen.311493,Nguyễn Thị Diễm Quỳnh,"🚨 Bitcoin giảm xuống còn 60.000 đô la trong bối cảnh căng thẳng ở Trung Đông – Biến động thị trường đáng báo động! 🚨
Trong một diễn biến đầy kịch tính, Bitcoin đã giảm xuống còn 60.000 đô la, xóa sạch hầu hết mức tăng sau khi Fed cắt giảm lãi suất. Đồng tiền điện tử lớn nhất theo vốn hóa thị trường đã giảm 3% trong 24 giờ qua, khi căng thẳng leo thang ở Trung Đông đã gây chấn động khắp thị trường.
Các tiêu đề đưa tin về một cuộc tấn công tên lửa sắp xảy ra của Iran vào Israel đã thúc đẩy một cuộc tháo chạy khỏi các tài sản rủi ro, khiến các nhà đầu tư hướng đến các nơi trú ẩn an toàn hơn. Điều này đánh dấu sự sụt giảm mạnh so với mức cao trước đó của Bitcoin là 64.000 đô la trong giờ giao dịch tại châu Âu. 📉
⚠️ Cảnh báo: Tình hình trở nên trầm trọng hơn khi Lực lượng Phòng vệ Israel xác nhận các cuộc tấn công bằng tên lửa, gây ra sự sụt giảm thêm xuống còn 61.000 đô la và cuối cùng, Bitcoin đã giảm ngay trên mốc quan trọng 60.000 đô la. Sự sụt giảm này đã xóa sổ gần như toàn bộ mức tăng sau khi Cục Dự trữ Liên bang Hoa Kỳ cắt giảm lãi suất 50 điểm cơ bản vào giữa tháng 9, phản ánh sự dễ bị tổn thương của Bitcoin trong các cuộc khủng hoảng toàn cầu.
Các altcoin lớn, bao gồm SOL, AVAX, DOT và NEAR, thậm chí còn bị ảnh hưởng nặng nề hơn, giảm 5%-10%, trong khi ETH giảm 3,8% xuống chỉ còn hơn 2.500 đô la. Sự sụt giảm lan rộng này làm nổi bật tác động nghiêm trọng của các sự kiện địa chính trị lên thị trường tiền điện tử nói chung.$BTC"
