comment_id,post_id,user_id,user_name,fullname,content
1719833565489649,1719631865509819,61557410638803,,Thảo Thu,"Nên ivf để bé khoẻ mạnh mom ạ, trước đó b có bé nào chưa"
1719857212153951,1719631865509819,100083741600573,,Phượng Tuyến,"Vậy thì ivf đi mom ạ, ivf chọn n gì tốt nhất để làm nên cũng yên tâm hơn. Chúc mom sk và may mắn nhé"
1719952245477781,1719631865509819,61561897556801,,Vũ Ngọc Bích,Mom nên làm ivf đi nhé . Mom có thể tham khảo qua viện đại học y mình từng theo bác Hương bên đó thành công rồi
1720138228792516,1719631865509819,,pie.piw.54,Choco Pie,Mom hỏi bac hiến xem
1719998062139866,1719631865509819,100065535884952,,My Đỗ,"Mình thấy gr này nhiều mom kinh nghiệm lắm, mình học được nhiều lắm này, mom và gr tham khảo xem MONG CON, HIẾM MUỘN TẠI TP.HCM (TỰ NHIÊN, IUI, IVF...)"
1720304242109248,1719631865509819,61552759295289,,Thu Trang Phương Đông,"Hiện tại IVF Phương Đông đang có nhiều ưu đãi giảm sâu đó ạ, chị cần tư vấn chi tiết ib em hoặc liên hệ 0936200926 ạ"
1722395901900082,1719631865509819,100028174173619,,Huế Nguyễn,"https://www.facebook.com/groups/ivfdaihocyhanoi/?ref=share&mibextid=NSMWBT

Các mom tham gia nhóm để cùng nhau chia sẻ iui-ivf và hiếm muộn nhé."
1721185798687759,1719631865509819,100070790873040,,Vũ Duyên,Mom cứ ăn uống bồi bổ thêm bổ trứng từ ăn uống cho đến thuốc thang rồi lm ivf nếu đang góp tiền lm ivf thì canh trứng thả tự nhiên hàng tháng xem . Mình theo bổ trứng bs kê vs có dùng thêm bổ trứng thảo dược chỗ nt Dương Thị Hiến ✅ này xem trộm vía lắm
1722429401896732,1719631865509819,,phongthao2228,Thao Le,"Bồi bổ trứng thật tốt khi làm IVF để tạo phôi khỏe hơn, các Mom dùng thêm các thuốc bổ trứng và ngũ cốc nội tiết. Nhà mình chuyên dòng ngũ cốc nội tiết và muối ngâm chân. Các Mom vào cửa hàng tham khảo ạ shopee.vn/thaole_meemtin"
1719884398817899,1719631865509819,,bautroitucach.sky,Khê Minh,mình tiền sử lưu 2 lần. Theo bs thu trang làm ivf viện đại học y HN đã có bé thành công. Mom muốn hỏi gì có thể inb mình nhé
1723105958495743,1719631865509819,,Dat4628k,Hà Thu Trần,"cứ theo bs thôi nên làm IVF sàng lọc , đợt mình đi khám bác sĩ dặn nên bồi bổ cho tốt trước khi làm IVF . bạn tham khảo thêm TRÀ CỦ GAI mua bên An Thái Phương ý , trà này uống bổ trứng - ổn định nội tiết và niêm mạc giúp tăng tỷ lệ đậu thai dc. mình trước khi làm IVF uống TRÀ CỦ GAI + thuốc bs kê kết hợp , thấy tốt lắm, các chỉ số cải thiện hơn nên lần đầu cp đậu luôn nè"
1720528192086853,1719631865509819,61559589027134,,Hạ Thương,"Bạn nào khó có con, mong con mau đến với mình, mong IVF thành công, mong con khỏe mạnh trong suốt thời gian thai kỳ, mong bé Trai, hoặc Gái..
Hữu duyên nhắn tin qua cho Chị, chị chia sẻ cho Các bạn ""Bài khấn Cầu Con"" xin lên Mẹ Bồ Tát Quan Âm đúng cách để được linh ứng ( Bài khấn Hoàn toàn M.i.ễ n phí - Chị làm vì muốn tích phước mà thôi ). Rồi sau đó các bạn TỰ KHẤN XIN ở nhà. 🙏"
1720530988753240,1719631865509819,61560550025038,,Xuân Xanh Dương,Mom nên làm ivf á mom. Trước khi làm mom nên bồi bổ cơ thể đã r hẳn làm nha. Mom vào gr này để tham khảo thực đơn tẩm bổ với quy trình ivf của các mom ivf thành công có bé này Hội IUI - IVF Sinh Con Theo Ý Muốn
1720482002091472,1719631865509819,61560560968401,,Đặng Tố Quyên,"Nên làm ivf mom ạ, để tự nhiên có nguy cơ con bệnh tật tội con lắm. Làm ivf lọc rửa tìm phôi tốt ko mang gen bệnh sẽ tốt hơn nhé. Mom vào gr này các mẹ chia sẻ kn ivf cho nè Hội mong con - Hiếm muộn (IUI - IVF)"
1720191248787214,1719631865509819,61561387002290,,Duy Đinh,mom nào cần người đổi mẫu tt ở viện ib em nhee mẫu bao đạt ạ
