comment_id,post_id,user_id,user_name,fullname,content
2364800250662465,2364768623998961,,vuong.zuki,Vương,chớp mắt cái ml nhà tui đã 5 tủi 🤣 ảnh chụp hôm sinh nhật 5 tủi của con tui ạ 🥰
2364778410664649,2364768623998961,,pham.h.anh.9400,Phạm Huyền Anh,Dậy thì dễ sợ zậy trời
2364777737331383,2364768623998961,,embesy.29,Dang Thanh Tuyen,bé xíu dọ cưng điên
2364818877327269,2364768623998961,100049305470758,,Nguyễn Thùy Linh,"E ké một tí ạ, e muốn gả bé golden này ạ"
2364778727331284,2364768623998961,,btuyet2408,Bùi Tuyết,"Đem về từ lúc nhỏ vừa về đã báo ốm đau bị nấm xong bị áp xe này nọ, thế mà đã 3 tháng rồi đó"
2364852173990606,2364768623998961,100007011918864,,Thanh Trúc Bùi Dương,Ngô Tâm
