comment_id,post_id,user_id,user_name,fullname,content
8126054704143406,8118042034944673,,vananh.shibi,Vân Anh ShiBi,"Đầu tiên em nên xác định được cho chị da của em thuộc loại nào Vì nếu không em sẽ không bao giờ tìm được cho mình sản phẩm chăm sóc da phù hợp mà em chỉ đang phí tiền mà khả năng dị ứng là khá cao. Và da bị mụn thì có rất nhiều nguyên nhân thường là do làm sạch da không kỹ hoặc là do sản phẩm skincare chứa chất dưỡng nhiều hoặc là do ăn nhiều dầu mỡ, cay nóng cũng có thể là do rối loạn nội tiết, căng thẳng, thức khuya.. Em nên xác định lại cho chị nguyên nhân là gì và khắc phục những nguyên nhân đó thì em đã góp phần điều trị mụn được 50% rồi. Tiếp theo nữa , em nên tối giản skincare chỉ sd những sp như srm dịu nhẹ, ko bọt ko hương để giúp kiểm soát dầu, xịt khoáng, dưỡng ẩm cấp nước, serum phục hồi, tẩy trang, trị mụn chứa azelaic acid kết hợp retinol dạng thấp, chấm mụn kháng sinh để đẩy và gom khô nhân mụn, che chắn kĩ và dùng kem cn( chọn loại ko làm bí tắc lcl) khi ra ngoài
.Ngoài ra, em nên tránh thức khuya, stress, ăn những thức ăn chứa nhiều đường, dầu mỡ ,cay nóng, socola ,cà phê ,trà sữa, thức ăn njhanh.Tăng cường rau xanh, uống trên 2l nước mỗi ngày.
Nếu chưa rành thay vì loay hoay tự tìm sp thì em nên chọn mua sp ở nơi có chuyên môn để được theo dõi, điều trị và hỗ trợ đổi trả để ko mất tiền oan mà hiệu quả cao. Chúc em sớm có làn da đẹp"
8126330540782489,8118042034944673,100081814004857,,Nguyễn Điền,mình dùng xà phòng hyakkaso đi bảo đảm mê luôn
8126001317482078,8118042034944673,,hoatit1990,Phạm Hà My,Thêm tây trang bôi mụn ẩn vào nhe
