comment_id,post_id,user_id,user_name,fullname,content
1685672165566375,1685625542237704,,Lucnaotocungbuon,Lê Thiên Nguyệt Hạo,"em ké con samsung s9 ( như mới, phẩy tí ) 2tr ạ"
1685687728898152,1685625542237704,,ntuan112,Nguyen Tuan Anh,"👉👈 ké, tìm note 12 turbo, iqoo z9, note 13 cũ ạ"
1685810342219224,1685625542237704,,hgsan1996,Hoàng San,Huawei nova2i pin mới 1tr2
1685670688899856,1685625542237704,,datvoggdn,Đạt Gaming,Lê Thiên Nguyệt Hạo
1685676925565899,1685625542237704,,khoa301290,Trường Khoa,Nam Nguyễn
1685673638899561,1685625542237704,100010290732134,,Phaolô Nguyễn Quyết Thắng,Sky Dũng
