post_id,user_id,user_name,fullname,content
1708721773261414,,quangzi254,Quang Zi,"Tình hình là em lượn 1 vòng trên mạng tìm ghế thì toàn thấy Seeder với Shop dìm sản phẩm người khác và nâng đồ mình bán lên nên mệt mỏi quá. 
Chắc trong gr mình k có seeder đâu nên nhờ các bác tư vấn giúp em 1 con ghế ok trong khoảng giá dưới 4m giúp em, nhà ở ngoại thành nên ko có showroom nào gần để ra test cả
PS: E cao 1m75, 64kg
Phân tích 1 số con nổi hiện tại ko biết thực hư ntn

Lumbar 03: Nhựa ọp ẹp, phần đỡ lưng nhìn thì hay chứ chả chỉnh được mấy, lưới nhanh trùng

Manson Vera: Đỡ lưng cứng, mâm ghế quá to so với người vn nên ngồi bị cạ vào đùi đau, đây cũng là con thuê nhiều tiktoker với reviewer vào nâng bi, seeder nhiều nhất
- Iris: Thấy phần nối lưng với mâm làm bằng nhựa mà giá còn cao hơn vera, điều chỉnh các thứ cũng kém hơn

HPW Airy: Khớp kê tay, đầu dễ trật phải chỉnh lại liên tục, tựa lưng hoàn toàn bằng nhựa nhô lên nên bị đau khi dựa vào (Review e đọc đc của bác chỉ cái này e thấy công tâm nhất và k giống seeder)

Sihoo: Đã ra mắt lâu nhưng ko update mà giá vẫn chat nên nói thẳng ra là bị Overprice so với những gì nó mang lại.

Epione FortisChair với gtchair lý do tương tự Sihoo

Bác nào đang ưng ý hay từng có trải nghiệm ưng ý với con nào cho em xin cái tên để cải thiện cột sống của em với, con ghế văn phòng 600k 2 năm tuổi của em bị lệch hẳn sang 1 bên giờ ngồi muốn gãy lưng mấy hôm nay rồi
#thaoluan #tuvan"
