comment_id,post_id,user_id,user_name,fullname,content
1746176156188723,1746174162855589,61559533331313,,Nguyen Thanh,Nv ok rui . N 12 scp xn mà Len beta cao tren 500 thì yên tâm
1746184029521269,1746174162855589,100093373841327,,Quỳnh Hạnh,"Cm mom, e xin vía beta cao vút"
1746184246187914,1746174162855589,100093041860278,,Ứng Châu,"thành tâm xin vía mom beta cao vút ạ ,chúc mom thành cocong đón con yêu ja"
1746181156188223,1746174162855589,100093359202003,,Phan Ngọc Kim,"Ổn nha chị, chúc mừng chị nhé"
1746188556187483,1746174162855589,100093400237966,,Chử Uyên Hải,"E xin vía 2v, beta cao vút ạ"
1746181639521508,1746174162855589,100093056183707,,Thy Khuê,Xin vía beta cao vút của mom!
1746177076188631,1746174162855589,100093247578069,,Ngà Vòng Khuê,Chúc mom beta cao vút con vào tổ an toàn. M thành tâm xin vía ạ
