comment_id,post_id,user_id,user_name,fullname,content
2048702282229064,2048380312261261,100074222080430,,Lưu Hạ Vi,"nó doạ thế thôi vì kiện thì sẽ phải tiến hành điều tra phía nó nữa, lúc đó lại lòi ra bao nhiêu sai phạm :)))"
2048694622229830,2048380312261261,,TranLong021988,Trần Long,"Phốt ẩn danh, ko nói tên cty, ko chỉ đích danh cá nhân mà dùng tên viết tắt"
2048680618897897,2048380312261261,,adachjkidymu,Lê Thanh Tùng,Dthome ak e
2048697018896257,2048380312261261,,bacvv,Bắc Vũ,Đêm qua tôi chiêm bao giống bà Phương Hằng nhé
2048759298890029,2048380312261261,100084691192165,,Ánh Tiên,"Học tiếng Anh bên thầy này siêu đỉnh, giáo viên có tâm, phương pháp khoa học hiệu quả. Bạn nào mất căn bản, muốn cải thiện kĩ năng giao tiếp, tiếng Anh học thuật IELTS, TOIEC tham khảo bên thầy này thử"
2048864205546205,2048380312261261,,jamiewhatttf,James Watt,Người đi làm muốn học TA Thương mại để tăng cơ hội việc làm; thăng tiến; lên lương; phát triển bản thân thì nhắn mình. Chỉ 150k/b. Số zalo: 0988601161.
