post_id,user_id,user_name,fullname,content
8474220162698544,,,,"Nhắc tới #meme  thì anh em đừng quên #BRC20
Để kiếm thu nhập cho Miner thì việc đẩy BRC-20 và Incrisption là không thể thiếu.
2 con $SATS và $RATS đều có fan Trung rất đông, miner Trung cũng đông nhất.
Sau $SATS thì $RATS là con mà tôi cho là khả năng list #Binance spot cao nhất vì hiện tại đã có Perp rồi.
$RATS cũng là con đã list, fomo và xả ngay trước thềm halving.
Từ đấy đến nay sideway biên rộng cũng 6 tháng, chạy theo vòng cung này không trượt phát nào.
Tích lũy như vầy cũng gọi là đủ lâu và mạnh rồi, anh em có thể vào hàng luôn, sau khi $BTC phá đỉnh thì sẽ tới lượt trend Runes và BRC-20."
