comment_id,post_id,user_id,user_name,fullname,content
1889123048283483,1889019601627161,100088555466291,,Nguyen Thang,chuyện có thật ko vậy? nếu thật thì hóa ra chính quyền ko bảo vệ đc ng lao động? chính quyền hoàn toàn có thể dập cty đấy phát một luôn
1889122434950211,1889019601627161,100061005900122,,Quốc Hưng,"Nhiều khi phải phông bạt thế để ngta còn tưởng cty vẫn ngon nghẻ thì mới có khách đó bn :)). Thuận mua vừa bán, không hợp thì nghỉ thôi"
1889115651617556,1889019601627161,100002895891799,,Dzung Dzing,"Đầy b ạ. Cty cũ mình sếp bảo các e làm đi a tăng thu nhập. Làm xog a bảo làm thêm exp thôi. Cty khó khăn lắm. Nhưng năm ngoái a xây biệt thự. Năm nay a đổi volvo, lại còn nuôi em ktoan nữa thì 🤣"
1889115231617598,1889019601627161,,,Thành viên ẩn danh 127,Mạnh dạn tìm chỗ mới 🙂
1889112778284510,1889019601627161,100043040201854,,Bim Bim,Thuận mua vừa bán. Giờ nhân viên không thay đổi được tư duy và cách suy nghĩ thì rất hay bị thiệt. Mạnh mẽ từ bỏ kiếm cái tốt hơn
1889111228284665,1889019601627161,,leeminhtrong,Lý Trọng,Nghỉ việc đi e. Cho cái tên nó lên đây luôn đi.
1889109964951458,1889019601627161,61553350535296,,Tôn Tử,Nợ lương nghỉ việc
