comment_id,post_id,user_id,user_name,fullname,content
1801741773689108,1800829050447047,,banmai.anh.9674,Linh Eva,Cần hướng dẫn chỉnh sửa routine phù hợp nhắn mình nha
1801800367016582,1800829050447047,100094529220725,,Nguyễn Ngân,"Gửi ảnh qua cho bác CEO Vicky Thuận để bác tư vấn kỹ càng hơn cho mình nè chị , bên bác có tay nghề lâu năm, điều trị lại mát tay nên da trộm vía vô cùng, giá cả lại hợp túi tiền"
1801715460358406,1800829050447047,,yenpham2609,Phạm Yến,"- Peel Qua một lượt để hấp thu dưỡng chất tốt
- Dùng Aha Bạt sừng sạch sâu
- Dùng Tre , thêm hoat chất trắng sáng da tranx, iluma, vital C nhé"
1801779697018649,1800829050447047,100092658605859,,Minh Ty,"bên này Viện Thẩm Mỹ Royal điều trị chuyên sâu về mụn hiệu quả lắm lại có cả bảo hành , trước mình điều trị ở đây rồi giờ sạch mụn da đẹp lắm luôn ấy"
1801733603689925,1800829050447047,100080718859914,,Tôn Ngộ Không,"chị dùng thêm toner này nha, bảng thành phần siu đẹp https://s.shopee.vn/6KkjeUqM9K"
1801737647022854,1800829050447047,,tiep.my.18,Bảo Thy,Mách bạn quaViện Thẩm Mỹ Royal mình cũng điều trị bên này thấy khỏi 1 năm rồi… giá cả phải chăng nữa nè bạn ơi
