comment_id,post_id,user_id,user_name,fullname,content
2365442543931569,2365180510624439,,yuu.nguyen.370,Tuyết Nga,"bé nhà mình khi nhỏ ăn đủ 3 cữ/ngày, tới tầm hơn 1 tuổi thì bé phát triển quá nên mình cho ăn 2 cữ/ngày (1 cữ hạt, 1 cữ pate). Hiện h 3 tuổi đã hơn 7kg rồi"
2365420150600475,2365180510624439,,phamthithuy.duong.19,Phạm Thị Thuỳ Dương.,Cho ăn thịt và vitamin vào
2365430003932823,2365180510624439,,nguyen.koko.5,Nguyễn Diệu Linh,"Có nha, vậy là đủ"
2365440817265075,2365180510624439,61565073140615,,Tiệm Thú Cưng LaKatz,"Được nha, nhưng mỗi bữa ăn bạn cho ăn vừa đủ thôi nha, đừng cho nhiều quá. Nếu ăn ngày 3 cử pate rồi thì hạt cắt lại bớt, đổ vừa đủ thoai"
2365454260597064,2365180510624439,,NguyenTanHai.1996,Nguyễn Tấn Hải,Hỏi làm gì chủ thấy đủ là nó đủ
