comment_id,post_id,user_id,user_name,fullname,content
8470483306405563,8470275926426301,100008886938918,,Minh Đức,Thôi trc cũng nhiều bài nhie này nó lại làm cho 1 gậy chả có phân tích gì ở đây cả biết trc đã giàu rồi ae :v
8470520053068555,8470275926426301,,thinh.conan,Tyler Jr Kingvul,Ok ae sọt căng thôi
8470438359743391,8470275926426301,,lehuywechat1245,Trần Lê Huy,Short dc rồi :))
8470452166408677,8470275926426301,,mung.thuocveem,Margin La,"Vẫn lạc quan quá , từ h đến t2 tuần sau kiểu gì cũng có 1 gậy về 5x"
8470875269699700,8470275926426301,100024182871737,,Hải Thành,Chiến tranh tới nơi cụ đi về đất mẹ chiến mới hoà bình
