comment_id,post_id,user_id,user_name,fullname,content
1722482348558104,1718559165617089,61558522764970,,Fe Pi,Em thành tâm xin vía ạ
1718586675614338,1718559165617089,100093064346956,,Nghi Phương,"Em xin vía ạ , scp mấy ngày thử dc ạ 😛"
1718587955614210,1718559165617089,100093041860278,,Ứng Châu,Chúc mừng m. Thành tâm xin vía m ak. M cp ngày 5 loại mấy đây m
1718701742269498,1718559165617089,100035613630324,,Phạm Duy Bách,"Chúc mừng mom, mình thành tâm xin vía 2 vạch đỏ chót beta cao vút ạ"
1718594135613592,1718559165617089,61559533331313,,Nguyen Thanh,"Chúc mừng m 🌹
Thành tâm xin vía 2vạch bỏ bụng tháng này ạ ❤️"
1719068262232846,1718559165617089,100084184585370,,Hoài Thương,"Bạn nào khó có con, mong con mau đến với mình, mong IVF thành công, mong con khỏe mạnh trong suốt thời gian thai kỳ, mong bé Trai, hoặc Gái..

Hữu duyên nhắn tin qua cho Chị, chị chia sẻ cho Các bạn ""Bài khấn Cầu Con"" xin lên Mẹ Bồ Tát Quan Âm đúng cách để được linh ứng ( Bài khấn Hoàn toàn M.i.ễ n phí - Chị làm vì muốn tích phước mà thôi ). Rồi sau đó các bạn TỰ KHẤN XIN ở nhà. 🙏"
1718600418946297,1718559165617089,100093400237966,,Chử Uyên Hải,"Chúc mừng mom , thành tâm xin vía 2 vạch bỏ bụng nha ❤️❤️❤️❤️"
1718589775614028,1718559165617089,100093373841327,,Quỳnh Hạnh,Xin vía bầu của mom bỏ bụng tháng này ạ 🥰
1718591192280553,1718559165617089,100093056183707,,Thy Khuê,Ve e như vậy có k mom .ngày thứ3 e trể kinh e thử lên vạch bửa sao e lại ra máu như có kinh mà ít hơn kinh bình thường
