post_id,user_id,user_name,fullname,content
1028260830987377,,ivandong.kl,Khổng Lung,"DU HỌC SINH VIỆT NAM ÚC BỊ BẮT DO TRỘM CẮP TÚI XÁCH CỦA LUXURY DESIGNER BRANDS (Dior, Loewe, Celine, Gucci,...)
Thứ Sáu, ngày 7/8/2020 (10:30pm), một du học sinh quốc tịch Việt Nam 25 tuổi đã bị bắt với tội danh trộm cắp tài sản của hàng loạt thương hiệu thời trang lớn.
Cảnh sát đã lục soát nhà riêng và thu giữ hàng loạt túi xách của những thương hiệu lớn như Dior, Loewe, Celine, Gucci... với tổng giá trị hơn $50,000 AUD (tương đương hơn 820 triệu VND).
Đơn vị Điều tra Tội phạm Thành phố Sydney cho biết, người này đã lấy cắp 3 chiếc túi xách từ một department store vào ngày 31/7/2020 với tổng giá trị là $11,000 (tương đương 180 triệu VND). Ngoài ra, nhiều trung tâm mua sắm tại Sydney và Melbourne cũng đã báo cáo về hành vi của du học sinh này.
Hơn nữa, đối tượng này sau khi lấy trộm nhiều túi xách thương hiệu đắt đỏ đã đăng lên Instagram và Facebook cho rằng bản thân được các nhãn hàng gửi tặng.
Cập nhật vào ngày 8/8/2020 cho biết, toà án Parramatta tại Sydney đã từ tối cho bảo lãnh tội danh này.
Hiện tại B.T đã khoá 2 tài khoản mạng xã hội Instagram và Facebook. (Mặc dù mình đã cố che tên 😔).
Nguồn: NSW Police Force (Ghi nguồn cả người dịch giúp mình nhé 😀, ghi Khổng Lung á 😀)"
