comment_id,post_id,user_id,user_name,fullname,content
8128576780573390,8115717885192613,100091464563093,,Phước Skincare,"Bôi sản phẩm dưỡng sáng da mờ thâm nám vào nhé
- Tranexamic, Arbutin, Kojic acid , Vitamin C, Niacinamide, Glutathion..
Ví dụ : Skafix TX + Vitamin C serum His to lab c nha"
8128545897243145,8115717885192613,,trangto97,Trang Tồ,Abutin+ vitamin c là nhanh hồi da và sáng da nhất nha b
8133061503458251,8115717885192613,,thuylinh.ha.5205622,Thùy Linh,Olay 7 in 1 bản uk nha
8128950517202683,8115717885192613,,conme.hoa.16,Lê Nga,Mình bị nám da ko đều màu có loại nào bôi ổn ko. Mình đang uống c voies e
8128769073887494,8115717885192613,,bsdoanhoangkhang,Hoàng Khang,Món đầu tiên và chắc chắn phải có là kem chống nắng nha e
8128761263888275,8115717885192613,100083230755341,,Nguyễn Hoa Dược Sỹ,Che kĩ chống nắng thêm sáng da
8131747613589640,8115717885192613,100092442021029,,Bông Skincare,"Trước tiên muốn sáng da e cần kcn kĩ
Thêm aha và các hoạt chất làm sáng da như Tranexamic arbutin vtm c Niacnamai nha e
Cấp ẩm phục hồi kèm theo nha"
8128537557243979,8115717885192613,100008577365437,,Thanh Quân,.
