post_id,user_id,user_name,fullname,content
1905690446626743,,,,"Em con gái tốt nghiệp ngành Hệ thống thông tin quản lý, không cạnh tranh nổi trong thị trường ngành IT, do tính chậm chạp, khó thích nghi môi trường mới của mình.
Tính em thích ổn định, làm việc theo quy trình rõ ràng, hay bị lo lắng thái quá khi điều gì đó thay đổi trong cuộc sống.
Việc em quen làm nhất là bán hàng tạp hóa, do nhà em có cửa hàng đã truyền qua đời bà và mẹ, vì quá stress công việc nên em đã về quê phụ mẹ bán hàng gần 1 năm nay dù sắp 25 tuổi. Nhà em tiệm ở trong chợ nên lượng khách đông và quen nhiều.
Mọi người thấy em có nên kế nghiệp mẹ từ giờ để mẹ về hưu sớm sau khi các em học xong, có thể lấy chồng sau 3, 4 năm và quyết định làm luôn ở quê từ tuổi 25.
Hay em đi học tiếng trung để xin vô khu công nghiệp làm nhân viên văn phòng, liệu họ có tuyển người không có nhiều kinh nghiệm, em ở Đồng Nai ạ."
