comment_id,post_id,user_id,user_name,fullname,content
2383498858792604,2383329465476210,,petpaulofficial,PET PAUL,hết hồn hà
2383869885422168,2383329465476210,,dinhhongngoc1612,Đinh Hồng Ngọc,Linh Đinh tà tưa ko
2383457818796708,2383329465476210,,nhutinh.dang,Đặng Như Tình,Ship 1 ly trà sữa như hình nhoa shop kkk 😂
2383334688809021,2383329465476210,,vit.con.1042032,Bùi Dung,"Bà bẩu ck bà mua cho
Thuỳ Trang"
2383379808804509,2383329465476210,,thanh.phuong.50767984,Thanh Phương,Ko có ly ts nào nhìn cọc như này cạ 😌
2383816518760838,2383329465476210,,nguyenngoc2401youarehero,Nguyễn Bích Ngọc,thôi béo?
2383514742124349,2383329465476210,100081531952264,,Nguyen Toan,Trịnh Lê Mỹ Kim muốn uống Meo tea🤭
2383347985474358,2383329465476210,,mytien961998,Tiên Mỹ Mỹ,Với ánh mắt phán xét như này ko thể nào là thú bông được
2383345172141306,2383329465476210,,AN.VP11108,An Võ,Mới đầu nhìn qua còn tưởng thú bông hình mèo :))))
