comment_id,post_id,user_id,user_name,fullname,content
1754770028662669,1754766548663017,61561083696515,,よう ふぉ,Mình 20.9 chưa test mai mới đi
1754776115328727,1754766548663017,100093373841327,,Quỳnh Hạnh,Mom chuyển mấy phôi vậy?
1754781585328180,1754766548663017,100093359202003,,Phan Ngọc Kim,"em cx cp ngày 21 mà chưa dám thử hix , xin vía mom nhiều nhiều ạ"
1754779828661689,1754766548663017,100093056183707,,Thy Khuê,thành tâm xin vía của mom
1754779785328360,1754766548663017,100093056183707,,Thy Khuê,"mom lm ở đâu v ạ ,em xin đc vs ạ"
1754773018662370,1754766548663017,100093400237966,,Chử Uyên Hải,"Cị ơi. Từ khi cị canh nm đến cp khoảng bn lâu ạ.
E canh theo đơn thuốc ạ"
1754771851995820,1754766548663017,100092712295264,,Ngọc Bình,"Chúc mừng mom nhé, kết quả như này là đậu rồi, mình ngày 7 scp beta cũng đc 61, đến ngày 10 lên 411, mom đợi ngày 10 test lại xem tăng ổn k nhé"
1754768955329443,1754766548663017,100092987539340,,Bình Thi,"Chúc mom beta cao vút, con vào tổ an toàn! Xin vía mom ạ!"
1754775078662164,1754766548663017,100093041860278,,Ứng Châu,E xin vía 2 vạch bỏ bụng ah
