comment_id,post_id,user_id,user_name,fullname,content
2090650804748369,2090646244748825,,Tranbatruong1997,Trần Bá Trường,Đm sao ông ck có gu mặn vô cùng tận zậy 🫣🫠🫠🫣🫠
2090650144748435,2090646244748825,,g.minhon,Hương Giang Nguyễn,Đm giống Mr.Bean vậy 🤣
2090724678074315,2090646244748825,,tricong.vo,Võ Trí Công,Gu lạ he
2090653331414783,2090646244748825,,hien1891,Thu Hiền,Nhìn như thằng đàn ông đội tóc giả ý
2090735178073265,2090646244748825,,minhhang.vu.52056,Minh Hang Vu,Xấu người xấu cả nết bay ơi 🥹🥹🥹🥹
2090698768076906,2090646244748825,,Zenzen.2608,Brenna Doris,Văng vẳng câu của Công Ken
