post_id,user_id,user_name,fullname,content
1781839415893177,,,,"NHÂN VIÊN #KATINAT_ĐỘI_CẤN CÓ THẬT SỰ GIAN DỐI????
E rất hay đặt trên app mà đúng trải nghiệm lần này k khác gì mua bực vào người
Chả là chiều nay e có đặt 2 cốc chôm chôm + 3 topping tc phô mai, nhưng nhận vội nên e cầm luôn và về thì k thấy tc như đã đặt.
E có gọi ship và báo lại ship báo quán đã gọi và e đồng ý rồi 😂😂
Đến khúc này mới thấy lươn lẹo này.. k biết vđề ở nv hay ship mà e k hề nhận đc cuộc gọi nào, âu cũng là do mình k ktra kỹ, vào đánh giá 1* thì thấy hàng loạt đánh giá 1* cũng thiếu đồ như mình
Thôi ngậm ngùi sau cạnh nó ra 🫡🫡"
