post_id,user_id,user_name,fullname,content
8449558925164668,,Thanhnamflashtrading,Nguyễn Thành Nam,"Thị trường đã thực sự Uptrend hay chưa ?

Sau nhịp tăng khá tốt từ 62k5 lên 66k ngày hôm qua , thị trường đang có dấu hiệu bullish trở lại. 

Chỉ số sợ hãi và tham lam đang quay trở lại mức 56 sau 1 thời gian dài giao động dưới 50

Altcoin cũng có cho mình được nhịp hồi khá tốt , đặc biệt là đám meme coin mới như TURBO , MEME , BOME . Ngoài ra một số đồng coin mới nhưng FDV cao sau một thời gian dài chỉ cắm đầu và đi ngang cũng chứng kiến sự hồi phục mạnh mẽ ví dụ như SAGA , ENA.

Có vẻ như rất nhiều người đang hi vọng BTC phá lên trên 70k hoặc thậm chí tạo ATH thì mình vẫn giữ quan điểm trung hạn trước đó rằng BTC có thể có thêm 1 nhịp giảm tiếp theo.

Cho dù thị trường có đi như thế nào đi chăng nữa thì mình vẫn cho rằng mùa uptrend đã ngay trước mặt và anh em nào đã cầm được coin trước đó thì hãy cố gắng giữ thật chặt để chờ đợi thành quả. Còn mình thì short nhẹ chờ vào hàng thêm sau đây "
