comment_id,post_id,user_id,user_name,fullname,content
8173460869386255,8170283853037290,100060080198040,,Lan Hoàng,Chắc tuỳ khẩu vị đó bạn.Hôm trước đi ngang tớ có thử. Trân châu olong ở đây ngon hơn so với mấy chỗ khác
8173364819395860,8170283853037290,,nttienn003,Minh Đạt,Sao tớ cũng order uống hai cốc ols trân châu trà vs cốc kim quất trà ngon sữa béo thơm mà hay do tuỳ khẩu vị 😅
8173413016057707,8170283853037290,,vanvovan,Bùi Thanh Vân,Uống 1 lần rồi thôi 😌 hôm tui mua còn bị làm sai order
8173861136012895,8170283853037290,100013279780839,,Minhh Phương,"Uống thử trà sữa thấy cũng tạm,ngon ở cái trân châu trà,nhưng với 1 quán mới như thế mà để tầm 37k 1 cốc size M,đắt hơn Nooshan,Laboong mà lại không chất bằng
Tuy nhiên thì mỗi người 1 khẩu vị thôi,chứ đồ ăn ai lại ""ói ẻ""😢
Cái trend nước lê hot hòn họt toàn đường hóa học mà còn chả thấy ai chê bằng mấy từ ngữ như thế"
8173286839403658,8170283853037290,,mtrang16,Minh Trang Tran,công nhận thấy chạy quảng cáo gần nhà ra mua thử mà hai cốc đều dở
