comment_id,post_id,user_id,user_name,fullname,content
8428843353880063,8423489844415414,100092442021029,,Bông Skincare,"Da có mụn ẩn cư mụn viêm
E thêm lọ chấm mụn viêm nha e
Bha tẩy tế bào chết
Adapalen trị mụn kèm phục hồi b5 kem dưỡng ẩm mỏng nhẹ nhé
Mụn gom e đi lấy nhân mụn định kì là OK
Hạn chế thức khuya ăn đồ cay nóng nha"
8428524000578665,8423489844415414,61556814346507,,Nguyễn Thảo,Da này nên xài tre kèm aha/bha nhé
8426724540758611,8423489844415414,,weiyiLiuu,Weyi Liu,"Da Nam sày sừng bít tắc, nhắn c kê lại routine nhé k lại rỗ hết"
