comment_id,post_id,user_id,user_name,fullname,content
6971046899659723,6967901213307625,,thi.hoai.568089,Hoài Thi,Chăm sài kem body vào chắc oki đó bạn
6978715248892888,6967901213307625,,thanglong.hatgiong,Bác Sĩ Đạt,Cái này cần dưỡng và cấp ẩm cho da.
6973640762733670,6967901213307625,,nguyen.trang.mons.ken.58,Mon's Ken,Sài kem body có dưỡng thể và dầu oli vừa trắg vừa cấp ẩm
6971124546318625,6967901213307625,100091635425417,,Dung Nguyen,Dùng body oil á bạn
6972168376214242,6967901213307625,100081756101735,,Hà T.Thu Nguyễn,Xài dưỡng thể là sẽ cải thiện á bạn
6973897936041286,6967901213307625,61553707750118,,Trương Ngọc Khánh Châu,Em cũng đang bị tình trạng giống vậy
8085206678243734,6967901213307625,100006767582101,,Thảo Lê,Xài body oil đi bạn
