comment_id,post_id,user_id,user_name,fullname,content
1724743191659272,1724615908338667,,ngoc.tam.90,Ngọc Tâm,máy đang xài tốt. đừng động chạm vào
1724757611657830,1724615908338667,,xuanhieu34722,Phan Xuân Hiếu,rớt hay sao vban
1724753128324945,1724615908338667,,lizziekute9x,Hung Nguyen,Để nguyên dùng tiếp 😂
1724758284991096,1724615908338667,,ruaut92,Hiep Le,Máy này là máy nào đó thím
1724746598325598,1724615908338667,,tuong.mac.9638,Phạm Doãn Hiệp,để nguyên mà dùng tiếp
1724740478326210,1724615908338667,,khi.con.927,Huy Lâm,"Mấy chỗ đó thường ko ai sửa đâu
Kệ nó đi
Hoặc lấy kẹo cao su nhét vào rồi quấn băng keo lại =))"
1724759578324300,1724615908338667,,luongkhanhhung172,Hưng Lương,để nguyên đi
