comment_id,post_id,user_id,user_name,fullname,content
7941852895912447,7940742219356848,100092442021029,,Bông Skincare,"Mụn viêm e thêm lọ chấm mụn viêm nha
Thâm đỏ Niacnamai vs azelaic trị thâm mụn nhẹ nhàng nhé
Cấp ẩm b5 kem dưỡng nha e"
7946461558784914,7940742219356848,100075322698216,,Farmacia Ghl Offical,dùng uriage cica phục hồi nhanh lắm nha bạn .
7942057959225274,7940742219356848,100083230755341,,Nguyễn Hoa Dược Sỹ,"B chup nền ds và sp đang dùng nhe
Lấy nhân xong về sẽ làm sạch da phuc hôi nhe"
7946865545411182,7940742219356848,100091524793286,,Cậu Nho Nhỏ,Mụn bạn có nhân không.Có nhân thì dùng bôi mụn cho khô còi r đi lấy nhân. Lấy nhân xong thì dùng phục hồi da sau nặn mụn là đk. Trong thời gian phục hồi thì sinkcare tối giản thôi
