comment_id,post_id,user_id,user_name,fullname,content
8131902963574105,8119419194822482,100092442021029,,Bông Skincare,"Da sạm đang trong quá trình lão hóa
Trc tiên cần kcn kĩ
Thêm rentinol chống lão hoá
Aha và các hoạt chất làm sáng da như Tranexamic arbutin Niacnamai vtmC nha e
Cấp ẩm phục hồi kèm theo nha
Hoạt chất làm sáng da như Tranexamic arbutin vtm c nè
Uống thêm glutathion vs vtmC nhé"
8128765663887835,8119419194822482,100083230755341,,Nguyễn Hoa Dược Sỹ,"E chú ý chế độ sinh hoạt nhé
Hiện tại làm sạch da câp ẩm dungg kem chống nắng che kĩ thêm sáng da tranexamic c"
