comment_id,post_id,user_id,user_name,fullname,content
1750465615759777,1750442352428770,100066271796473,,Anna Lê,là phôi ko đậu mom aj
1750465065759832,1750442352428770,100094137979673,,Trịnh Văn Vàng,là thai ko đậu bạn nha
1750464675759871,1750442352428770,100095041196705,,Phạm Khánh Tâm,là ko có mom ạ
1750464439093228,1750442352428770,100094187656980,,Huỳnh Khả Di,ko có chứ ko phải sinh hóa mom nhé
1750608102412195,1750442352428770,61560560968401,,Đặng Tố Quyên,"Là ko đậu mom ạ, còn thai sinh hoá là beta tụt dần ấy. Cố lên mom ơi, mom còn phôi ko? Mom vào gr này các mẹ chia sẻ kn cho nha Hội mong con - Hiếm muộn (IUI - IVF)"
