comment_id,post_id,user_id,user_name,fullname,content
2346817749127382,2346568532485637,,trangtrangphung.98,Phùng Huyền Trang,Bảo quản dễ ko ạ?
2346621282480362,2346568532485637,,quynh.thi.14203,Phạm Quỳnh,Này ship tỉnh được k pà
2346621265813697,2346568532485637,,Hydralancer,Anh Vũ,Có review shop này k vậy bà con
2346943249114832,2346568532485637,100082430832738,,Minh Hiếu,Có ai có thông tin về bé mèo trên tay không vậy
2346849499124207,2346568532485637,61564522945687,,Nguyen Hao,"Thức ăn giúp cải thiện sức khỏe răng miệng và hơi thở cho thú cưng
👉🏻 Mua ngay : https://shopee.vn/supreme_petfood"
