comment_id,post_id,user_id,user_name,fullname,content
2356871314788692,2356645258144631,,tuanphuong122,Phương Thanh,Cần tuyển ny nhé 🌝🌝🌝 ưu tiên các bé cam
2356786584797165,2356645258144631,,thuyduong.nguyenhoang.961,Minh Hưng,Bé ba làm.người iêu amh nhé
2356934138115743,2356645258144631,,KingNHK99,HK Nguyễn,E còn mẫu giáu quá a à ơi đợi e lớn đã hihi
2356850541457436,2356645258144631,,trang.tay.731,Trang Tày,Anh còn trym koo
2356786921463798,2356645258144631,,thuyduong.nguyenhoang.961,Minh Hưng,Đẹp troai nhỉ
2356934101449080,2356645258144631,,nguyenthi.minh.900,Nguyễn Thị Minh,Anh cũng mất trym rồi he he
