post_id,user_id,user_name,fullname,content
3283762498372675,,thienmanhnunhi,Thủy Thu,"#BTARVN #review #son #merzy
Chào các chị em, nhân dịp sinh nhật vừa qua được hội chị em bạn dì tặng cho nguyên 1 set son tím lịm tìm sim của Merzy xong mình xin phép được review và swatch lại cho chị e nào cần tham khảo nha ^^ Vào đề luôn cho nóng ah :*
1/ Packaging:
Vỏ hộp tím lịm tìm sim, tím hồng mộng mơ 😇 Điệu như chính mình vậy nên mình khá thích vỏ son này, các bạn mình thì cứ kêu sến nhưng này trend tím mà đúng k ah. Thỏi son thuôn dài, vừa vặn và cầm khá chắc tay.
2/ Chất son:
Son dạng kem lì, khá đặc và sệt nhưng lên môi lại siêu nhẹ mà k bị bết hay bột. Màu son lên tương đối chuẩn (cái này tùy vào sắc tố môi mỗi người hay sao ý, mình đánh màu M1 thì thấy chuẩn đỏ nâu còn bạn mình đánh thử lại thấy nâu hơn hehe)
Khả năng bám màu rất tốt - lớp tint rất chắc nha nhưng k phải dạng ngàn năm không trôi đâu. Son bám lên môi lì nhưng nhẹ nhàng thôi, ăn uống 1 lúc lâu cũng sẽ trôi nhưng để lại lớp finish tương đối đẹp mà k bị nhợt nhạt.
3/ Màu son:
Tổng công có đến 6 tông màu nhưng thiên về các màu đậm nhiều hơn, xoay quanh nâu, đỏ, cam là chính. Mấy màu này nhìn chung mình thấy khá tôn da, nếu có thời gian make up 1 tí thì xinh, còn k đánh nhẹ nhàng cũng được. Có màu M4 tone tím trend năm nay khá lạ, nhưng sẽ hợp với bạn nào da trắng mà make up trông sẽ hợp hơn các bạn da ngăm nên dù thích tone tím cũng suy nghĩ kĩ trc khi mua nha, còn lại các màu đều ổn để có thể đầu tư nè.
M1 Mahogany: màu đỏ nâu trầm có sắc đỏ nhiều hơn và base hồng nhẹ.
M2 Jane Chili: đỏ nâu có ánh nâu gạch nhiều hơn.
M3 Spice Brick: màu cam pha một chút sắc nâu.
M4 Brian Rose: màu nâu tím trầm
M5 Hey Candy: cam gạch ánh
M6 Tony Ruby: đỏ ruby
4/ Cảm nhận:
Màu mình thích nhất là M4 tùy dễ kén nhưng lại rất lạ và cá tính hihi, còn lại thì cũng khá ổn vì mấy tone đó đều dễ dùng cả.
Chất son vẫn thích như ngày nào, ngày xưa mn mê mệt V6 của merzy thì mình đoán cũng sẽ thích son lần này luôn. Màu son tương đối đẹp và dễ đánh.
Giá cũng k đắt nên hợp với các sinh viên, còn học sinh thì nên đánh màu M3, M5 sẽ dễ đánh và màu nhẹ nhàng nhất.
Trên là 1 vài review của mình, hi vọng sẽ giúp chị em có thể chọn được son xinh đánh mùa thu cho xinh nha ^^"
