comment_id,post_id,user_id,user_name,fullname,content
1873629196499535,1873534583175663,,mary.trang,TRang Tịnh Như,Thôi bạn ạ. Ko làm cty này làm cty khác chứ kiện cáo làm gì cho thêm rắc rối.giờ đi kiếm tiền ko kiếm chuyện bạn a
1873884899807298,1873534583175663,100035508013251,,Hà Linh,Tham khảo RAVEN - Nhật Ký Bị Công Ty Ép Nghỉ Việc nhé
1873876513141470,1873534583175663,,lala.liti,Thuỳ Linh Nguyễn,Off
1873813923147729,1873534583175663,100004973380250,,Huỳnh Nguyễn,"Theo mình thì ko nên lãng phí thêm thời gian vào những thứ tào lao, nhất là ông tào lao kia. Đúng ra bạn nên nêu thẳng từ lúc bị chèn ép với HR.
Nhưng nếu bạn vẫn muốn thì chỉ nên tập trung vào ông sếp chèn ép kia, vì cty ko có lỗi:
1 - Làm nhẹ lá đơn lên sở lao động/ công đoàn khiếu nại về việc bị chèn ép, sa thải nld trái pháp luật. Và xin hướng dẫn thưa kiện. Mục đích cho ông sếp bay màu.
2 - Nộp đơn lên tòa án quận - nơi đăng ký giấy phép kinh doanh của cty đó
3 - Book 1 bài báo hoặc trang FB lớn viết về việc này nhưng tập trung vào ông sếp kia. Vì cty cũng ko có lỗi gì, tránh ảnh hưởng uy tín cty họ + Bị kiện ngược.
4 - Chia sẻ link bài báo và bơm một ít tiền chạy Quảng cáo FBAds để cho tin này tung tóe trên mạng xã hội, nhiều người biết

Trường hợp sếp chính là ông chủ, nếu bạn thấy có dấu hiệu trốn thuế, bảo hiểm, lách luật,... thì làm nhẹ lá đơn lên cục Thuế, chắc chắn họ phải về thanh tra. Thiệt hại cho cty này đảm bảo ko ít đâu.

P/S: Một lần nữa mình thấy bạn nên liệt kê ra giấy 2 cột, 1 bên ghi là lợi, 1 bên ghi là hại khi làm việc này. Nếu chỉ để thỏa mãn cảm xúc thì ko nên. Vì vừa tốn thời gian, tiền bạc lại mệt mỏi thêm.
Tuy nhiên, nhờ những ng như bạn thì thị trường lao động cũng sẽ sạch sẽ hơn.
Lần sau có bị chèn kiểu vậy thì tranh thủ giữa cuộc họp nêu thẳng vấn đề, công kích cá nhân ông sếp đó với các bằng chứng thu thập được! Sau đó nộp đơn xin nghỉ việc. Làm nhẹ lá đơn song ngữ qua mail lên HR, cc thêm những người liên quan, các sếp lớn, ông tổng."
1873593723169749,1873534583175663,,lazy.buzu,Nguyễn Mạnh Dũng,Kiện đc bạn
1873595103169611,1873534583175663,61554628387141,,Dinn Din,"Bạn hoàn tất các thủ tục bàn giao, nhận đủ lương, chốt đủ bhxh, nhận quyết định nghỉ việc để lấy bhtn. Nhớ lại xem lúc kí HĐLĐ có kí cam kết bảo mật thông tin gì ko. Xem thử những gì b ghi âm có vi phạm cái đó ko nữa nha. Mắc công ngta vịn vào cái đó hại lại bạn."
1873597913169330,1873534583175663,,NangCuoiDongArsenal,Trần Tuấn Anh,Nó trả thù ntn đc?
1873749139820874,1873534583175663,,tino.uyca.3,Carolina Rosemary,Bác liên hệ admin group OFFB rồi tổng hợp đầy đủ chặt chẽ bằng chứng rồi lên bài nhé . Group ấy mem đông và khá là dữ dằn đấy
1873714049824383,1873534583175663,,duythanh.nguyen.3382,Nguyễn Duy Thành,"Kiện đi , ko sợ đâu , hoặc cho hội đó lên ttang nhât luôn. Ko bạn đưa nik sếp bạn, mình rủa hộ cho"
1873592243169897,1873534583175663,100037929874143,,Ngọc Quỳnh,"Nếu c có năng lực
Thì k sợ trả thù đâu c."
1873704186492036,1873534583175663,100068918794556,,Tất NT,Ngô Huyền Ngọc Nữ c cho em 1 bài lên đây đi c :)))
1873701613158960,1873534583175663,100074312820973,,Hồng Thảo Phạm,"Cty chuyên quỵt lương lừa đảo mọi người cẩn thận nhé địa chỉ No6c LK62 Đường B7 KĐT HIMLAM Vạn phúc, hà đông, hn"
1873698589825929,1873534583175663,100007644576180,,Cu Nam,cho xin cái tên cty với ạ để mng biết mà né
1873674353161686,1873534583175663,,mr.kool668,Edison Liu,Y trang trường hợp mình ta. Phải chăng cùng 1 sếp 1 công ty. :))))
1873672263161895,1873534583175663,,dongbighand,Bố Dương Mỡ,Ơ sợ gì nó trả thù. Cứ thế mà nghỉ chứ ở lại cũng có làm đc đâu
1873671786495276,1873534583175663,100005411109670,,Nguyễn Tú,Thời gian ấy thì nghỉ luôn từ đầu đi tìm việc mới. Giờ lại ổn định vui sống mỗi ngày r cần gì khổ thế 😍
1873667579829030,1873534583175663,,keo.bong.982,Hang Hana,Thu Trang like bác
1873665416495913,1873534583175663,,thutrang14011993,Thu Trang,"1 môi trường thật độc hại. Làm cái phốt cho mng biết đến để tránh là đc, còn đâu bỏ đi mà lấy phúc đức cho con cháu b ạ. Quả táo đến muộn là quả táo to, ko fai lo đâu b"
1873652003163921,1873534583175663,100015662443176,,Đức Minh,"Nhận lương rồi nghỉ thôi, đăng lên tên cty để mọi người tránh chứ kiện khó và lâu dài xong cũng chả có lợi j nhiều đâu"
1873651429830645,1873534583175663,,lalaland.393633,Lalaland,Bỏ đi đi xin việc chỗ khác cho đỡ mất thời gian bạn ạ
1873646143164507,1873534583175663,,binh.truong.3348,Trương Bình,"Bỏ đi, trả lương đầy đủ là dc, mình đi làm kiếm tiền ko kiếm chuyện, kiện cáo mất thời gian lắm, chỉ kiện cáo hoặc doạ kiện trừ khi họ quỵt lương mình. Còn đi làm mà ko hợp sếp lẽ ra mình té trước khi họ đuổi ấy. Ko làm chỗ này làm chỗ khác"
1873596993169422,1873534583175663,100095036374977,,Ngoc Anh,"Sếp e còn đem chuyện riêng của 1 con bé thân với e ra làm trò cười bôi nhọ với đám nhân viên lúc nó nghỉ, e không nhịn dc đốp vài câu thế là bị đì và kết quả nhận đuổi việc nè😂😂"
1873645416497913,1873534583175663,,ha.le.50115,Hà Lucky,"Sếp gì thể loại đó, mong nó sớm bị quả báo, thứ khốn kiếp"
1873637716498683,1873534583175663,100025946059582,,Park Yura,"Cho ké vs. Mình làm cho 1cty Hàn, nma toàn qli nh VN cx ăn chặn hoa hồng của mình. Cx đang thảo đơn gửi Cục HK vs Bộ LĐ TB XH và báo chí đâyyy"
1873633769832411,1873534583175663,,ke.diet.chung,Kẻ Diệt Chủng,"Đúng ra lúc đó bạn nên giả bộ đi giao hàng và khi giao hàng xong thì méc khách, đề xuất khách không mua đồ ở cty hoặc ko hợp tác vs cty luôn :)))))"
1873631509832637,1873534583175663,,inhye.lee.9889,Thư Mai,"Bắt đi giao hàng còn may đó bạn, trc ở chỗ mình còn bắt hàng ngày lau tủ locker ý, cả ngày chỉ ở đó. Thế mà anh đấy cũng không nghỉ, bgio lên làm quản lý rồi"
1873631353165986,1873534583175663,100013778954881,,Đoàn Hiếu,Thôi nó trả lương là đc r kiện lj ảnh hưởng cv sau này ra
1873629693166152,1873534583175663,,hqviet1405,Viet HQ,"Đã ko hợp từ đầu thì còn cố đấm ăn xôi để làm làm gì bạn, nghỉ ra bố chỗ khác mà kiếm tiền"
1873627649833023,1873534583175663,100073307171685,,Hoa Mộc Hương,"Nó không quỵt lương là đc, chứ làm k hợp sếp thì khó mà phát triển. Kiện cáo chả mang lại cái gì đâu, dính vào kiện tụng có khi sau ko ai dám nhận vì cũng sợ kể cả cty đàng hoàng"
1873591873169934,1873534583175663,,ntbsvia5,Long Hạo Thần,"T ko tin, đã đăng bóc phốt thì gỡ cái ẩn danh ra. Chắc chắn m đã làm gì đó thì sếp mới tư thù với m"
1873598156502639,1873534583175663,100047529406758,,Lý A Phong,Bóc phốt cty nào vậy?hay câu viu vậy?
1873596229836165,1873534583175663,,vyle200191,Lê Vy,Nhừng ng đó cty nào cũng có hết ak b.Chính mình cũng bị nè thôi chả làm được j họ đâu buông bỏ tìm cty mới thôi.
1873595579836230,1873534583175663,,fany.thinh,Phạm Quốc Thịnh,"Làm thì làm ko làm thì nghỉ, ở lại chống dối đê làm gì vậy bro?"
1873593596503095,1873534583175663,,annat.tran.9615,Tran Nguyet,Bỏ đi bạn 😁 cũng là để lòng mình không vướng bận còn hận thù là còn khổ
1873593529836435,1873534583175663,,truongluxury,Nguyễn Mạnh Trường,Ai sợ thì đi về
1873592593169862,1873534583175663,,lqchiat,Nguyễn Đình Trung,Mình nghĩ đi làm là cuộc chơi của lợi ích 2 bên. Nếu ko thỏa mãn lợi ích của 2 bên thì chia tay. Miễn nó trả đủ lương và chế độ sòng phẳng thì bạn ra đi trong êm đẹp. Còn nếu nợ lương thì hãy kiện cáo.
1873591579836630,1873534583175663,,lanh.hantuyet,Trần Mai Chi,"Sợ những người sếp đem tư thù cá nhân vào công việc, rất rất sợ 😌😌😌"
1873591563169965,1873534583175663,,ngocthu191,Nguyễn Ngọc Thu,.
