comment_id,post_id,user_id,user_name,fullname,content
1691926591607599,1690024658464459,100058796419406,,Văn Quyền,"tầm 10tr thì mình thấy dòng này khá ok đó b, cấu hình khá ổn dùng vp mượt mà với cả mỏng nhẹ dùng khá thích"
1691787378288187,1690024658464459,,hung.chu.10,Hùng Chu,Mua máy cũ đc bác nhé
1691880181612240,1690024658464459,,my.blues.3,Nguyễn Thế Đạt,làm con Thinkpad X1 gen 7 mà mỹ mãn
1691775071622751,1690024658464459,,ntuan112,Nguyen Tuan Anh,Nên dùng dell hoặc thinkpad bạn ạ
1691736761626582,1690024658464459,100049667844125,,Nấm Và Cá Xấu,Dell cho bền
