post_id,user_id,user_name,fullname,content
2018867335212559,,,,"Em là sinh viên mới ra trường và làm bên mảng cơ khí, em pv đậu được 2 cty đều ngồi văn phòng và có công việc khá tương tự nhau.
1. Cty của nước ngoài cách nhà e khoảng 12 km đoạn đường e đi làm kẹt xe có thể mất đến 45p để đến cty, môi trường làm việc chuyên nghiệp có quy trình rõ ràng, phúc lợi cho nhân viên tốt. Em deal lương 8 củ.
2. Cty VN cách nhà e khoảng 7km, làm việc trực tiếp với chủ, phúc lợi có thể ít hoặc không có, lương 8 -10 củ tùy vào năng lực sếp sẽ quyết định.
Hiện tại em đang thử việc ở cty 1 được 2 tuần và đang có ý định nghỉ để xin về cty 2 làm. Ngoài làm trên cty thì buổi tối em còn đi thêm 25km để học tiếng N và về nhà khoảng 17km nữa là những ngày đi học em có đi hơn 50km =((((
Nếu em muốn nghỉ trong thời gian thử việc thì cần viết mail hay đến gặp trực tiếp cho lịch sự ạ. Em có nên tiếp tục cố gắng ở cty 1 nữa không 🥲🥲🥲"
