comment_id,post_id,user_id,user_name,fullname,content
8191935734237494,8190032671094467,61556814346507,,Nguyễn Thảo,Nền Da yếu .e dùng spham gì v
8191911310906603,8190032671094467,100092442021029,,Bông Skincare,"Da mụn ẩn mụn viêm liti trên nền da yếu
Trc e xài sp j ko rõ nguồn gốc ko e
E da chú ý bước làm sạch da sp dịu nhẹ
Uống thêm bên trong trị mụn nha e
Kem dưỡng ẩm mỏng phục hồi ưu tiên có tp rau má nha
Hạn chế thức khuya ăn đồ cay nóng nhé"
8191926714238396,8190032671094467,100025970791883,,Phạm Thu Hoài,.
