post_id,user_id,user_name,fullname,content
1660859707840709,,,,"M&A DOANH NGHIỆP KHỦNG, GEX THU VỀ DÒNG TIỀN NGHÌN TỶ
Dự án khu công nghiệp dầu khí Long Sơn
 Quy mô: tổng diện tích 850ha, gồm Nhà máy Lọc dầu số 3 và Kho ngầm chứa xăng dầu
Tổng mức đầu tư: 1.633 tỷ đồng, trong đó: giá trị bồi thường và hỗ trợ tái định cư là 1.200 tỷ đồng.
Một số ngành nghề chính trong KCN Long Sơn – Vũng Tàu:
+ Công nghiệp lọc hóa dầu
+ Công nghiệp điện
+ Công nghiệp sản xuất vật liệu xây dựng
+ Công nghiệp luyện, cán thép, nhôm
+ Công nghiệp cơ khí, sửa chữa giàn khoan
Các ngành nghề này được khuyến khích đầu tư, bên cạnh đó với nhiều lợi thế về vị trí địa lý lẫn chính sách ưu đãi đầu tư. KCN Long Sơn hứa hẹn sẽ là miền đất hứa cho những nhà đầu tư.
Quá trình thực hiện
 KCN Long Sơn với mục tiêu tăng vốn từ 827,2 tỷ đồng lên mức 1.761,4 tỷ đồng sau nhiều lần thông qua các Đại hội đồng cổ đông thường niên 2021, 2022 và 2023 vẫn chưa được thực hiện. Sau những lần điều chỉnh, tại Đại hội đồng cổ đông thường niên 2024, công ty đã thông qua phương án mới chào bán hơn 93,4 triệu cổ phiếu PXL cho đối tác chiến lược là Công ty CP Hạ tầng GELEX với giá 10.000 đồng/cổ phiếu, dự kiến thu về hơn 934 tỷ đồng.
Số tiền này được sử dụng để tư vấn đầu tư xây dựng, đền bù giải phóng mặt bằng, hỗ trợ tái định cư, triển khai công trình tạm và các hạng mục liên quan tại dự án Khu công nghiệp Dầu khí Long Sơn. Dự kiến việc chào bán này sẽ được thực hiện trong năm 2024 - 2025.
Nếu thương vụ này diễn ra thành công, Hạ tầng GELEX sẽ tăng tỷ lệ chi phối từ 25,52% lên 65% và trở thành công ty mẹ của KCN Dầu khí Long Sơn.
Tính đến cuối quý 2/2024, Tập đoàn GELEX (GEX) nắm giữ 93,89% tỷ lệ lợi ích tại Hạ tầng GELEX, vậy GEX sẽ là người hưởng lợi gián tiếp từ dự án KCN Long Sơn."
