comment_id,post_id,user_id,user_name,fullname,content
1730149051118686,1726297734837151,,hitech.duong,Trịnh Dương,"Ko rõ, nhưng đang bị ông Elechome gì đấy combat :v 2 ông lên video đều lắm"
1729963384470586,1726297734837151,,bimm277,Huy Hoàng,Bác up tài chính lên mn tư vấn cho r đi mua thôi. Tuỳ new hay 2nd
1730169391116652,1726297734837151,,kien.3002,Phạm Kiên,Ko
1729983217801936,1726297734837151,61559854113157,,Huy Hoàng,"bác inbox e tư vấn, bao tất cả ae check test máy ạ"
1729984061135185,1726297734837151,,annh.tuan.5621,Tuấn Annh,trước khi mua máy lướt bác thử tìm hiểu qua giá máy nội địa trước xem
1730446547755603,1726297734837151,,trung.thamtuconan,Trung Đặng,Ủa ? 15tr mua dc lap new rồi mà nhỉ 🤣
