comment_id,post_id,user_id,user_name,fullname,content
7774531872644551,7768334939930911,100092442021029,,Bông Skincare,"H e thay khẩu trang
Thêm hoạt chất làm sáng da như Tranexamic vtm C Niacnamai arbutin nè e
Cấp ẩm phục hồi kèm theo nha"
7774935855937486,7768334939930911,100092570064685,,Đức Tài,"Thêm sp làm sáng như tranexamic,niacinamide, aảbutin C bha e.
Phục hồi hab5 + kem dưỡng ẩm + kcn kĩ."
7778178832279855,7768334939930911,100083230755341,,Nguyễn Hoa Dược Sỹ,Da mà dày sừng peel nhẹ đi xong dưỡng đều màu nhe
7946911062073297,7768334939930911,100091524793286,,Cậu Nho Nhỏ,Bạn dùng Niacinamide dùng tầm 3-6 tháng là thấy da đều màu đó. Kết hợp với các hoạt chất làm sáng da khác nữa là OK. Mà đã đang mụn thì k dùng sp có hoạt chất sáng da nha k thì bùng mụn đó 😅
7946403638790706,7768334939930911,100075322698216,,Farmacia Ghl Offical,bạn dùng serum nay giúp da trăng hồng nhé
7775301045900967,7768334939930911,,thanglong.hatgiong,Bác Sĩ Đạt,"Em bổ sung serum dưỡng sáng da mờ thâm sạm chứa thành phần như Tranexamic , Arbutin, Kojic acid, Niacinamide, Vitamin C, Glutathion.. chú ý em chống nắng đầy đủ và sử dụng viên uống sáng da kết hợp nhé."
