comment_id,post_id,user_id,user_name,fullname,content
1747888469350825,1747885536017785,100094187656980,,Huỳnh Khả Di,mom ko đáp ứng thuốc rồi
1747890142683991,1747885536017785,100094137979673,,Trịnh Văn Vàng,vậy là b ko đáp ứng đc thuốc rồi
1747891826017156,1747885536017785,100091543760625,,My Kinh Vân,tăng liều xem sao bạn
1747892616017077,1747885536017785,100091259637022,,Liên Lam,"đc bnh mm rồi mom ,nếu ko đạt phải hủy đó"
1747890606017278,1747885536017785,100066271796473,,Anna Lê,mom thử xin bsi kích liều cao hơn xem
1747963942676611,1747885536017785,,hp.sukha,Sukha Yoga,Mình tham khảo khóa tăng cường chất lượng trứng bên em nhé
1747933959346276,1747885536017785,,huongle.le.796,Lucky Lucky,Chị m tăng liều đạt luôn đấy
1747944819345190,1747885536017785,61560560968401,,Đặng Tố Quyên,"Thế thì ko ổn r mom, kích trứng tầm 10-12 ngày thôi mà. Mom hỏi bsi xem, có lẽ phác đồ này chx hợp vs mom r, cố bồi bổ r làm lại nhé. Mom vào gr này các mẹ chia sẻ kn cho nha Hội mong con - Hiếm muộn (IUI - IVF)"
1747889192684086,1747885536017785,100094225395264,,Kim Dung Võ,trứng đc bnh mm rồi mom
