post_id,user_id,user_name,fullname,content
938047921547879,,,,"Ở đây đã ai stress vì mụn chưa ạ😞 em thật sự stress vì nhan sắc hiện tại của bản thân, tình trạng mụn hiện nay là nổi mụn ẩn và sần 2 bên má lan xuống xương hàm và cổ.
Da em là da thường hơi thiên dầu, chỉ đổ dầu vùng chữ T nhưng ko quá nhiều. Điều em thắc mắc vùng chữ T không gặp vấn đề gì nghiêm trọng chỉ cần làm sạch để giải quyết sợi bã nhờn là da ổn định trong khi đó những vùng rìa mặt ko đổ dầu lại nổi mụn siêu nhiều, chân tóc cũng có nữa ạ😞
Từ trước lúc mới skincare cách đây 4 năm em chưa bao giờ nổi mụn ở vùng má bao giờ và da cũng không bao giờ gặp tình trạng gì quá nặng, đa số là nổi mụn ở trán nhưng giờ da lại gặp tình trạng xấu đến vậy
Em dùng routines skincare tối giản, nước tầy trang em dùng của senz mua trong siêu thị khá lành tính, srm dùng của complement vạch hồng. Em dùng bha cách 1 ngày dùng 1 lần nhưng vẫn không giảm mụn
Em mong muốn tìm được sp và hoạt chất cần thiết để da ổn định trở lại ạ😭😭em là sinh viên nên không có đk để ra spa hay phòng khám mong được mng tư vấn giúp em😢"
