post_id,user_id,user_name,fullname,content
1691304558336469,,feifeili91,Lê Phi,"#thacmac #tuvan #laptop
Chào các thím.
Nhờ các thím tư vấn giúp em 1 chiếc laptop nhu cầu văn phòng là chính. Em cần màn đẹp 15,6 inch Full HD, không quá nặng (khoảng 2,2 kg quay đầu); và có thể chơi được (chơi được Dota 2, chơi được thôi ạ, ko cần settings cao); nếu được thì build máy bền chút.
Laptop cũ Dell E6530 card rời NVS 5200M của em hiện chơi tàm tạm cũng được nhưng vừa rồi có mấy big updates thì bắt đầu tụt FPS và lúc chơi máy kêu hơi to.
Tiền thì e có khoảng 12 củ quay đầu. Em mới tìm hiểu qua thì đa phần tầm này có mấy máy chip U card on UHD hoặc phải cố tí thì có card on Iris. Dòng thì có Vivo, Acer Aspire (hình như chắc tiền này thì vô đối về cấu hình)...
Cảm ơn các thím."
