comment_id,post_id,user_id,user_name,fullname,content
8105470812883987,8100815343349534,100089459913561,,Vũ Gia Hân,Bích Nguyễn spa xin gửi Chị Em bảng giá dịch vụ mới + sử dụng máy công nghệ cao bên em ạ sdt 0343339983
8104727339625001,8100815343349534,100092442021029,,Bông Skincare,"Nám e nha e
E đang dùng sp j r
Nám e laze r về bôi thoa các hoạt chất ức chế sắc tố tránh lên lại như Tranexamic arbutin vtmC Niacnamai nha e
Thêm tretinol/ rentinol chống lão hoá
Kèm phục hồi tốt
Kcn kĩ nha"
8105653426199059,8100815343349534,100093844669447,,Thao My,Nám phải chữa sạch chân nám đi mới ổn nhá không là cứ tái đi tái lại đấy. T từng bị nám với đi chữa rồi t biết. Nếu cần cứ nhắn qua t share lại knghiem chữa cho xem sao
8106136509484084,8100815343349534,100088171574936,,Bảo Lan,"Nám đốm đó bà, mới lấm chấm đi chữa sớm cho dứt điểm chứ để lâu khó chữa tốn kém lắm"
