comment_id,post_id,user_id,user_name,fullname,content
1492587478208179,1492092541591006,100004838509097,,Linh Tinh Phạm,Ips thôi. Oled bay màu lại tốn công chế máy bàn 😂😂
1492328824900711,1492092541591006,,ttnghia.it,Trọng Nghĩa,Màn con Zenbook có hay chảy mực không ae
1492267828240144,1492092541591006,,tien.huynhquoc,Huỳnh Quốc Tiến,asus máy pc thì ok chứ lap thì next cho nhanh
1492230814910512,1492092541591006,,Ansex1609,An Vương,"nếu b có chơi game thì chốt con dell đi, zenbook hợp làm văn phòng thôi"
1492230238243903,1492092541591006,,dongshan149,Đồng Shan,"Tuỳ nhu cầu bác ạ, nếu cần quả VGA rời thì 5430 với màn IPS khá ổn, còn thích siêu mỏng và ko cần VGA rời thì Zen thôi"
1492132411587019,1492092541591006,,quynguyenduy.21202,Nguyễn Duy Quý,Dell chứ. Có quả card rời vẫn ổn hơn. Mà dell cảm giác yên tâm hơn asus ấy
1492097291590531,1492092541591006,,maihung01,Mai Hùng,có
1492094268257500,1492092541591006,100092871450364,,Tran Dong Vuu,zenbook 14 đi b
