comment_id,post_id,user_id,user_name,fullname,content
1688979101902348,1688971901903068,,lizziekute9x,Hung Nguyen,Nếu lo kinh phí không đủ thì nên sắm lap win để có GPU rời chạy dễ thở hơn.
1688996398567285,1688971901903068,,nguyenquanganh38,Quang Anh Nguyễn,"M1 Max cũng đủ r, dòng M2 thì nó có xu hướng bóp tốc độ SSD do dung lượng thấp hơn nó ít NAND hơn"
1688978655235726,1688971901903068,,mq.han.7,Hogan Vũ Quang,"Hn mình có M1 max ram 64 bản 16"" giá tốt, qua cài chạy thử trực tiếp là chuẩn nhất"
1688989401901318,1688971901903068,,AlexPham110191,Alex Pham,Nếu máy win thì cần cấu hình như nào để đúng nhu cầu của bạn ?
1688986128568312,1688971901903068,100052291368244,,Toản Bé,nên kiếm shop có máy trưng bày ra chạy thử xem dc ko. ko thì cứ quất 1 con gaming vừa mới vừa chạy ngon
