comment_id,post_id,user_id,user_name,fullname,content
8169223673159842,8169006553181554,100011826182050,,Lục Gia Mẫn,"Nên xem lại bước làm sạch tẩy trang - srm, da sạch sẽ đỡ mụn."
8169208926494650,8169006553181554,,tkp.1605,Tăng Kim Phụng,xài ezanic acid 20% á bạn nó giảm đỏ với trị thâm luôn nha
8169226133159596,8169006553181554,,vananh.shibi,Vân Anh ShiBi,"Đối với làn da này của em chị thấy mụn viêm khá nhiều. Em nên dùng thêm kháng sinh, uống thêm trị mụn giảm tiết bã, nếu có đk thì nên đi khám da liễu hoặc chọn nơi bán sp có chuyên môn để được theo dõi, điều trị và hỗ trợ đổi trả khi dị ứng để ko mất tiền oan mà hiệu quả cao vì mụn này dễ để lại sẹo cần được theo dõi và điều trị em nhé. Em nên tối giản skincare chỉ sd những sp như srm dịu nhẹ, ko bọt ko hương để giúp kiểm soát dầu, xịt khoáng, dưỡng ẩm cấp nước, serum phục hồi, tẩy trang, trị mụn chứa azelaic acid , chấm mụn ks, retinol dạng thấp... để đẩy và gom khô nhân mụn, che chắn kĩ và dùng kem cn( chọn loại ko làm bí tắc lcl) khi ra ngoài. Bên cạnh đó, em nên tránh ăn những thức ăn chứa nhiều đường, dầu mỡ ,cay nóng, socola ,cà phê ,trà sữa, thức ăn nhanh. uống trên 2 lít nước mỗi ngày, tăng cường rau xanh, và tránh thức khuya, căng thẳng.. Và muốn tìm dc sp hợp da và mang lại hiệu quả cao thì em phải xác định được cho c da của em thuộc loại nào? Vì nếu ko em chỉ đang phí tiền mà khả năng dị ứng là khá cao. Chúc em sớm có làn da đẹp"
8169474576468085,8169006553181554,,tuzino1,Tú Uyên,Trị hết mụn đã r trị thâm sau em ơi
8169385209810355,8169006553181554,61551489913483,,Ngọc Ánh,khuyên chân thành ngừng các sản phẩm lại kệ nó rửa mặt bằng nước muối sinh lý thôi để da thoáng chút c ạ
8169536076461935,8169006553181554,,loi.lay.92351,Bùi Thị Thùy,"Bạn bị stress , tắc lỗ chân lông, và sử dụng sản phẩm chưa phù hợp với da nên viêm . Trước tiên bạn vệ sinh mặt đúng cách nên lựa sản phẩm sữa rửa mặt nhẹ chiết xuất trà xanh khổ qua, thiên về thiên nhiên.
Sử dụng thuốc mụn để đào thải và gom cồi mụn. Lấy sạch nhân
Sau khi hết mụn bạn vào sử dụng trị thâm và phục hồi cấu trúc da. Sẽ ổn. Tuyệt đối k dùng nước muối rửa mặt sẽ làm cho da mỏng tệ hơn. Đây là kinh nghiệm bị mụn rất nặng bao năm của mình. Chúc bạn nhanh hết mụn"
