comment_id,post_id,user_id,user_name,fullname,content
2086096828537100,2085455505267899,,my.truong.948494,My Trương,"bs Việt Anh ở vinhome skylake ạ, hình như giá 120k/ cái, nhổ răng khôn cũng ok, m niềng ở đó khá rẻ mà nhẹ nhàng"
2086107091869407,2085455505267899,,anly.nguyen.33,Lan Nguyễn,"Không đắt đâu bạn ơi, có nhiều loại giá mà. Mình hàn ở quê cũng 250k/cái rồi, là loại đắt nhất. Còn loại rẻ nhất có 50k/cái thôi, nhưng sẽ không được bền"
2086111031869013,2085455505267899,,chanhnek261,Chau Anh,rẻ b ơi mình hàn ở medlatec còn 4tr8 8 cái ;))) b hàn nhiều loại giá mà nma 300k 1c n bền b ơi
2086132128533570,2085455505267899,,daylahuongly,Hương Ly,"cũng bthg mà b , nh chỗ làm giá rẻ mà kh đc chắc đâu"
2086097198537063,2085455505267899,,tyt.tran.39,Trần Lan Anh,ib chị nhé 1xx
2086132941866822,2085455505267899,100047787362030,,Đào Thị Huệ,"Ơ e hàn có 80k/c mà trộm vía bền lắm, mỗi tội k phải ở Hà Nội 🥹"
2086132945200155,2085455505267899,,bluewater1502,Cỏ Đỏ,"Mình trám răng trẻ e ở bv công, 300k/cái đây"
2086129111867205,2085455505267899,,matcha.31.rose,Thu Thảo,=)) giờ toàn giá ý thôi.
2086119405201509,2085455505267899,100028865048374,,Nam Tuấn,Nếu lỗ sâu to thì giá này ko đắt đâu. Trc t làm cách đây vài năm đã 200k/chiếc rồi.
2086098855203564,2085455505267899,,momophan,Phan Anh,Giá vậy đúng rồi bạn
2086099638536819,2085455505267899,,cu.shin.3323,Dương Thu Hằng,Hồi đi hàn ở oze 520/c giờ vẫn kb n khác gì vs hàn mấy chỗ pk bình thường 80-100k/c
2086097795203670,2085455505267899,,duynt251097,Duy,Bình thường
2086133348533448,2085455505267899,,thuhang.pham.7549,Phạm Hằng,Chỗ mình 400k mình bị 6c cũng hang có 1
2086118588534924,2085455505267899,100027417859959,,Thi An,Mình hàn 300k/1 cái
2086115655201884,2085455505267899,,Pon.Saniya,Nguyễn Ngọc Trâm,"Hòi đó mình trám răng 250/1 cái cũng hết hồn tưởng bị chém rồi, nhg gần 5 năm ời răng vẫn im ru và đẹp như ngày đầu"
2086127941867322,2085455505267899,,pun.nhoc.965,Huỳnh Trâm,Hàn là trám á hả mn. Lần đầu nghe hàn răng
2086096328537150,2085455505267899,,phuc.la.334,Lã Quang Thọ,"Giá đi đôi vs chất lượng thôi bạn ơi, răng là cái đáng để đầu tư, 300k thì bạn vào hẳn lạc việt hàn cho uy tín ik"
2086122451867871,2085455505267899,100004089063259,,Ngọc Linh,"Mình hàn răng 100k 1 cái, hàn thẩm mỹ răng cửa 300k 1 cái 🤣🤣"
2086120375201412,2085455505267899,,chanhpeter.mm,Đạt Nguyễn,Mình trám một cái răng cũng đã 300k rồi
2086132225200227,2085455505267899,,nguyen.hang1997,Nguyễn Hằng,Mk thấy cả lấy cao răng nữa thì nó mới đắt vậy
2086128915200558,2085455505267899,,kundelete.quakhu,Như Quỳnh,Bé nhà mình đi hàn răng sữa còn mất 500k 1 cái
2086124311867685,2085455505267899,100034103534264,,Thu Thu,các bác ơi răng em thưa có nên trám ko? Trám răng cửa thì giá tầm bn là vừa nhỉ
2086113748535408,2085455505267899,,ngocbinh.pets,Ngọc Bình,Xin địa chỉ hàn răng sâu và trám thẩm mỹ chất lượng giá tốt ở hcm ạ.
2086110528535730,2085455505267899,,linh.7198,Ling Anh,Thế mà bên này e đi hàn răng 1 chiếc 1tr5 nè =)))
2086093858537397,2085455505267899,100008505819221,,Hoàng Huệ,.
2086182405195209,2085455505267899,,yenhoang.yenhoang.581,Như Ngọc,Phạm Quyến ủa sao cái răng của em trị giá 3tr/1 răng z 🥹
