post_id,user_id,user_name,fullname,content
1700187030781555,,nqhung119,Nguyễn Quang Hưng,"#hoidap
Lần đầu em sử dụng Smart Key của Honda, em có một vài thắc mắc:
1. Có phải chỉ cần Smart Key ở trong phạm vi 2m là người dùng có thể mở được cốp không ạ, hay phải kết nối remote (đèn xanh) mới mở cốp được ạ?
2. Sau khi khoá cổ, nếu không tắt remote (bấm giữ sang đèn đỏ), có phải người khác vẫn mở bình thường được đúng không ạ?
3. Smart Key thì sau bao lâu em thay pin một lần ạ?
Em cũng mạn phép xin hỏi anh em kinh nghiệm sử dụng Smart Key, hiện em khoá xe, ngắt kết nối remote xong phải bấm một phát check lại cho chắc rồi mới rời xe được. Không biết anh em sử dụng Smart Key như thế nào để em rút kinh nghiệm ạ.
Em xin cảm ơn."
