comment_id,post_id,user_id,user_name,fullname,content
2355565048252652,2355553704920453,100036114851565,,Trang Nấm,"Mình ổn bạn ơi
Ổn lòi lìa"
2355566731585817,2355553704920453,100024808125649,,Hoàng Xuyên,"Bà chê tui thúi, hồi bà đừng có ẩm tui nhei🤔🤔🤔"
2355571518252005,2355553704920453,61557835377148,,Nguyễn Cúc,Chừa nhé! Sau vụ này lo ăn rau nhiều vào😂😂
2355571558252001,2355553704920453,,huy.le1808,Huy Lê,ổn lòi lìa
2355569254918898,2355553704920453,100004269522317,,Ngân Lê,Một chiếc video bốc mùi 😖
2355559464919877,2355553704920453,,linhphuong2703,Linh Phương,Đổ nhiều cát lên bạn. Đổ một tí như thế đi dính đáy chậu và không hết mùi đâu
2355560628253094,2355553704920453,100016279635403,,Kem Bình Dương,Nguyen Thi Phuong Anh
