post_id,user_id,user_name,fullname,content
2921878417894420,,,,"#skincare #peel #review
Dạo này Peel da đang thịnh hành nên mình cũng tậu về một em để thử xem sao
Và mình đã chọn Peel của The Ordinary 👏🏻 vì mình đã từng dùng 1 số sản phẩm trước đó của The Ordinary nên chọn luôn ẻm
✔Về công dụng thì mọi người đều đã biết là tẩy tế bào chết hoá học cho da. Với mình khi dùng thì cảm thấy châm chích trên da nhưng cũng không nhiều và cũng tuỳ vào từng vùng da chứ không hết cả mặt và hơi ngứa vì tinh chất không chỉ loại bỏ da chết bên trên da mà còn đi sâu vào lỗ chân lông. Sau khi peel thì da mịn mượt sờ vào thích lắm cảm giác loại bỏ được các tế bào chết trên da nhẹ hẳn mặt. Và cũng có đẩy mụn một ít trên da của mình nữa ỤwỤ.
Mùi hơi khó chịu 1 tí nhưng mùi này đỡ nhất trong các loại sản phẩm của The Ordinary :v
Lọ này mình mua 290k
➡️ 1 tuần mình chỉ peel 1 lần và 1 lần tầm 7-10 phút sau đó sẽ đi rửa lại với nước sạch. Trước đó mình làm sạch mặt bằng dầu tẩy trang và srm.
✔️Sau đó mình sẽ đắp thêm 1 mask để cung cấp độ ẩm cho da vì khi peel xong da khá là khô nên da cần được tiếp ẩm . Và mình chọn Medi Hydro Vial của Wonjin. Mask của nhà Wonjin thì đắp siêu thích luôn mỏng và ôm sát mặt lại nhiều tinh chất có khi thoa mặt không hết thoa luôn cổ mà vẫn còn dư 👏🏻 Medi Hydro Vial cấp ẩm cho da cực tốt lại giúp da giữ nước nữa nên dùng ngay sau peel là 1 combo toẹt vời. Theo như mình xem review thì mask này dùng được cho cả da nhạy cảm, da sau điều trị laser nên em này lành tính lắm nha.
Mask này lần đầu mình mua lẻ dùng thử là 28k sau đó mê em này quá nên tậu cả hộp 10 miếng về thì hết 270k
➡️1 tuần thì mình dùng mask 2-3 lần mỗi lần 10-15 phút sau đó vỗ nhẹ để tinh chất thấm vào da rồi dùng kem dưỡng để khoá ẩm là xong
Vì đang nghỉ dịch nên cũng chăm chút cho da nhiều hơn và tìm được sản phẩm tốt cho bản thân ☺️ nên trồi lên đây chia sẻ 1 tí với mọi người (có sai sót xin mọi người bỏ qua cho mình nha)
Cảm ơn mọi người đã đọc đến đây. Và đừng quên rửa tay sạch, ăn chín uống sôi, đeo khẩu trang khi ra đường để phòng dịch nhé~~"
