comment_id,post_id,user_id,user_name,fullname,content
8315217118495464,8313063695377473,100003840318729,,Huong Nguyen,"Collagen glutathione bbc
Trị nám sạm, tàn nhang. Da trắng mịn, , chống lão hóa
Điều hòa nội tiết tố nữ
ib e giá tốt"
8315636311786878,8313063695377473,100034668554593,,Phạm Thị Hương Lan,Mẹ e sài bộ này của Bijincos Vietnam đỡ hẳn chị tham khảo thử nha
8317894724894370,8313063695377473,100090871280480,,Trà My Kim,Điều trị nám nên tìm bs da liễu uy tín. Bạn Ib hỏi bs da liễu Xuân việt xe . Mình thấy bs điều trị hiệu quả lắm@[530101561454815:69:Skincare Đẹp Cùng BS Da Liễu ✅]
8317971091553400,8313063695377473,100042247873153,,Thanh Mai,em đang sài bộ kem mairis này cũng ok lắm nè c
8318157271534782,8313063695377473,,zynrr.porak.5,Đỗ Bích,Trước em cũng bi nám nè chị ơi em làm Exosome Ultra + Meso F meloa clear bên chỗ PGS.TS Bác Sĩ Trần Đăng Quyết thấy da cải thiện lắm đó chị tham khảo xem sao ạ
8318183704865472,8313063695377473,100087247281043,,Tuệ Lâm,Da nám bạn tham khảo làm Exosome Ultra + Meso F mela clear bên chỗ PGS.TS Bác Sĩ Trần Đăng Quyết xem soa trước mình làm bên này thấy hiệu quả lắm ý bạn tham khảo thử xem sao
8319706231379886,8313063695377473,,,Thành viên ẩn danh,h
8319728338044342,8313063695377473,100094176997513,,Phương Thu,Nám nè bạn qua Thẩm Mỹ Viện Seoul Center bác sỹ mát tay bắn tới đâu nám mấy cũng sạch bay hết á mà chi phí ổn áp này
8323348407682335,8313063695377473,100087582499661,,Lan Anh,Dùng bên c Phan Huyền ok lắm chị ơi
