comment_id,post_id,user_id,user_name,fullname,content
1734611454011860,1730154194457586,,hoanh.binh.758,Hoành Binh,Mom mua thuốc nam bên fb Thuý Yiu này nha hiệu quả lắm 😍😍😍
1734634330676239,1730154194457586,61560816232284,,Anh Mai Vũ,"Mom vào hội này để tham khảo thông tin địa chỉ uy tín bsi giỏi chuyên môn cao về ivf này, nhiều mom cũng case khó mà thành công có bé chia sẻ kinh nghiệm kinh nghiệm trong này đó Hội mong con - Hiếm muộn (IUI - IVF)"
1734518824021123,1730154194457586,61561897556801,,Vũ Ngọc Bích,"Mom qua bác Yến viện đại học y xem sao. Bác có kinh nghiệm nhiều năm rồi. Bác chu đáo, nhiệt tình lắm. Mom tham khảo xem sao"
1734623630677309,1730154194457586,100058153541089,,Nguyễn Vân Thu,Em còn phôi ivf k?
1734556300684042,1730154194457586,100084184585370,,Hoài Thương,"Con cái là do Trời ban. Bé tới sớm hay muộn là do nhân duyên của mỗi người mỗi vợ chồng. Bạn nào khó có Con. Mong con mau đến với mình, muốn IVF thành công, muốn con khỏe mạnh trong suốt thời gian thai kỳ, HAY có Bé Trai hoặc bé Gái.
Hữu duyên nhắn tin qua cho Chị, chị hướng dẫn và chia sẻ cho Các bạn ""Bài khấn Cầu Con"" xin lên Mẹ Bồ Tát Quan Âm đúng cách để được linh ứng ( Bài khấn Hoàn toàn M.i.ễ n phí - Chị làm vì muốn tích phước mà thôi ). Rồi sau đó các bạn TỰ KHẤN XIN ở nhà. ( không cần nhang đèn hoa quả, l.ễ v.ật gì cho tốn kém, chỉ cần lòng thành tâm cầu khấn Ngài là được)🙏"
