post_id,user_id,user_name,fullname,content
2372696739872816,,hanoi.sodep.5,Trần Oanh,"Tao Đi Khảo Sát Tí Thôi Làm Gì Căng
😭😭
Ace bạn bè có nhìn thấy bạn này ở đâu xin cho mình thông tin ạ!!😖😖
TÌM CHÓ LẠC khu vực An Lạc - Nông nghiệp - Vin oceanpark 1
👉Tên: Hachi
👉Đực chưa thiến
👉Cổ có đeo vòng đen và xích
Hôm mưa bão nhà mình bị lạc 1 em chó vàng như ảnh ạ.
Do giông mưa bé sợ nên đã giằng xích và xổng mất
Anh chị, các bạn nhìn thấy, tìm được xin hãy liên hệ với em ạ
Sđt: 0941.26.62.26
Em rất biết ơn và xin được hậu tạ!!
Các bạn share giúp chứ Sen Đang Mất Ăn Mất Ngủ"
