comment_id,post_id,user_id,user_name,fullname,content
1175007953783100,1174421057175123,,BeautyLyLyNguyen,LyLy Nguyễn,"T cũng có mở 1 spa tại nhà, vì nhỏ lẻ nên t chẳng dám quảng cáo nhiều vì ngoài kia quá trời sự lựa chọn, quy mô người ta cũng lớn nên thôi t lui về làm tèn tèn khách gần gần nhà, mấy chị em làm rồi giới thiệu nhau. Cơ mà sao t buồn khi đọc những bình luận bỏ ra cả chục triệu theo liệu trình vẫn không hết mụn là quái nào, trong khi khách t qua tầm 2-3 lần thôi là da dẻ ngon lành. Nên ai bị mụn mà chịu khó đi xa được thì cứ qua t điều trị cho. Giá học sinh sinh viên đều bon chen vô tư luôn."
1176395253644370,1174421057175123,,Maiyeuminhanh.maithanhluan,Oanh Phạm,"K.o.r.e.a bên tre ngay ngã 4 phú khương bên tre nha , phun môi k lên màu dặm lần 2 cung con thâm viền môi , làm theo ý nhân viên ,nhân viên nhất quyết đã đẹp rồi , khách nói k đẹp kệ khách !! Né gấp ... Cảm thấy spa k có trách nhiệm k có người đứng đầu nên có gì k ai chịu trách nhiệm nha mn"
1174924683791427,1174421057175123,,pham.an.56614,Pham Thuy An Pmu,"Phun mày môi ghé e nha, chính chủ làm ạ😚"
1174572790493283,1174421057175123,,rose.gen.3597,Lý Phúc,Q spa nha
1176511393632756,1174421057175123,,quynh.vitmomo,Trần Quỳnh,Zakka spa ổn k ạ
1175500233733872,1174421057175123,,phale1812,Đỗ Pha Lê,Bác nào làm Kang clinic rồi review em với
1174614550489107,1174421057175123,,dtnbt.vn,Đinh Tam Nguyên,coi chừng bị bay màu nha 😆😆
1174614687155760,1174421057175123,,dtnbt.vn,Đinh Tam Nguyên,Nguyen Thanh Huy vô Huy ơi
1174421600508402,1174421057175123,,BB.Tran.31,Nick Trần,. hóng :))
1174602250490337,1174421057175123,,VongBoiLinh,Linh Linh,Seoul spa mua cái thẻ ở trỏng làm dịch vụ gì cũng tệ từ nặn mụn tới tắm trắng. Mà không đi nữa thì tháng nào cũng gọi điện thoại kêu ngta đi spa. Đang ngủ gọi dậy đi spa 😩
1174511260499436,1174421057175123,,duyphuc.0711,Lê Duy Phúc,"Riêng cá nhân tui thấy không ưng An Tây spa nha :) đợt đi nặn thử, đúng kiểu lấy mụn chừa lại"
1174616533822242,1174421057175123,,binh.hy.92,Hy Bình,"Mới trải nghiệm CAREYOU BEAUTY SPA, làm tiền spa á mọi ng, mọi ng cẩn thận nhé, vì tư vấn vẽ vời đủ kiểu đủ công nghệ, để bắt mình trả thêm tiền :))"
1174463340504228,1174421057175123,100027119597597,,Ruan Wei,Thấy ai cũng chê spa hết. Chắc điều trị da tui vào đại học y dược tphcm quá. Cho chắc. Hoặc bl da liễu mà làm.
1174765830473979,1174421057175123,100069071830168,,Auegnstern,anh chị nào cho em xin review về Bờ Liss xinh đẹp spa với ạ. Em định đi lấy nhân mụn với peel da ạ
1174924663791429,1174421057175123,100078267655501,,Dương Ngọc,"TA BEAUTY SPA - TA BEAUTY SPA - TA BEAUTY SPA
Né nó ra nha mn, cái gì quan trọng nhắc đi nhắc lại 3 lần, có 1 cái bên Bình Thạnh với 1 cái địa chỉ 37 Hồ Bá Kiện quận 10 á, không phải làm k hiệu quả nữa mà là nó siêu lừa đảo, nhân viên rất mất dạy."
1175143283769567,1174421057175123,,thuhuyenmoon2909,Thu Huyền,"Trị mụn vào bệnh viện da liễu nó cứ gọi là ok, y sời vào đấy bác sĩ nhiệt tình lắm, nói chuỵện thân thiện dễ nghe, làm dịch vụ cứ gọi là hết nước chấm😁"
1174945570456005,1174421057175123,,lecongtuananh1993,Lê Công Tuấn Anh,"🎁🎁 Giảm ngay 200K cho các bạn học sinh - sinh viên nữ, khi mua gói 8 buổi triệt lông vùng nách Diode Laser tại Hasaki Clinic (Giá gốc 800K, chỉ còn #600K). Bảo hành 5 năm bằng văn bản. https://www.facebook.com/hasakispa"
1174653127151916,1174421057175123,100005340708161,,Phương Lê,Anhlee spa nha
1175669313716964,1174421057175123,100001113771629,,Thúy Vân Trần,Qua thử Dlynk clinic 67trường sơn chim ưng luôn mấy bà ơi. Xài đồ xịn dermalogica không chèo kéo mua gói nè mấy bà ơi
1176787083605187,1174421057175123,100032258992358,,Xuân Diệu,"Bill cũng 810k chứ rẻ đâu , mình thấy không vừa ý mình nhắn riêng với shop để complan riêng . Xong bị nhân viên tìm fb chửi , tr oi có dịch vụ nào như vậy ko . 27 Nguyễn Trường Tộ P12 Q4"
1177322090218353,1174421057175123,,lay.makeupartic,Lay Hồ,"Ai Tân Phú - Bình Tân - Q11 thì qa Quỳnh Chi Home Spa thử nha. Có 3 CN dịch vụ giá bình dân nhất mình từng làm mình làm ở đây cũng được 5-6 năm r.
Trước đó có thử nhìu nơi xa gần đều đi hết mà sau khi làm ở đây mình gắn bó luôn tới giờ. Chị chủ xuất thân là bs da liễu nên yên tâm lắm."
1174977907119438,1174421057175123,,jihoon049,Phạm Đức Nhật,Lê Văn Vượng
1175004857116743,1174421057175123,,ddnhauyen,Anna N Uyen,"Đọc thấy nhiều spa to bự ở SG quá, cũng dính hết 1-2 cái thời còn là sinh viên.
May mà từ ngày con bạn mình dấn thân vào ngành này, mình hết sợ ròiiii 🥹🥹 nặn mụn mát tay xỉuuuu trviaaa 😅😅😅 đòi làm liệu trình mắc tiền zị chớ đâu phải mắc là nó cho làm đâu :)))) da ko ổn là mài khoải luôn. Ko vẽ vời, tập trung những cái khách cần.
Emily Nguyen Do 10 đỉmmmm 😘"
1174615340489028,1174421057175123,,phggnghi.04,Phương Nghi,Tui mua gói triệt bên LG cứ thấy sao sao á 🥹
1174965653787330,1174421057175123,,ver0njka,Nguyen Khanh Ly,"A** L** spa nha tụi bây, má nó mời chào t nâng cấp liệu trình wax t ko nâng cấp,thế là nó chui thẳng vô phòng lúc m đang làm để nó sale luôn,thứ spa md"
1175673283716567,1174421057175123,,parisglamor,Paris Glamor,"Bạn qua thử D.Lynk Clinic làm thử dịch vụ, giá cả hợp lý, lại dùng toàn mỹ phẩm của Dermalogica để điều trị mụn, thương hiệu mỹ nổi tiếng, họ dùng sản phẩm toàn bộ hàng châu âu, an toàn, ktv có tâm dễ thương. Mỹ phẩm làm da là để sẵn trong phòng cho mình thấy xài loại gi luôn. Địa chỉ ở 67 trường sơn, p2, Q.10, ngay sân bay đi lại cũng tiện"
1174968710453691,1174421057175123,,ThuyDuong.TDL,Võ Thị Thùy Dương,"Ngược với Stt, spa Ok Khu vực Bình Thạnh thì qua bên chị Như Hoàng thử đi mn... homespa nên ko chèo kéo gì đâu, mình chữa mụn ở đây nguyên liệu trình có 12tr mà trong vòng 2 tháng láng o luôn. Xịn xò con bò. Được bà Như chính tay điều trị luôn nha😍"
1174978640452698,1174421057175123,100007496715917,,Dương Mỹ Hoa,"Bạn nào ở hcm cần tìm 1 spa môi trường thân thiện k up sale, kĩ thuật viên siêu kĩ và chuyên nghiệp thì tham khảo fb mình nhé!! Đảm bảo ưng luôn ạ"
1174985370452025,1174421057175123,,hoong.van,Van Cam Hong,TA beauty hồ bá kiện mng có trãi nghiệm chưa?
1174978640452698,1174421057175123,100007496715917,,Dương Mỹ Hoa,"Bạn nào ở hcm cần tìm 1 spa môi trường thân thiện k up sale, kĩ thuật viên siêu kĩ và chuyên nghiệp thì tham khảo fb mình nhé!! Đảm bảo ưng luôn ạ"
1174985370452025,1174421057175123,,hoong.van,Van Cam Hong,TA beauty hồ bá kiện mng có trãi nghiệm chưa?
1174635453820350,1174421057175123,,harleydaynee,Giang Hoàng,Xê-un🥰🥰🥰
1174974900453072,1174421057175123,,tam.pham1107,Julia Pham,Bạn nào cần tìm spa uy tín thì qua chị Như Hoàng nha. Mình theo chị này chắc cũng 2-3 năm rồi. Bên trái là hình cũ bên phải là hình mới. Để thấy khuyên tai khuyên môi cho chân thật 😂😂😂. Hình này mình tự ghép tự để tên spa tại sợ người khác thấy rồi lấy về trang họ làm review 🤣🤣🤣.
1174453027171926,1174421057175123,,thuygiang.duong.3,Dương Thùy Giang,Thủ đô Hàn Quốc Spa
1174887217128507,1174421057175123,,nhatvi.2307,Nhật Vi,Nặn mụn ghé thử dr linh coi s mấy bà. Trộm día tui nặn thấy ok nè mà mấy c nv cũng dễ thưn nha
1176931276924101,1174421057175123,,tungtung.conuong,Hoa Lê,Ngọc Hà Clinic thì sao vậy mọi người?
1176225646994664,1174421057175123,100042563437746,,Bảo Trân,Mọi người ghé thử DALI beauty ở ngay góc vĩnh viễn ngô quyền Q10 á mình hay nặn ở đó giá hơn 200k nặn kĩ mà không bị sưng với thâm nhiều đâu
1174619797155249,1174421057175123,,HangNguyetPham,Phạm Nguyệt Hằng,Chuỗi spa vườn nhỏ á.
1177095336907695,1174421057175123,100053544156832,,Huỳnh Thư,t thấy trị da tuỳ tâm mỗi đứa làm nghề hay s á. như t thích nặn mụn lắm nên khách mà dô tay tao là tới khuya mới đc dìa :))) . mà đc cái khách rất happy vì nặn sạch sẽ về tối rữa mặt lán o. còn massage thì khách nào làm xong cũng kêu da sáng bật tone căng mướt luôn. tiếc là t đẻ rồi về ở ẩn thấy mn cmt nên t dô theo
1174965300454032,1174421057175123,,lieu.le.9,Lĩu Lĩu,"Sao thây mọi ng lấy nhân mụn 400,500k đắt v nhở, spa mình 249k/ lần láy nhân mụn, là lấy sạch, tầm hơn 2 tiếng, lấy chuẩn y khoa, đầy đủ các bước chứ lấy 400,500k mà về khách tự nặn thêm ở nhà hay đi nặn chỗ khác vì chưa sạch thì chán thiệt 🥵"
1174618070488755,1174421057175123,,thuytrang88vn2003,Trang Dương,S h y n h thì sao mọi người.
1174577363826159,1174421057175123,,minhtrunghtr,Huynh Tran Minh Trung,O2 skin có tốt không mng ? Mình hỏi thật. Định đi nặn mụn với trị mụn ẩn với sợi bã nhờn
1175182447098984,1174421057175123,,huyen.lu.9,Huyền Lư,"Có ai ghét spa kiểu lúc đầu ngọt ngào để sale mấy gói dịch vụ cho mình, mua dịch vụ xong dùng đc 2-3 lần là bắt đầu nhân viên nó kiểu hết nhiệt tình với mình ko 🙄"
1175244473759448,1174421057175123,,kieuchi.nguyen.5,Nguyen Minh Kieu Chi,Cái tên nào mình biết đều có trong list cmt hết vậy tèn
1174462687170960,1174421057175123,,NTVA090299,Vân Anh Nguyen,"Hasaki có phốt gì không mọi người, em mình mua gói triệt bên đó mà nó hẹn 1 tháng tới triệt 1 lần, trong khi các chỗ khác thời gian đầu phải đi 1 tuần 1 lần =))"
1175559730394589,1174421057175123,,thuytien19.04,Tiên Tiên,Quận 11 hoặc các quận lân cận ghé 𝕄𝕖𝕖 𝔹𝕖𝕒𝕦𝕥𝕪 𝕊𝕡𝕒 nặn mụn siêu sạch nha
1176023133681582,1174421057175123,100071791028683,,Ngân Kim,"Tâm An lúc trước ở q1, xong đổi tên đổi chủ thành Băng Băng dời về q7 :)) cắn của t hơn 2tr mà đéo cho t làm dịch vụ, đẩy qua đẩy lại, nuốt cũng dễ trôi lắm con 😌🤞"
1174998233784072,1174421057175123,100041034920205,,Ng H Phuoc An,skione của bs Châu ở đặng văn bi thủ đức sao các bác
1175602927056936,1174421057175123,,kimlien23041999,Kim Liên,M.I.A nha ai làm liệu trình nặng mun chưa
1176191990331363,1174421057175123,,tram.piggy,Nguyễn Ngọc Bích Trâm,Little garden nha. Chỉ chăm chăm tìm cách moi tiền thôi chứ chả thấy hiệu quả gì. Thêm cái lần t chuyển tiền thì nv đứng kế bên nhìn số dư của t xong nói với nhau là t còn nhiu đây tiền nè. Ủa ý là chê ít hay là muốn tìm cách moi cho hết hay gì? 👎🏻👎🏻👎🏻
1176859866931242,1174421057175123,,thoanguyen368,Thoa Nguyễn,Nếu mấy bà mất hết niềm tin thì có thể ghé Spa nhỏ xinh của tui nha!
1174468840503678,1174421057175123,,phuongthao.lephuc1212,Phuong Thao,Ê xin chô triệt hair uy tín mấy ní ơi
1175077457109483,1174421057175123,,myluy.tran29,Mỹ Luy,"Lysbeautycare gò vấp nha mấy bà, né vội,nặn mụn siêu đau, về mặt sưng lên mấy ngày lun, để lại 1 rừng thâm"
1174626743821221,1174421057175123,100027901303965,,Vân San,seoul spa 🥲tắm trắng tốn chục củ như 🐦. còn bị ngứa.
1174780727139156,1174421057175123,,kimthu200798,Nguyễn Ngọc Kim Thư,Mấy c nào dư giả qua spa của c HannahOlala làm lun i cho an toàn mà ko bị vẽ nữa.
1177464043537491,1174421057175123,100075374499071,,Nguyễn Ngọc,"Đừng đợi #đến #Tết rồi mới #giảm #mỡ...
Đừng đợi đến khi có dịp quan trọng rồi mới vội vã dồn ép cơ thể...
Lấy lại vóc dáng là cả một quá trình...
Không phải cứ bất thình lình là xong
Muốn vừa #AN_TOÀN vừa #ĐẸP_DÁNG thì kiên trì sẽ giúp các bạn lấy lại vòng eo lý tưởng, thân hình cân đối.

Mua hàng ở: https://www.facebook.com/Thuocgiammo.NewLishou 🌼😫💕🥄"
1174924037124825,1174421057175123,,phucc.kim.7,Kim Phúcc,Cho em hỏi spa nào nặn ổn ở gv ạ
1175527970397765,1174421057175123,100008004948227,,Ngoc Phụng Pham,Thủ dầu 1 gé mình thử nha. Mình làmtại nhà chủ yếu phụ tiền thuê nhà. Nặn mụn 200 có sát khuẩn đắp nạ điện tím đầy đủ nha mấy ní. Giá 200k/ lần 😁
1175677070382855,1174421057175123,100001113771629,,Thúy Vân Trần,Ngọc dung mấy bà ơi né gấp
1174897113794184,1174421057175123,,nhatminh.pham.902604,Gia Changg,Spa nào nặn mụn oke z mọi người
1174953780455184,1174421057175123,,zoelynnisme,Lynn Khánh Linh,Ở q12 hóc môn spa nào nặn oki vậy mng ? Kiểu bài bản ko bậy bạ á :(( e sợ đi nặn về nát bét cái mặt quá huhu
1174651580485404,1174421057175123,,ly.vukhanh.792,Vũ Khánh Ly,"🛑🛑 Anh chị nào mà bị lừa tiền qua mạng, Làm nhiệm vụ telegram, Shoppe... Các sàn điện tử không rút ra được. Muốn lấy lại nhắn tin cho mình. Mình chỉ cách thu hồi lại tiền bị lừa. Ok ❤️"
1175898440360718,1174421057175123,,hoa.ai.98031,Ái Hoa,"Mình đieu tri da khách từ 6-10 triệu tuỳ mức độ mụn , da hết sạch mụn thâm khách hài lòng thì tui mới trả da .. riêng về mụn thì đơn giản giá tầm đó ok rồi..chứ đi spa mà vào chục triệu chỉ để trị mụn thì giá hơi cao"
1176199166997312,1174421057175123,,tranla99,Trân La,"Gà spa :)) cơn ác mộng của t, làm xong 1 ề mụn t trầm cảm cmnl"
1175494877067741,1174421057175123,,hao.tin.day,Hào Tín,Dr Yh thì sao ạ
1177440580206504,1174421057175123,,uyen.phuong.1510,Uyên Phương,có spa nào uy tín ở biên hòa ko ạ😅
1174992137118015,1174421057175123,100008339356387,,Vân Lê,"Bạn nào quận 10 cần nặn mụn sạch qua 506/2 đường 3-2, p14 quận 10 nha. 0909641155 chỉ 200k à nha"
1175008080449754,1174421057175123,,mun.doremon,Phương Ngọc,Quận 8 thì ở đâu uy tín vậy mn?
1175177293766166,1174421057175123,100015250563086,,Lan Anh,Lan Thanh hahahaha Lan Hương spa đg mua gói triệt spa dẹp k một thông báo xong r kêu đợi spa mở lại tới nay hơn nửa năm câm lun =)) Xài đồ trộn :)))
1174523817164847,1174421057175123,,chin.quynh.589,Quỳnh Anh,G...à spa :))
1175670653716830,1174421057175123,,meomi999,Trà Mi,Ồ láng viện thì sao mọi người? Ai trải nghiệm rồi cho e xin tí review ạ
1176784130272149,1174421057175123,,phuongquynh.nguyen.378,Thanh Loan,Quảng cái toàn ngôi sao hạng A kinh nghiệm mười mấy năm mà t vô làm hết 20tr mà da càng ngày càng tệ.nên giờ sợ quá kg dám tin nữa
1176397943644101,1174421057175123,,kev.kris.79,Su Su,"Né spa của cha bs Mập Hồng nha, nuốt của ngta 38tr xong làm hifu phỏng 1 bên má, h để lại sẹo luôn."
1175519100398652,1174421057175123,,huyenhao.le.1810,Lê Thị Huyền Hảo,Ngô Huấn Tiên Tiên vào xem sân si đi mấy chế 🤣
1174640773819818,1174421057175123,100010572663523,,Sup Sean,Careyou nha. Toàn làm tiền k chứ đi k hiệu quả mấy
1175739930376569,1174421057175123,,linhlinh1112002,Linh Linh,"Ai đã từng đi qua tiệm Goncy clinic của chị thanh thanh phạm hồ chưa ạ, cho e xin ít review với"
1175431817074047,1174421057175123,,nguyen.kimmy.9022,Nguyễn Kim My,Spa Shynh Beauty 🥲
1175012667115962,1174421057175123,,subich.tranthanh.1,Trần Thanh Sử Bích,Cho e xin review spa Diva
1175307313753164,1174421057175123,,abcxjhahah,Bo Nguyen,E xin review triệt lông bên Hasaki ạ
1174639347153294,1174421057175123,,baoo.baoo.10,Trang Nguyen,Có bạn nào làm ở Dr Acnes chưa ạ
1175537503730145,1174421057175123,100073259535599,,Di Di,Mình hay nặn chị kia. 200k/ lần . K chèo kéo gì cả. K bán mỹ phẩm. Chỉ hướng dẩn mình sử dụng và mua theo khả năng bản thân.
1174852340465328,1174421057175123,100022709074598,,Gia Hân,"Có ai làm ở kyky chưa ạ , cho e xin rv vớii"
1175256737091555,1174421057175123,100017654977819,,Thúy Vi,Mạnh dạn đoán eo gi
1174549360495626,1174421057175123,100009203661953,,Vay Ao MiMi,"Lê Quỳnh spa nha mn, tốn mấy chục triệu k hết mà vẽ mua mp kem trộn"
1174645133819382,1174421057175123,100021701898283,,Mai Ngoc Tran,Tui toàn vô VITA. Thấy cũng ổn.
1175006017116627,1174421057175123,,NhiNhiMinMin,Nhi Nguyen,Xê un :))
1174966750453887,1174421057175123,100074690255131,,Ngọc's Thii's,Cho e xin địa chỉ triệt lông uy tín zs ạ
1176278963655999,1174421057175123,100008761593753,,Nguyễn Trang Cẩm Tú,Dat Nguyen
1174675037149725,1174421057175123,,thaoly.tran19321,Thảo Ly Trần,Ybspa né nặn mụn
1174614363822459,1174421057175123,100005352964109,,Nguyễn Kim Dung,Lan hương spa
1174882210462341,1174421057175123,100068948513317,,Bạch Dương,Có ai đi cái Em Mây chưa mn ơi? Cho tui xin tí review đi
1175513653732530,1174421057175123,,phng.51,Phương,Táo Đỏ ổn ko mng
1176901496927079,1174421057175123,,hiuchodien,Kim Hieu Phan,Anhlee spa
1174955927121636,1174421057175123,,confidental.la,Adams Louis Phan,GÀ SPA!!! Mặt đang mụn ít nặn xong thành cái rổ luôn :)))
1174770693806826,1174421057175123,100075730111377,,Di Zũ,Cao Kim
1174722053811690,1174421057175123,100049588774768,,Lz Qe,có ai triệt lông ở hasaki chưa ạ
1177246466892582,1174421057175123,100093681348468,,Võ Ngọc Ái,Mời bạn Vào nhóm Hội Review Về Triệt Lông có nhiều phương pháp triệt lông rất hay ạ 💪
1175010650449497,1174421057175123,,pnpc.pnpc,Phương Cát,Kefi skinlab nha 🌚
1174960950454467,1174421057175123,,nguyenchauthaohien,Na Nguyễn,Minh Cường vô rì viu liền anh 😆
1175674037049825,1174421057175123,,lam.tuong.9638,lam tường,Xê un nha mấy bà😂
1174859987131230,1174421057175123,100027633559797,,Minh Lê,Chicken Spa 😇
1177494063534489,1174421057175123,,ngocquyen.tran.1612,Ngọc Quyên Trần,Gà Spa🥲
1181022969848265,1174421057175123,,bear.nga,Nga Bear,Hòa đọc chơi😆
1174617853822110,1174421057175123,,tkhue21,Trần Kim Huệ,Kim Trần thấy có Antay nữa kìa
1177171996900029,1174421057175123,,kiwidymie,Kiều Vy,Lê Thị Thúy Lam cú sốc đầu đời kkkk
1174961013787794,1174421057175123,,nguyenchauthaohien,Na Nguyễn,Hồng Ngọc Đt vô chị ơi 😆
1176717686945460,1174421057175123,,rua.heo.3572,Diễm Hương,"Diễm Hình
Thảo Nguyên hóng"
1174625647154664,1174421057175123,,linhcute38,Nguyễn Ngọc Linh,Nguyễn AnhQuốc vô đọc đi nè
