comment_id,post_id,user_id,user_name,fullname,content
1749681845820269,1749680809153706,,mstranthihoaithu,Trần Thị Hoài Thu,"Ỏ. Bé này em có, xay thịt thì thấy không được mấy ạ 😄"
1749686415819812,1749680809153706,,nguyenngocanh1503,Ngọc Anh,"Mình cũng dùng cái máy xay cầm tay braun, nồi nấu cháo bear, thêm cái nồi inox hành trình ăn dặm của con đơn giản hẳn"
1749683769153410,1749680809153706,,dinhtieuthu.dinh.9,Đinh Hằng,"chân ái là nồi nấu chậm bear, chứ còn máy xay thì....... mình chẳng dùng làm gì hết 😉😋"
1749686529153134,1749680809153706,100089776278438,,Han Nhat Gia Dung,"Máy xay sinh tố Braun, công suất 1000W, combo 1 bộ chân ái là đây chứ đâu ạ"
1749683695820084,1749680809153706,,thuy.tranquangminh,October Rain,M dùng mới có xay ăn dặm cho 4 đứa con à.
1749682242486896,1749680809153706,,dnanhh98,Ngọc Anh,E cũng dùng máy xay cầm tay nhưng của fatz mà ko thấy mạnh lắm. Đồ ăn dặm cho con hơi khó xay nhưng dc cái tiện và vệ sinh nhanh
