comment_id,post_id,user_id,user_name,fullname,content
2356292078179949,2355737734902050,,dinhlin1404,Đinh Lin,bé này kute quá
2356305398178617,2355737734902050,,ailinh.hoang.90834,Ngọc Trâm,Khó chịu vô cùng
2356316291510861,2355737734902050,,nguyenphuocdong,Nguyễn Phước Đông,Khó chệu vô cùng!
2356319538177203,2355737734902050,,dumpy.katie,Katie Chen,Múp Trần lúc nhỏ như thiên thằn 🤣
2356294698179687,2355737734902050,100006442590104,,Ngọc Oanh Oanh,Lúc á hự thì hỏng thấy khó ưa😸
2356312794844544,2355737734902050,61562374585719,,Góc Bình Yên,Cưng quá 😂❤
2356314954844328,2355737734902050,,Khadiem0342183802,Tư Cầm Điềm Khả,🥲 mặt bánh bao mà liếc làm gì có lực sát thương
2356323821510108,2355737734902050,,ylan.buithi.9,Bùi Thi Ý Lan,Mắt tỉ lệ nghịch vs thân hén 🤣
2356327261509764,2355737734902050,,quang.lam.562114,Quang Lam,Emma Lee
