comment_id,post_id,user_id,user_name,fullname,content
1878787572650364,1878781642650957,,MinhMapMap277,Nguyễn Văn Minh,Vnexpress vừa kêu evn phủ nhận việc cắt điện rồi
1878807089315079,1878781642650957,,son.pt.5,Sơn PT,Trang chủ evn bác tin vịt này rồi nhé
1878793119316476,1878781642650957,100055036110533,,Hii Truynh,"Vấn đề là sóng kém, chập chờn"
1878787252650396,1878781642650957,,numa51,Juan Nguyen,tiếc ghê tiếc hùi hụi :))
1878785635983891,1878781642650957,,chinhh.nguyenn.1,Chinh Nguyễn,mô phật😀
1878783552650766,1878781642650957,,trungnt271,Trung,mấy bác đi làm t7 đã về nhà chưa??
1878783052650816,1878781642650957,,nhatdeptraivodichvutru,Vũ Minh Nhật,Cúp hết ngày mai r 👀
