post_id,user_id,user_name,fullname,content
1706225416844383,,hungpn.tr79,Phan Hùng,"Chào các bác cho em hỏi có giải pháp nào thay thế cho bình nóng lạnh năng lượng mặt trời không ạ?
Em ở miền trung, nhà có con nhỏ sắp vào mùa mưa liên tục mà con rơ le của bình nóng lạnh nó tèo rồi, nghiên cứu báo giá thay thế khoảng 7 - 8 loét + công bảo dưỡng vệ sinh 7,5 loét chưa kể các loại roan đi kèm.
Cách đây 5 năm nhà em cải tạo lại phòng ngủ, thì hệ ống nước thay đổi không có chừa lỗ để lắp bộ nóng lạnh gián tiếp. Giờ em phải nấu nước sôi bằng bình đun 1.7L, nhà đông con nấu kiểu này phê quá.
Nhờ các bác hỗ trợ phương án khả thi việc sử dụng nước nóng mùa mưa.
Em cảm ơn.
#Tuvan #Hoidap #nonglanh #mattroi."
