comment_id,post_id,user_id,user_name,fullname,content
8574853672596838,8569789819769890,100069592038926,,Mi Mi,"b tham khảo thử bsi xuân việt, hnay mình mới tới khám thử, m cũng tham khảo trên mạng r mới qdinh đến đây
nghe tư vấn thì thấy cũng oki b ạ, còn để tgian theo phác đồ điều trị của bác xem sao"
8578142575601281,8569789819769890,100081040037446,,Thư Xinh,"Ma mãnh là sao á bà, kiểu chèo kéo mua dịch vụ ấy hả. Giờ pk càng hot thì càng k ok lắm 😂. Mình trải nghiệm rồi kk thà đtri pk bình thường mà đc takecare kĩ còn ổn hơn, đằng nào vẫn là các bsdl có chuyên môn thì mới đc làm bs mà. Giờ đang thấy vụ phốt bs KHN đó mà bác khá nổi luôn"
8578207822261423,8569789819769890,100024802726616,,Tien Hoa,Hồi trước mình cũng bị mụn lưng mà nhiều lắm còn lan sang hai vai. Này do vệ sinh da với dị ứng nên bị. Mình Đi o2 skin trị vài tháng hết sạch
8582712125144326,8569789819769890,100082750374487,,Phạm Thắm,"Mình ở TpHCM. Đi phòng khám da liễu SG SGC. Đã trị mụn thành công.
Bên đó cũng tư vấn gói trị liệu. Nhưng mình có thể lựa chọn chứ ko bắt buộc và chèo kéo"
