comment_id,post_id,user_id,user_name,fullname,content
2047137755718850,2046950972404195,,kudo.nguyen.334,Trinh Nguyễn,"Cũng ng Phủ Lý à, thế lên Đồng Văn hoặc sang Châu Sơn làm. Có tí tiếng Trung thì tuyển nhiều lắm"
2047137205718905,2046950972404195,100010245030430,,Thuy Nguyen,Làm việc ở khu công nghiệp chính sách cũng ổn định mà bạn. Có Ban quản lý khu công nghiệp luôn luôn sát sao với các doanh nghiệp nên chế độ của người lao động về luật sẽ không bị thiệt đâu. Bạn cứ mạnh dạn làm nhé. Tuy nhiên cường độ làm việc không nhẹ nhé 😃
2047144805718145,2046950972404195,,,Thành viên ẩn danh 513,"E làm ngành gì, nếu học may thì c có job cho em ở Phủ Lý nhé"
2047141055718520,2046950972404195,,phuong.thao.hr.2024,Phương Thảo HR,Làm kcn nhiều chế độ mà bạn. Môi trường cũng chuyên nghiệp . Nhưng yêu cầu bạn phải có ngoại ngữ và chịu được làm ca kíp nhé
2047130115719614,2046950972404195,,yyds.ngtuan,Nguyễn Tuấn,"Miền bắc thì có Bắc Giang, Bắc Ninh ,Hưng Yên
Đa số biết 1 trong 3 ngôn ngữ Anh,Trung,Nhật là ok"
2047137969052162,2046950972404195,,secret.217.yan,Nina Yan,"Biết tiếng Trung ko bạn, bên mình đang cần tuyển phiên dịch dự án ở Đồng Văn 3"
2047139865718639,2046950972404195,100006478013338,,Thúy Ngân,"nếu bạn nào ko muốn làm ở KCN mà muốn làm sale thì ib mình nha, mình tuyển ở HCM và Hà Nội."
