comment_id,post_id,user_id,user_name,fullname,content
8607668405982031,8604470662968472,,ths.bsdanh.dalieu,Ths.Bs Danh Da liễu,"Với những nốt mụn viêm em sd các hoạt chất bôi mụn để cải thiện nhé, sau đó đến các thâm đỏ sau mụn em có thể bổ sung serum chứa thành phần như Tranexamic, Arbutin, Kojic acid, Niacinamide, Vitamin C, Glutathion.. chú ý chống nắng đầy đủ. Em i.b anh hướng dẫn điều chỉnh skincare nhé"
8604866549595550,8604470662968472,,vananh.shibi,Vân Anh ShiBi,"Đầu tiên em nên xác định được cho chị da của em thuộc loại nào Vì nếu không em sẽ không bao giờ tìm được cho mình sản phẩm chăm sóc da phù hợp mà em chỉ đang phí tiền mà khả năng dị ứng là khá cao. Và da bị mụn thì có rất nhiều nguyên nhân thường là do làm sạch da không kỹ hoặc là do sản phẩm skincare chứa chất dưỡng nhiều hoặc là do ăn nhiều dầu mỡ, cay nóng cũng có thể là do rối loạn nội tiết, căng thẳng, thức khuya.. Em nên xác định lại cho chị nguyên nhân là gì và khắc phục những nguyên nhân đó thì em đã góp phần điều trị mụn được 50% rồi. Tiếp theo nữa , em nên tối giản skincare chỉ sd những sp như srm dịu nhẹ, ko bọt ko hương để giúp kiểm soát dầu, xịt khoáng, dưỡng ẩm cấp nước, serum phục hồi, tẩy trang, trị mụn chứa azelaic acid kết hợp retinol dạng thấp, chấm mụn kháng sinh để đẩy và gom khô nhân mụn, che chắn kĩ và dùng kem cn( chọn loại ko làm bí tắc lcl) khi ra ngoài
.Ngoài ra, em nên tránh thức khuya, stress, ăn những thức ăn chứa nhiều đường, dầu mỡ ,cay nóng, socola ,cà phê ,trà sữa, thức ăn njhanh.Tăng cường rau xanh, uống trên 2l nước mỗi ngày.
Nếu chưa rành thay vì loay hoay tự tìm sp thì em nên chọn mua sp ở nơi có chuyên môn để được theo dõi, điều trị và hỗ trợ đổi trả để ko mất tiền oan mà hiệu quả cao. Chúc em sớm có làn da đẹp"
8605031192912419,8604470662968472,,moon.nhi.16568,Moon Nhi,"Mụn này do sản phẩm dưỡng da không hợp và ăn uống không lành mạnh nhé. Kiểm tra lại kem dưỡng da và srm nhé ạ. Mụn trứng cá đỏ,nội tiết"
