comment_id,post_id,user_id,user_name,fullname,content
1706249750175283,1705056073627984,,tuan.phamanh.5074,Phạm Tuấn,Bật mode máy bay
1706274073506184,1705056073627984,,tulang.hoa,Hoa Tử Lăng,Cái đếm giờ app ấy. Rồi muốn bao nhiêu thời gian cũng đc. 5p 10p 1h 2h sao cũng dc. Đang dùng s23ul. K biết dt khác có k
1706210723512519,1705056073627984,1851601017,,Linh Ngoc Trinh,Bạn chuyển qua lướt ban ngày thử xem
1706392663494325,1705056073627984,,wolflingvolant,Thanh,Nghiện tik tok 😂
1706248190175439,1705056073627984,,tominh.thang.54,Tô Minh Thắng,Học hay làm vc cứ ném cái đt ra 1 chỗ ý ông
