comment_id,post_id,user_id,user_name,fullname,content
7907606792670391,7906297309468006,100002239621584,,Bảo Ngọc,Nt c để tham khảo cách nhé
7909546509143086,7906297309468006,,han.haky.54,Kỳ Duyên,"Này là do sắc tố da rồi. Phải dùng KCN để chống nắng kĩ, và che chắn kĩ nữa để không hình thành vết tàn nhang mới.

Còn vết cũ thì tìm các sản phẩm có thành phần B3 (Niacinamide), arbutin, Gluthanione,… để làm sáng và mờ chứ never hết. Bổ sung uống collagen nhé."
7909529275811476,7906297309468006,100092570064685,,Đức Tài,"Tàn nhang thì laser nha e.
Da e chú ý các bước làm sạch.
Muốn đều màu sáng da e thêm Aha + Tranexamic, arbutin, niacinamide nha.
Cấp ẩm phục hồi hab5 + kem dưỡng ẩm + kcn kĩ."
7909568725807531,7906297309468006,100092442021029,,Bông Skincare,"Da e tàn nhang vs mụn nhẹ
E peel da một lượt r đi lấy nhân mụn định kì
Hết mụn qua trị tàn nhang
Tàn nhang ít e chống nắng kĩ nhé
Laze r về bôi thoa các hoạt chất ức chế sắc tố tránh lên lại như Tranexamic vtm C Niacnamai
Hoặc bộ nám aithan
Cấp ẩm phục hồi kèm theo nha e"
