comment_id,post_id,user_id,user_name,fullname,content
8006814086082994,8006423106122092,,thanglong.hatgiong,Bác Sĩ Đạt,"Em bổ sung serum dưỡng sáng da mờ thâm sạm chứa thành phần như Tranexamic , Arbutin, Kojic acid, Niacinamide, Vitamin C, Glutathion.. chú ý em chống nắng đầy đủ và sử dụng viên uống sáng da kết hợp nhé."
8006793432751726,8006423106122092,100012449582268,,Đoàn Thu Phương,muốn cải thiện da rõ rệt thì c tham khảo dần retinol đi là vừa nhé
8006887429408993,8006423106122092,100092442021029,,Bông Skincare,"B5 vs kem dưỡng nha e
Hoạt chất làm sáng đều màu da như azelaic và Nia vtmC an toàn cho bầu bú
Da khá ổn"
