comment_id,post_id,user_id,user_name,fullname,content
1743121586476295,1743090503146070,61550773962146,,Phúc Nguyễn,Ngắn gọn nha chị: không nên dùng chậu mạ + không nên dùng chậu có nút bấm như này. Sau nhiều vấn đề lắm chị. Chậu trơn đơn giản vẫn là chân ái
1743122676476186,1743090503146070,,jun.nguyen.77,Nguyễn Hằng Dung,Không nên dùng ạ. Đằng sau chữ không nên có rất nhiều điều để nói.
1743133633141757,1743090503146070,,tran.quangminh.756,Minh Trần,Thôi đừng dùng mà hối hận b ạ :))
1743165243138596,1743090503146070,,huyen.ngoc.963,Phạm Ngọc Huyền,Màu đen khó nhìn thấy để vs b ạ
1743244683130652,1743090503146070,,ngo.hongnhung.9,Ngô Hồng Nhung,Theo em bác cứ thuần inox và ít chi tiết mà dùng ạ!
1743128623142258,1743090503146070,,doan.luu.9674,Lưu Doan,Chậu konox bh 10 năm vân sần chống xước . mua chậu tặng vòi. Đáng để ra tiền đó c
1743134813141639,1743090503146070,,kun.kung.1422,Thắm Nguyễn,"Mình thấy inox chân ái nha bạn ơi,nhà mình 3 năm mấy rồi rửa xong lấy búi inox chà vẫn i chang mới sạch sẽ,nhà bạn mình làm sau dc thầu tư vấn loại này mới 1 năm máy nó bong ra lóm đóm và đặt biệt hôm nào ăn dầu mơ nhìu cọ rất cực kiểu nó cứ dính bên bếch á"
1743152539806533,1743090503146070,100007297159028,,Thơ Trần,"K nên dùg nha b,bữa mình koi bài c kia đăg dùg chậu này nè qay video đóng cặn canxi khiếp lun"
1743177806470673,1743090503146070,,van.bong.988711,Vân Bông,Huyền Đậu
1743177749804012,1743090503146070,,van.bong.988711,Vân Bông,Huyền Đậu
