comment_id,post_id,user_id,user_name,fullname,content
1714731495993775,1712312592902332,,nhutvantrinh,Trịnh Văn Nhựt,Tắt Bitlocker chưa ?
1714739505992974,1712312592902332,100008176817526,,Tang Minh,Không up bios bừa bãi
1714760295990895,1712312592902332,,LuuManhDung,Quang Dũng,Bios K sao thì thôi đừng update
1715928212540770,1712312592902332,100092871450364,,Tran Dong Vuu,k cần thì đừng up b ơi
1715989672534624,1712312592902332,100087996330493,,An Thái,Vâng e cảm ơn các bác
1714746355992289,1712312592902332,100002267285896,,Đào Duy Công,Máy đời cũ méo update đc sao ấy
