comment_id,post_id,user_id,user_name,fullname,content
1827124704484148,1826802257849726,100066856773332,,Hồng Phương,"Minh bổ sung collagen của công ty dược, mờ nám tàng nhang k lên nữa đó
Trắng da ngăn ngừa lão hoá nữa"
1827126507817301,1826802257849726,,dung.thuythuy.9210,Thuỳ Thuỳ Dung,https://s.shopee.vn/3VRbOvFrgx
1827132481150037,1826802257849726,100080718859914,,Tôn Ngộ Không,rcm b dùng kem dưỡng này https://s.shopee.vn/6pi3NZUKNO
1827136687816283,1826802257849726,,yenpham2609,Phạm Yến,"- tàn nhang đâm dùng Cos hoặc tre, hq4 Điều trị ngoài một tháng là cải thiện nha. Bôi ngoài uống trong càng tốt nhé
Kèm phục hồi cấp ẩm chông nắng đầy đủ là ok nha"
1827142617815690,1826802257849726,100030153903991,,EMspa Chuyênđiềutrị Da,Hải phòng qua mình bắn laser 1 tuần là sạch nha
1827149497815002,1826802257849726,100083230755341,,Nguyễn Hoa Dược Sỹ,"Đôm nâu này bôi thoa ko hết dc cần làm sạch da thêm các sp sáng da như tranexmic arbutij hq4 aha
Ngủ sớm hạn chê thức khuya
Săn hàng dược mi phẩm điêu trị theo sát da"
1827171047812847,1826802257849726,100003126604086,,Linh Nguyen,"Da nám,tàn nhang bạn nhớ chống nắng kỹ
Sau đó bóc tách sắc tố: peel da bằng các hoạt chất (aha,bha,tca,glycolic,retinol…)
👉🏻Tiếp đó phục hồi da: tế bào gốc,EGF,vitamin A,C,E
👉🏻Kết hợp các hoạt chất ức chế sắc tố melalin: HQ 2-4%,abutin,tranexamic acid,nia….
Đồng thời uống điều hoà nội tiết và thực phẩm Đồng thời uống điều hoà nội tiết và thực phẩm"
1827171734479445,1826802257849726,100080922901989,,HaLy Phạm,"=> Da bị nám & sắc tố như này
Muốn nhanh ok thì dùng Cos2 hoặc HQ + Tre nhé
Còn lâu dài an toàn thì Peel định kỳ kết hợp :
Tre + AHA + Arbutin/Tranexamic / Kojic/ Hq2…👌

👉AHA: điều tiết, giảm bít tắc lcl, làm sạch sâu tbc của da
👉Arbutin/ Tranexamic/ Kojic/ Hq2…: cải thiện & ức chế Sắc tố, sáng & làm đều màu da

=> Routine như nào cho hợp lý nữa nhé☘️,"
