comment_id,post_id,user_id,user_name,fullname,content
8000891463341923,7996453177119085,100092442021029,,Bông Skincare,"Da mụn ẩn trán và munn viêm nhiều
E hạn chế thức khuya ăn đồ cay nóng nha e
Điều trị đi kèm phục hồi
Thêm lọ chấm mụn viêm
Adapalen trị mụn kết hợp bha tẩy tế bào chết tuần 1-2 lần
Mụn gom e đi lấy nhân mụn định kì
Peel da một lượt giúp da thông thoáng ăn dưỡng nhé"
8004252769672459,7996453177119085,100083230755341,,Nguyễn Hoa Dược Sỹ,"E chinh lại chế độ ăn ngủ nghi nhé
Nền da này hiện tai nhiều mụn ẩn đẩy viêm
Thêm tây da chết
Câp ẩm da và đi lấy nhân mụn
Ngủ nghi hơp lý"
