comment_id,post_id,user_id,user_name,fullname,content
7907781569319580,7900984483332622,,tru.lothi.5,Hồ Xuân Hương,"2 sp trị mụn đỉnh caooo

Đặc biệt da đã qua dùng thuốc rượu, kể cả mụn lâu năm vẫn xử lý rất nhanh nhé😉
Xoa tầm 7 bữa đã thấy hiệu quả gôm cồi mụn , hết sưng đỏ đến 70% rồi ạ"
7909968889100848,7900984483332622,,ha.dieuha.585,Dieu Ha,"Da này là mụn viêm rồi em, đtri kháng viêm"
7909473405817063,7900984483332622,100092570064685,,Đức Tài,"Mụn viêm và có ít mụn ẩn .
E chú ý các bước làm sạch.
Azelaic + serum kẽm trị mụn.
Thêm lọ chấm mụn viêm biotrade.
Cấp ẩm phục hồi hab5,b9 + kem dưỡng ẩm mỏng nhẹ thoáng da.
Gom mụn lấy nhân nha e.
Hạn chế thức khuya, nên ăn uống ngủ nghỉ sinh hoạt hợp lý."
7909688529128884,7900984483332622,100092442021029,,Bông Skincare,"E đang dùng sp j r
Tối giản lại nhé
Làm sạch tẩy trang- srm dịu nhẹ
Chấm mụn viêm cho gom nhân
Da đỏ yếu cấp ẩm vô cho da dịu
Srum mụn trị mụn nhẹ kháng viêm
Ko nặn mụn non nhé
Uống thêm bên trong đc thì sẽ OK"
