post_id,user_id,user_name,fullname,content
1910934752768979,,,,"Em muốn hỏi cả nhà đã ai đang goldengate đặc biệt là gogi giống như em chưa ạ
Em là sinh viên năm 2 đã từng đi làm ở quán cà phê và quán cơm nhưng mà vì lịch học nên e nghỉ 1 thời gian và sau khi sắp sếp ổn thoả có xin đi làm ở gogi ( e xin phép k nó rõ địa chỉ)
Ngay từ đầu lúc xin phỏng vấn a K quản lí có bảo lịch làm được đăng kí theo lịch học và cuối tuần không được nghỉ, e ok và thấy khá vui vẻ về nơi đây nhưng mọi chuyện không như em nghĩ
1: Trong công việc vì e đã từng đi làm nên rất biết điều, nhiều khi đông khách có hôm 14h hết ca nhưng e cũng toàn ở lại thêm 30p đến 1h những ngày lễ thậm chí còn hơn nhưng chưa bao giờ BQL có hỏi han nhân viên có mệt hay có đói hay tăng ca không có mà chỉ thấy bọn e k nói gì là cứ chăm chăm đón khách, có những hôm đón xuyên trưa
Em biết là các a chị đón đông được thưởng cao( nghe được cả tháng lương) nhưng mong các a chị sắp xếp hợp lí có ca trực chứ đừng lợi dụng bọn e để đạt được mục đích. E nói thật là làm quần quật thưởng cao nhất e nhận được có hơn 100k 🙂
2: Cống hiến không sao nhưng nhiều khi đi học về muộn do tắc đường đến trễ 10-15p bi lôi ra nói rồi còn doạ cho nghỉ việc, buồn thật sự 😭😭😭
3: Biết là cuối tuần k được nghỉ, nhưng nhiều khi có việc bận đki nghi và báo trước nhưng bql vẫn xếp lịch cho đi làm và bảo câu xanh dờn, k đi làm thì nghỉ luôn đi. Ủa e có xin trước 1 tuần r cơ mà có phải nghỉ đột xuất đâu.
4: Đỉnh điểm khiến e chia tay nơi đây
Hôm đó cuối tuần, đông khách ít nhân viên không có tạp vụ. Em phải vào làm tạp vụ. rửa bát bình thường nhưng mà đến 22h kém vẫn đón khách.
Bên trong rất nhiều bát và rửa xong thì cũng gần 12h đi ra thì chả còn ai còn 1 một chị đợi khoá cửa đi về
Cũng chả ai vào hỏi e có cần giúp hay là như không,
BQl xong là về còn kb nhân viên của mình như nào!"
