comment_id,post_id,user_id,user_name,fullname,content
1887006708495117,1886786831850438,,khanh.pk8888xyccv788765x6i,Minhh Khánhh,IT vừa rồi chả sa thải 1 loạt vì không có việc để làm giờ lại đâm đầu vào 🤣
1886916668504121,1886786831850438,,nhanle.it,Nhan Le,"đúng ngành còn k có việc bạn ơi, đừng làm mồi cho mấy trung tâm lùa gà"
1886835505178904,1886786831850438,,nguyenthuha285,Hà Nguyễn,Đúng ngành còn đang thất nghiệp đầy ra 😂
1886889125173542,1886786831850438,100046786489915,,Bùi T. Giang,nên học ở trung tâm nữa nhé + rồi đi làm tts 1 tg cho chắc tay nghề
1886819518513836,1886786831850438,,phuoc.levanphuoc,Le Van Phuoc,"có đam mê thì vẫn ok thôi ! cái nghề này giờ cũng bão hòa ! nếu đã có base kĩ thuật rồi bạn có thể tìm hiểu về iOT, Nhúng,... còn đổi ngành vì tiền thì quên đi."
1886794761849645,1886786831850438,,tuan.khang3.9.2,Tuấn Khang,Làm kĩ thuật tiếp đi bạn
1886801218515666,1886786831850438,,changervif,Nguyễn Quang Trung,"Theo tôi thì: Đừng tham gia khóa học nào cả. Đi học thì cố gắng học cho nó bài bản thì may ra theo được nghề, không là cứ chấp chới chả đâu vào đâu cả. Trường lớp thì đầy, học trên mạng thì rủi ro nhiều. Bạn cứ tự cân nhắc nhé."
