comment_id,post_id,user_id,user_name,fullname,content
2400161193793037,2400104373798719,100029079253312,,Nguyễn Lê Ngọc Nhi,Hoàng Võ người giữ nhà
2400139473795209,2400104373798719,,kun.dien,Vương Linh Lan,tẻn tẻn là sao :)))) nhưng nghe với trông mặt cũng tẻn tẻn thật đấy :))))
2400163747126115,2400104373798719,,wazasjk9,Yang Huynh,con mèo dùng dầu gội gì nhìn mượt vậy :))
2400165667125923,2400104373798719,,thien.lieu.3705,Liam Ho,"Thị Leo mặt non chẹt, mà bộ râu hú hồn 🙄"
2400129090462914,2400104373798719,,Tangphotocredit,Cao Yuan,xấu mà còn gian hồ nưa haha
