post_id,user_id,user_name,fullname,content
1309590196140280,,,,"Xin chào mọi người, mình xin phép review Cty AT-Com, một cty KHÔNG nên apply vào. Mình là nạn nhân chiêu trò của HR và GĐ công ty này.
Trước tiên, mình nhận ofer cty này với mức lương A và khoản phụ cấp B được trả theo chu kỳ 3th (nếu cam kết làm 2 năm). Mình cảm thấy oke, vì bản thân mình khi đi làm cũng muốn gắn bó với 1 cty ít nhất là 2 năm, đương nhiên theo Luật LĐ thì mình và cty vẫn có 2th thử việc để trãi nghiệm. Nhưng ngày đầu làm việc, nhân sự cty này đã bắt tất cả nhân viên đều phải ký HĐLĐ và bản cam kết, khi mình hỏi thì nhân sự trả lời rằng: ký HĐLĐ nhưng vẫn theo luật thử việc 2th và ký cam kết để mình nhận được khoản B từ tháng thử việc.
Với câu trả lời như vậy và đảm bảo từ nhân sự thì bản thân mình cảm thấy cũng không vđe gì.
Nhưng sau hơn 1th thử việc, mình cảm thấy công việc và các chính sách, định hướng của cty không phù hợp với bản thân, nên mình đã viết đơn xin kết thúc công việc sau khi đủ 2th thử việc để cty tuyển người backup. Sau đó, mình vẫn hỏi lại nhân sự các vđe về bản cam kết có ảnh hưởng gì không và nhân sự xác nhận mình vẫn thử việc nên không áp dụng.
Đến ngày cuối làm việc, mình vẫn bàn giao theo đúng thủ tục và không nhận thêm thông báo gì từ nhân sự hay quản lý, GĐ.
Đến chu kỳ lương, mình không nhận được lương của mình và bất kỳ email thông báo gì từ cty. Sau khi hỏi nhân sự cty AT-Com thì nhận được câu trả lời là: không biết về việc trễ lương này, để check lại.
Và sau đó, mình nhận được email thông báo bồi thường vì vi phạm cam kết 2 năm????
Sau rất nhiều email trao đổi qua lại, mình vẫn không nhận được phản hồi đi vào vđe về việc có thanh toán lương hay không, vì toàn bộ thông tin trao đổi với nhân sự trước đó về việc thử việc không áp dụng cam kết mình đều ghi nhận lại và đã gửi qua email, nhưng cty cố tình không đi vào vde đó mà vòng vo và cố cho là do mình đã ký cam kết trước đó.
Bạn Nguyễn Đình V****nhân sự cty AT-Com và GĐ cty cố tình lấp liếm cho qua chuyện, bạn Q-nhân sự cty là người tuyển dụng vị trí của mình và trao đổi công việc từ lúc nhận việc đến khi mình nghỉ thì phản hồi kết 1 câu là không được biết quy trình từ GĐ và bạn V**** này. Mình có hỏi: cty có mấy phòng HR, mà mỗi ng trả lời 1 kiểu, ng này trả lời thì ng kia phủ nhận, đến khi làm căng thì chối bỏ trách nhiệm.
Sau mấy tháng trời mình vẫn cố theo để đòi lương, vì đây là tiền mình đáng được nhận. Bạn V**** lúc thì trả lời là đang đề xuất GĐ, lúc thì kêu GĐ chưa duyệt lương, lúc thì kêu GĐ phản hồi “lương sẽ trả nhưng sẽ trả chậm”, và sau cùng thì kêu cứ theo thông báo ban đầu????
Thật ra, ngay từ đầu cty đã cố tình bẫy NLĐ, thì cuối cùng người chịu thiệt vẫn là NLĐ, nhưng mình rất không hài lòng với cách làm việc của GĐ công ty và bạn nhân sự này, nếu không trả thì nói không trả, cứ lòng vòng lúc này lúc khác. Và đặc biệt, có rất nhiều trường hợp giống mình, nhưng có một vài trường hợp được trả lương vì học chung trường với bạn V**** này, có bạn chung vs bạn nên bạn sợ bị phốt hoặc lý do acb gì đó, nhưng vẫn được thanh toán lương. Còn các trường hợp còn lại, có mình, vẫn KHÔNG nhận được câu trả lời thoả đáng.
Đến hôm nay, mình viết những dòng này ra, mình chỉ hi vọng là 1 bài học cho các bạn khi apply vào cty này hoặc những cty khác hãy cẩn thận và cân nhắc.
Cảm ơn các bạn đã đọc đến đây."
