post_id,user_id,user_name,fullname,content
1888697471659374,,,,"E xin a c lời khuyên ạ.
E định chuyển việc về công ty ở gần nhà làm nvkd. Mà nghe chị Hr nói bên Phòng KD đang có vấn đề, chắc sẽ cho ra đi cả phòng KD, hay cả nhóm kd gì đó nên e sẽ ngồi riêng.
Liệu e có nên nhảy việc ko ạ.
👉 đang làm nvkd 1 CTY lương 5tr, ko phụ cấp gì, 3%hh bán hàng. Hàng ngách cũng khó bán. E làm được hơn 1 năm xíu.
👉 Công ty chuẩn bị apply NVKD bên y tế thì trả 9tr + 1%hh. Khả năng sẽ phải đi tỉnh chăm sóc KH 1-2 ngày/tuần.
Rất mong được sự góp ý của a/c."
