comment_id,post_id,user_id,user_name,fullname,content
1801804427016176,1801653863697899,100094529220725,,Nguyễn Ngân,"Chữa vnlmà dùng sp hay thuốc thì không ăn thua nhé, vẫn tái lại thôi. Mình trc đây từng trải qua rồi nên biết. May mình tìm đc cách chữa phù hợp không thì kb bao giờ mới khỏi đc nữa cơ.hồi đó mình dtri ở bên chị CEO Vicky Thuận dc chị ấy tư vấn và dtri rất kĩ nên an tâm"
1801779517018667,1801653863697899,100092658605859,,Minh Ty,"Chị qua bên Viện Thẩm Mỹ Royal thăm khám và điều trị nè chị.chứ dùng Mỹ phẩm này, kia không hết đôi khi không hợp lại hư da"
1801878040342148,1801653863697899,100083230755341,,Nguyễn Hoa Dược Sỹ,"Bi năng thê
Dùng tắm táy thi hoăc gynosap
Kết hợp bôi adapalen nhe"
1801711927025426,1801653863697899,100080718859914,,Tôn Ngộ Không,"dùng sữa tắm này nha cậu, an toàn hiệu quả, đỡ mụn và viêm nang lông đọc fb cũng biết nè, loại matcha khổ qua á

https://s.shopee.vn/9Uhw4mBKle"
1801877780342174,1801653863697899,100094649701230,,Hà Nhi,"Vnl nặng rồi đấy bạn ạ, đi điều trị sớm đi ko để lâu nó lan nhiều hơn đó mách bạn qua bên bác Vicky Thuận này điều trị vnl hiệu quả mà giá cả phải chăng nè, trc mk bị vnl ở chân tay chữa bên này khỏi dứt điểm rồi giờ tự tin váy vóc ròiii"
1801742607022358,1801653863697899,100050211463486,,San San,https://s.shopee.vn/Vn7XnFY7H
