comment_id,post_id,user_id,user_name,fullname,content
1736818807124458,1736809797125359,61559533331313,,Nguyen Thanh,Mai thử lại lên đậm hơn là OK nha m
1736823450457327,1736809797125359,100093056183707,,Thy Khuê,Mai thử lại lên đậm hơn là OK nha m
1736821037124235,1736809797125359,100093359202003,,Phan Ngọc Kim,Có thấy vạch mờ nha
1736813073791698,1736809797125359,100093400237966,,Chử Uyên Hải,ngày 9 rồi hả mom
1736829223790083,1736809797125359,100084184585370,,Hoài Thương,"Con cái là do Trời ban. Bé tới sớm hay muộn là do nhân duyên của mỗi người mỗi vợ chồng. Bạn nào khó có Con. Mong con mau đến với mình, muốn IVF thành công, muốn con khỏe mạnh trong suốt thời gian thai kỳ, HAY có Bé Trai hoặc bé Gái.
Hữu duyên nhắn tin qua cho Chị, chị hướng dẫn và chia sẻ cho Các bạn ""Bài khấn Cầu Con"" xin lên Mẹ Bồ Tát Quan Âm đúng cách để được linh ứng ( Bài khấn Hoàn toàn M.i.ễ n phí - Chị làm vì muốn tích phước mà thôi ). Rồi sau đó các bạn TỰ KHẤN XIN ở nhà. ( không cần nhang đèn hoa quả, l.ễ v.ật gì cho tốn kém, chỉ cần lòng thành tâm cầu khấn Ngài là được)🙏"
1736828060456866,1736809797125359,100093041860278,,Ứng Châu,Nhã vía cho các mẹ 2 vạch đỏ chót.beta cao vút nha
1736825443790461,1736809797125359,100093373841327,,Quỳnh Hạnh,"EM THẤY VẠCH MỜ RÙI MOM ƠI, CHÚC MOM SỚM ĐÓN CON YÊU THÀNH CÔNG NHA"
1736812440458428,1736809797125359,100093247578069,,Ngà Vòng Khuê,Mờ là có hi vọng roi a . Do thai làm tổ muộn a
