post_id,user_id,user_name,fullname,content
532306671386568,,nhim.1412,Nguyễn Thị Thu Hiền,"#doublemask #mák #review
𝐁𝐢́ 𝐤𝐢́𝐩 đ𝐚̆́𝐩 𝐦𝐚̣̆𝐭 𝐧𝐚̣ 𝐠𝐢𝐮́𝐩 𝐝𝐚 𝐦𝐮̛𝐨̛́𝐭 𝐦𝐮̛𝐨̛̀𝐧 𝐦𝐮̛𝐨̛̣𝐭 ✨
Hé lô cả nhà iu, em là đứa siu lười đắp mặt nạ giấy nhưng sau khi biết được bí kíp đắp mask siu xịn mịn này thì em đã chăm đắp mask hơn nên lỗ chân lông được cải thiện và da lúc nào cũng căng mượt hết chơnnn. À da em thuộc da hh thiên khô, lcl hơi bự xíu 🥲
Bí kíp của em là dùng phương pháp 𝐝𝐨𝐮𝐛𝐥𝐞 𝐦𝐚𝐬𝐤. Đây là cách đắp mặt nạ lần lượt 2 mask: 1 là mặt nạ làm sạch sâu trong vòng 10-15p sau đó rửa sạch và đắp lớp mặt nạ thứ 2 là mặt nạ dưỡng. Đây cũng là cách mấy chị đẹp bên Hàn áp dụng và nó thực sự có hiệu quả ngay sau khi đắp mng ạ 😬
Đọc đến đây mng có thấy quen ko ah, chắc chắn là chị em cũng từng thử cách này rùi ấy 🤣 đắp 1 em mặt nạ đất sét để làm sạch sâu lấy đi dầu nhờn, sau đó cảm giác da còn thiếu 1 chút ẩm nên đắp 1 miếng mặt nạ giấy cho đủ bộ, em đã từng làm z rồi nhưng h mới biết tên của cách đắp mask này là Double mask mng ơi, em quê mùa quá 😬
Cách mà em thường dùng để double mask hiệu quả (áp dụng 2 lần/ tuần):
-Tẩy da chết trước khi double mask.
-Lớp mặt nạ đầu tiên: Em dùng mặt nạ đất sét để làm sạch sâu như vậy làn da sẽ hấp thụ được các dưỡng chất 1 cách tối đa. Ở bước này em chỉ đắp mặt nạ tầm 10-15p thui.
-Lớp thứ 2: tuỳ tình trạng da hôm đó thiếu ẩm, bị mụn hay bị kích ứng thì em sẽ chọn mặt nạ phù hợp, nhưng chủ yếu thì em vẫn chọn mặt nạ giấy là chủ yếu vì em nó dễ sử dụng và phù hợp túi tiền của đứa đỗ nghèo khỉ như iêm 🤣 bước này em cũng chỉ đắp 15p.
Dưới đây là các loại mask ngon-bổ-rẻ mà em dùng:
-Mask đất sét 𝐆𝐥𝐨𝐰 𝐬𝐨𝐟𝐭𝐞𝐧𝐢𝐧𝐠 𝐦𝐚𝐬𝐪𝐮𝐞 𝐜𝐮̉𝐚 𝐂𝐡𝐮𝐜𝐨𝐬. Đây là loại mặt nạ đất sét Kaolin có khả năng hút sạch 98% dầu thừa, làm sạch sâu và tẩy tế bào chết cho da. Em nó còn chứa tinh dầu hạt Macadamia giúp dưỡng ẩm nên sau khi đắp da sẽ ko bị khô như các loại mặt nạ đất sét khác. Sau 2 tháng sử dụng tích cực kết hợp double mask thì da em sáng, đều màu và ẩm mịn hơn mặc dù trc đó da mình hay bị khô. Em này thì da nào cũng dùng đc nhen.
Mặt nạ giấy:
-Nếu 𝐝𝐚 𝐤𝐨 đ𝐞̂̀𝐮 𝐦𝐚̀𝐮, 𝐧𝐡𝐢𝐞̂̀𝐮 đ𝐨̂́𝐦 𝐭𝐡𝐚̂𝐦 𝐬𝐚̣𝐦, 𝐧𝐚́𝐦, em sẽ chọn mask có thành phần dưỡng trắng, làm sáng da an toàn như vitC và E của 𝐍𝐚𝐭𝐮𝐫𝐚𝐥 𝐕𝐢𝐭𝐚𝐦𝐢𝐧 𝟐𝟏.𝟓% 𝐄𝐧𝐡𝐚𝐧𝐜𝐢𝐧𝐠 𝐒𝐡𝐞𝐞𝐭 𝐌𝐚𝐬𝐤: Em này sẽ cấp ẩm tức thì, làm dịu các vết đỏ, hỗ trợ làm đều màu da và chống lão hoá ổn áp lắm lun.
-Nếu da 𝐧𝐡𝐚̣𝐲 𝐜𝐚̉𝐦, 𝐛𝐢̣ 𝐤𝐢́𝐜𝐡 𝐮̛́𝐧𝐠 em sẽ chọn mask dưỡng chứa thành phần làm dịu, khỏe da từ sâu bên trong: 𝐌𝐮𝐠𝐰𝐨𝐫𝐭 𝐒𝐡𝐞𝐞𝐭 𝐌𝐚𝐬𝐤, em này có chiết xuất ngải cứu giúp làm dịu và phục hồi cho da khi bị ứng hoặc 𝐌𝐢𝐝𝐧𝐢𝐠𝐡𝐭 𝐁𝐥𝐮𝐞 𝐂𝐚𝐥𝐦𝐢𝐧𝐠 𝐒𝐡𝐞𝐞𝐭 𝐌𝐚𝐬𝐤 𝐜𝐮̉𝐚 𝐊𝐥𝐚𝐢𝐫𝐬 vì em nó có tác dụng giảm nhiệt độ trên da và giảm kích ứng, đồng thời với bột than tre em còn giúp kiểm soát dầu thừa, hạn chế mụn đầu đen và làm sạch lỗ chân lông.
-Nếu 𝐝𝐚 𝐛𝐢̣ 𝐦𝐮̣𝐧 𝐯𝐢𝐞̂𝐦 𝐬𝐮̛𝐧𝐠, em sẽ dùng mask dưỡng chứa thành phần trị mụn, kháng viêm, diệt khuẩn: Tea Tree Oil, Niacinamide như 𝐃𝐫.𝐌𝐨𝐫𝐢𝐭𝐚 𝐓𝐞𝐚 𝐓𝐫𝐞𝐞 & 𝐋𝐢𝐜𝐨𝐫𝐢𝐜𝐞 𝐏𝐨𝐫𝐞 𝐑𝐞𝐟𝐢𝐧𝐢𝐧𝐠 𝐅𝐚𝐜𝐢𝐚𝐥 𝐌𝐚𝐬𝐤, ngoài ra em này còn có chiết cam thảo hỗ trợ làm đều màu da và Sodium PCA giúp tăng cường độ ẩm trên da.
-Còn hôm nào 𝐝𝐚 𝐤𝐡𝐨̂ 𝐯𝐚̀ 𝐭𝐡𝐢𝐞̂́𝐮 𝐬𝐮̛́𝐜 𝐬𝐨̂́𝐧𝐠 thì em sẽ chọn mask có tác dụng cấp ẩm sâu có chứa thành phần Sodium Hyaluronate, Ceramide,Beta-glucan như 𝐑𝐢𝐜𝐡 𝐌𝐨𝐢𝐬𝐭 𝐒𝐨𝐨𝐭𝐡𝐢𝐧𝐠 𝐂𝐫𝐞𝐚𝐦 𝐜𝐮̉𝐚 𝐊𝐥𝐚𝐢𝐫𝐬 để làm mát da tức thời đồng thời giúp da ngậm nước hơn.
Mng yên tâm là dùng phương pháp này rồi thì chỉ có nghiện đắp mặt nạ thôi ạ vì hiệu quả thấy ngay sau khi đắp: Da sáng hồng mịn màng, lỗ chân lông đc cải thiện, da mặt căng bóng đàn hồi hơn như vậy sau bước này chỉ cần dưỡng nhẹ nhàng là đủ.
Mong là với bí kíp đắp mask này sẽ giúp cho chị em có 1 làn da đẹp. Cám on mng đã đọc bài ạ 😘"
