comment_id,post_id,user_id,user_name,fullname,content
1755589701914035,1755431725263166,61551413946456,,Mỹ Trinh,Tìm ngnhan nghỉ ngơi 1 thời gian rồi hẵn làm tiếp m nhé
1755577905248548,1755431725263166,100066271796473,,Anna Lê,tìm nguyên nhân trc đi mom
1755578841915121,1755431725263166,100091543760625,,My Kinh Vân,mom nghỉ 1 thời gian rồi chuyển tiếp nha
1755574975248841,1755431725263166,100094225395264,,Kim Dung Võ,mom có sl phôi ko
1759317674874571,1755431725263166,61558122632531,,Hương Nguyễn,Nên tìm nguyên nhân rồi nghỉ ngơi 1 thời gian để hồi phục sức khỏe đã mom ạ. Chúc mom sớm thành công đón con yêu nhé.
