comment_id,post_id,user_id,user_name,fullname,content
8501074426641430,8500156470066559,100022358590445,,Phạm Viêt,Bước đầu phải đầu tư cỡ 3 4 củ đổ lại
8501067323308807,8500156470066559,100022358590445,,Phạm Viêt,Ở dưới da kia còn nhiều mụn lắm á nó sắp viêm lên rồi
8500959916652881,8500156470066559,,sap.phuong.18,Phương Sap,Đi khám và điều trị bạn ạ. Em trai mình cũng mụn viêm tùm lum giờ khỏi rồi . Rcm Honest 148Thaithinh1 Bs đtri có tâm lắm nè
8501124513303088,8500156470066559,100070460565159,,Lê Phương Trang,"Trước tiên thì phải xử lý vấn đề mụn cả trong lẫn ngoài đã em ạ, sau đấy mình mới chữa đến cải thiện da được. Trc đợt đi chữa là cũng bị da như em luôn á, cũng may là chữa được"
8500903539991852,8500156470066559,,vuminhanh193,Minh Anh,"Ê bà, bà đi khám dl thử xem. Trước tui cũng bị mụn nhiều lắm, mà cũng giống bà cứ đến tháng lại lên đó, tui cũng mua mấy sản phẩm như AHA, BHA để trị mụn này kia nhưng cũng chẳng ăn thua đâu. Có đợt lên nhiều quá t đến dltw khám ng ta cho thuốc uống, hết thuốc mụn cũng bị lại, nản quá tui đi khám tư, sau đtrị thì da tui đẹp rồi"
