comment_id,post_id,user_id,user_name,fullname,content
1848623109000974,1847859502410668,100025162457081,,Lan Trần,"Mh từng dùng rồi b nhé nó bùng thật đấy huhu😫 trước mh bị mụn ẩn nhiều dùg xog đỏ rát rồi bị viêm ý, sau chữa gần 3 thág mới khỏi đây này"
1848641112332507,1847859502410668,61564659722397,,Thuỳ Dung,Lỗ chân lông to b tham khảo em này https://s.shopee.vn/8znF7kqyh8
1849031388960146,1847859502410668,,to.bichthuy.56,Dương Khánh Quỳnh,Bạn ib Ninh Thương này nè đợt mình bị mụn khá nặng may được bà c gthieu qua c này dùng sp bên c trộm vía hết đó mà c điều trị sp ở bệnh viện da liễu tw nên an toàn hiệu quả
1849022468961038,1847859502410668,,thanh.thuyet.378,Phan Ngọc Minh,"Nếu dưới da bạn có mụn thì nó sẽ đẩy lên nha.
Ban đầu sử dụng thì bạn dùng 1 tuần 2 lần, sau đó quen rồi thì tăng lên dùng cách ngày, rồi tăng lên dùng mỗi ngày. Dùng từ từ để xem nó có bị kích ứng hay ko. Còn break out thì cũng tùy cơ địa nữa bạn. Như mình xài thì thấy có đẩy mụn 1 xíu thôi à."
