comment_id,post_id,user_id,user_name,fullname,content
2052773225155303,2052737201825572,,kittyy9x,TyTy Nguyen,Bạn cho mình hỏi này là app hay web nào ạ? Mình cảm ơn ạ
2052774565155169,2052737201825572,,jinhanyuexi,Kim Hàn Nguyệt Hy,"Tết về nhà ông bà cô bác hỏi không biết trả lời sao 🐧
Có khi tưởng làm bé đường 🐧"
2052772308488728,2052737201825572,,ryuu520999,Ryuu,"viết content thôi ko sao, chứ còn ai đâm đầu vào thì chịu ạ :))"
2052799501819342,2052737201825572,100078326047330,,Nguyễn Phương,Huy Võ gì dữ dị
2052810455151580,2052737201825572,,iamhoanganhnguyen,Hoàng Anh,Giống như có cái sàn lớn Kucoin đó :)))
2052788225153803,2052737201825572,,daoquoctuan,Tuan Dao,"về quê Mẹ hỏi: ""Con lên TP làm cty nào vậy con?""
Đáp: ""Coincu""
Mẹ: ""Lên TP đi làm hay chơi bời mà giờ về quê ăn nói mấ.t dạ.y vậy hả?"""
2052794178486541,2052737201825572,100024960371714,,Đinh Hoàng Phong Ngân,Nguyễn Phú
