comment_id,post_id,user_id,user_name,fullname,content
1906152896580498,1905895743272880,100079690776235,,HR Nguyễn Thành,ib mình share CV trên linkedlin nhé
1906131269915994,1905895743272880,,khang.pb.3,August PK,Bạn chuyên ngành gì
1906138696581918,1905895743272880,,Maithao.N1,Mai Bích Thảo,"Tầm cuối năm này chắc vẫn phải làm sale thôi em, đây là nghề mà nhiều việc nhất, nếu e tìm được 1 môi trường tốt sẽ thấy điểm hay khi làm sale."
1906135023248952,1905895743272880,,linh.xom.52,Linh Xồm,Cố lên bạn ơi. Còn thở là còn gỡ
1906133429915778,1905895743272880,,bine.kuteee,Nguyen Trung,Ib tâm sự k b ơi !
