post_id,user_id,user_name,fullname,content
3802522950013113,,Stephen.HG.01,Hồng Giang,"Bitcoin và Altcoin
Bitcoin tiếp tục giảm hơn 1%, chạm đáy cục bộ tại ngưỡng tâm lý $60.000, mức thấp nhất kể từ giữa tháng 9. Đây cũng là cây nến đỏ thứ 4 liên tiếp trên khung thời gian hàng ngày.
Những bất ổn tại khu vực Trung Đông đã kéo giá tài sản hàng đầu giảm mạnh trong những ngày qua, từ mốc trên $66.000 trong ngày 29/09 xuống quanh $61.000 vào thời điểm hiện tại.
Altcoin tiếp tục lao dốc trong ngày hôm qua khi BTC lao dốc về sát mốc $60.000.
Beam (BEAM) và EigenLayer (EIGEN) là hai dự án có hiệu suất hoạt động kém nhất trong ngày hôm qua khi đồng loạt bốc hơi khoảng 17% giá trị.
Trong khi đó, XRP (XRP) cũng lao dốc hơn 11%, ghi nhận một trong những ngày hoạt động tồi tệ nhất kể từ giữa tháng 4.
Giá XRP đã lao dốc sau khi SEC quyết định nộp đơn kháng cáo trong vụ kiện với Ripple.
Một số dự án lớn khác trong top 100 như Lido DAO (LDO), Helium (HNT), Ethena (ENA), Akash Network (AKT), Menero (XMR), Bonk (BONK), Optimism (OP), Render (RNDR), Celestia (TIA), Theta Network (THETA), Arweave (AR), Starknet (STRK)… giảm từ 5-9%.
Ethereum (ETH) tiếp tục giảm điểm trong ngày thứ 5 liên tiếp. Tài sản có vốn hoá lớn thứ 2 trên thị trường bốc hơi gần 4% trong ngày hôm qua và hiện đang được giao dịch bên dưới mốc $2.400 vào thời điểm hiện tại."
