comment_id,post_id,user_id,user_name,fullname,content
2364564154019408,2364331510709339,100008785307708,,Trần Ngọc Ly,tội z tr. mất điện mà còn wifi à
2364582867350870,2364331510709339,61565188239930,,Ngọc Bảo,tui đang tính happy birthday ẻm =))
2364682244007599,2364331510709339,,dzungdang.IT,Đặng Đức Bảo Dũng,Nhìn như kiểu muốn liếm cái nến thế nhỉ
2364628370679653,2364331510709339,,kinhthenguyen94,Kinh Thế,"[Hỏa Tốc] Cát mùn dừa vón chắc, ít bụi, khử mùi tốt >>> https://s.shopee.vn/20cR2gaCSI"
2364912430651247,2364331510709339,,lanhuong.vuhoang.77,Triệu Lan Hương,Đã phát hiện ra âm mưu của bà già
2364570970685393,2364331510709339,,yubilyn,Đỗ Hồng Ngân,Phuong Linh Nguyen
2364571014018722,2364331510709339,,yubilyn,Đỗ Hồng Ngân,Huỳnh Tuyết Mai
