comment_id,post_id,user_id,user_name,fullname,content
7926307200800350,7926054097492327,,,Người tham gia ẩn danh,Em cảm ơn quản trị viên đã duyệt bài ạ
7928885427209194,7926054097492327,100079085771342,,Trịnh Lan,E dùng được bao lâu rồi
7927807957316941,7926054097492327,100092442021029,,Bông Skincare,"Kích ứng nha
Vs nó là kem trộn"
7928888357208901,7926054097492327,100076452249590,,Giáp Ngọc Hương,"Giờ thành viêm da rồi ấy bà, sẹo thâm thì bà qua phòng khám ý hôm tôi làm bsi dùng máy gần giống laser những không phải laser đâu r đẩy tinh chất giúp đều màu da vùng sẹo là được"
7926919034072500,7926054097492327,,,Người tham gia ẩn danh,.
