post_id,user_id,user_name,fullname,content
1885925108603277,,,,"“Công việc nhân sự (70%)
-Đảm bảo môi trường làm việc tốt cho nhân sự: tham gia tổ chức các sự kiện, chương trình teambuilding, dã ngoại, du lịch,....
-Cầu nối giữa BLĐ & nhân sự - Quan hệ của doanh nghiệp với người lao động, truyền tải thông điệp từ công ty xuống nhân sự, truyền thông nội bộ, gắn kết nhân sự
-Lên kế hoạch đào tạo & đánh giá hiệu quả làm việc nhân viên (đào tạo một phần về văn hóa, follow nhân sự giải quyết những vấn đề tồn đọng trong công việc, tinh thần
- Đề xuất về chính sách lương thưởng, phúc lợi, lộ trình thăng tiến nhân sự”
Các a/c làm về nhân sự lâu năm rồi cho em hỏi với các đầu mục công việc như thế này, sếp yêu cầu em lập 1 bảng kế hoạch chi tiết để làm các đầu mục này.
Ngồi nghĩ nát óc mới đc mấy dòng, em thì ko chuyên về mảng này lắm, các cv của hc khác thì e tự tin chứ h sếp yêu cầu như này, các bác giúp em với
Ad duyệt bài cho em với, thanks ad"
