comment_id,post_id,user_id,user_name,fullname,content
8367848476646218,8367531540011245,100092442021029,,Bông Skincare,"Da khô sạm nám
E đang dùng sp j r
H cần kcn kĩ nha
Thêm tre kết hợp aha và các hoạt chất làm sáng da như Tranexamic vtm C Niacnamai arbutin nè
Phục hồi hab5 kem dưỡng ẩm nhé
Peel da cần phục hồi kcn kĩ ko rất dễ nám đó"
8368453426585723,8367531540011245,61556814346507,,Nguyễn Thảo,Dính kem trộn r e
8367973173300415,8367531540011245,100087118973891,,Bích Thảo Skincare,Thêm sp làm sáng da nhé
8367842646646801,8367531540011245,,vo.chensris,Nhan Vo,Nt mình tư vấn cho nha
8368608099903589,8367531540011245,100083230755341,,Nguyễn Hoa Dược Sỹ,Nám mảng sẽ cần hq4 aha arbutin tranexmic uống trong nhé
