comment_id,post_id,user_id,user_name,fullname,content
8006838622747207,8004860689611667,100063098086327,,Hoa Anh Túc,C đang dùng những mỹ phẩm gì rồi ạ. C bị mụn vậy lâu chưa
8006744492756620,8004860689611667,100086173809188,,Lê Ngọc,Bạn có thể tham khảo sp trị mụn riibe nhé
8006817562749313,8004860689611667,,thanglong.hatgiong,Bác Sĩ Đạt,"Em dùng theo thứ tự để xử lý mụn ẩn, mụn viêm, thâm mụn, ko đều màu như sau:
+) Thứ tự buổi sáng:
Srm - Serum HA - Dưỡng ẩm lotion (phù hợp da dầu mụ.n, thông thoáng)
Thêm kem chống nắng nếu ra ngoài
+) Buổi trưa: toner- Serum HA - Kem chống nắng
+) Buổi tối:
Làm sạch da với tẩy trang và sữa rửa mặt - Serum HA- Dưỡng ẩm Clear spot vùng chữ T ( Thêm chấm mụn viêm nếu có: BP.O, Clin.damycin..) - Dưỡng ẩm"
8006902202740849,8004860689611667,100092442021029,,Bông Skincare,"Nền da mụn ẩn mụn viêm
E đang dùng sp j r
Da khô e cấp ẩm b5- kem dưỡng vô nha e
Thêm lọ chấm mụn viêm
Adapalen trị mụn nhẹ nhàng
Đi lấy nhân mụn kết hợp peel da nha e
Hạn chế thức khuya ăn đồ cay nóng nhé
Uống nhiều nước lọc nha e"
8006773602753709,8004860689611667,,ngocvy.tran.9699,Ngoc Vy Tran,Jb tư vấn trong vòng tuần da khác hẳng
8006783076086095,8004860689611667,,duong.thithuytrinh.18,Dương Thị Thùy Trinh,.
