post_id,user_id,user_name,fullname,content
1645785309543257,,,,"Xin chào các Anh, Chị ạ. Thấy mọi người chia sẻ các tips dọn nhà sạch, mê quá. Em thì không có kinh nghiệm dọn dẹp gì, có chút kinh nghiệm chăm tóc từ thiên nhiên xanh, sạch để chăm tóc mấy năm qua. Mong sẽ đóng góp giúp ích cho mọi người trong hội mình ạ 🫶🫶🫶
𝐓𝐎𝐏 𝐍𝐇𝐔̛̃𝐍𝐆 𝐂𝐎̂𝐍𝐆 𝐓𝐇𝐔̛́𝐂 𝐌𝐀̣̆𝐓 𝐍𝐀̣ 𝐔̉ 𝐓𝐎́𝐂 𝐑𝐀̂́𝐓 Đ𝐈̉𝐍𝐇 - 𝐌𝐎̣𝐂 𝐓𝐎́𝐂 𝐒𝐈𝐄̂𝐔 𝐍𝐇𝐈𝐄̂̀𝐔 𝐕𝐀̀ 𝐑𝐀̂́𝐓 𝐍𝐇𝐀𝐍𝐇 𝐃𝐀̀𝐈 👍
Kể từ lúc em bị hói, trắng cả da đầu. Em đã quyết tâm dưỡng lại mái tóc của mình một cách rất nghiêm túc.
Thứ nhất, nghiêm túc thay đổi dầu gội từ dầu gội công nghiệp sang dùng dùng dầu gội thảo dược không chứa silicone với hoạt chất làm sạch dịu nhẹ từ thiên nhiên: dừa, cọ... Các chị em có thời gian thì nấu nước gội đầu, hoặc mua dầu gội thiên nhiên dùng đều dc ạ.
Tiếp theo, chăm chỉ làm mặt nạ ủ tóc khác nhau.
Hôm nay em chia sẻ những cách em đã áp dụng, hi vọng rằng sẽ giúp ích được cho nhiều chị em để chăm sóc Tóc ạ. (Cách làm những mặt nạ này mọi người bấm vào ảnh xem chi tiết nha, e có hướng dẫn cụ thể ạ.)
𝟏. 𝐌𝐀̣̆𝐓 𝐍𝐀̣ Đ𝐀̣̂𝐔 𝐁𝐀̆́𝐏 🌿🌿🌿
- Mặt nạ đậu bắp rất đỉnh luôn ạ, ngoài giúp mượt tóc, mà còn mọc tóc con rất nhiều. Dễ làm, giá thành rất rẻ, ủ xong bị ghiền luôn.
𝟐. 𝐌𝐀̣̆𝐓 𝐍𝐀̣ 𝐍𝐇𝐀 Đ𝐀𝐌 🌱🌱🌱
- Nha đam ngoài giúp mọc tóc con, mà còn làm bóng tóc lắm, tóc mượt và có độ bóng hơn.
𝟑. 𝐌𝐀̣̆𝐓 𝐍𝐀̣ 𝐆𝐔̛̀𝐍𝐆 🪵🪵🪵
- Mặt nạ gừng ủ tóc rất tốt, đặc biệt là cho mẹ sau sinh luôn nè, giúp làm ấm da đầu, kích thích lưu thông mạch máu dưới da đầu, tăng tuần hoàn máu, thư giãn lắm, giảm rụng tóc và mọc tóc con. Mùa đông lạnh, thì mọi người ủ mặt nạ gừng rất hợp, làm ấm da đầu thích lắm, đỡ bị lạnh nha.
𝟒. 𝐌𝐀̣̆𝐓 𝐍𝐀̣ 𝐁𝐎̛ 🥑🥑🥑
- Bơ thì mọi người nhớ chọn Bơ ngon, Bơ sáp dẻo, Bơ Booth hoặc Bơ 034 đều được. Bơ càng ngon và xịn thì ủ tóc xong, tóc càng bóng và rất mềm mượt.
𝟓. 𝐌𝐀̣̆𝐓 𝐍𝐀̣ 𝐍𝐔̛𝐎̛́𝐂 𝐕𝐎 𝐆𝐀̣𝐎 🌾🌾🌾
-Mặt nạ dễ làm và tiết kiệm nhất trong các loại mặt nạ, không tốn chi phí gì cả, vừa rẻ vừa hiệu quả.
𝟔. 𝐌𝐀̣̆𝐓 𝐍𝐀̣ 𝐓𝐈𝐍𝐇 𝐃𝐀̂̀𝐔 𝐁𝐔̛𝐎̛̉𝐈 + 𝐕𝐈𝐓𝐀𝐌𝐈𝐍 𝐁𝟓 + 𝐃𝐀̂̀𝐔 𝐓𝐇𝐔̛̣𝐂 𝐕𝐀̣̂𝐓 𝐄́𝐏 𝐋𝐀̣𝐍𝐇 🥥🫒 🌸
- Mặt nạ giúp mọc tóc con rất nhanh luôn nha. Rất nên thử ạ.
𝟕. 𝐔̉ 𝐓𝐎́𝐂 𝐕𝐎̛́𝐈 𝐃𝐀̂̀𝐔 𝐓𝐇𝐔̛̣𝐂 𝐕𝐀̣̂𝐓 𝐄́𝐏 𝐋𝐀̣𝐍𝐇 (𝐃𝐞𝐞𝐩 𝐎𝐢𝐥) ☘️☘️☘️
- Phương pháp này em đã biết cách đây lâu lắm rồi nhưng dạo gần đây em thấy tự nhiên mới hot trên tóp tóp nhiều.
❌ 𝗟𝗨̛𝗨 𝗬́:
- Ai bị viêm da đầu, bị nấm, thì tuyệt đối không được ủ tóc với mặt nạ thiên nhiên, cũng như không sử dụng các sản phẩm dưỡng hay xịt kích mọc nha. Nên đi bác sĩ da liễu khám ạ.
- Khi ủ mặt nạ thiên nhiên, nên ủ tầm 30p-1 tiếng tuỳ mặt nạ. Không nên ủ quá thời gian, 2-3 tiếng. Ủ quá lâu sẽ phản tác dụng và còn gây ra rụng tóc nhiều hơn. Riêng phương pháp deep oil, mình có thể ủ lâu hơn 2-3 tiếng vẫn được.
- Sau khi ủ tóc với mặt nạ, nên gội đầu 2 lần và 1 lần dầu xả hoặc kem ủ đều được. Nên chọn dầu gội phù hợp với tình trạng da đầu của mình nha.

Các công thức này rất đơn giản, dễ làm, hầu như trong bếp của mọi nhà đều có những nguyên liệu này. Mỗi một loại mặt nạ đều có ưu điểm và công dụng riêng, tuỳ thuộc vào tình trạng da đầu và chất tóc của mỗi người khác nhau và còn tuỳ theo nhu cầu, sở thích của mọi người như thế nào, cho nên mọi người hãy cứ trải nghiệm để biết được loại mặt nạ nào phù hợp với tóc của mình nha. 🫶
Hè rồi, thời gian thấm thoát thoi đưa, sẽ đến Tết rất nhanh thôi. Vì vậy, chăm tóc từ bây giờ là vừa rồi ạ. Mọi người nhớ siêng chăm tóc, cho tóc khoẻ và nhanh dài nè. Kiên trì, dần dần sẽ hình thành nên thói quen, thì lúc đó Tóc sẽ cải thiện và đẹp hơn rất nhiều. Chăm tóc từ thiên nhiên thật sự có hiệu quả, an toàn, tiết kiệm chi phí rất nhiều, chỉ cần kiên trì và phải siêng chăm đều đặn là sẽ được ạ 💪
Thành quả sau hơn 2 năm kiên trì của em, giờ đây tóc em không còn bị gàu mảng mảng như tuyết trắng mùa đông, tóc lâu bết hơn, có khi 3 ngày không gội mà không bết. Tóc tơi phồng nhưng rất mềm mượt, không bị khô, e có thể lấy ngón tay vuốt 1 phát từ chân đến ngọn mà không rối. Thích lắm 😍. Và bây giờ tóc con em mọc rất nhiều, mọc đến nỗi đầu tóc không thể gọn gàng nổi, hết bị hói, hết bị lộ da đầu rồi. Tóc thì nhanh dài cực kì, nặng cả đầu. Trộm vía ạ, thành quả của việc chăm tóc siêng năng chăm chỉ đó ạ 😊
Em cảm ơn tất cả mọi người đã dành thời gian đọc bài viết của em ạ. Chúc các chị em áp dụng thành công và mọc được nhiều tóc con, hết hói nha. Cố nhên ạ 💪💪💪"
