comment_id,post_id,user_id,user_name,fullname,content
1876628272866294,1876451952883926,,20695h,Thu Hường Nguyễn,Lương gross 9tr2 của bạn gồm lương CB và các khoản gì? Vì nếu phần còn lại khác lương cơ bản là các khoản phụ cấp khác thì khi tăng lương CB tức là bạn được tăng lương theo thêm khoản tăng của cơ bản còn cty lách thì bạn thiệt thôi không được tăng mà đóng bh tăng lên thực nhận sẽ thấp đi
1876577302871391,1876451952883926,,annhien.98.30.05,Diệu An,"tăng lương đóng bhiem, giảm lương thực nhận 😅"
1876570656205389,1876451952883926,,ngo.uyen08,Ngô Uyên,"Đúng rồi bạn ạ, đa số các cty đều như vậy. Bạn cứ nghĩ tăng mức lương đóng bảo hiểm đồng nghĩa với việc tăng quyền lợi khi hưởng chế độ cho nó nhẹ nhõm 🤣 chứ có cty còn đóng bảo hiểm full lương mà 🤣"
1876588909536897,1876451952883926,,OmertaSnake,Nam Viet,Sao cty tăng lương BH lên hơn 1tr nhỉ? Bạn ở vùng mấy mà mức trước đó thấp thế?
1876573869538401,1876451952883926,,ngangiang.vu,Ngân Giang,Tăng lương cơ bản -> tiền đóng bảo hiểm tăng mức bạn đóng 10.5% tăng-> lương nhận về giảm
1876558226206632,1876451952883926,100071078567765,,Mai Linh,"Đúng rồi Á b, mức lương cơ bản tăng lên đồng nghĩa b tăng tiền nộp bảo hiểm"
