comment_id,post_id,user_id,user_name,fullname,content
1887209868474801,1886815458514242,100013407787720,,Hải Minh,Sếp bạn ở đâu? là người Việt hay người nn hả bạn?
1887209335141521,1886815458514242,,linh.vivu.33,Hoa Thược Dược,"B bật mí tên chữ cái đầu cty đi , mình hỏi thật🥹"
1886979355164519,1886815458514242,100079621393728,,Nguyen Tiff,bạn ib cho mình hỏi chút xíu ạ
1886923668503421,1886815458514242,100025068340711,,Phạm Hoa,Bạn ơi? Inbox mình hỏi chút nhé!
1886905145171940,1886815458514242,,cuongns.blue,Junky Nsc,"Nghe đã khó rồi. Thôi thì chín bỏ làm 10, lần sau chọn chỗ đàng hoàng tử tế mà làm."
1886887505173704,1886815458514242,100046786489915,,Bùi T. Giang,Chủ yếu là làm chui chứ cty gì kiểu này
1886861871842934,1886815458514242,,nothinglastsforever1712,Nguyễn Đức Phương,"Dọa thèng giám đốc là nếu ko trả tiền sẽ gọi thanh tra lao động về việc sử dụng lao động chui. Gọi bên thuế cho tội trốn thuế.
Còn về việc em giao kèo miệng thì ko ăn thua. Khó đòi tiền lắm"
1886854115177043,1886815458514242,,Unicorn9x,Lữ Tài Lân,lên bê cái máy tính bỏ túi xách về nhé :v
1886817585180696,1886815458514242,,suytbily,Hoàng Ngọc Thu Hương,Kiện củ khoai hả em 🥲 ko có cái cơ sở pháp lý gì về việc nó có tồn tại cả thì lấy gì ra mà kiện
