post_id,user_id,user_name,fullname,content
1863319014197220,,,,"Em chào mọi người ạ, em chia sẻ chút và xin nhận ý kiến của mọi người
E hiện có 2 option
- Công ty 1 lương thử việc 12tr, chính thức 14tr, ngoài ra ko có gì thêm, đóng BH 5tr8, ăn trưa tự túc, tăng ca ko lương, 26 công 1 tháng làm T2-T7, thường xuyên tc đến 7h tối, xe cty đưa đón
- Công ty 2 lương thử việc 13tr, chính thức 14tr, trợ cấp ăn trưa và chuyên cần tổng lương 1 tháng ~17tr chưa gồm tăng ca, đóng BH 6tr, 26 công T2-T7, sau 5h tính lương tăng ca, đi lại tự túc, cách nhà 15km
Cả 2 công ty đều là công ty xây dựng của TQ và đều là vị trí phiên dịch ạ. CÔng ty 1 là công ty hiện tại e đang làm, e mới chuyển chính thức nhưng mà công ty đòi giữ mức lương thử việc của e thêm 2th nữa để thử thách thêm tức là chuyển chính nhưng lương vẫn 12tr thêm 2th nữa. Nên e có đi phỏng vấn và nhận đc offer 2. Mọi người cho e lời khuyên vs ạ
( công ty 1 hiện giờ việc hết người thừa nên rất nhàn, chắc có lẽ v nên cty ko muốn chuyển lương chính thức cho e. Còn cty 2 e chưa tiếp xúc ko biết lượng cviec như thế nào )"
