post_id,user_id,user_name,fullname,content
465664719160152,100014049399684,,Đỗ Ngọc Sơn,"Chúc Các Nhà Đầu Tư May Mắn!
Tham gia nhóm Zalo, Telegram để nhận tư vấn đầu tư cổ phiếu:
Cộng Đồng Đầu Tư Chứng Khoán Thịnh Vượng:
Lướt Sóng Ngành: https://zalo.me/g/ommgik239
Cổ Phiếu Tích Lũy: https://zalo.me/g/zxcsxl949
Đầu Tư Theo Trụ VN30: https://zalo.me/g/yuyaih757
Telegram: https://t.me/+OrTh2kIlnpg3ODU9
TUYỂN DỤNG,ĐÀO TẠO CỘNG TÁC VIÊN HOA HỒNG CAO NHẤT THỊ TRƯỜNG.
https://zalo.me/g/ybdzse542
SĐT/Zalo Admin: 0796286822"
