comment_id,post_id,user_id,user_name,fullname,content
8497428330377727,8497427720377788,,tradecoinvietnam1,TradeCoin Việt Nam,Chi tiết: https://tradecoinvn.net/newsfeed/newsfeed-detail/viet-nam-chinh-thuc-ky-ban-hanh-chien-luoc-blockchain-quoc-gia
8497640463689847,8497427720377788,,kenztran,Nguyen Tran,"Blockchain k đồng nghĩa với Crypto/Trade Coin theo hiểu biết hạn hẹp của mình.

Blockchain giúp làm hợp đồng 1 cách minh bạch. Crypto là tiền ảo để mua bán dùng công nghệ blockchain (huy động vốn trá hình most of the times)"
8497550000365560,8497427720377788,,truongvu123456789,Ngô Trường Vũ,"chết rồi , này là chuẩn bị đóng thuế đấy , chứng khoán lãi hay lỗ gì cũng phải thuế , thuế thì dn đã đóng giờ nhà đầu tư vẫn phải đóng ,"
8497742413679652,8497427720377788,,ngaidetam,Ngài Đệ Tam,Đầu bùi à
8497543043699589,8497427720377788,100019831929059,,Đỗ Tuấn Hải,Này là dc có tác dụng gì ko ạ
8497537227033504,8497427720377788,100089702464319,,Cẩm Ấn,vẫn mờ mịt quá
8497533663700527,8497427720377788,,thu.minh.7334,Thu Minh,Chuân bị đào thôi😂😂😂
8497630073690886,8497427720377788,100038973049494,,Đặng Thái Bình,"Cái gì cũng đi sau mà đòi đứng đầu, đầu cầu"
