post_id,user_id,user_name,fullname,content
2026128857819740,100086304858595,,Đặng Hải Đăng,"#gocchiase
Thời buổi kinh tế khó khăn, công việc rồi môi trường làm việc nhiều khi không thuận lợi, không hợp thì việc nhảy việc, đổi việc, nghỉ việc là chuyện bình thường.  
Từ cuối năm ngoái đến giữa năm nay mình cũng chuyển việc 2 lần, chật vật sửa rồi rải CV, lượn lờ khắp các trang web, nhóm facebook, headhunter tuyển dụng mình biết; đợi mòn mỏi phản hồi, rồi vô vàn câu chuyện đi phỏng vấn... @@ 
Giờ nghĩ lại thấy hãi thật, nhưng biết làm sao nhỉ, ai cũng phải trải qua.
Thế mới thấy được giúp đỡ bước nào trong quá trình này để tiết kiệm thời gian hơn thì thật là biết ơn.
Mình đã có công việc mới (với mình là ổn) nên muốn chia sẻ (aka nhả vía) cho bạn nào chuẩn bị hay đang trong thời gian tìm việc, thử việc cái này. Mình tình cờ thấy trên Threads và ban đầu cũng không kỳ vọng nhiều lắm sẽ được giúp đỡ.
Mình đã chủ động xin feedback về CV cũng như cách để thể hiện tốt bản thân khi phỏng vấn, rồi một số phương pháp để kết nối, hoà nhập trong môi trường mới.

*Ảnh là tên tài khoản Threat mình nhắc đến, các bạn có thể lên Insta/ Threads tìm nhé! Hy vọng giúp được ai đó."
