post_id,user_id,user_name,fullname,content
1864803934048728,,,,"Mình đang hơi bị mất phương hướng 1 chút nên muốn nhận được sự góp ý từ mọi người trong group ạ.
Mình là nữ 29 tuổi, học Luật kinh tế.
Thời gian đầu mới ra trường đã theo ngành nhưng sau 1 năm tự thấy bản thân k đủ sự cẩn thận, chi tiết nên nghỉ.
Chuyển qua học và làm bên Dược ( theo mong muốn gia đình) được gần 2 năm thì cũng k muốn phát triển theo ngành này nữa nên tiếp tục nghỉ.
Công việc gần đây nhất là mình làm Giám sát đội ngũ PG, công việc ổn nhưng môi trường công ty toxic, drama mỗi ngày, áp lực từ nhiều phía nên cũng đã xin nghỉ.
Sau 1 thời gian đi làm mình nhận thấy bản thân thích làm remote, làm việc với số liệu, báo cáo, tập trung chuyên môn hơn là quản lý hoặc làm việc với con người. Vì vậy dự định sẽ chuyển qua mảng Data analyst hoặc Marketing.
Ưu điểm mình tự thấy là nắm bắt nhanh trong công việc, chịu khó học thêm các chứng chỉ, bằng cấp nếu công việc có yêu cầu. Tư duy logic, làm việc nghiêm túc, dễ hoà nhập.
Nhược điểm là thiếu sự tỉ mỉ, cẩn trọng ví dụ những công việc đòi hỏi độ chính xác cao như làm hợp đồng, chứng từ, hoá đơn. Tiếp tới là tính mau chán, nhảy việc nhảy ngành quá nhiều nên k có sự chuyên sâu và thiếu kinh nghiệm. 🥹
Hiện giờ mình đang bị khủng hoảng u30 vì không biết sẽ làm gì tiếp theo. Chưa từng làm về IT hay các công việc về DA, mình k biết hình dung của bản thân về ngành này có đúng không nữa, sợ vào làm lại tiếp tục thấy không hợp với nghề.
Chưa kể mình sắp 30t rồi, so về tuổi tác và bằng cấp k thể đọ được với các bạn trẻ mới ra trường.
Mọi người ai đã vượt qua hoặc có kinh nghiệm về ngành Da thì cho mình xin 1 vài lời khuyên nhé.
Cảm ơn group trước"
