comment_id,post_id,user_id,user_name,fullname,content
7976599335771136,7975531212544615,,minhtu.lan,Lan Minh Tú,Bạn có thể tham khảo thải độc da và cao mụn của DrCvin. Rửa mặt sạch và tẩy da chết thường xuyên nữa nhé
7978168462280890,7975531212544615,100092442021029,,Bông Skincare,"Da mụn ẩn liti và sạm da
E chú ý bước làm sạch da nhé
Pele da nhẹ nhàng kết hợp đi lấy nhân mụn
Adapalen trị mụn nhẹ nhàng
Tẩy da chết tuần 1-3 lần
Cấp ẩm phục hồi kcn mỏng nhẹ nha e
Hạn chế thức khuya ăn đồ cay nóng nhé"
7976524865778583,7975531212544615,100091464563093,,Phước Skincare,"Vậy c đã dùng sản phẩm nào điều trị mụn ẩn chưa nhỉ ?
- Adapalen điều trị mụn
- Chấm mụn viêm BPO hoặc kháng sinh Clindamyxin
- Sản phẩm làm sạch : Bio derma, Post Quam, De ma cos, Flo slek, S VR , Pau la choi, La ro cher posay, Ch ris tina BHA, Derma logica...
- Kem dưỡng vừa cấp ẩm, vừa hỗ trợ kiểm soát dầu nhờn trên da tương tự hãng làm sạch
- Lấy nhân mụn 15 ngày /1 lần
- Peel 2 -4 tuần 1 lần tùy từng loại peel nhé"
