post_id,user_id,user_name,fullname,content
445962237797067,,,,"🌟 Tặng Tài Liệu PDF Chứng Khoán Miễn Phí! 📈📚
Chào các bạn,
Nhằm hỗ trợ các bạn trong việc học tập và nghiên cứu chứng khoán, mình rất vui được chia sẻ tài liệu học tập miễn phí về chứng khoán mà mình đã tổng hợp. Đây là những tài liệu hữu ích giúp các bạn nắm vững các khái niệm cơ bản cũng như các chiến lược đầu tư hiệu quả.
🔹 Nội dung tài liệu bao gồm:
Chiến lược đầu tư chứng khoán
Phương pháp đầu tư của Warren Buffett
Nhà đầu tư thông minh
Tâm lý thị trường chứng khoáng
............
🌟 Cách nhận tài liệu:
Like bài viết này để giúp những người quan tâm cùng nhận tài liệu
Comment dưới bài viết này.
Mình sẽ gửi tài liệu qua tin nhắn riêng cho bạn.
Hy vọng tài liệu này sẽ giúp ích cho các bạn trong hành trình đầu tư và học tập. Nếu có bất kỳ câu hỏi nào hoặc cần thêm thông tin, đừng ngần ngại comment hoặc nhắn tin cho mình nhé!
Chúc các bạn học tập và đầu tư hiệu quả! 🚀"
