comment_id,post_id,user_id,user_name,fullname,content
1702305790569679,1701591690641089,,QuanHoangLe.2311,Quân Hoàng Lê,"E thử hỏi nó chưa
Giao tiếp là chìa khoá mà =)))"
1703082870491971,1701591690641089,,ruaut92,Hiep Le,Hình như hai tai dùng chung 1 key để nhận dạng thì phải 🤣
1702391043894487,1701591690641089,61565383925355,,Sống Vui,"Tránh bão nên công ty em off mấy hôm.
Giờ e hết tiền ăn nên tha thiết bán bộ sạc siêu nhanh samsung type C, giá mong muốn 200.
Tặng kèm gối chữ U.
E cảm ơn"
