post_id,user_id,user_name,fullname,content
924018046284200,,,,"Cho mình hỏi là sau khi đi lấy nhân mụn thì :
_ có nên sử dụng nước muối sinh lý không ạ ( tại mình nghe vài nơi là ko được đụng vào nước sau 4 tiếng lấy mụn )
_ có thể sử dụng toner và Sd sau bước nước muối sinh lý ngày đầu ko ?
_ sau 48 tiếng có thể skincare bth nên cho mình hỏi là mình đang sử dụng "" tẩy trang , sửa rửa mặt skin 004 , SRM skin 004 , kem dưỡng ẩm phục hồi cho da dầu Đg.r "" không biết có cần thây đổi rt thường ngày để mau phục hồi không hoặc cần thêm sp gì để mau phục hồi ạ ??
_ và mn cho mình xin vài sp trị thâm , hổ trợ giảm thâm mụn đỏ , đen sau khi da đã phục hồi ổn mình sẽ sử dụng ạ 🥲"
