post_id,user_id,user_name,fullname,content
475048338221790,,,,"“Đàm đạo” cuối ngày chuyện thị trường ngày 23/10/2024
Chào buổi tối các bác, thị trường có vẻ chán nhỉ tích lũy đi ngang với thanh khoản thấp nhưng vẫn giữ vững mốc 1270. Kết phiên hình thành cây nến doji chuồng chuồng với động lực phục hồi từ nhóm bất động sản sau nhiều phiên nhóm này bị bán te tua.
Thôi thì cũng xin chúc mừng cho các bác đã bắt đáy thành công BDS và các bác đã ôm BDS từ lúc trước khi giảm mạnh cũng đỡ 1 phần. Riêng em thì thời điểm hiện tại em không đánh nhóm này do đối với em vẫn chưa có nhiều triển vọng và các dự án BDS của các DN lớn vẫn còn đang dính nhiều pháp lý. Có đánh thì cũng chỉ lướt lát chút đỉnh chứ không nói đến câu chuyện ôm dài hạn.
Nhóm bank hôm nay thì có sự phân hóa với hai thằng STB, TPB có thể nói là “beartrap” 2 phiên trước đó. Bank thì giờ em vẫn đang cầm STB và MBB đồng thời canh mua thêm ACB em đánh giá ACB tích lũy vùng 25 này khá ổn để mua vào.
Cuối cùng, dòng tiền không có đi kèm với ngân hàng nhà nước hút tiền trở lại là tín hiệu khá tiêu cực nên hiện tại em không khuyến nghị full margin và lướt sóng ngắn hạn, thời điểm hiện tại chỉ nên tập trung vào các mã có cơ bản tốt, KQKD quý 3 tăng trưởng ổn định và có câu chuyện riêng để tăng trưởng.
Thị trường đi ngang thì mình dành thời gian để đi lọc cổ phiếu tốt để chờ cho nhịp tăng mới chứ sao phải đi lướt lát, trade vô kỷ luật trong thị trường khó làm gì đúng không các bác. Hãy làm việc dễ đừng làm khó bản thân!
Thân mến."
