comment_id,post_id,user_id,user_name,fullname,content
8234625256619683,8234156396666569,100015270017179,,Vân Nguyễn,Vãi thiệc. Thần dược. Moẹ mấy dòng này cord nhiều thôi rồi🤪
8235266143222261,8234156396666569,,hongvan.pham.16568,Phạm Hồng Vân,Organic zữ chưa nạ
8234828856599323,8234156396666569,,Then.giang.24,Giang,Nghe thần dược là đã thấy ngán ngẩm r
8235974193151456,8234156396666569,,trannguyen.hanhngan,Hana Trần,"Thần dược, Organic!!!!
Lạy hồn"
8235233206558888,8234156396666569,,oaaooa.aoaa,Lương Nguyễn,khốn nạn thật sự
8237317396350469,8234156396666569,,kimphuong.letran.54,Lê Trần Kim Phương,"Giờ sìpa mà làm mấy thứ trộn này thật sự wá khốn nạn,,, có đi sìpa lựa máy chổ nta lm chăm sóc da khoa học,, còn mấy chổ đưa thuốc màu nâu là trộn hết luôn,,,, bạn nên đi da liễu còn cứu kịp,,,đừg đổ tiền vào máy chổ vô ít đó nữa."
8235380303210845,8234156396666569,100080492313243,,Linh Linh,"Trời mạ, bà dám bôi cái này lên mặt ak, nhìn cái lọ phèn phẹt"
