post_id,user_id,user_name,fullname,content
1789713228439129,,bob.cutevipzoNo1,Phạm Hà Anh,"🤤THƯỞNG THỨC TRỌN VỊ CƠM NHÀ ĐẬM ĐÀ CHỈ TỪ 50K !!??
Đó giờ chỉ biết An Nam Cháo là nổi tiếng về các món cháo đa dạng thui mà giờ mới chiêm nghiệm được thêm cả cơm đốt cũng chất lượng không kém😼
😍Với đủ các món cơm canh rau củ đạm bạc như ở nhà gồm: cơm sườn, cá kho tộ, ba chỉ kho thịt, thịt chưng, rau củ luộc chấm muối vừng, …..
Ấn tượng nhất với món cá kho tộ đậm đà, cá thơm kho mằn mặn mềm rục, thị ba chỉ kho mềm lắm, rưới nước kho ăn cùng cơm cũng bén miệng ghê, ngoài ra mỗi xuất cơm đều có canh ăn kèm cũng ngon lành cành đào. Quán cũng bán cả các món lẻ nên mọi người ord cơm niêu cháy và các món lẻ ăn kèm cũng được nha 🤓🤓
Cơm đốt có đoạn đáy giòn giòn vui miệng, mấy người đạo ăn cơm cháy đáy nồi như tui thì thích mê, mn có thể chọn cháy 2 mặt hoặc 1 mặt đều được nha.
Cháo ở đây vẫn ngon như này nào, chất lượng vẫn cứ quá là okie, gọi thêm đĩa gan xào best seller ăn cùng cháo hay cơm cũng đều bén 😂😂
An Nam Cháo còn đang có chương trình "" MUA 3 TẶNG 1 "" và tặng món rất hời lun nha, khi mua 3 món bất kì đều được tặng 1 món cơm thố đốt nha mọi ngừi 😍😍😍
🏡: An Nam Cháo: 20 Đào Tấn, Ba Đình, Hà Nội
☎️: 0926.999.113"
