comment_id,post_id,user_id,user_name,fullname,content
1718037795663145,1717947855672139,,vietlinh152,Lê Viết Linh,Joystick này lắp được cho one X không bạn nhỉ. Nếu được mình xin link với ạ
1718038168996441,1717947855672139,,NguyenKimSinhThe,Nguyễn Kim,Có độ được xbox one đời đầu ko bác
1718138178986440,1717947855672139,,hongducwb,Nguyễn Hồng Đức,Vào apex legends vẫn nằm đất sau 15' thôi
1718058545661070,1717947855672139,,danhhuy.2910,Danh Huy,vẫn 125hz đúng k ạ :( chứ bọn xbox này cũng ok nma tật nhất là độ trễ n cao
1718040592329532,1717947855672139,,tuber.kata.1,Hoàng Nguyễn,Nah tôi cusual gamer thôi
1718060552327536,1717947855672139,100087400555439,,Ho Cường,"Có cho Xbox360 ko b, mua ở đâu vậy b"
1718044368995821,1717947855672139,,phucgk.dangcong,Dang Cong Phuc GK,"E ko biết nhiều mấy cái này nên ko dám chơi, sẵn cho e hỏi, e có con PXN 9609 có vẻ như là nó đột tử ko biết bác nào nhận sửa ko ạ"
