comment_id,post_id,user_id,user_name,fullname,content
2041105872988705,2041035026329123,100009112465621,,HV Cường,"nếu bạn cảm thấy mình có năng lực thì bạn đề xuất làm phó giám đốc luôn cũng được, chứ deal thì có gì mà phải băn khoăn thế. đi làm cái quan trọng là bạn làm được việc, có năng lực thực sự"
2041082832991009,2041035026329123,,dqdthanhthanh,Dũng Đinh,bình thường sẽ sau khi thử việc làm chính thức sẽ deal lương. Rồi tính tiếp từ thời điểm làm chính thức.
2041102722989020,2041035026329123,,khanhhoa134,Nguyễn Khánh Hòa,Công vc sao k liên quan đến chuyên môn thế bạn. 😗 này mình nghĩ khó deal lương lắm
2041081602991132,2041035026329123,,tranquochoanz,Trần Quốc Hoàn,Thông thường thì thời gian deal lương không bao gồm thời gian thử việc á bạn. Còn nếu bạn cảm thấy mình có thể xứng đáng với mức lương cao hơn thì cứ đề nghị với cấp trên thôi.
2041083066324319,2041035026329123,,minh.h.tran,Minh Ha Tran,Bạn tự nhận công việc không có nhiều thì làm sao mà đòi hỏi lương phải cao lên được?
2041092222990070,2041035026329123,100012593647345,,Phạm Châu,Tham khảo cv bạn nha
