comment_id,post_id,user_id,user_name,fullname,content
7962373150527088,7877321139032290,,phamchibi15121992,Chibi Phạm,"Chị đến phòng khám chuyên khoa thẩm mỹ của bác sĩ khanh để bác tư vấn kĩ hơn đi chị, bên này chuyên về da liễu nè"
7962353890529014,7877321139032290,,thy.30.8.98,Đoàn Minh Thy,Mình bị thâm mắt mới làm pp thermage xong nè. Recomnend cho mấy bạn muốn trị thâm mắt thì nên thử pp này nha
7878056938958710,7877321139032290,,thanglong.hatgiong,Bác Sĩ Đạt,"Em bổ sung serum dưỡng sáng da mờ thâm sạm chứa thành phần như Tranexamic , Arbutin, Kojic acid, Niacinamide, Vitamin C, Glutathion.. chú ý em chống nắng đầy đủ và sử dụng viên uống sáng da kết hợp nhé."
7877446525686418,7877321139032290,100092442021029,,Bông Skincare,"Hạn chế thức khuya
Thêm kem mắt nha"
7930253873739016,7877321139032290,100009713761349,,Mỹ Linh,"Dùng kem mắt retinol của Rejuvaskin á, nhưng mà phải ngủ đủ giấc chứ các phương pháp khác chỉ là hỗ trợ thôi, không trị tận gốc đc"
7877469672350770,7877321139032290,61564124692897,,Loan Nguyễn,Kem vi kim mắt
7880771992020538,7877321139032290,100055492248577,,Nguyễn Đông Dương,"Thức khuya thì không có thuốc nào chưa được đâu bạn ơi. Ngủ sớm đi ạ và kết hợp dùng thêm kem mắt nữa. Mình đang dùng kem mắt Rejuvaskin Retinoid Eye Cream của Mỹ trị nếp nhăn, vết chân chim nơi khóe mắt thấy khá hiệu quả nha. Bạn tham khảo xem sao, có retinol mà thuần thực vật nên yên tâm là không gây kích ứng đâu."
7930200077077729,7877321139032290,,lam271000,Nhật Lam,"Em làm khử thâm mắt bên chỗ bs Khanh nè chị, vừa xong 1 liệu trình thấy mắt đỡ thâm nhiều rồi"
7880990421998695,7877321139032290,100075756483824,,Nguyễn Thị Hòa,Bà thâm có nặng như tôi không nhắn tôi gửi ảnh trước tôti bị cho xem giống của tôi không tôi chỉ cho
