comment_id,post_id,user_id,user_name,fullname,content
2377170036092153,2376825856126571,,tuanh.nguyenhoang.988,Bé Lyn,Hy Nguyen ghen tị gòiii đoáaa
2377281746080982,2376825856126571,,trami1992,Mi Trầnn,Thanh Liêm gòi mắc j mua đồ noel bận h này???
2377386639403826,2376825856126571,,ken.nguyen.001,Nguyễn Ken,T lại tưởng fan Mu
2377317149410775,2376825856126571,100090780185337,,Tạ Thị Thuý,Kk
2377168762758947,2376825856126571,,luan.danh,Danh Luận,Hấy cưng dữ luôn òi
2377603936048763,2376825856126571,61562888641321,,Kinh Thế,"[Hỏa Tốc] Cát mùn dừa vón chắc, ít bụi, siêu khử mùi >>> https://s.shopee.vn/7UxnVSGnXn"
2377324669410023,2376825856126571,100021590495069,,Trườnq Gianq,Ngọc Huyền
