post_id,user_id,user_name,fullname,content
2371714226637734,,hanoi.sodep.5,Trần Oanh,"Khẩn thiết mong các bạn share bài chấm để tìm ah QTV giúp đăng hộ
Nhà mình tiếp tục TÌM CHÓ MẸ ĐI LẠC
Tha thiết nhờ mọi người tìm giúp, gia đình xin cảm ơn và HẬU TẠ ạ.
Đêm 6/9 trời gió bão mẹ trắng này chắc hoảng sợ chạy ra phố Tứ Liên (quận Tây Hồ, HN), rồi trời mưa to mất dấu không quay về được. Nhà đã lần theo xem Cam các nhà dọc đường thấy em loanh quanh ở phố Tứ Liên đó đến rạng sáng thì mất dấu. Nó là chó mẹ nên thương lắm mọi ng ơiiiiii 😢😔
Đặc điểm: Trắng, tai nhọn, mũi hồng, đuôi cuộn tròn trên lưng, cổ đeo dây màu đỏ.
Ai thâý con ở đâu thì xin giữ giùm và liên lạc với gia đình theo số 091.4418833 sẽ đến đón về ngay ạ . Xin được HẬU TẠ và mang ơn thật nhiều 😍.
LH 091.4418833
094.4497026
Mưa Bão Các Con Đi Lạc Do Sợ . Thương lắm"
