post_id,user_id,user_name,fullname,content
3801527386779336,,huong.lan.908132,Lan Hương,"🚩 $STRK, $W, $DYM, $PIXEL, $PORTAL $ETHFI, $ENA, $XAI
Launchpool Binance 2024 là công cụ thanh khoản cho MM
Kể từ đầu năm 2024 đến nay, Binance cho ra mắt 16 Launchpool
Có 6 Token Dump ngay khi TGE
Có 10 Token được đẩy giá trong khoảng 1-2 tháng sau khi listing và sau đó là chia ít nhất 2 lần.
Đặc biệt có $STRK, Cap chia 2,5 nhưng giá token chia 6 vì tình trạng token được mint thêm và xả hết.
Nếu để ý sẽ thấy năm 2023, các dự án list Binance có MC khá khiêm tốn so với 2024 và có phần ""Ngáo định giá""
MM đang muốn user cảm thấy list Cap to là bình thường, để dễ dàng xả hàng
Sẽ khó có coin nào list sàn vài tuần để được đẩy banh nóc, câu chuyện x100 như mùa trước nữa
Cuộc chơi hiện tại đã khó hơn, đòi hỏi sự kiên nhẫn từ nhà đâu tư, chờ đợi vị thế đẹp để vào hàng
Chia tan nát rồi sideway dài như STRK, W, DYM, PIXEL, PORTAL ETHFI, ENA thì lúc đẩy sẽ lại càng crazy hơn
Lựa chọn nền văn minh thôi
Hình bên dưới là tổng hợp của mình về MC của các dự án sau khi lên Binance, ae có thể view qua để lựa chọn nhanh"
