post_id,user_id,user_name,fullname,content
1273958873079947,,solo.nguyen.1207,Nguyễn Thanh Kim Nguyên,"CÓ MỘT SỐ BẠN HỎI NÊN MÌNH CHIA SẺ LẠI THUỐC TRỊ NẤM
Mèo bị nấm là vấn đề mà khá nhiều các sen nuôi mèo quan tâm khi đã dùng qua các loại thuốc nhưng không khỏi. Mình xin chia sẻ với các bạn một loại thuốc trị nấm rất hiệu quả cho mèo mà không cần cạo lông làm mất đi vẻ đẹp của các boss nhé.
LƯU Ý: Bài viết này không nhằm mục đích thương mại vì thuốc này các bạn có thể dễ dàng mua ở hiệu thuốc của người.
Hiện nay, có một loại thuốc uống có hiệu quả khá tốt trong việc điều trị nấm trên mèo mình thấy các bạn hay chia sẻ là dạng thuốc nhộng có thành phần itraconazole, tên thương mại là Sporal, Itrafungol,… Itraconazole mua ở hiệu thuốc của người dưới dạng viên nhộng các bạn mua về sẽ khó chia theo liều lượng của chó mèo, các bạn lưu ý không nên gỡ vỏ nhộng mà cho uống thuốc bên trong vì sẽ làm giảm việc hấp thu của thuốc qua đường tiêu hóa. Ngoài ra, không dung itraconazole cho chó mèo có tiền sử suy tim hay suy gan, thận.
Một liệu trình an toàn hơn và hiệu quả điều trị tương đương với itraconazole là hoạt chất Terbinafine, tên thương mại là Terbisil. Đây là thuốc dạng viên nén có thể mua ở nhà thuốc nhân y, các bạn mua về cho chó mèo uống liều như sau: Dưới 2.8 kg uống ¼ viên, từ 2.8 kg – 5.5 kg uống ½ viên, trên 5.5 kg uống 1 viên. Ngày uống 1 lần trong 14 ngày.
Terbisil (Terbinafine) đã được chứng minh hiệu quả lâm sàng trong việc điều trị nấm và các bệnh ngoài da trên chó mèo, thuốc có khả năng dung nạp tốt và ít gây tác động tiêu cực lên gan thận. Thuốc này được FDA xếp loại B, nghĩa là trong trường hợp mèo mang thai bị nấm nặng có thể dung thuốc để điểu trị luôn nhé.
Đây cũng là bài viết sau khi điều trị thành công cho các bé mèo nhà mình. Mình chia sẻ ở đây như là 1 tip để các bạn tham khảo cho việc chữa trị các bệnh phổ biến hay gặp trong quá trình chăm sóc các bé. Thuốc điều trị các bạn có thể mua ở nhà thuốc của người, vừa tiết kiệm chi phí và thời gian của các sen nữa nhé. 😊"
