comment_id,post_id,user_id,user_name,fullname,content
1653326221927391,1653285491931464,100010274269217,,Nguyễn Văn Thịnh,Nhìn là thấy xàm câu view :)) Thu 0. Bảo dịch. Dịch mà điện nước 8tr
1653325685260778,1653285491931464,61561355696464,,Ch Ất,Dịch mà duy trì thì thua. Mà giờ kinh tế cũng chậm. Kdoanh chưa chắc ăn bằng xe ôm công nghệ 😂
1653294998597180,1653285491931464,100010560918251,,Trần Quốc Bảo,Sao lại thu 0. Bịp à
1653295875263759,1653285491931464,100024644671872,,Phạm Hòa,Phương Thanh chắc ko phải tương lai phi vụ của t với m đâu ha 😂
1653313525261994,1653285491931464,,canh.amethyst,Nguyễn Xuân Cảnh,Ăn thua gì. T cò con mà tháng bay mẹ con camry. H vẫn tái tê nhói lòng. Gắng dc cứ gắng. Chứ h bỏ là mất
1653290195264327,1653285491931464,,ngocdyy02,Ngọc Dy,Do mình nhạy cảm hay sao mà thấy đoạn tin nhắn này ko nên lấy ra làm content 🥹🥹😮‍💨
1653310795262267,1653285491931464,,sharkerwu97,Tùng Vũ,chắc giờ phất lên lại rồi
