comment_id,post_id,user_id,user_name,fullname,content
1836650103531608,1836586413537977,,nguyenngocanhthu13701,Nguyễn Ngọc Anh Thư,"Actidem trị thâm mới ổn lắm , thâm cũ cũng mờ bớt đi nhiều"
1836644450198840,1836586413537977,,nghiem.han.12764,Nghiêm Hàn,"Nặn spa hay nặn nhà đây b, này bị lâu chưa"
1836646700198615,1836586413537977,,vananh.shibi,Vân Anh ShiBi,"Đối với làn da bị thâm sau mụn như da em thì do lúc bị mụn hay sờ nặn, cộng với việc chống nắng ko kĩ nên làm tăng sắc tố sau viêm. Em nên bổ sung các sp chứa tp giúp ức chế hst như tranxenamic acid, vitamin c, glutathiol, arbutin, azelaic acid, thêm serum cấp nước chứa hyaluronic( để giảm tiết dầu) kết hợp retinol/tretinon và niacinamide để giúp se nhỏ lcl, dùng kem cn và che chắn kĩ khi ra ngoài. Có thể uống thêm viên chống nắng, glutathion, l-cystein để tăng hiệu quả, bôi kem cn và che chắn kĩ khi ra ngoài, uống trên 2 lít nước mỗi ngày, tăng cường rau xanh, và tránh thức khuya, căng thẳng... Nếu chưa rành thì nên chọn nơi bán sp có theo dõi, điều trị và hỗ trợ đổi trả khi dị ứng để ko mất tiền oan. Và muốn tìm dc sp hợp da và mang lại hiệu quả cao thì em phải xác định được cho c da của em thuộc loại nào? Vì nếu ko em chỉ đang phí tiền mà khả năng dị ứng là khá cao. Chúc em sớm có làn da đẹp."
1836667506863201,1836586413537977,100080922901989,,HaLy Phạm,"=> Lcl, Sợi bã nhờn, Mụn ẩn, Thâm sần ko đều màu như này … :
Do da bít tắc quá lâu
Skincare ko phù hợp
Nhiều yếu tố dẫn đến da bị vầy nha👎

👉Peel định kỳ kết hợp Hoạt Chất ( Đặc trị mụn & Tăng tốc đổi mới Tb )+ Pore / Tranexamic / Kojic/ Arbutin… da sẽ sáng dần lên & cải thiện lcl, sợi bã nhờn rõ luôn nhé

// phục hồi & chống nắng đủ đô nhé🎉
=> Routine thế nào cho hợp lý nữa nhé ✅"
1836648143531804,1836586413537977,100087118973891,,Bích Thảo Skincare,Nên peel cho đỡ thâm nhé
1836928266837125,1836586413537977,100055853311022,,Nguyễn Thị Thu Thảo,Đối với làn da bị thâm chỉ cần……….có tiền là hết
1836644080198877,1836586413537977,,trang.phan.90038,Phan Trang,"tập trung trị mụn ổn trước đã, mụn ổn thì thâm sẽ đỡ"
1836644413532177,1836586413537977,100073020214777,,Hoài Thương,"Bên bácCEO Vicky Thuận điều trị mụn thâm hiệu quả lắm nè bạn tham khảo xem. Uy tín với tư vẫn nhiệt tình lắm, mình trị bên này thấy da cải thiện rõ rệt luôn. Giá cũng cũng hợp bạn đến thử đi"
1836926006837351,1836586413537977,,loving.iu.7,Liz Nguyen,"Đắp mask này nè tui dùng sau khi lấy mụn , đắp mỗi buổi tối luôn rồi đi ngủ . Tui xài cũng 6 hộp rùi
https://s.shopee.vn/50GhZ0ZA6d"
1836863446843607,1836586413537977,100053558057096,,Minh Trang,Ib nè ty
1836645613532057,1836586413537977,,toosnhuw15,Lan Anh Phạm,"bà coi thử tazo với enza xem shao, tui cũng cỡ bà mà thấy nó đỡ á, nhớ dưỡng ẩm đủ nhe"
1836892316840720,1836586413537977,,TwistingNoodle,Nhi Diệp,Numbuzin 10 điểm k có nhưng nhé
1836655136864438,1836586413537977,100071925396298,,Cẩm Nhiên,Linh Đan tớ có biết bên nay ok nè điều trị hiệu quả kỹ càng với lại còn kết hợp với dược liệu nữa nên tớ ưng và thấy an toàn lắm
1836820826847869,1836586413537977,61550516130883,,Tran Ngọc Ngân,Trị mụn tk bên chị Vicky Thuận chữa trị nè bạn .chị khám chữa trị cho hiệu quả khỏi mụn đc nhé đợt mình điều trị bên chị mà khỏi hẳn đó .trị liệu một lần khỏi mụn dứt bạn ơi
1836698693526749,1836586413537977,,diepchi.122,Huỳnh Diệp Chi,nhắn riêng chị chia sẻ e nhé
1836925686837383,1836586413537977,100081213976275,,Xuân Quỳnh,Mìk chỉ đắp lọ cao thôi mình trước dùng đủ loại mà ko hết nay đắp 3 tuần mờ nám rõ rệt mà da trắng mịn nay đi đâu tô tí son là dc. Mìk mua bên chổ shop Lê Thắm
1836689896860962,1836586413537977,100093356409699,,Trần Ânn,"🌺GROUP CHIA SẺ DƯỠNG DA🪞:
https://www.facebook.com/groups/ptlskincarekhoahoc/?rdid=WfzLJ7NKTdHbd4lq&share_url=https%3A%2F%2Fwww.facebook.com%2Fshare%2Fg%2FAeWKhMWfVs2waA6k%2F
👉Dành cho những bạn muốn quan tâm về Peel & Treatment
( SKINCARE KHOA HỌC )
Với các hoạt chất ( AHA, BHA, RETINOL, TRETINOIN ) để có làn da xuất sắc nhưng chưa biết bắt đầu từ đâu ✅

💌Join in My Group để chia sẻ cùng nhau đẹp hơn mỗi ngày nhé chị em💃"
1836660630197222,1836586413537977,100095174802758,,Kim Dung Nguyễn,B qua bs da liễu chữa cho yên tâm với lại chữa sạch tận gốc. Trc t làm ltrinh meso nano không kim bên bs thạc sĩ Vũ Thiên Tuân thấy ổn á bs tv nhiệt tình thạc sĩ chuyên về da liễu làm chắc tay phết. Bên bs có cam kết bảo hành nên cũng yên tâm b nhắn qua bác coi sao.
1836644093532209,1836586413537977,61559395586679,,Võ Thị Bé Na,Mún cải thiện tình trạng mụn thì ib mình tv cho nhé
1836666953529923,1836586413537977,,danghoa.mocmien,Đặng Hoa,Xay mướp đắng đắp lên bạn
1836914843505134,1836586413537977,100063015191597,,Trần Thuý Hằng,"Bạn nặn mụn ở spa đk chứ da tn chả có tip gì ngoài đi bác sĩ da liễu sớm đi Bạn qua bên bsi Vicky Thuận xem, vì trước mình chữa mụn viêm, thâm hiệu quả đó."
1836712876858664,1836586413537977,,ngochiep.nguyen.142,Nguyễn Ngọc Hiệp,"giảm thâm
kết hợp giảm dày sừng mới đem
lại hiệu quả . Hoạt chất sáng da mờ thâm azelaic 20% được hấp thu qua hàng rào bảo vệ da khi dùng kèm re 1%
kết hợp uống glutathion"
1836647070198578,1836586413537977,,yenpham2609,Phạm Yến,"Em vệ sinh nước muối sinh lý và phục hồi trong vòng một tuần đầu nhé￼
Sau một tuần xem tình trạng như nào bổ sung kết hợp thêm Tretinoin, azeliac,
Dùng kem dưỡng thật mỏng nhẹ và thoáng thôi nha"
1836959460167339,1836586413537977,61552857908594,,Nguyễn Hoàng Ly,"Mụn này đi lấy nhân mụn, thải độc da rồi điều trị viêm hết là okela nha. Da m trước còn mụn nhiều hơn í mà theo chữa pp kia là khỏi dứt hẳn từ ngày đó tới giờ r,ko bị mụn lại.qua bên Viện Thẩm Mỹ Royal này đi bạn"
