post_id,user_id,user_name,fullname,content
8231849366832240,,giabao.tran.716,Nguyễn Huyền,"ĐÂU LÀ SERUM HA CẤP ẨM CHÂN ÁI? BẠN ĐÃ DÙNG LOẠI NÀO BÊN DƯỚI ĐÂY??
1. Klairs Rich Moist Smoothing Serum
Một em serum giúp dưỡng da căng khoẻ, đàn hồi, làm dịu da cực tốt. Em ấy chứa những thành phần như Sodium Hyaluronate giúp duy trì độ ẩm cho da, chiết xuất rau má giảm kích ứng và phục hồi, rễ cây cam thảo giảm thiểu tình trạng kích ứng.
Link mua tham khảo: https://shope.ee/4AduSdT4hB
2. Balance Active Formula Hyaluronic Deep Moisture Serum
Giá cực kì rẻ chưa đến 200k nhưng chất lượng dưỡng ẩm da, phục hồi lại khá tốt. Thành phần đặc biệt Hyasol PF siêu dưỡng ẩm, cấp nước mạnh mẽ hơn cả Hyaluronic Acid thông thường. Texture dễ dàng thẩm thấu và làm mềm hiệu quả, phù hợp với mọi loại da.
Link mua tham khảo: https://shope.ee/6KiP3NsdaC
3. The Ordinary 2% HA + B5
Thành phần chứa Hyaluronic Acid hỗ trợ cấp nước và giữ nước, bổ sung các thành phần thân thiện, lành tính cho da. Ngoài ra còn chứa B5 phục hồi và tạo màng chắn bảo vệ da. Kết cấu khá đặc, nhưng thấm không quá lâu, giúp da ẩm nhưng không gây bí.
Link mua tham khảo: https://shope.ee/6V1pEyASJC
4. The Inkey List Hyaluronic Acid Serum
Em này không màu, có kết cấu mỏng nhẹ và thẩm thấu nhanh, da bạn sẽ nhanh chóng trở nên mịn màng, căng mịn nhờ nhận được độ ẩm cần thiết. Thành phần chính của serum là Hyaluronic Acid 2%, peptide Matrixyl 3000 giúp phục hồi da và giảm thiếu nếp nhăn xuất hiện.
Link mua tham khảo: https://shope.ee/3AlNMlobu2
5. Timeless Hyaluronic Acid Pure
Em này rất dễ dùng, bảng thành phần an toàn, lành tính và phù hợp mọi loại da. Khi apply sẽ cho da cảm giác ẩm mượt nhưng không gây nhờn dính hay khiến da bí bách, khó chịu. Những nàng da dầu hay da khô đều bon chen được hết nè để tránh tình trạng da đổ nhiều dầu hoặc khô căng, bong tróc.
Link mua tham khảo: https://shope.ee/4AduSj9Bp4"
