comment_id,post_id,user_id,user_name,fullname,content
8035928379838231,8031246413639761,,trinh.cherry.980,Cherry Trinh,Ngoài 30t dùng chống nắng thôi là chưa đủ đâu c
8036133946484341,8031246413639761,,yen.nguyen.54540218,Yen Nguyen,"Mới 20 mà đã tàn nhang rồi. Tội e quá. E đổi kcn, dùng kcn ngày 2 lần, trưa e tẩy trang, rửa nước, dùng thêm dưỡng ẩm ( trc khi dùng kcn, da luôn cần có dưỡng ẩm, e nên dùng hãng bioderma hoặc la roche-posay nhé), rồi kcn lại. Tối tẩy trang, srm, dưỡng ẩm rồi ngủ nhé. Còn phải tìm hiểu sp uống e ạ. Để ngăn ngừa lão hoá. Chị k rành nên k dám chỉ e dùng cái nào. Vì da mỗi ng 1 khác nè."
8036294093134993,8031246413639761,100083230755341,,Nguyễn Hoa Dược Sỹ,"Chuyện bt thôi nó còn do cơ đia chê độ sinh hoạt nhé
Hiện tại làm sạch da câp ẩm nhé da khoẻ thêm tây da chết"
8035897173174685,8031246413639761,,phunghau13,Phùng Hậu,Tưởng mặt mình luôn🤣🤣
8035931259837943,8031246413639761,,mupshop,Nguyen Hai Ly,Bạn dùng kcn j đấy
8036070686490667,8031246413639761,100092442021029,,Bông Skincare,"E năm nay bao nhiêu tuổi
Tàn nhang nha e"
8035926623171740,8031246413639761,,travan.nguyen.3,Trà Vân,"Là vì bạn dị ứng với 1 trong những thanh phan cua kcn. Mình là nguoi cũng từ xài kcn theo phong trào, ai dè da càng ngày cang tệ. Mà mình k biết, mua đủ thứ my pham khac đắp len để chữa. Sau hết cách, mệt quá mình bỏ hết, k xài gì, chỉ dùng sua rua mat thôi. Xong nó hết. Da trộm vía khỏe hơn. Mới nhận ra là do kcn. Khổ thân mình, tốn k biết bn tiền."
