post_id,user_id,user_name,fullname,content
1914120492450405,,,,"Qua một thời gian đi làm thì mình chỉ muốn hỏi ý kiến mọi người:
- Nhân sự trong team của mình đều có kế hoạch nghỉ hết trước khi mình vào. Dù lúc bàn giao mình thấy họ thực sự rất yêu công ty. Chỉ mình từng phe cách hiện tại, tính cách của người này, người kia, rồi người này ko nên gây người kia ko nên đụng
- Các nhân sự trong cty đều rất thoải mái nhiệt tình, nhưng lại đều có kế hoạch nghỉ
- Công việc thì thoải mái, đến giờ là ai cũng bảo đi về đi em ơi và thực sự ở cty chỉ cần sau 10p là sáng bóng
***
Mình thực sự không hiểu vì sao công việc, môi trường làm việc khá nice và mức lương cũng khá tốt vậy mà mn lại nghỉ"
