comment_id,post_id,user_id,user_name,fullname,content
1887190061810115,1886527895209665,100084540133681,,Dương Phan,b làm sales hay gì? nếu là sales phải onl 24/7 rồi
1887151768480611,1886527895209665,100013126382686,,Khánh Toàn,"Càng về cuối năm sẽ càng ít việc, nhưng cũng sẽ ít người nhảy việc, ít cạnh tranh. Mà nói chung cứ tìm việc mới đi rồi nghỉ."
1886921305170324,1886527895209665,100075416479294,,Richard Ta,"Kinh tế để hồi phục còn lâu đó. Giờ cứ phải nhìn kinh tế mấy nước lớn như Mỹ nó phục hồi tốt, thì khoảng 6-12 tháng sau việt nam mới có ảnh hưởng tích cực, tình hình hiện tại thì chưa khả quan đâu"
1886882865174168,1886527895209665,100046786489915,,Bùi T. Giang,"Tình hình kinh tế miền bắc còn giảm rất sâu nữa nhé.
Năm sau dự báo khủng hoảng tài chính kinh tế sâu rộng.
Bạn lên các nhóm về chứng khoán để tìm hiểu.
Hiện quỹ lớn đều đang bán tài sản có giá trị - chốt lời để gom tiền mặt chờ thời rồi.
Nên là nhịn được thì nhịn
ko là ra đg chỉ có nhịn đói đấy"
