comment_id,post_id,user_id,user_name,fullname,content
1651855962074417,1651833222076691,,thoa.tran.98,Thoả Trần,"Nếu a thích ấm áp, cảm giác gia đình thì cho luôn vợ chồng và con e ở cùng dc k? Đảm bảo vẫn đáp ứng đủ yêu cầu cv nấu ăn, dọn nhà nè. 😁"
1651850358741644,1651833222076691,,ebetetytvnemebecenlr,Nguyễn Thị Hường,"E đăng ký thêm cho chồng e nữa, tăng sự ấm cúng cho gia đình luôn ạ"
1651845045408842,1651833222076691,,installedbymax,Đường Tam Tạng,Viết xong cap lại nghĩ xem aqn mỳ tôm loại nào 😂
1651835772076436,1651833222076691,100006161130269,,Hoa Hồng Bạch,"E đủ đk luôn, mạnh dạn đăng ký mang thêm ck con đến cho nhà cửa ấm áp và có không khí gia đình a nhé"
1651835448743135,1651833222076691,,HC.quyanh234x,Hoàng Công Quý Anh,A bốc phét e nhé
