post_id,user_id,user_name,fullname,content
8472142666239627,,,,"Thứ 6 vàng tăng mạnh, $BTC tiếp tục nhịp tăng
Khả năng thứ 2 sẽ kéo tiếp 1 nhịp tăng nữa.
Anh em nào vote $BTC phá lên 71k vào thứ 2 không? Điều này rất có khả năng vì sóng tích lũy ở H4 đã tương đối hoàn chỉnh.
Mọi thứ đều đang ủng hộ cho xu hướng tăng, mặc dù $BTC vẫn chưa phá trend giảm.
Nếu nến đóng trên vùng 71k thì xác định break trend giảm, còn rút râu thì sẽ phải back test thêm 1-2 nhịp.
Ngoài ra có nhiều anh em đang lo ngại kết quả bầu cử xấu sẽ gây ra một cú crash cực mạnh cho toàn thị trường.
Tuy nhiên điều này khó xảy ra!"
