post_id,user_id,user_name,fullname,content
1903926200136501,,,,"E xin chào mọi người ! Xin những lời khuyên và chia sẻ của anh chị đi trước ạ !
Em hiện tại 26 tuổi ,chỉ có bằng cấp 3, vừa rồi có kinh doanh quần áo onl nhỏ lẻ nhưng bị thất bại mặc dù rất thích và đam mê nó !Và giờ có suy nghĩ tới học ngôn ngữ để kiếm 1cv khác ạ!
E đang không biết học ngôn ngữ HÀN hay TRUNG .
-Tiếng Trung thì thấy có nhiều cty hơn , và sẽ có lợi hơn nếu như sau em vẫn đam mê bán quần áo nhập taobao
-Tiếng Hàn do đã từng làm nhà hàng HQ với hay xem phim Hàn nhiều nên có thiên hướng yêu thích hơn ạ
Và em cũng đã chuyển đến khu vực mỹ đình vì nghĩ đến chỗ đó sẽ có môi trường giao tiếp với ng Hàn nếu như vừa học vừa đi làm thêm !
Em không biết phải làm sao vì em có không ai định hướng nên em mông lung quá 😢😢
26 tuổi học giờ mới học ngôn ngữ thì học xong liệu có bị giới hạn tuổi tác để xin việc không ạ? Và các bạn trẻ bây giờ toàn vừa có bằng đại học /cao đẳng ,vừa có chuyên môn lại có học thêm ngôn ngữ nữa liệu em còn cơ hội nào không?
Và nếu học thì theo anh chị nên học ngôn ngữ nào hay sẽ tiếp tục kiên trì buôn bán (dù em thích nhưng không khả thi lắm vì k có thu nhập 😞😞)
E thành tâm xin lời khuyên của mn ạ !"
