comment_id,post_id,user_id,user_name,fullname,content
1843791889484096,1842906769572608,61554978092697,,Lê Ngọc Hoan,"Bị mụn thì b nên qtrong bước làm sạch nhé, da b nhạy cảm k nên bôi thoa linh tinh. B qua da liễu khám xem sao để tìm cách chữa chứ k thành sẹo đó, b tham khảo bên Thạc sĩ - Bác sĩ Vũ Thiên Tuân nha, trước m làm da bên bác, bác tận tình lắm mà chắc tay nghề cần thì t gửi tt cho nha"
1843752462821372,1842906769572608,,loving.iu.7,Liz Nguyen,"Kẽm kiềm dầu nè
https://s.shopee.vn/9zfcKmTpm6"
1844127402783878,1842906769572608,100074063915216,,Đinh Thị Hạnh,"Cái gì là cũng phải làm sạch da trước nha mấy bà tham khảo những loại nước tẩy trang dưới đây thử nha

Nước tẩy trang loreal : https://s.shopee.vn/9zfd1iwr4f

Nước tẩy trang contella : https://s.shopee.vn/AKITQPtZCU

Nước tẩy trang Garnier : https://s.shopee.vn/40OÓPqp7aD

Nước tẩy trang Bioderma : https://s.shopee.vn/3L8j5fU6Zs"
1843647022831916,1842906769572608,100008577093688,,Hanh Hong Nguyen,"Để giảm dầu và mụn viêm, có nhiều sản phẩm chăm sóc da phổ biến được khuyên dùng, bao gồm:

1. Sữa rửa mặt dịu nhẹ: Chọn các loại sữa rửa mặt chứa thành phần như acid salicylic, tea tree oil hoặc benzoyl peroxide, giúp làm sạch lỗ chân lông, giảm bã nhờn và chống viêm.

Ví dụ: La Roche-Posay Effaclar Gel, Neutrogena Oil-Free Acne Wash.

2. Toner cân bằng da: Sử dụng toner chứa BHA (beta hydroxy acid) hoặc AHA (alpha hydroxy acid) để loại bỏ tế bào chết, giảm tình trạng bít tắc lỗ chân lông.

Ví dụ: Thayers Witch Hazel Toner, Paula’s Choice Skin Perfecting 2% BHA Liquid.

3. Serum chứa niacinamide hoặc kẽm: Niacinamide giúp kiểm soát dầu nhờn, giảm sưng viêm, và hỗ trợ làm đều màu da.

Ví dụ: The Ordinary Niacinamide 10% + Zinc 1%, SkinCeuticals Blemish + Age Defense.

4. Kem dưỡng ẩm không gây tắc lỗ chân lông: Kem dưỡng ẩm giúp giữ ẩm cho da mà không làm nặng thêm tình trạng mụn. Nên chọn sản phẩm không chứa dầu (oil-free) và không gây mụn (non-comedogenic).

Ví dụ: CeraVe PM Facial Moisturizing Lotion, Neutrogena Hydro Boost Water Gel.
https://s.shopee.vn/6piaLD2nPR
https://s.shopee.vn/50Gw9siAKD
5. Kem trị mụn: Các loại kem bôi tại chỗ chứa benzoyl peroxide, acid salicylic hoặc retinoid có thể giúp làm giảm mụn viêm hiệu quả.

Ví dụ: Differin Gel (Adapalene), Epiduo (Adapalene và Benzoyl Peroxide).
https://s.shopee.vn/609TLcTvVD
6. Mặt nạ đất sét: Sử dụng mặt nạ đất sét 1-2 lần/tuần để hút dầu thừa và làm sạch sâu.

Ví dụ: Innisfree Super Volcanic Pore Clay Mask, Kiehl's Rare Earth Deep Pore Cleansing Masque.

Khi lựa chọn sản phẩm, bạn nên ưu tiên các loại dành riêng cho da dầu mụn và tránh sử dụng những sản phẩm chứa cồn hoặc hương liệu mạnh, vì chúng có thể làm tình trạng da tồi tệ hơn."
1843829269480358,1842906769572608,100094118140341,,Nguyễn Mai Loan,"trước mình cũng bị mụn như bạn skincare mãi không đỡ đâu,,sau phải đi da liễu điều trị á,,đầu tư 1 lần qua Viện Thẩm Mỹ Royal chữa giờ da đẹp lắm nha"
1844058882790730,1842906769572608,61555737599319,,Huỳnh Minh Diệu,muốn trị sẹo mụn thì qua bên Viện Thẩm Mỹ Royal là lựa chọn chuẩn xác nhất đó bạn.mình đã điều trị bên này rồi uy tín lắm.bác sĩ giỏi công nghệ hiện đại
1844025532794065,1842906769572608,61550516130883,,Tran Ngọc Ngân,Vẩn tái đi tái lại đó chị .chị thăm khám điều trị bên chị Vicky Thuận cho chắc nè chị chữa trị về da có tâm đc nhiều chị e điều trị khen lắm .chị tk bên chị điều trị cho mà an tâm nè
1843746779488607,1842906769572608,61562004926337,,Minh Thảo,"Gel chấm mụn dr.pong: Chân ái mình đây, dùng êm hơn, bôi lên mát dịu
Em nì ta nói gom cùi hơi đỉnh nha, dùng chấm mí em mụn đỏ chưa có nhân, qua hôm sau gom nhân mụn trắng lên cái rẹt :))) thâm mụn cũng bay ít phết. Loại da nào cũng dùng đc 1000000 đỉm/10
Mua ở đây nha: https://s.shopee.vn/7fHe4DYewA"
1843579872838631,1842906769572608,100050211463486,,San San,https://s.shopee.vn/7KeqnPCdpA
