comment_id,post_id,user_id,user_name,fullname,content
1734698037336535,1734201457386193,100073491678863,,Diễm Quỳnh,"Mình thấy gr này nhiều mom kinh nghiệm lắm, mình học được nhiều lắm này, mom và gr tham khảo xem https://www.facebook.com/groups/mongconhiemmuontphcm MONG CON, HIẾM MUỘN TẠI TP.HCM (TỰ NHIÊN, IUI, IVF...)"
1734520284020977,1734201457386193,61561897556801,,Vũ Ngọc Bích,"Vẫn có khả năng mà mom. Mom tham khảo bác Yến bên viện đại học y xem sao. Bác có nhiều năm kinh nghiệm trong nghề mà chu đáo, nhiệt tình lắm."
1734609024012103,1734201457386193,,hoanh.binh.758,Hoành Binh,Tắc vòi trứng m uống thuốc nam bên fb Thuý Yiu này nha 🥰🥰🥰 mình cũng bị uống đã khỏi
1734594230680249,1734201457386193,61557410638803,,Thảo Thu,"Tắc vt chị thấy thường làm ivf vì mổ thông rồi để tự nhiên dễ tắc lại lắm. Em tham khảo qua viện đại học y, chị thấy bác sĩ bên đó giỏi lắm. Nhà chị ivf theo bác đồng trang thành công r đấy"
1734640217342317,1734201457386193,61560837142676,,Phan Hồ Diệp,"Tắc vòi trứng thì làm ivf là tốt nhất á mom. Mổ hồi cũng tắc lại à. Mom vào gr này để tham khảo thông tin địa chỉ uy tín bsi giỏi chuyên môn cao về ivf này, nhiều mom tắc vòi trứng mà ivf thành công có bé chia sẻ kinh nghiệm kinh nghiệm trong này á Hội Hiếm Muộn Việt Nam (IVF - IUI)"
1734620330677639,1734201457386193,61560560968401,,Đặng Tố Quyên,"Tắc cả hai vòi thì phải làm ivf thôi mom ơi mới có cơ hội đón con được, môt thông thì dễ tắc lại còn iui thì ko xi nhê. Mom vào gr này các mẹ tắc vt làm ivf thành công chia sẻ kn cho nha Hội mong con - Hiếm muộn (IUI - IVF)"
