comment_id,post_id,user_id,user_name,fullname,content
1862602167602238,1862445120951276,,mipucute,Do Phung,Bn làm đối soát ấy. Làm sàn TMDT chắc làm đối soát dc mà.
1862594284269693,1862445120951276,100006667038780,,Khánh Ngọc Quỳnh,"Đầu tư thêm khoá HC.NS để nâng cao kỹ năng phỏng vấn và am hiểu về các nghiệp vụ HC.NS mình có khoá HC.NS, đủ tài liệu, bằng 2 cốc cafe. Ib nhận đề cương fre.eeeee🤩"
1862589904270131,1862445120951276,100077910881232,,Trần Linh,Khu đô thị Lideco cần tuyển sale/Leader sale mảng TPCN. Quan tâm ib ạ
1862558340939954,1862445120951276,,xuyen.pham.167527,Doris Phạm,"Hi bạn
Hiện bên mình kinh doanh theo mô hình D2C ( các sp tiêu dùng hữu cơ mảng sức khoẻ và làm đẹp) tại HCM
Không chạy KPI, cơ hội đột phá thu nhập thông qua sự nổ lực của bản thân.
Môi trường làm việc trẻ, năng động
Bạn quan tâm ib mình trao đổi kỹ hơn nhé"
