comment_id,post_id,user_id,user_name,fullname,content
2068300960316687,2068180840328699,100051792154544,,DS Thanh Xuan,c đang dùng những sp gì nhỉ ?
2068299733650143,2068180840328699,,meo.con.75436531,Ngọc Mến,Bôi serum mụn đi em
2068300020316781,2068180840328699,100064848706427,,Phùng Thị Hương Thu,"Chị check ib em nhé, em tư vấn miễn phí và thăm khám da free ạ"
2068305580316225,2068180840328699,100082783042400,,Lam Nguyễn,Da dày sừng hả ta. Bạn có xài ttbc không
2068435806969869,2068180840328699,,NoTaLam.2502,Văn Chung,Nội dung comment 1
2068301430316640,2068180840328699,100073379899411,,Neo Jen,bạn đang dùng tẩy trang nào đó
2068377010309082,2068180840328699,61557402306651,,Huấn Hà,"Kích ứng nhiefu vậy thì gặp bs th b nha, mình hk nghĩ này là mụn bth đâuu, có gì gặp bs khám cho chắc chứ hk sợ lên mụn viêm á, b ở sg thì đến q10 chỗ cmt8 kế toàn nhà viettel á, có pkham tên doctoracnes đến đó thăm khám vs bsi nha, da mình đi điều trị bên đó về nè"
2068305366982913,2068180840328699,100027616621613,,Ngaa Phạmm,"Nó cứ đẩy viêm lên như thế này ạ
Trc da mk trộm vía k có mụn mà 4 tháng nay cứ đỡ xog lại bị lại
Mn giúp mk giải cứu làn da này với ạ"
2068677873612329,2068180840328699,,dieuhiengiap11,Dieu Hien Giap,"B tham khảo bên chỗ Thạc sĩ - Bác sĩ Vũ Thiên Tuân uy tín nha, bác chuyên môn cao tay nghề giỏi còn tận tình nữa nên yên tâm khỏi bàn. Mình làm đẹp bên bác lần nào cũng ưng luôn, highly rcm nha"
