comment_id,post_id,user_id,user_name,fullname,content
1952744935205624,1952586348554816,,ana.tr.79656,Anna Tran,Vy Thanh Mai tui vs cậu😂
1953816981765086,1952586348554816,100029987104895,,Vy Dương,Tarmie Nguyen Truong Quynh Huong làm trọn bộ cho chị
1953190761827708,1952586348554816,100007619528921,,Nguyễn Tuyết Hạnh,Thảo Vân Cao Hien zô k em
1954507581696026,1952586348554816,100005861619885,,Phương Vũ,y vậy lun :)))
1953889401757844,1952586348554816,,annh.van.12914,Van Anh,triển
1952876831859101,1952586348554816,,tyty.nguyen.756,Tyty Nguyen,Hahaha mấy đứa hay chê chẳng qua ko có tiền làm thôi... chứ đẹp hơn thì ngại ji ce oi
1953964458417005,1952586348554816,,ngoc.van.501,Bảo Ngọc,Thuý Hằng :)))) vầng
1952774931869291,1952586348554816,100004508774231,,Mai Ngọc,Mai Anh nhỉ hihi
1953974835082634,1952586348554816,,hienthu.le.378,Lê Thị Thu Hiền,Diệu Linh xin tiền độ bộ loa na
1953017961844988,1952586348554816,100008166348435,,Tuyết Mai,Phương Luậtt khỏi dài dòng hem… 😂 đừng ai hỏi khi giàu mình làm gì 🤣
1953017961844988,1952586348554816,100008166348435,,Tuyết Mai,Phương Luậtt khỏi dài dòng hem… 😂 đừng ai hỏi khi giàu mình làm gì 🤣
1953286951818089,1952586348554816,,pntn.tn,Tuấn Nguyên,"Phan Minh Anh cậu nè, độ bộ loa"
1953162061830578,1952586348554816,100009806528677,,Nguyễn Thị Thu Thuỷ,Thanh Duyên ĐỨC THỌ LEE kkk
1952823618531089,1952586348554816,100007941993308,,Việt Lệ,Ngọc Bích giống b thế😂
1952685241878260,1952586348554816,,ngo.huyen.528,Huyền Ngô,Vũ Thúy Ly Dương Nguyễn có sửa k ^^
1953312865148831,1952586348554816,,lanhoang0220,Hoàng Lan,Lạc Hảo có tiền chưa =))
1953574438456007,1952586348554816,100008052428422,,Thành Long,Cẩm Ngân u có mún ko
1954797405000377,1952586348554816,,chi.oaoa.5,Chang Chu,Lee Pé Tý khi nào có tiền đi độ loa đi nhớ
1960111747802276,1952586348554816,,myngan.tran.7334,Mỹ Ngân,Lành Trương em ơi em ơi 🤣
1952788971867887,1952586348554816,,tranhuyentran101,Trần Huyền Trân,Thu Hà hâhhaha
1952685828544868,1952586348554816,100039089131410,,Đinh Diệu Linh,Trang Bum hai ce mình đi =))
1953321241814660,1952586348554816,,dien.ngoc.3192479,Ngọc Diện,Hàn Duyên chắc phải thế
1952758061870978,1952586348554816,61554800436472,,Huỳnh Brian,Nguyễn Như có làm luôn ko kìa
1952639631882821,1952586348554816,100004910830931,,Ngọc Mỹ,Nguyễn Thư kìa m kìa
1953572915122826,1952586348554816,,tungan.nguyenly,Ngân Nguyễn,Thanh Xuân em đó :) chính là emmmm
1953571638456287,1952586348554816,100009177564476,,Ha Moon,Hà Huỳnh dứt khoát lun🤣
1952759061870878,1952586348554816,,thanhhuyenn2812,Trần Thanh Huyền,Lâm Linh dmd hâhhah
1953040091842775,1952586348554816,100071361677099,,Lâm Bé Vy,Nhung Nguyễn Huyền Nguyễnn tui dí nhỏ bạn 😆😆
1952925571854227,1952586348554816,,hienbeo333,Trúc Hiền,Tường Vi đang tính zị lun đó pé heo ơi 🤭🤭
1952641798549271,1952586348554816,,sam.ngo.1044,Hồng Hạnh,Phượng Nguyễn m hã
1952758075204310,1952586348554816,100002830160892,,Jeremy Nguyen,Thanh Truc ủa bạn
1953834735096644,1952586348554816,100072220364822,,Tiến Nguyễn,Thùy Trang nào có tiền. T dẫn cho đi
1952721228541328,1952586348554816,100079730541081,,Hoàng Thái,Chúc Giang nói gì nữa
1953386498474801,1952586348554816,,kenny.ngo.984,Cô Kỳ,E nghĩ Bảo Ngọc cũng sẽ nv đúng ko c...:)) Hung Tran
1955472498266201,1952586348554816,100090445625937,,Trang Pham,Bảo Trân2 ce t có tiền :))
1953027205177397,1952586348554816,100009945069345,,Khanh Zi,Linh Tôm阮氏雲泉Tố Uyên Vương Thêu khumm cảng đứa nào hết
1952987358514715,1952586348554816,,ngocyen412005,Ngọc Yến,Bình San chị phải không
1952805491866235,1952586348554816,,bephapham,Bếp Nhà Hà,"Rất dứt khoát, có trời mới cản đc t😂😂😂"
1952685961878188,1952586348554816,100008597801801,,Dung Miêu,Diệp Khanh chị em mình khi Nguyễn Chiến có tiền và sụn tai
1954855804994537,1952586348554816,,Tienky1997,Tiền Yumii,Yu Mi Sống là phải có mục đích 😂
1952861728527278,1952586348554816,100009256742222,,Trần Thị Mỹ Hạnh,Một Centimet Ánh Dương p em bé Bão hông =)))
1958892561257528,1952586348554816,,vothi.nhatle.7,Võ Nhật Lệ,Trần Ngọc Hưng Trúc nè e. Nó nói c z á
1952704125209705,1952586348554816,,maile.150594,Mai Lê,Lê Hồng Ngọc 🤣🤣🤣 thảo nào thấy bà đi HN
1952645645215553,1952586348554816,100017396898596,,Mỹ Tuyết,Hương Tú kkkk clm
1953333938480057,1952586348554816,,dieuai18031996,Út Nqân,Như Emm t làm tất trừ làm dú 🤣
1953623051784479,1952586348554816,100004887601818,,Kim Chi,Nguyen Trang c ơii 🤣🤣
1952877618525689,1952586348554816,,danh.anh.7967,Danh Anh,Điền Thị Hồng Yến c ha
1954632391683545,1952586348554816,100062884770456,,Nguyễn T. Mai Anh,Tới công chiện liền
1954116208401830,1952586348554816,,thao.tran.5209,Thảo Trần,Nguyễn Hồng Uyên Bich Ngoc Sie 2 dua m do 🤣🤣🤣
1953679731778811,1952586348554816,,banhbao.nguyen.104,Nguyễn Ngọc,Mũi đầu tiênn
1952924635187654,1952586348554816,100025242369348,,Nguyễn Khánh Linh,Thu Hằng Thu Giang lẹee
1961017407711710,1952586348554816,100026581183122,,Ngô Ngọc Như Quỳnh,Huyền Trân alooooo
1952924935187624,1952586348554816,,ponie.pon.3,Kháng Kháng,Lan Phương k nói nhiều :))
1952597888553662,1952586348554816,,ngocpham3105,Phạm Ngọc,Kieu Anh ôi phú bà hãy cho e xin vài tỷ đi pttm🤭
1953409298472521,1952586348554816,,hai.suri.3,Âu Hải,Nguyễn Thị Ngọc HiệpĐinh Thị Lệ QuyênHuyền SandyKim Anh sai thế đếu nào dc
1952865091860275,1952586348554816,100035373390102,,Trang Nguyễn,Nguyen Windy nè he :))((
1952830435197074,1952586348554816,,khoathanh.lan.1,Khoa Thanh Lan,Moon Hồng kkk
1952745601872224,1952586348554816,100090558431083,,Hồng Chăm,Hương Lâm đập xây lại hết cho chuỵ 🤣
1952697945210323,1952586348554816,,AsuraQz,Nguyễn Hồng Quang,Đăng Nhi vk tui chắc cũng giống vậy he 😆😆😆
1952681341878650,1952586348554816,100022635452448,,Như Huỳnh,Thuý An y sì
1955146878298763,1952586348554816,100010715076590,,Vũ Văn Mừng,Vũ Duyên hình ảnh Vũ Thị Dinh trong tương lai nè chị.=)))
1952602075219910,1952586348554816,,caodat1996,Đạt Phạm,Võ Phạm Bảo Vy coi nè em
1954691181677666,1952586348554816,100027973242293,,Thịnh,Trần Khánh Huyền Nguyễn Phương Trang đi
1953122008501250,1952586348554816,100072414078182,,Hoang Thao Nguyen,Phạm Hoàng Kim Chi my future
1952827778530673,1952586348554816,,gauconmissa,Missa Đỗ,Thuy Nguyen làm cỡ này dc òi há Đình Quân Thao Phan
1957252144754903,1952586348554816,,lynklucky.lee,Khánh Linh,Anna Lê sương sương vậy thôi à
1954081098405341,1952586348554816,,ngc.vihhh,Ngọc Vinnh,đúm dị 😌
1952774875202630,1952586348554816,100007457710379,,Đỗ Thanh Trang,Hằng Đinh hay Mai Lê
1952645775215540,1952586348554816,,NganDang94Oct,Ngan Dang,Duy Farmer size 500
1952672295212888,1952586348554816,,hauthinh1611,Hậu Vũ,Nguyễn Hong Anh đúng bạn rồi còn gì
1953757995104318,1952586348554816,100050275844991,,Thanh Nga,Thanh Nguyên Khang Nguyễn làm từ đầu tới chân 😘❤❤
1952635548549896,1952586348554816,,ph.khanh116,Phương Khanh,Kim Ngân Nguyễn Hoàng Đức Chờ đón diện mạo mới của t trong tương lai đi =)))
1952796785200439,1952586348554816,,bella.hienngo,Ngô Nguyễn Lam Hiền,Ngọc Diễm Nguyễn kk
1953623768451074,1952586348554816,100017501700810,,Ngân Thiên,Trần Ngọc Diễm My nào giào
1952767331870051,1952586348554816,,Tmy19.mytran,My Trần,Phương TrangKiều NhungNguyễn Thị Lan Anh body samsung đi
1955795034900614,1952586348554816,,icecayaaa,Nguyễn Phan Bảo Thy,Tra My nâng dú
1952802978533153,1952586348554816,,duyen.nguyen.254,Duyên Nguyễn,Thu Thuý mé giống PTQ qá
1953511521795632,1952586348554816,100008768744432,,Hữu Phạm,Maria Barbie Nguyen niềng xong là tới công chuyện à =)))))))
1952609825219135,1952586348554816,100058228496494,,Lan Anhh,Chúng toaii sau này Thanh TrúcTran Hong
1952658931880891,1952586348554816,,bichtuyen.luong.186,Lương Thị Bích Tuyền,Huyền Trân há há bà kìa
1955163758297075,1952586348554816,,linh.tepriu.5,Võ Thị Khánh Linh,Thanh Hà chắc đi thẩm mĩ đây
1952721031874681,1952586348554816,,duyen.ho.73345,Duyên Định,Thảo Nguyễn chốt đơn
1954711841675600,1952586348554816,,myy.thao.79,Nguyen Thao My,Mai Hương k noi nhiu =)))))
1952828988530552,1952586348554816,,hien.smile.197,Thanh Hiền,Ngọc Ánh đúng k :)))
1952943408519110,1952586348554816,,hasaidthat,Phạm Ngọc Hà,Yếnn Nhii nghĩ ngay đến pà
1952865565193561,1952586348554816,,chuot.ogi,Hoàng Hiên,Minh Huế khi có tiền bạn có thế ko kkkk
1959173197896131,1952586348554816,,ngoclan.au.3386,Tô Trang,Bích Bích khi nào mình có xiền chị nhể
1953299748483476,1952586348554816,,linhmit141093,Khánh Linh,Hằng Sún thích mà méo dám 😂😂😂
1952877225192395,1952586348554816,,nguyen.duy.90281,Thuý Duy,Trinh Triệu kkk
1954139505066167,1952586348554816,,jess.tran.963,Ngân Trần,Lý Nguyễn Kim Xuân c xin lõy c xin lõy đc chưa 🤣🤣🤣 nhưng c chỉ nghĩ đến e
1953310075149110,1952586348554816,100010394498322,,Nguyễn Thị Mỹ Nhung,Lê Thị Kim Yến ước mơ
1953041941842590,1952586348554816,100009400579831,,Như Như,Tuyết Ngân kkk
1952628855217232,1952586348554816,,nhu.quynhh.93,Như Quỳnhh,Bích Ngân đúng e mình đây r 🤣
1960862514393866,1952586348554816,,tuuyen.trinhthi.35,Trịnh Tú Uyên,Trần Phạm Huỳnh Như quất cái big size
1959827207830730,1952586348554816,100011654780639,,Thanh Tuyền,Ly Trúc mời 3 bích đi trước
1958282917985159,1952586348554816,,tao.tay.9250,Lii Lii,Nguyễn Hà Aanh k nói nhiều
1956042068209244,1952586348554816,100022646762015,,Hà Thanh Trúc Huyền,Hạ Trúc tui
1954848948328556,1952586348554816,,nguyet.tran.771,Ánh Nguyệt,Mai Minh Ánh Lê Trang y chang 🤣
1954105825069535,1952586348554816,,daoeyne,Đào Ey,Ngọc Ánh c toy
1953489245131193,1952586348554816,,maithao21200,Thanh Thảo,Nguyen Thi Thuy Linh nhìn hình e nhớ chị liền
1953485505131567,1952586348554816,100027049811351,,Trần Minh,Juice Vu có lương r đi làm tiếp đi chị
1953441538469297,1952586348554816,100059329941834,,Miiss Trinh,Hanh THanh kkkk
1953249251821859,1952586348554816,,vuthanhlamloveyjmcs,Lam Vu,Hà Thu tự nhiên nghĩ đến e 🤣
1952917328521718,1952586348554816,,ytran.nhu.96155,Như Ýi,Pé Heo kkkk
1957043294775788,1952586348554816,100029236477710,,Anh Tran,Trang Lê nào mới có tiền
1955499861596798,1952586348554816,,vy.nguyen.213,Vy Nguyễn,Thanh Phương xao giống ai kia quá à
1953930871753697,1952586348554816,,pony.le.52,Xuân Trang,Nguyễn Huyền kkkk nhô liền =))))
1952789598534491,1952586348554816,,mi.tran.1029770,Mi Trần,Lý Hồ giống m
1952707288542722,1952586348554816,,jenny.2tv,Ngọc Thảo,QuangDai Nguyen như nàoo
1952628945217223,1952586348554816,,Thaobili.dt,ThuuThảoo Trần,Lệ Quyên haha
