comment_id,post_id,user_id,user_name,fullname,content
2787325538112579,2784875558357577,,tam.trung.5492,Trung Tám,"Lấy 500tr đó mua trái phiếu của Vin mới ra lãi suất 13,5%"
2787243634787436,2784875558357577,,binh.thuong.5,Minh Hung,500tr lấy đi mua ô tô luôn đi kẻo mua lung tung cuối năm lại ko đủ kk
2787243288120804,2784875558357577,,PhoebeGoby,Phuong Anh Nguyen,Cầm 500tr đi mua ô tô luôn đi bác :)
2787260934785706,2784875558357577,,huan.nguyentrong.589,Huan Nguyen Trong,Mua luôn đi cần ji phải đầu tư nữa
2787311624780637,2784875558357577,,hoa.kt.asean,Hoa Nguyen,"500tr dc ô tô rồi bạn, đt làm gì nựa"
2787265251451941,2784875558357577,100029926447296,,Hoang Phan,Bạn nên dtu chứng khoán. Đảm bảo cuối năm bạn mua được VF3
2787264434785356,2784875558357577,,ngocvu.chien,Vũ Ngọc Chiến,Chắc chắn cuối năm nhưng ko biết năm nào
2787265401451926,2784875558357577,100011455744447,,Nguyễn Nam,Lấy tiền đi mua ô tô chứ đầu tư chứng khoán thì còn được cái lốp😆
2787307881447678,2784875558357577,,anh.quynh.794,Jang NaNa,Cuối năm lại nợ thêm x2
2787304571448009,2784875558357577,,thanhnam.tran.520,Thanh Nam,giờ không mua cuối năm mua sh
2787262751452191,2784875558357577,100002751518584,,Kim Uyên,"Mình mua ô tô 300tr , 200tr còn lại đầu tư chứng khoán là có cả 2 mà 🤭"
2787266241451842,2784875558357577,100000064615393,,Nguyễn V.Anh,"500 tr giờ mua đất !!!! Mua đất nông nghiệp !! Về trồng lúa , trồng rau cuối năm mua honda"
2787342854777514,2784875558357577,100010292532352,,Vi Lee,mua vf3 thì e tư vấn đc
2787244311454035,2784875558357577,,YS.Sniper.HaiZero.Na,Nguyễn Văn Hải,Sell vàng vô địch
2787351794776620,2784875558357577,61562475355084,,Phạm Thắng,Đi mua luôn bác ơi chứ không mất sạch như chơi
2787370768108056,2784875558357577,100092355052972,,Lâm Quang Doanh,"Mình hiện tại đang đầu tư,kinh doanh ngoại tệ,vàng để ăn chênh lệch giá.
Lợi nhuận khá tốt 1-3%/vụ. (1 tháng 3-4 vụ)
✅Vốn đầu tư k cần quá nhiều,an toàn rủi ro thấp.Đang cần ace có vốn hợp tác làm cùng.Hữu duyên thiện chí inbox nhé"
2787284961449970,2784875558357577,61554893125253,,Đông Pha Kim,ăn pô
2787267658118367,2784875558357577,61565853517242,,Tuan Ho,Mình hỗ trợ kinh nghiệm cho người mới . Dạy phân tích VSA . Ngoài ra hàng ngày sẽ đưa view VSA & Wyckoff anh em tham khảo . Chi tiết ib mình nhé
2787243888120744,2784875558357577,61550627265961,,Quân Trần,Nhóm này chỉ chơi chứng thôi bác :))
2787285951449871,2784875558357577,,ckc.cuong,Phú Cường,"Đầu tư chứng khoán có nhiều điểm tương đồng với việc trồng cây. Khi bạn bắt đầu, giống như việc gieo một hạt giống, bạn cần kiên nhẫn và tỉ mỉ. Một cây xanh không thể lớn lên và cho quả ngay lập tức, cũng như cổ phiếu không thể sinh lời ngay sau khi mua. Nhà đầu tư cần dành thời gian để tìm hiểu, lựa chọn loại cây phù hợp với điều kiện đất, khí hậu và tài nguyên mà họ có, tương tự như việc chọn lựa cổ phiếu phù hợp với mục tiêu tài chính và mức độ chấp nhận rủi ro.

Quá trình đầu tư cần sự chăm sóc liên tục, giống như cây cối cần được tưới nước, bón phân và cắt tỉa. Trong thị trường chứng khoán, bạn cần cập nhật thông tin, theo dõi diễn biến thị trường và đôi khi điều chỉnh danh mục đầu tư của mình. Có những thời điểm, giá cổ phiếu giảm giống như thời kỳ khô hạn hoặc bão tố khiến cây cối gặp khó khăn, nhưng nếu bạn kiên nhẫn và chăm sóc đúng cách, cây sẽ hồi phục và phát triển mạnh mẽ.

Cuối cùng, đầu tư thành công giống như việc thu hoạch trái ngọt từ cây đã trồng. Điều này đòi hỏi sự kiên trì, tầm nhìn dài hạn và sự linh hoạt trong cách tiếp cận. Kết quả không đến ngay lập tức, nhưng nếu bạn giữ vững niềm tin và chăm chỉ, trái ngọt sẽ đến vào đúng thời điểm."
2787263938118739,2784875558357577,,duyhau.chu,Chu Duy Hậu,Đừng bốc phét trước đã
2787291934782606,2784875558357577,100036260677158,,Phạm Tùng,"Cầm tiền đó mua ô tô còn có xe đi,chứ đầu tư chứng khoán thì cuối năm cũng mua dc ô tô...nhưng là ô tô đồ chơi ad ạ
Ad thử tượng tượng ngày nào cũng bị vk đấm đá ko thương tiếc dù mình chẳng làm gì sai chưa....
Đó là cảm giác gồng lỗ đấy"
2787310824780717,2784875558357577,,forevernd1989,Ngân,"Chứng khoán đi bác, cuối năm sóng to đấy"
