comment_id,post_id,user_id,user_name,fullname,content
1725847768221562,1725841251555547,100066271796473,,Anna Lê,"lúc nào bsi bảo kiêng thì kiêng , còn ko thì thôi"
1725870504885955,1725841251555547,100082521004736,,Nguyễn Ly,Không kiêng á. Mom iui hay ivf thế
1725843274888678,1725841251555547,100094187656980,,Huỳnh Khả Di,bình thường mom ơi
1725846488221690,1725841251555547,100095041196705,,Phạm Khánh Tâm,ko có kiêng c nhé
1725845591555113,1725841251555547,100094225395264,,Kim Dung Võ,kiêng đc thì tốt
1726160621523610,1725841251555547,61560560968401,,Đặng Tố Quyên,"Ko cần kiêng nha mom ơi, nếu làm ivf thì nên hạn chế á. Mom vào gr này các mẹ chia sẻ kn cho nha Hội mong con - Hiếm muộn (IUI - IVF)"
1725845308221808,1725841251555547,100035613630324,,Phạm Duy Bách,Nếu kích iui thì qh đc còn kích ivf thì ko vì kích ivf lên nhiều trứng nếu qh sẽ dễ bị xoắn buồng trứng.
