comment_id,post_id,user_id,user_name,fullname,content
1779888936088225,1779721179438334,,haku2003,Triệu Gia Minh,Hẳn là giá vẫn hợp lý. Làm như nhà hàng k bằng 🤣🤣🤣
1779888029421649,1779721179438334,,Luke.Joji,Joji Nguyen,"Lại ăn tiền quảng cáo à, tôi ở gần đấy ăn 1 lần say bye luôn. Quán làm gì có cảnh đẹp vậy"
1779797069430745,1779721179438334,100017484677767,,Bin KonChuot,ở đâu Hà Nội thế b?
1781744472569338,1779721179438334,,nguyenkimtuyen020799,Nguyễn Kim Tuyến,trông ngon vậy Duy Hiếu
1779892532754532,1779721179438334,100008293270588,,Tuấn Anh Nguyễn,"Khó thế nhỉ? Đi ăn khen mà lắm bác kêu gào quá, chê cũng thấy kêu gào luôn🤣🤣🤣 mạng xã hội chứ có phải làm báo đâu các cụ"
1780060462737739,1779721179438334,,ngoc.phungkim.71,Phùng Kim Ngọc,"Bác ơi em hỏi thật bác là bác làm PR cho quán hay bác là người nhà của quán??? Em có một trải nghiệm rất tệ, gia đình em đi 4 người, em có vào gọi đồ là 2 bánh và 8 nem (do nhà em có 2 trẻ em ko ăn được bánh). Nhân viên ra bảo ko bán vậy, chỉ bán theo xuất là 4 bánh và 8 nem, nói khó mãi thì mới bán 3 bánh và 10 nem. Thực sự thấy buồn cưới. Sau đó em thấy một đoàn xe máy chở toàn tây du lịch vào ăn. Đúng là càng ngày càng đi xuống. Bánh thì cứng, nem thig mặn. Ko có lần thứ 2 quay lại."
1779813922762393,1779721179438334,,LePhuongDongDev,Lê Phương Đông,"hn cũng ko rủ ai đi ăn chè đc, định đi ăn bánh xèo ở hàng gần nhà thì hàng ý đóng cửa, chắc là nghỉ đi ăn chè rồi 🤧"
1779842719426180,1779721179438334,100002355682119,,Trịnh Đức Huy,"Mình đến ăn quán này một lần buổi trưa mà cảm giác giác vừa nhục vừa tức đ chịu được. Mấy ku nhân viên toàn bọn trẻ không được train tử tế nên nhiều cái mình nói cno chả thèm care khách. Bàn ghế ngồi thì ít, không thoải mái. Đ gì năm 2024 rồi mà còn phải ngồi ghép bàn mặt đối mặt với người lạ. Phục vụ thì chậm, bánh xèo thì dở, nhiều dầu mỡ, đến cái nước chấm cũng không ưng. Không hiểu quán này lộc lá đến mức nào mà đông khách quanh năm luôn =))) Nhà ny mình cách có 100m mà suốt mấy năm đi ăn đúng 1 lần kbh quay lại"
