comment_id,post_id,user_id,user_name,fullname,content
1827131144483504,1826366177893334,,dung.thuythuy.9210,Thuỳ Thuỳ Dung,https://s.shopee.vn/3L8BCu5AkU
1827153471147938,1826366177893334,100083230755341,,Nguyễn Hoa Dược Sỹ,"Má kia có ko e da dầu hay khô
Tây trang srm sach sâu chấm mụn kèm tẩy da chết nhé
Lưa chọn đồ đúng đủ hạn chế thức khuya"
1827167261146559,1826366177893334,100080922901989,,HaLy Phạm,"- Thứ 1: Mụn ẩn sần sùi , kích viêm thâm mụn các kiểu như này thì nền da phải luôn thật sạch sâu ( Xem lại bước làm sạch thật kĩ nhé👌)
=> Peel định kỳ nhẹ nhàng để thông thoáng lcl & ăn dưỡng hơn nhé

- Thứ 2: Duy trì với hoạt chất ( đặc trị mụn ) & Tranexamic/ Arbutin/ Kojic…sáng đều màu, mờ thâm, ucst
Kết hợp Phục hồi + Cấp ẩm đủ đô để da luôn khoẻ, khô cồi nhanh & tránh bị kích viêm như này nhé

=> Và Routine như nào cho hợp lý nữa nhé ✅"
1827174704479148,1826366177893334,100051792154544,,DS Thanh Xuan,C đang dùng những sp gì nhỉ
