post_id,user_id,user_name,fullname,content
2026917041074255,,,,"[ Tâm sự ]
Em buồn quá mọi người ơi. Em ở tỉnh Đồng Tháp, sn98.
Em đã thất nghiệp từ hồi tháng 6, sau đó xin được vị trí kế toán viên ở cửa hàng gas, mới thử việc 7 ngày thì mất việc vì chủ tuyển nữ vào làm.
Em có kinh nghiệm kế toán nội bộ 2 năm, sale 3 năm, em chỉ muốn tìm việc làm văn phòng bởi vì sức khỏe không phù hợp làm công nhân. Vậy mà tìm việc bây giờ như mò kim đáy biển vậy, em đi phỏng vấn đến hết tiền xăng đi lại, phải đi vay mượn tiền để có tiền đổ xăng. Vậy mà chỗ thì phỏng vấn xong im re, chỗ thì tới nơi kêu trùng lịch xong hủy pv, chỗ thì ghi trên bài tuyển không yêu cầu kinh nghiệm, tới nơi đòi kinh nghiệm, trong khi em phải bỏ tiền xăng chạy hơn 40km, nói thử việc 1 tuần không lương em cũng cắn răng chấp nhận để hi vọng được công việc làm mà cuối cùng từ chối.
Nhà em chỉ có mình em tạo thu nhập, họ hàng cũng không ai giúp đỡ gì, bây giờ em không thể vay mượn tiền ai để mà sống nữa, em còn mẹ già nữa. Nhiều lúc em chỉ muốn 44 ( tu sat ) thôi, em cảm thấy rất tệ, bây giờ cả cái tỉnh Đồng Tháp lớn như vậy lại không có lấy 1 chỗ nào cho em làm hay sao ấy, mấy năm trước em tìm 1 tuần là có, bây giờ đã hơn 4 tháng rồi vẫn không có việc. Tiền thì hết, sinh hoạt phí thì ngày nào cũng cần. Tìm mấy chỗ sale thì toàn không có lương, dù là tiền đổ xăng cũng không có. Mà mấy chỗ như vậy lại nhận em, mỗi lần nghĩ tới không có lương nhưng hàng ngày đi làm tệ gì cũng hết 30k tiền xăng,20k tiền cơm, giờ mua ổ bánh mì cũng 15k. Mà không có trả lương thì lấy tiền đâu ra mà đi hoài, số tiền em vay được cũng chỉ có vài trăm, vay thì phải trả, cứ nghĩ tới cảnh mỗi ngày đi làm nhưng không có lương là em lại nản ,em thức cả đêm lo nào là tiền ăn tiền điện nước....
Tìm việc online thì toàn luadao, xin lại công ti cũ cũng không nhận do đang cắt giảm nhân sự.
Xã hội rộng lớn như vậy, lại không có 1 công ti nào còn chỗ cho em nữa."
