comment_id,post_id,user_id,user_name,fullname,content
1703011783819720,1703005003820398,,mrgoonie,Duy Nguyen,"Trước mắt đăng ký tài khoản Developer tốn $5 cái đã 😂

Rồi sau đó tuỳ theo chọn Trader hay Non-trader thì quy trình review khác nhau, nếu extension có thu tiền thì phải chọn Trader, quy trình review mệt mỏi luôn, còn ext free thì thì chọn Non-trader, nếu ext đơn giản chắc 2-4h là review xong (có kết quả thôi chứ chưa chắc approve nha), còn ext đòi nhiều permissions thì review take time hơn (lên đến vài ngày)

Trong group mình cũng có nhiều bạn làm Chrome Extension á"
1703011467153085,1703005003820398,,vietnh.dev,Hoàng Việt,"Đky tài khoản mất mấy $, xong up cũng dễ thôi b"
1703017287152503,1703005003820398,,quangpl99,Le Quang,Upload đơn giản nhưng nhớ tuân thủ policy nha bác : D
