comment_id,post_id,user_id,user_name,fullname,content
1871817033347418,1871502760045512,,leo.bui.180,Hùng Hùng,trong thời gian 45ngày làm tròn trách nhiệm và ko còn nhiệt huyết thì cho nghỉ sớm thôi chứ chả có cty nào trả lương cho người ko còn động lực đâu (trừ khi bạn cố tình vi phạm hợp đồng để họ phạt)
1871541496708305,1871502760045512,100004717906038,,An Nhiên,"Giống cty tui, đưa tờ cam kết, nghỉ phải báo trước 3 tháng, đến lúc nghỉ, giữ 50% tháng tiếp theo mới trả, mà trả ko thì hên xui, vì thường sẽ kím cớ phạt"
1871549266707528,1871502760045512,100051918411407,,Pham Duc Hai,Trong thời gian thử việc mà cty cho nghỉ đột xuất ko báo trước (hôm nay báo rồi mai cho nhân sự nghỉ luôn) thì cty có phạm luật k ạ
1871538716708583,1871502760045512,,hahaidangvn,Hà Hải Đặng,"Cứ gửi đi, thường k tới 45 ngày sau mới đc nghỉ đâu, cứ bàn giao hết việc xong cty cx cho nghỉ trc à"
1871535743375547,1871502760045512,,lethietbao,Bao Le,Ủa sao ko?
