comment_id,post_id,user_id,user_name,fullname,content
2370781016731055,2370596033416220,,MumMim1993,Khoa Thanh Huyền,Trước mình nuôi bé mèo đực. Bỏ nhà đi hai tháng hơn mới tìm được về. Nhiều khi đi chơi xa quá quên mất nhà
2370812006727956,2370596033416220,,nghiem.tran.77128,Trần Nghiêm,Sao giống nhau thế cái mặt.
2370720453403778,2370596033416220,,huonggiang.dinh.359,Đinh Hương Giang,"B thử nhờ mèo hoang tìm giúp, mang hạt và nước ra ngoài nhờ mèo hoang tìm giúp"
2370810833394740,2370596033416220,,trang.tay.731,Trang Tày,"Nhà mình 2 lần đi dạt, lần đầu 3 ngày lần 2 thì 4 ngày. Chúc bé sớm về nhà."
2370792540063236,2370596033416220,100086965827326,,Cảnh Hà,"Bạn nên tham khảo các bệnh viện lớn, mình thấy có nhóm Review Bác sĩ mắt, Phòng khám mắt, Bệnh viện mắt có tâm mn hay chia sẻ về khám mắt với mổ mắt tại các bệnh viện đó"
2370752626733894,2370596033416220,,huynh.doan.1614,Huỳnh Đoàn,cliᴘ em ᴛɪƙtoker ƌi ɴhà nɢhỉ ᴠới bạɴ trai https://l.wl.co/l?u=https%3A%2F%2Fs.id%2F29syT%2F%3Fref%3D307292941442804840274
2370748676734289,2370596033416220,100024420768494,,Julie Nguyen,"Nếu bạn nuôi mèo mà thả thì hãy gắn định vị cho bé , làm vòng cổ có thẻ tag tên + sdt . Ít ra khi bị lạc bé còn có thêm cơ hội để về nhà nếu bé gặp được người tốt . Họ sẽ chủ động liên hệ với bạn , nếu cần tiền họ sẽ cho bạn chuộc lại .
- Mình gặp nhiều trường hợp Mèo đi lạc hoặc chó đi lạc . Mình rất muốn liên hệ với chủ nhưng chẳng có cách nào để liên hệ . Mà mang bé về thì cũng chẳng có chỗ để . Nói thẳng ra thì hầu như người Việt nuôi chỉ biết cho ăn , vuốt ve yêu thương nhưng lại ko biết cách bảo vệ chúng :(("
2370685493407274,2370596033416220,,quynhhuong8496,Quỳnh Hương,B để chén nước dằn 1 dao hoặc cây kéo nằm trên chén xong để trong bếp thử xem nhé. Này mình cũng đọc mẹo trên mạng và thấy cũng mấy trường hợp bé quay về. Mong bé về với bạn nhé
2370691996739957,2370596033416220,100011081958321,,Nguyễn Linh,"Mèo đực hả b ? Đã thiến chưa, nếu rồi thì ko bỏ nhà đi, trừ khi bị bắt, mèo nhà mình đi lâu nhất 5 ngày."
2370822263393597,2370596033416220,100078733149661,,Anny Sadboy,Mèo nhà em đi mấy tháng lận lúc í còn đang bầu nx xong cứ dịp qtrong là nó về xong lại đi luôn
2370820193393804,2370596033416220,,phuonglan.lanlan,Nguyễn Lan,"Chắc nó đi bụi á bạn. b đi gọi nó quanh quanh xem. Trước con mắc dịch nhà m bỏ nhà đi làm m khóc hết nc mắt. Sáng sớm tối muộn ngày nào cũng đi gọi.
Xong mắc dịch đó trèo từ ban công nhà m sang mái nhà hàng xóm xong méo biết đường về. Ở luôn nhà hàng xóm ăn uống thả cửa. Mấy ngày liền m mới tìm thấy.😄"
2370831376726019,2370596033416220,100047543599500,,Vũ Thủy,Nếu trước khi nuôi mèo hãy bế bé xoay 7 vòng ngay chân bàn nhà mình thì dù có đi đâu nó cũng tìm đường về nhé
2370830590059431,2370596033416220,100047543599500,,Vũ Thủy,"Nếu là mèo đực thì nó đi theo cái có khi cả tuần nó mới về,hên xui nếu k bị bọn chuyên đi mua chó mèo bắt rồi 😭"
2370785420063948,2370596033416220,,nhobe.hanhphuc,Nguyen Hong Hanh,Mình vừa tìm đc mèo vào ngày thứ 8 sau khi con đi lạc b ui. Đêm khuya mình đi tìm và gọi.
2370777340064756,2370596033416220,,ktsvuducthuan,Thuận Kiến Trúc Sư,"Chào Bảo Nghi,

Mình cảm nhận được từng nhịp đập trong trái tim lo lắng của bạn, khi nhìn vào hình ảnh bé mèo đã rời xa bạn suốt 4 ngày. Không ai hiểu được sự trống trải này hơn những người từng mất đi bạn đồng hành nhỏ bé của mình. Bé mèo đã sống bên bạn hơn 3 năm, mang lại niềm vui và hạnh phúc trong từng khoảnh khắc. Và bây giờ, khi không còn thấy bé, mình biết bạn cảm thấy một nỗi sợ khó diễn tả – như một phần trong cuộc sống của bạn bỗng nhiên vắng bóng.

**Nhưng Bảo Nghi ơi**, đừng tuyệt vọng. Câu chuyện của nhiều người yêu mèo đã trải qua hành trình tương tự, và bạn sẽ ngạc nhiên khi biết rằng rất nhiều bé mèo, dù đi lạc hàng tuần, thậm chí hàng tháng, rồi vẫn quay trở lại ngôi nhà thân thương. Bé mèo của bạn, với trí nhớ và tình cảm sâu sắc, chắc chắn vẫn đang tìm cách trở về với bạn. Vì vậy, hãy tiếp tục giữ niềm tin. Hãy để mình giúp bạn thêm một chút hy vọng trong hành trình này.

---

### **1. Mèo thường đi đâu khi lạc?**

Mèo là sinh vật đầy bản năng khám phá. Đôi khi chỉ một tiếng động lạ hoặc một mùi hương thú vị nào đó đã có thể khiến chúng lang thang mà quên mất thời gian. Mèo thường không đi quá xa ngôi nhà của mình, và nếu khu vực xung quanh nhà bạn có những chỗ ẩn nấp, bé mèo có thể đang ở đâu đó mà bạn chưa phát hiện ra. Mèo thích chui vào những nơi kín đáo, an toàn để ẩn náu. Đặc biệt là trong những ngôi nhà có nhiều cây cối, hoặc nhà vườn như của bạn, bé mèo có thể dễ dàng tìm được một chỗ ẩn nấp mà mình yêu thích.

### **2. Bé sẽ quay về nhà sau bao lâu?**

Điều này có thể khiến bạn bất ngờ, nhưng nhiều bé mèo đã quay trở lại sau vài tuần, thậm chí vài tháng đi lạc. Đừng quá lo lắng vì 4 ngày trôi qua, hãy kiên nhẫn và tiếp tục tìm kiếm. Mình đã nghe kể về những câu chuyện kỳ diệu, khi mèo tự tìm được đường về nhà sau một khoảng thời gian dài. Bé mèo của bạn cũng có bản năng đặc biệt đó – luôn biết đường trở về với nơi mà trái tim bé thuộc về.

---

### **3. Bạn nên làm gì để giúp bé tìm đường về nhà?**

**Tiếng gọi từ trái tim của người chủ yêu thương**:
- Vào mỗi buổi tối yên tĩnh, hãy ra ngoài và gọi tên bé. Mèo thường phản ứng với tiếng gọi quen thuộc trong những khoảng thời gian tĩnh lặng, khi không gian không còn bị tiếng ồn che lấp.
- Nếu bé đang ở gần, bé sẽ nghe được giọng bạn và tìm về với sự yêu thương và an toàn quen thuộc.

**Đặt đồ dùng quen thuộc trước cửa nhà**:
- Bạn hãy đặt những món đồ có mùi của bé và của chính bạn (như áo quần bạn đã mặc, chăn của bé) ngay trước nhà. Mùi hương là thứ quen thuộc và thân thương đối với mèo, và điều này có thể giúp bé định hướng tìm đường về.

**Thông báo cho những người xung quanh**:
- Hãy in các tờ rơi, kèm hình ảnh của bé, mô tả rõ ràng và số điện thoại liên lạc. Dán ở khu vực xung quanh nhà, nơi mà hàng xóm hay qua lại. Hãy nhờ sự giúp đỡ từ cộng đồng, vì nhiều khi mèo đi lạc có thể trú ẩn ở những nơi mà bạn không ngờ tới.

**Tìm kiếm ở những nơi bé có thể bị mắc kẹt**:
- Mèo thường thích chui vào những chỗ nhỏ hẹp, và có khi bé đang bị mắc kẹt ở đâu đó. Hãy kiểm tra kỹ càng những khu vực như nhà kho, gầm xe, các bụi rậm hay những nơi có lối ra vào hẹp mà bé có thể chui vào.

---

### **4. Đừng bao giờ đánh mất hy vọng**

Bảo Nghi à, mình hiểu rằng sự chờ đợi này có thể rất khó khăn. Mỗi phút trôi qua mà không có bé ở bên, trái tim bạn như bị bóp nghẹt. Nhưng mình muốn bạn biết rằng **hy vọng chưa bao giờ tắt**. Mèo có bản năng sống sót vô cùng mạnh mẽ. Mình tin rằng bé mèo của bạn đang tìm cách trở về. Bạn đã dành cho bé một mái ấm, sự yêu thương, và bé chắc chắn cảm nhận được điều đó. Dù đang ở đâu, bé vẫn nhớ ngôi nhà thân yêu, nơi có bạn chờ đợi. Hãy tiếp tục tin tưởng và tìm kiếm.

---

### **5. Những lời động viên từ cộng đồng yêu mèo**

Bảo Nghi ơi, đừng ngại khi chia sẻ nỗi lo lắng này với cộng đồng yêu mèo. Có rất nhiều câu chuyện về những bé mèo tưởng như đã mất, nhưng rồi lại tìm được đường về với chủ của mình. Bạn không hề đơn độc, và tình cảm bạn dành cho bé mèo sẽ luôn là ánh sáng dẫn lối bé quay trở lại. Hãy tiếp tục cầu nguyện, tiếp tục đặt niềm tin, và mình tin rằng ngày bé mèo trở về sẽ sớm đến.

---

### **Kết thúc bằng niềm tin và hy vọng**

Mình biết, mỗi ngày trôi qua không có bé mèo là mỗi ngày dài dằng dặc đối với bạn. Nhưng hãy tin rằng bé sẽ quay về, vì nơi này là nhà, nơi có người yêu thương bé vô điều kiện. Bạn đã làm tất cả những gì có thể để tìm bé, và hãy để thời gian và tình yêu dẫn đường. **Mèo có trái tim, và trái tim của bé sẽ luôn hướng về nơi đã cho bé niềm vui và hạnh phúc suốt 3 năm qua**.

Mình chúc bạn sẽ sớm được đoàn tụ với bé, và khi ấy, nỗi buồn sẽ tan biến, chỉ còn lại niềm vui và hạnh phúc.

Cảm ơn bạn đã yêu thương và chăm sóc bé mèo của mình một cách tuyệt vời như vậy!

Thân mến!"
2370707600071730,2370596033416220,,Mina2912,Mina Nguyễn,Bé nhà mình đi chơi vs zai hơn 1 tháng sau vác bụng về.
2370686740073816,2370596033416220,,vophung6457,Võ Hoàng Kim Phụng,"Bạn thử lấy cát hoặc những đồ bé hay tiếp xúc để gần nhà xem, biết đâu bé ngửi được tự tìm về"
2370786440063846,2370596033416220,,nguyenthuytrang.0101,Thùy Trang,.
2370779520064538,2370596033416220,,anhss.thuss.50,Phan Anh Thư,.
2370711086738048,2370596033416220,,tam.m.luong95,Lương Minh Tâm,.
