comment_id,post_id,user_id,user_name,fullname,content
8178916938872707,8175173935913674,100094740210603,,Vũ Ánh,"Tham khảo cái pp silkskin không xâm lấn chỗ Doctor William Lee này mà chữa em, chữa xong da dẻ ổn rồi sau chăm sóc cho dễ"
8181793658585035,8175173935913674,,thanglong.hatgiong,Bác Sĩ Đạt,"Da thiên dầu, lỗ chân lông to, em có thể dùng Retinol nhé. Hiệu quả căng bóng da chống lão hóa...
- AHA tẩy da chết, loại bỏ sắc tố da xỉn màu thâm sạm
- Tranexamic + Vitamin C dưỡng sáng đều màu da
- HA cấp ẩm cho da mịn màng săn chắc"
8178065008957900,8175173935913674,100092442021029,,Bông Skincare,"Da dầu và khá dày sừng
E chú ý bước làm sạch da nha e
Peel da một lượt kiểm soát tuyến dầu và giảm dày sừng nha
Thêm rentinol chống lão hoá
Aha và các hoạt chất làm sáng da như Tranexamic arbutin Niacnamai nè
Cấp ẩm phục hồi kèm theo nha e"
