comment_id,post_id,user_id,user_name,fullname,content
1681790085898111,1679999902743796,100078723105323,,Bobo Bobo,Ko tìm đc ig này
1684191572324629,1679999902743796,,tramy.dangtran.7,GD Love Jiko,K tìm đc ig TvT
1680205329389920,1679999902743796,,Pham.Diem.2512,Diễm Phạm,Diễm thích cái này Mai Hương Nguyễn
1680911315985988,1679999902743796,,junseob.phuong,Lê Thảo Phương,Lã Quỳnh Anh
1689688785108241,1679999902743796,,huyen84,Huyền Xấu Đầu Gấu,Maria Quỳnh 👍🏻
1825140498229735,1679999902743796,,linhli2205,Nguyễn Thuỳ Linh,"Ltpastry.shop chứ kphai itpastr.shop các bác ạ 🥹🥹
Chttps://www.instagram.com/ltpastry.shop?igsh=aGNoMmIwdzdlMmdy"
