post_id,user_id,user_name,fullname,content
1865364043992717,,,,"Em muốn xin ý kiến tư vấn của các bác về trường hợp bị chậm/quỵt lương ạ.
Chả là em có người nhà làm tạp vụ cho một công ty đồ uống ở Vạn Phúc, đã nghỉ việc được gần 1 năm nay. Trong thời gian làm việc thì có ký HĐLĐ bình thường, họ thường xuyên chậm lương và tính tới thời điểm nghỉ việc thì họ vẫn nợ hơn 3 tháng lương (gần 20tr).
Giờ người nhà em cũng đi làm công việc khác rồi nhưng lương ở cty đồ uống đấy vẫn chưa đòi được dù nhiều lần nhắn tin nhưng GĐ bên cty đó vẫn chỉ hứa hẹn chứ mãi chưa thanh toán.
A/c nào có kinh nghiệm đòi lương hoặc biện pháp mạnh nào để đòi lương chưa ạ, có thể cho em xin chút kinh nghiệm cho người nhà được ko ạ? Chứ bực quá, làm tạp vụ lao động chân tay lương 3 cọc 3 đồng, sức thì bỏ ra rồi mà tới giờ người ta nghỉ việc rồi vẫn chưa thanh toán cho.
Ngoài ra người nhà em có được biết những nhân viên cũ của công ty hồi đó cũng rất nhiều người bị quỵt/chậm lương như vậy, mỗi người đều phải tầm mấy chục triệu. Vậy trường hợp này có thể báo cáo lên Sở LĐ hay biện pháp mạnh nào ko ạ?
Xin cảm ơn cả nhà!"
