post_id,user_id,user_name,fullname,content
1863197884209333,,,,"Ad ơi duyệt bài giúp em với ạ
Mn ơi nghĩ sao về điều này
Hồi kì trước e có làm việc cho 1 cty du lịch.
Đc 1 tháng thử việc xong, họ cho em nghỉ luôn😢😢😢
Họ nói rằng:
1)em không hoà hợp với tất cả mn trong cty
2) em phát triễn chậm
Thật sự nghe xong, em rất buồn và sốc.Trước đây em còn biết đc là rất nhiều cv nộp vô nhưng họ chọn đc duy nhất mình e.
Em nghĩ rằng trong mấy cv đó sẽ có người giỏi hơn em mà họ ko chọn vì có thể người giỏi vậy họ yêu cầu 1 mức lương cao. Vậy nên, cty ko mún chi lương cao cho người có nhiều kn trong ngành thay vào đó chọn mấy đứa non như e để tiết kiệm. Hơn nữa ở vị trí của em cũng đã có sẵn người giỏi rồi nên tuyển newbie vô để phụ thêm thôi.
Nay em có xem xét các trường hợp khác như là:
+ Có thể do cty họ đang làm ăn không thuận lợi nên thôi cho frescher (em) nghỉ vì cảm thấy không cần thiết. Họ có nói rằng giờ họ sẽ tuyển lại vị trí của em.
Hay còn giả thuyết nào không. Mn comment nói lên ý của mn. Rồi chúng ta cùng bàn luận vs ạ"
