comment_id,post_id,user_id,user_name,fullname,content
1711160763017515,1710719499728308,,Hexadecimal.6261636b796172646f666e6b7462,THIÊN MẠC,thay card wifi intel ax210 😂
1711109063022685,1710719499728308,100005866621609,,Việt Cường,"Gỡ và hạ phiên bản driver card wifi xuống, ko dc thì thay card wifi khác."
1711110279689230,1710719499728308,100043416803681,,N.A Nguyễn,"Bệnh máy nó thế , bác chỉnh lại driver là đc"
1711100193023572,1710719499728308,,thinhdinh26,Đinh Đức Thịnh,thay card wifi
1711139716352953,1710719499728308,100070542415256,,Gia Huy,Thay card wifi nhé :)))
1711102173023374,1710719499728308,,minhnt5118,Nguyễn Tuấn Minh,Bệnh nó thế bác. Con f15 của em thì bật game lên là mất 😂😂😂.
1711167019683556,1710719499728308,,nguyen.nd1999,Nguyễn Đức Nguyên,vote thay card wifi
