comment_id,post_id,user_id,user_name,fullname,content
1700804190719839,1700505550749703,100087400555439,,Ho Cường,"Mua Samsung, crucial. Bọn Kingston thuộc top cùi bắp nhất chứ chưa nói đến nhái làm gì"
1700793704054221,1700505550749703,100039845799213,,Nguyễn Chiến,"Kiểm tra kỹ chủng loại ổ cứng máy hỗ trợ. Cái đang lắp là M2 sata. Đời cũ như này thì mấy hãng lớn đều ok. Samsung, Hynix, Micron, Sandisk,..."
1700798160720442,1700505550749703,,Khanh.banhs6,Tran Anh Đong,Dùng samsung đi bác
1700801600720098,1700505550749703,,vietdan.it,Lê Việt Đan,"Ít tiền thì tìm mấy con skhynix
Nhiều tiền muốn an tâm thì cứ Samsung mà táng thôi"
1700790237387901,1700505550749703,100008182155961,,Kha NV,Có tiền mua Samsung / Intel . Còn mua sợ hàng nhái thì ra mấy cửa hàng máy tính lớn : hacom / anphat / …
