post_id,user_id,user_name,fullname,content
2196612280680445,,PHH131278,Trần Quốc Tuấn,"Một số Tip đơn giản về Ăn
Ăn gì mập ?
Không gì qua thịt cá. Cứ luộc, hấp không gia vị, chín hoặc tái đều được. Lười thì làm 1 mẻ lớn, chia phần vào bịt nhỏ, để đông. Hạt chỉ là phụ
Nó cào lấp thức ăn ?
Đồ ăn ôi thiu hoặc nguyên liệu không tươi
Ăn hạt có bị thận không ?
Còn tùy vào loại có ""mặn"" không và có làm bửa chính không hay chỉ làm bửa phụ
Ăn sữa chua ?
Được, nên lấy loại mềm, ăn buổi trưa
Phô mai cục ?
Được, nhưng hạn chế, vì nó mặn
Ciao , súp thưởng ?
Được, nhưng hạn chế, dùng nhiều sẽ làm nó lờn, kén ăn đồ khác
Quá kén ăn ?
Xem lại thức ăn có cũ, thiu không. Giờ giấc cố định hay tùy hứng. Và nên nuôi 2 con để nó giành ăn
Cân nặng nhưng Quá gầy ?
Tầm 7, 8 tháng mới phát tướng chiều ngang, nhỏ hơn thì chiều dọc. Triệt sản sẽ nhanh mâp hơn
Ăn mạnh mà vẫn gầy ?
Xổ giun định kỳ, triêt sản
Uống nước gì ?
Nước lọc, thay mới mỗi ngày.
Nước hồ cá là thích nhất
Ăn chung đồ của người ?
Không nên, gia vị sẽ hại thận
Còn gì nữa ?
Thì hỏi thêm dưới bình luận"
