comment_id,post_id,user_id,user_name,fullname,content
1914827345713053,1914782852384169,100015328922221,,Tin Tin Lê,Tuyển e nè e dô r cj nghỉ
1914790409050080,1914782852384169,,dua.hau.96,Huong Thanh,"Ủa bạn nghỉ thôi
Do gia đình em có việc
Em phải chuyển trọ
Muốn phát triển chuyên môn bla bla thiếu gì lí do
Tìm người thay thế rồi bàn giao công việc"
1914789582383496,1914782852384169,,,Thành viên ẩn danh 736,"Hồi còn trẻ mình cũng thay than vãn khi thấy bất công giống bạn, sau này nhận ra than vãn k giải quyết được gì, cứ nâng cao trình độ bản thân r kiếm công việc tốt hơn thôi"
1914789615716826,1914782852384169,,po.peheokull,Po Peheokull,"Nghỉ thôi chứ sao nữa, kêu e muốn tập trung vào chuyen môn blala"
